{
  "id": "KDS 41 40 20",
  "title": "합성목구조 설계기준",
  "category": "건축",
  "content": {
    "full": "**표준코드**: KDS 41 40 20 **문서 제목**: 목적 **변환일시**: 2025-07-09 16:46:20 **첨부 이미지**: 1개 KDS 41 00 00 설계기준 Korean Design Standard 건축 구조기준 KDS 41 40 20 : 2022 합성목구조 설계기준 2022년 10월 11일 제정 http://www.kcsc.re.kr 건설기준 제정 또는 개정에 따른 경과 조치 이 기준은 발간 시점부터 사용하며, 이미 시행 중에 있는 설계용역이나 건설공사는 발주기관의 장이 필요하다고 인정하는 경우 종전에 적용하고 있는 기준을 그대로 사용할 수 있습니다. 건설기준 제・개정 연혁 ∙ 이 기준은 건설기준 코드체계 전환에 따라 기존 건설기준(설계기준, 표준시방서) 간 중복· 상충을 비교 검토하여 코드로 통합 정비하였다. ∙ 이 기준은 합성목구조 설계에 해당되는 부분을 통합 정비하여 기준으로 제정한 것으로 제ㆍ개정 연혁은 다음과 같다. 건설기준 주요내용 제⋅개정 (년.월) KDS 41 40 20 : 2022 ∙ 합성목구조 설계기준 제정 제정 (2022.10) 제 정 : 2022년 10월 11일 심 의 : 중앙건설기술심의위원회 소관부서 : 국토교통부 건축안전과 개 정 : 자문검토 : 국가건설기준센터 건설기준위원회 관련단체 : 대한건축학회 작성기관 : 대한건축학회 ∙ 국토교통부장관은 「훈령·예규 등의 발령 및 관리에 관한 규정」에 따라 이 고시에 대하여 2023년 1월 1일 기준으로 매 3년이 되는 시점(매 3년째의 12월 31일까지를 말한다)마다 그 타당성을 검토하여 개선 등의 조치를 하여야 한다. 목차 1. 일반사항 1 1.1 목적 1 1.2 적용범위 1 1.3 참고 기준 1 1.4 용어의 정의 1 1.5 기호의 정의 1 2. 조사 및 계획 1 3. 재료 2 3.1 목재 2 3.2 콘크리트 2 3.3 철근 2 3.4 강재 2 3.5 전단연결재 2 4. 설계 2 4.1 설계 기본 조건 2 4.2 내구성 3 4.3 구조해석 3 1. 일반사항 1.1 목적 (1) KDS 41 40 20은 합성목구조 건축물에 대한 재료와 내구성, 구조해석 등의 기술적 사항을 규정함으로써 목구조 건축물의 안전성과 사용성, 내구성을 확보하는 것을 그 목적으로 한다. 1.2 적용범위 (1) 이 기준은 목재와 다른 구조재료가 함께 외부 하중에 대해 거동하도록 구성된 합성 바닥판 설계에 대해 적용한다. (2) 합성목구조를 구성하는 부재의 설계는 강도, 사용성, 내구성 및 내화에 대한 요구조건을 만족해야 한다. (3) 합성목구조 부재의 강도는 제작 및 공사과정에서 발생된 변형과 시공오차 등의 불완전성 영향을 고려하여야 한다. 1.3 참고 기준 1.3.1 관련 법규 내용 없음. 1.3.2 관련 기준 KDS 41 10 00 건축구조기준 일반사항 KDS 41 20 00 건축물 콘크리트구조 설계기준 KDS 41 30 00 건축물 강구조 설계기준 KDS 41 50 05 목구조 일반 KDS 41 50 10 목구조 재료 및 허용응력 KDS 41 50 40 목구조 내구계획 및 공법 1.4 용어의 정의 (1) KDS 41 50 05 (1.4)에 따른다. 1.5 기호의 정의 (1) KDS 41 50 05 (1.5)에 따른다. 2. 조사 및 계획 내용 없음. 3. 재료 3.1 목재 (1) 합성목구조의 구조설계에 필요한 목재의 재료 특성은 KDS 41 50 10을 따른다. 3.2 콘크리트 (1) 합성목구조의 구조설계에 필요한 보통 및 경량콘크리트의 재료 특성은 KDS 41 20 00을 따른다. 3.3 철근 (1) 합성목구조의 구조설계에 사용되는 철근(철선 및 용접철망 포함)의 재료 특성은 KDS 41 20 00을 따른다. 3.4 강재 (1) 합성목구조의 구조설계에 사용되는 강재의 재료 특성은 KDS 41 30 00을 따른다. 3.5 전단연결재 (1) 전단연결재로 사용되는 강재의 강도 및 재료특성은 KDS 41 20 00과 KDS 41 30 00을 따른다. 4. 설계 4.1 설계 기본 조건 4.1.1 기본 요구 사항 (1) 합성목구조와 그에 따른 부재는 요구되는 구조적 성능과 사용성을 만족하도록 설계되어야 한다. (2) 합성목구조의 설계는 모든 관련 변수를 포함한 적절한 설계모델을 이용하여 수행한다. 설계모델은 충분한 신뢰도를 가지고 구조물의 거동을 예측할 수 있어야 한다. 4.1.2 하중 (1) 합성목구조와 그에 따른 부재는 예상되는 모든 하중을 안전하게 지지하기 위해 설계되고 시공되어야 한다. (2) 사용기간 동안 예상되는 모든 하중작용과 기타 영향에 대해 기능성과 안전성이 유지되어야 한다. 4.2 내구성 (1) 내구성 확보를 위해 합성목구조의 설계는 KDS 41 10 00과 KDS 41 50 40을 따라야 한다. 4.3 구조해석 (1) 구조해석 모델링과 이를 위한 기본가정은 부재, 접합부, 받침부를 포함한 구조물 전체의 예상되는 거동을 합리적으로 반영하여야 한다. (2) 이 기준은 부재 및 접합부의 전체 또는 일부가 목재-콘크리트 합성구조인 구조물에 적용할 수 있다. 다만, 주요한 구조거동이 철근콘크리트 또는 프리스트레스트 콘크리트 구조에 가까운 경우, 구조해석은 콘크리트구조기준(KDS 14 20 00 / KDS 41 20 00)을 따른다. 집필위원 성 명 소 속 성 명 소 속 김광철 전북대학교 오세창 대구대학교 김영민 명지대학교 오정권 서울대학교 김철기 국립산림과학원 이기학 세종대학교 김태진 티아이구조기술사사무소 이재훈 ㈜도화구조 박문재 한국목재공학회 장상식 전남대학교 심국보 국립산림과학원 황원중 국립산림과학원 자문위원 성 명 소 속 성 명 소 속 강현구 서울대학교 이철호 서울대학교 김석구 ㈜쓰리디엔지니어링 전봉수 (주)전우구조건축 김종호 ㈜창민우구조컨설탄트 정광량 ㈜동양구조안전기술 김홍진 경북대학교 정란 단국대학교 민경원 단국대학교 정재철 국민대학교(명예교수) 박문재 국립산림과학원 조봉호 아주대학교 박지훈 인천대학교 천성철 인천대학교 박홍근 서울대학교 최경규 숭실대학교 신성우 한양대학교 최창식 한양대학교 이경구 대한건축학회 하영철 금오공과대학 이기학 세종대학교 홍건호 호서대학교 이리형 한양대학교(명예교수) 홍성걸 서울대학교 이상현 단국대학교 홍성목 서울대학교(명예교수) 국가건설기준센터 및 건설기준위원회 성 명 소 속 성 명 소 속 이영호 한국건설기술연구원 신영수 이화여자대학교 구재동 한국건설기술연구원 강현구 서울대학교 김기현 한국건설기술연구원 곽동삼 ㈜원우구조기술사사무소 김태송 한국건설기술연구원 김두기 공주대학교 김희석 한국건설기술연구원 김세일 빛과울구조컨설팅 류상훈 한국건설기술연구원 김승원 뉴테크구조기술사사무소 안준혁 한국건설기술연구원 김희선 이화여자대학교 원훈일 한국건설기술연구원 박지훈 인천대학교 이상규 한국건설기술연구원 유영찬 한국건설기술연구원 이승환 한국건설기술연구원 최준식 ㈜단이엔씨 이여경 한국건설기술연구원 이용수 한국건설기술연구원 주영경 한국건설기술연구원 최봉혁 한국건설기술연구원 허원호 한국건설기술연구원 중앙건설기술심의위원회 성 명 소 속 성 명 소 속 김성수 대진대학교 박완신 충남대학교 김성훈 국토안전관리원 유정한 서울과학기술대학교 김태진 티아이구조기술사사무소 한동욱 남서울대학교 국토교통부 성 명 소 속 성 명 소 속 김연희 국토교통부 건축안전과 조윤빈 국토교통부 건축안전과 이지형 국토교통부 건축안전과 KDS 41 40 20 : 2022 합성목구조 설계기준 2022년 10월 11일 제정 소관부서 국토교통부 건축안전과 관련단체 대한건축학회 06687 서울특별시 서초구 효령로 87(방배동 917-9) Tel : 02-525-1841 E-mail : webmaster@aik.or.kr http://www.aik.or.kr/ 작성기관 대한건축학회 06687 서울특별시 서초구 효령로 87(방배동 917-9) Tel : 02-525-1841 E-mail : webmaster@aik.or.kr http://www.aik.or.kr/ 국가건설기준센터 10223 경기도 고양시 일산서구 고양대로 283(대화동) Tel : 031-910-0444 E-mail : kcsc@kict.re.kr http://www.kcsc.re.kr",
    "sections": {
      "scope": "(1) 이 기준은 목재와 다른 구조재료가 함께 외부 하중에 대해 거동하도록 구성된 합성 바닥판 설계에 대해 적용한다. \n(2) 합성목구조를 구성하는 부재의 설계는 강도, 사용성, 내구성 및 내화에 대한 요구조건을 만족해야 한다.\n(3) 합성목구조 부재의 강도는 제작 및 공사과정에서 발생된 변형과 시공오차 등의 불완전성 영향을 고려하여야 한다.",
      "materials": "목재 2 3.2 콘크리트 2 3.3 철근 2 3.4 강재 2 3.5 전단연결재 2 4. 설계 2 4.1 설계 기본 조건 2 4.2 내구성 3 4.3 구조해석 3 1. 일반사항 1.1 목적 (1) KDS 41 40 20은 합성목구조 건축물에 대한 재료와 내구성, 구조해석 등의 기술적 사항을 규정함으로써 목구조 건축물의 안전성과 사용성, 내구성을 확보하는 것을 그 목적으로 한다. 1.2 적용범위 (1) 이 기준은 목재와 다른 구조재료가 함께 외부 하중에 대해 거동하도록 구성된 합성 바닥판 설계에 대해 적용한다. (2) 합성목구조를 구성하는 부재의 설계는 강도, 사용성, 내구성 및 내화에 대한 요구조건을 만족해야 한다. (3) 합성목구조 부재의 강도는 제작 및 공사과정에서 발생된 변형과 시공오차 등의 불완전성 영향을 고려하여야 한다. 1.3 참고 기준 1.3.1 관련 법규 내용 없음. 1.3.2 관련 기준 KDS 41 10 00 건축구조기준 일반사항 KDS 41 20 00 건축물 콘크리트구조 설계기준 KDS 41 30 00 건축물 강구조 설계기준 KDS 41 50 05 목구조 일반 KDS 41 50 10 목구조 재료 및 허용응력 KDS 41 50 40 목구조 내구계획 및 공법 1.4 용어의 정의 (1) KDS 41 50 05 (1.4)에 따른다. 1.5 기호의 정의 (1) KDS 41 50 05 (1.5)에 따른다. 2. 조사 및 계획 내용 없음. 3. 재료 3.1 목재 (1) 합성목구조의 구조설계에 필요한 목재의 재료 특성은 KDS 41 50 10을 따른다. 3.2 콘크리트 (1) 합성목구조의 구조설계에 필요한 보통 및 경량콘크리트의 재료 특성은 KDS 41 20 00을 따른다. 3.3 철근 (1) 합성목구조의 구조설계에 사용되는 철근(철선 및 용접철망 포함)의 재료 특성은 KDS 41 20 00을 따른다. 3.4 강재 (1) 합성목구조의 구조설계에 사용되는 강재의 재료 특성은 KDS 41 30 00을 따른다. 3.5 전단연결재 (1) 전단연결재로 사용되는 강재의 강도 및 재료특성은 KDS 41 20 00과 KDS 41 30 00을 따른다. 4. 설계 4.1 설계 기본 조건 4.1.1 기본 요구 사항 (1) 합성목구조와 그에 따른 부재는 요구되는 구조적 성능과 사용성을 만족하도록 설계되어야 한다. (2) 합성목구조의 설계는 모든 관련 변수를 포함한 적절한 설계모델을 이용하여 수행한다. 설계모델은 충분한 신뢰도를 가지고 구조물의 거동을 예측할 수 있어야 한다. 4.1.2 하중 (1) 합성목구조와 그에 따른 부재는 예상되는 모든 하중을 안전하게 지지하기 위해 설계되고 시공되어야 한다. (2) 사용기간 동안 예상되는 모든 하중작용과 기타 영향에 대해 기능성과 안전성이 유지되어야 한다. 4.2 내구성 (1) 내구성 확보를 위해 합성목구조의 설계는 KDS 41 10 00과 KDS 41 50 40을 따라야 한다. 4.3 구조해석 (1) 구조해석 모델링과 이를 위한 기본가정은 부재, 접합부, 받침부를 포함한 구조물 전체의 예상되는 거동을 합리적으로 반영하여야 한다. (2) 이 기준은 부재 및 접합부의 전체 또는 일부가 목재-콘크리트 합성구조인 구조물에 적용할 수 있다. 다만, 주요한 구조거동이 철근콘크리트 또는 프리스트레스트 콘크리트 구조에 가까운 경우, 구조해석은 콘크리트구조기준(KDS 14 20 00 / KDS 41 20 00)을 따른다. 집필위원 성 명 소 속 성 명 소 속 김광철 전북대학교 오세창 대구대학교 김영민 명지대학교 오정권 서울대학교 김철기 국립산림과학원 이기학 세종대학교 김태진 티아이구조기술사사무소 이재훈 ㈜도화구조 박문재 한국목재공학회 장상식 전남대학교 심국보 국립산림과학원 황원중 국립산림과학원 자문위원 성 명 소 속 성 명 소 속 강현구 서울대학교 이철호 서울대학교 김석구 ㈜쓰리디엔지니어링 전봉수 (주)전우구조건축 김종호 ㈜창민우구조컨설탄트 정광량 ㈜동양구조안전기술 김홍진 경북대학교 정란 단국대학교 민경원 단국대학교 정재철 국민대학교(명예교수) 박문재 국립산림과학원 조봉호 아주대학교 박지훈 인천대학교 천성철 인천대학교 박홍근 서울대학교 최경규 숭실대학교 신성우 한양대학교 최창식 한양대학교 이경구 대한건축학회 하영철 금오공과대학 이기학 세종대학교 홍건호 호서대학교 이리형 한양대학교(명예교수) 홍성걸 서울대학교 이상현 단국대학교 홍성목 서울대학교(명예교수) 국가건설기준센터 및 건설기준위원회 성 명 소 속 성 명 소 속 이영호 한국건설기술연구원 신영수 이화여자대학교 구재동 한국건설기술연구원 강현구 서울대학교 김기현 한국건설기술연구원 곽동삼 ㈜원우구조기술사사무소 김태송 한국건설기술연구원 김두기 공주대학교 김희석 한국건설기술연구원 김세일 빛과울구조컨설팅 류상훈 한국건설기술연구원 김승원 뉴테크구조기술사사무소 안준혁 한국건설기술연구원 김희선 이화여자대학교 원훈일 한국건설기술연구원 박지훈 인천대학교 이상규 한국건설기술연구원 유영찬 한국건설기술연구원 이승환 한국건설기술연구원 최준식 ㈜단이엔씨 이여경 한국건설기술연구원 이용수 한국건설기술연구원 주영경 한국건설기술연구원 최봉혁 한국건설기술연구원 허원호 한국건설기술연구원 중앙건설기술심의위원회 성 명 소 속 성 명 소 속 김성수 대진대학교 박완신 충남대학교 김성훈 국토안전관리원 유정한 서울과학기술대학교 김태진 티아이구조기술사사무소 한동욱 남서울대학교 국토교통부 성 명 소 속 성 명 소 속 김연희 국토교통부 건축안전과 조윤빈 국토교통부 건축안전과 이지형 국토교통부 건축안전과 KDS 41 40 20 : 2022 합성목구조 설계기준 2022년 10월 11일 제정 소관부서 국토교통부 건축안전과 관련단체 대한건축학회 06687 서울특별시 서초구 효령로 87(방배동 917-9) Tel : 02-525-1841 E-mail : webmaster@aik.or.kr http://www.aik.or.kr/ 작성기관 대한건축학회 06687 서울특별시 서초구 효령로 87(방배동 917-9) Tel : 02-525-1841 E-mail : webmaster@aik.or.kr http://www.aik.or.kr/ 국가건설기준센터 10223 경기도 고양시 일산서구 고양대로 283(대화동) Tel : 031-910-0444 E-mail : kcsc@kict.re.kr http://www.kcsc.re.kr",
      "construction": "",
      "quality": "",
      "safety": "안전관리원 유정한 서울과학기술대학교 김태진 티아이구조기술사사무소 한동욱 남서울대학교 국토교통부 성 명 소 속 성 명 소 속 김연희 국토교통부 건축안전과 조윤빈 국토교통부 건축안전과 이지형 국토교통부 건축안전과 KDS 41 40 20 : 2022 합성목구조 설계기준 2022년 10월 11일 제정 소관부서 국토교통부 건축안전과 관련단체 대한건축학회 06687 서울특별시 서초구 효령로 87(방배동 917-9) Tel : 02-525-1841 E-mail : webmaster@aik.or.kr http://www.aik.or.kr/ 작성기관 대한건축학회 06687 서울특별시 서초구 효령로 87(방배동 917-9) Tel : 02-525-1841 E-mail : webmaster@aik.or.kr http://www.aik.or.kr/ 국가건설기준센터 10223 경기도 고양시 일산서구 고양대로 283(대화동) Tel : 031-910-0444 E-mail : kcsc@kict.re.kr http://www.kcsc.re.kr"
    }
  },
  "metadata": {
    "quality_score": 50,
    "keywords": [
      "철근",
      "콘크리트",
      "용접",
      "내화"
    ],
    "references": [
      "KDS"
    ],
    "equations": 0,
    "tables": 0
  },
  "standard_code": "KDS 41 40 20"
}