{
  "id": "KDS 27 10 15",
  "title": "설계일반_수정",
  "category": "기타",
  "content": {
    "full": "**표준코드**: KDS 27 10 15 **문서 제목**: 목적 **변환일시**: 2025-07-09 16:46:05 **첨부 이미지**: 2개 KDS 27 00 00 설계기준 Korean Design Standard 터널 설계일반 KDS 27 10 15 : 2016 설계일반 2016년 6월 30일 개정 http://www.kcsc.re.kr 건설기준 제·개정에 따른 경과 조치 이 기준은 발간 시점부터 사용하며, 이미 시행 중에 있는 설계용역이나 건설공사는 발주기관의 장이 필요하다고 인정하는 경우 종전에 적용하고 있는 기준을 그대로 사용할 수 있습니다. 건설기준 제・개정 연혁 ∙ 이 기준은 건설기준 코드체계 전환에 따라 기존 건설기준(설계기준, 표준시방서) 간 중복· 상충을 비교 검토하여 코드로 통합 정비하였다. ∙ 이 기준은 기존의 터널설계기준을 중심으로 도로설계기준, 공동구 설계기준, 철도설계기준(노반편), 하천설계기준, 항만 및 어항 설계기준 등의 설계일반에 해당하는 부분을 통합 정비하여 기준으로 제정한 것으로 제·개정 연혁은 다음과 같다. 건설기준 주요내용 제·개정 (년.월) 터널공사표준시방서 및 동해설 ∙ 산악지대에 건설되는 터널공사의 조사, 설계, 시공관련 일반 방침, 기준 제정 (1975.3) 터널공사 표준시방서 ∙ 조사편에 노선계획, 공사계획 추가 ∙ 설계편에 하중, 동바리공의 본문 및 해설 추가 ∙ 시공편에 안전위생, 기계굴착 등 추가 ∙ 시공법 및 시공 방식 현대화 ∙ 사갱, 수직갱 신설 ∙ NATM 공법 표준사항 신설 개정 (1985.12) 터널표준시방서 ∙ 일반시방서로 개편 및 해설부분 생략 ∙ 국내 용어 및 서술형식 적용 개정 (1996.5) 터널설계기준 ∙ 터널설계기준과 터널표준시방서 분리, 개편, 보완 개정 (1999.9) 터널설계기준 ∙ 관련법, 기준, 지침과의 연계성 확보 ∙ 향상된 국내 터널기술 수준 반영 및 현안문제 개선 ∙ 내진설계기준 보완, 터널공사의 안전성 제고 ∙ 국제적 추세에 맞춘 기계화 시공 및 환경 친화적 설계 개선 개정 (2007.11) KDS 27 10 15 : 2016 ∙ 건설기준 코드체계 전환에 따라 코드화로 통합 정비 제정 (2016.6) 제 정 : 2016년 6월 30일 심 의 : 중앙건설기술심의위원회 소관부서 : 국토교통부 간선도로과 관련단체 : 한국터널지하공간학회 개 정 : 년 월 일 자문검토 : 국가건설기준센터 건설기준위원회 작성기관 : 한국터널지하공간학회 목 차 1. 일반사항 1 1.1 목적 1 1.2 적용범위 1 1.3 용어정의 1 1.4 시설물의 구성 1 1.5 기호정의 1 1.6 참고 기준 1 1.7 해석과 설계원칙 1 1.8 설계 고려사항 2 1.9 신규기술적용 3 1.10 구조설계도서 3 2. 조사 및 계획 3 2.1 일반사항 3 2.2 조사 4 2.3 계획 4 3. 재료 4 3.1 일반사항 4 3.2 재료특성 4 3.3 품질 및 성능시험 4 4. 설계 4 4.1 설계방법의 선정 4 4.2 설계내용의 변경 5 4.3 품질보증에 대한 기본사항 5 4.4 연직갱 및 경사갱 6 4.5 갱구부 8 4.6 갱문의 설계 10 4.7 갱문부 주행 안전성 확보 11 4.8 단면확폭부 및 접속부 11 4.9 접속부의 설계 12 4.10 침매터널 13 1. 일반사항 1.1 목적 (1) 이 기준은 터널설계를 위해 고려해야 할 일반사항을 기술한다. 1.2 적용범위 (1) 연직갱의 설계는 수직이거나 수직에 가까운 터널에 적용하여야 한다. (2) 경사갱의 설계는 경사진 터널에 적용하여야 한다. (3) 갱구부 및 갱문의 설계는 산악터널에 적용하여야 한다. 1.3 용어정의 (1) 이 기준의 용어정의는 KDS 27 10 05(1.3)을 따른다. 1.4 시설물의 구성 내용 없음. 1.5 기호정의 내용 없음. 1.6 참고 기준 1.6.1 관련 법규 (1) 이 기준의 관련 법규는 KDS 27 10 05(1.6.1)을 따른다. 1.6.2 관련 기준 (1) 이 기준의 관련 기준은 KDS 27 10 05(1.6.2)를 따른다. 1.7 해석과 설계원칙 내용 없음. 1.8 설계 고려사항 (1) 터널설계는 터널단면에 따라 단선터널, 복선터널, 대단면터널 등으로 구분하여 용도를 고려하여 설계해야 한다. (2) 터널설계는 터널연장에 따라 짧은터널, 장대터널, 초장대터널로 구분하여 그 기능과 목적에 적합하도록 설계해야 한다. (3) 장대터널과 초장대터널에서 사람이 이용하는 터널은 방재대책을 고려하여 설계해야 한다. (4) 터널설계는 지반의 불확실성, 지반조사의 기술적 한계 및 지하공간에서의 제한적 작업특성 등이 고려되어야 한다. (5) 터널설계는 조사 결과를 이용하여 안정성, 시공성, 내구성, 경제성이 확보되고 유지관리가 편리한 시설이 되도록 하는 것을 원칙으로 하되, 실제 시공조건이 설계 당시에 예측한 조건과 상이한 경우에 대비한 변경방법 및 조치사항 등을 포함하여야 한다. 이를 위하여 설계 시에 적용한 제반적용 자료와 분석 및 예측사항을 명확하게 제시하여야 한다. (6) 터널설계는 제반조사 자료들을 근거로 지반특성을 고려하여 터널주변 원지반이 보유하고 있는 지보능력을 최대한 활용할 수 있도록 소요규격, 단면형상, 굴착공법과 방법, 지보재형식, 콘크리트라이닝, 터널 입구와 출구부, 방재 및 부대시설, 시공순서 등을 계획 선정하여야 한다. (7) 터널안정성을 확보하기 위하여 터널구조물의 안전뿐만 아니라 주변 위험영향도 최소화되도록 하여야 하며, 터널 주위에 미치는 영향에 대하여는 필요시 합리적인 대책을 강구하여야 한다. (8) 터널설계는 환기, 조명, 방재시설 등의 제반설비 사항들도 고려하여야 하며 이들의 역할이 잘 발휘되도록 하여야 한다. (9) 터널설계는 굴착 시 원지반의 손상이나 여굴 발생이 최소화되도록 하여야 하며, 원지반의 손상이나 여굴 발생 시 그 처리방안을 제시하여야 한다. (10) 터널설계는 계획 터널노선에 대하여 시공성을 고려한 경제성 분석을 실시하여야 한다. (11) 터널설계는 안정성 확보를 우선으로 하되 지보재의 최적화를 도모하여야 한다. 이 경우 해석적인 방법 외에 설계⋅시공사례 등의 경험적인 방법도 고려해야 한다. (12) 콘크리트라이닝은 터널이 신선한 경암반을 통과하는 경우 지보재와 콘크리트라이닝의 역할에 따라 라이닝의 설치 여부를 검토할 수 있다. (13) 터널설계는 관계 법령이 정하는 바에 따라 제반 안전성 분석 및 피난계획을 수립하고, 터널 내 부착물 및 시설물은 화재 시를 고려하여 적절한 재료를 선정하여야 한다. (14) 터널설계에는 다음 사항이 포함되어야 한다. ① 평면 및 종단선형 ② 굴착대상지반의 분석 및 분류 ③ 터널단면의 형상 ④ 굴착 공법 및 방법 ⑥ 지보패턴 선정 ⑦ 각종 지보재의 규격 및 시공순서도 ⑧ 필요한 보조공법 ⑨ 방수 및 배수 방법 ⑩ 콘크리트라이닝의 타설시기 검토 및 시공도 ⑪ 계측계획 및 수행방법 ⑫ 갱구 및 갱문 계획 ⑬ 환기, 조명, 방재 계획 ⑭ 터널시공에 따른 환경영향분석 ⑮ 공사시방서 (15) 터널 부대시설에 사용하는 재료는 화재에 대한 내화성을 가진 재료를 사용해야 한다. (16) 터널 공사용 자재는 산업표준화법에 의한 한국산업규격 표시품(이하 KS 표시품이라 한다.) 또는 이와 동등 이상의 성능을 지닌 자재 이어야 하며, 친환경상품 구매촉진에 관한 법률에 의한 친환경상품 또는 중소기업제품 구매촉진 및 판로지원에 관한 법률에 따른 우선구매대상 기술개발제품이 설계에 반영될 수 있는지 검토해야 한다. (17) 향후 운영 시의 유지관리에 필요한 사항을 고려하여야 한다. 1.9 신규기술적용 내용 없음. 1.10 구조설계도서 내용 없음. 2. 조사 및 계획 2.1 일반사항 내용 없음. 2.2 조사 내용 없음. 2.3 계획 내용 없음. 3. 재료 3.1 일반사항 내용 없음. 3.2 재료특성 내용 없음. 3.3 품질 및 성능시험 내용 없음. 4. 설계 4.1 설계방법의 선정 (1) 설계방법의 선정에 있어서는 지반의 거동특성과 지보재의 지보력이 상호 연합하여 일체로 거동하여 터널의 안전성이 유지될 수 있는 방법을 선정하여야 한다. 단, 지반의 거동특성상 지반의 지보능력 활용이 불가능할 경우에는 지반보강을 시행하거나 지보재가 지반하중을 모두 지지하도록 하는 설계방법을 채택하여야 한다. (2) 암반 분류 후 해당 등급에 적용할 표준적인 지보패턴과 굴착방법을 정하여 설계할 수 있다. 이 경우 유사암반 조건에서의 시공실적 또는 RMR 방법 및 Q-시스템 등에서 제안한 지보패턴을 참조하여 지보패턴을 정하는 것을 원칙으로 하며 현장조건에 따라 변경할 수 있다. 암분류는 KDS 27 10 05, KDS 27 10 10(2.2.2), 기본설계 등에 관한 세부시행기준(국토교통부), KDS 11 10 10 등을 기본으로 하며 필요할 경우 별도로 정하여 실시한다. (3) 선정된 굴착계획, 굴착공법 및 지보패턴은 해석적인 방법을 통하여 그 안정성을 검증하여야 하며, 안정성의 검증과정에서는 작용하중, 사용되는 지반공학적 특성치, 해석기법 및 경계조건 등을 충실하게 검토하여 합리적인 검증이 되도록 하여야 한다. (4) 설계조건이 특수하거나 유사조건에서의 시공사례도 없는 경우에는 예상되는 제반문제를 면밀히 검토한 후 굴착방법, 굴착공법, 지보패턴 및 인버트 시공을 포함한 보조공법 등을 선정하고 해석적인 검증을 통하여 확정하여야 한다. 4.2 설계내용의 변경 (1) 시공 시의 제반 여건이 설계 시의 조건과 상이하여 예상되는 문제점에 대하여서는 표 4.2-1과 같은 사항들에 대하여 설계내용을 변경할 수 있도록 하여야 한다. 표 4.2-1 설계내용의 변경사항 표 4.2-1 설계내용의 변경사항 주요 항목 주요 내용 지반의 재분류 ·적용지반의 분류 설계단면 변경 ·지보재 ·변형 여유량 ·단면형상 적용지보패턴의 변경 ·숏크리트의 두께 ·숏크리트의 재질 ·록볼트의 길이, 본수 ·강지보재 설치간격 및 규격 굴착공법의 변경 ·벤치커트 공법 (코아(Core) 남김, 링커트 포함) ·선진도갱공법 ·기타 굴착단면 분할 보조공법 도입 ·굴진면 안정화 대책 ·지반보강 대책 ·용출수대책 ·지표면 침하 대책 ·근접 구조물 대책 단면의 폐합 ·인버트 부분 콘크리트 타설(조기시공) ·인버트 부분 숏크리트 타설(가폐합) ·콘크리트라이닝 강성증대 ·이중라이닝(임시라이닝) 터널공법 변경 ·개착터널공법으로 전환·토공구간으로 전환 기타 ·상기내용 외에 시공 시 제반 여건이 설계 시의 조건과 상이하여 변경이 요구되는 사항 4.3 품질보증에 대한 기본사항 (1) 활단층지역에는 구조물을 건설하지 않는 것이 바람직하다. 단, 이를 피하기 어려울 경우에는 지진 발생에 따른 손상이 최소화되도록 설계하여야 한다. 또한 기능 손상이 발생할 경우에 대비하여 보수⋅보강이 용이하도록 설계하여야 한다. (2) 중요 구조물의 경우, 설계 요구사항의 만족성, 설계 기법 및 가정사항의 적절성, 법규요건에 대한 만족성, 설계 결과의 시공성 등의 검증을 위하여 터널전문기술자에 의한 검토가 실시되어야 한다. 4.4 연직갱 및 경사갱 4.4.1 설계일반 (1) 연직갱 및 경사갱의 설계 시에는 사전에 충분한 지반조사를 실시하여 지반의 상태 및 특성을 파악하고 이를 설계에 반영하여야 한다. (2) 연직갱에서는 특수한 작업기계를 사용하게 되므로 지형 및 지반조건에 적합한 장비를 선정하여 제시하여야 하고, 지하수 유입에 대비하여 안정성, 시공성을 충분히 고려한 계획을 세워야 한다. 특히, 동절기 시공 중 지표 부근의 누수로 인한 고드름 및 기타 낙하물에 대한 안전대책을 사전에 강구하여야 한다. (3) 연직갱을 작업용으로 사용하고 공사 완공 후 타목적으로 전용하지 않는 경우에는 터널 본체 및 지표에 영향을 미치지 않도록 보강, 폐쇄, 매립 등의 적절한 방안을 제시하여야 한다. (4) 경사갱의 설계 시에는 용도, 지반조건, 버력 및 기자재의 반출입, 터널 내부설비, 측량, 시공, 유지보수, 점검 시의 안정성 등을 충분히 고려하여 위치, 유효단면, 기울기, 수평부의 연장, 수평분기점의 위치, 본 터널과의 교차각도 등을 정하여야 한다. (5) 경사갱의 수평부의 연장은 터널 내부설비 외에 측량의 정도, 버력설비, 차량의 교체작업 등을 고려하여 정하여야 한다. (6) 경사갱과 본 터널과의 교차각도는 직각을 표준으로 하되 연결부의 구조, 시공성, 차량의 선회반경 등 운행조건을 고려하여 교차각도를 별도로 정할 수 있다. (7) 연직갱 및 경사갱의 위치는 용도, 지반 및 지형조건, 유입 지하수, 연장 및 유지관리를 고려하여 경제적으로 유리한 장소를 선정하여야 한다. 유지 관리하여야 할 연직갱의 경우에는 인력 및 장비수송용 승강기를 연직갱 내에 설치하여야 하며, 심도에 따른 안전대책을 수립하여야 한다. (8) 연직갱 및 경사갱을 작업용으로 사용하는 경우에는 본 터널과 연결되는 갱저설비의 배치, 측량, 완성 후의 처리 등을 고려하여 위치를 선정하여야 한다. (9) 연직갱 및 경사갱을 환기, 배수, 비상용 통로 등 본 설비로 사용하는 경우에는 향후 지하시설의 확장에 대비하여 위치를 선정하여야 하며, 배출되는 오염물질이 주변 환경에 미치는 영향을 검토하여야 한다. (10) 연직갱 및 경사갱의 굴착대상인 지층에 대수층이 있거나 유입 지하수가 많을 것으로 예상되는 경우에는 지하수위 저하, 지수, 지반 강화 등의 보조공법을 계획하여야 한다. (11) 철도터널의 경우 차량의 터널 진입 시 발생하는 공기압 증가에 따른 이명감 및 공기 저항 증가 등을 해소하기 위하여 연직갱 또는 경사갱을 설계할 경우에는 사전에 필요로 하는 조사 및 검토를 실시해야 한다. 4.4.2 연직갱의 설계 (1) 연직갱의 단면은 용도에 따른 소요 내공단면, 시공방법, 연직갱 내에 설치될 모든 설비의 배치, 반입기자재의 크기, 지반조건 등을 종합적으로 고려하여 그 크기와 형상을 정하여야 한다. (2) 도로 및 철도터널의 환기용 연직갱은 터널 내의 소요 환기량을 충분히 확보할 수 있는 단면적을 확보하여야 한다. 연직갱의 단면은 연직갱 내 풍속이 20 m/sec 이하로 되는 단면으로 결정하여야 한다. (3) 철도터널에서 공기압의 저감을 위하여 설계하는 연직갱의 단면은 본선 터널의 단면, 열차속도 등 관련사항을 고려하여 결정해야 한다. (4) 도로 및 철도터널 등의 작업용 연직갱의 설계 시에는 케이지(Cage), 스킵(Skip) 등의 버력처리설비 및 배수관, 환기관, 급기관, 각종 배선류, 비상계단 등의 설치와 반입 기자재의 크기 등을 종합적으로 검토하여 단면을 결정하여야 한다. (5) 지보설치 후의 연직갱 유효단면은 지하시설 건설공사를 가장 경제적으로 수행하기 위한 시간당 버력, 인원, 소요 자재 운반량과 반입될 장비, 설비의 크기, 시간당 환기량과 각종 설비, 지반조건을 고려하여 결정하여야 한다. 4.4.3 경사갱의 설계 (1) 경사갱의 기울기는 용도, 연장, 본 터널과의 위치 관계, 지반조건, 시공법, 공기, 운반방법의 특성, 환기방법, 경제성 등에 대하여 검토를 하고 정하여야 하며, 버력반출용 경사갱의 경우에는 장비의 등판능력을 고려하여 계획하여야 한다. (2) 경사갱에서는 설치하는 설비의 반출입, 설치의 용이성, 유지보수, 점검 시의 안전성 등을 충분히 고려하여 기울기 및 연장을 정하여야 한다. (3) 경사갱의 단면은 용도, 시공을 위한 운반설비, 작업용 통로 및 공사용 제설비의 배치 등을 종합적으로 고려하여 크기와 형태를 정하여야 한다. (4) 작업용 경사갱의 단면은 버력반출설비, 배수관, 환기관, 급기관, 각종 배선류와 반입 기자재의 크기 등을 종합적으로 검토하여 정하여야 한다. (5) 배수관은 지하수의 유입 상태에 따라 증설의 필요성이 발생하므로 여유를 갖는 배치가 되도록 내공단면을 확보하여야 한다. 4.5 갱구부 (1) 갱구부는 일반적으로 갱문구조물 배면으로부터 터널길이 방향으로 터널직경의 1~2배 범위 또는 터널 천장부로부터 토피고 3~5 m에서 터널직경 1.5배의 토피고가 확보되는 범위까지로 정의한다. 단, 원지반 조건이 양호한 암반층 또는 붕적층, 충적층 등의 연약토사층에서는 별도의 구간을 갱구부 범위로 정의할 수 있다. NATM 터널시점토피고 3~5m계획면갱문구조물갱구부(1~2D)1.5D터널일반부그림 4.5-1 갱구부의 범위 NATM 터널시점 토피고 3~5m 계획면 갱문 구조물 갱구부(1~2D) 1.5D 터널일반부 그림 4.5-1 갱구부의 범위 (2) 갱구부는 터널 본선부와는 달리 지형, 기상, 입지조건, 근접시설물 등의 외적조건에 크게 영향을 받기 때문에 이를 고려하여 구조 및 시공법을 선정해야 한다. (3) 갱구부의 설계에는 아래의 사항들을 검토하여 안정성을 확보하고 환경훼손을 최소화할 수 있도록 해야 한다. ① 갱구의 위치 및 설치방법 ② 갱구부의 범위 ③ 갱구부의 굴착공법, 지보구조, 보조공법과 콘크리트라이닝 구조 ④ 갱구비탈면의 안정검토와 필요한 사면 안정공법 ⑤ 갱구비탈면의 지표수 및 지하수 배수 대책 ⑥ 기상재해의 가능성과 필요한 대책공법 ⑦ 지표 침하 등 갱구 주변의 구조물에 미치는 영향 (4) 터널 중심축선은 지형 경사면과 가급적 직교하도록 하여야 하며, 이 경우 경사면 하단보다 상부 지역에 갱구부가 계획될 때에는 공사용 진입로를 확보하도록 하여야 하고, 인접 구조물과의 관계 등도 고려하여야 한다. (5) 갱구부는 갱구부 깎기 최소화를 위하여 특수한 지형 및 지질조건을 제외하고는 갱구부 상단 토피 3~5 m 또는 암토피고 1~2 m 확보되는 지점에 갱구부를 형성하는 것을 표준으로 한다. (6) 터널 중심축선이 지형 비탈면에 대하여 사각으로 진입하는 경우에는 비대칭의 깎기 비탈면이나 갱문이 형성되게 되므로 횡방향 토피 확보 여부와 편압에 대한 검토를 하여야 한다. (7) 터널 중심축선과 지형경사면이 평행한 경우는 가급적 피해야 하며, 골짜기 쪽의 토피가 극단적으로 얇아질 경우가 있으므로 전 구간에 걸쳐 편압에 대한 검토와 이에 대한 대책을 수립하여야 한다. (8) 골짜기에는 일반적으로 지질구조대가 발달하여 있고 지표수 유입과 지하수위가 높을 경우가 많으므로 터널 중심축선이 골짜기로 진입하는 경우는 최대한 피하여야 한다. 부득이하게 계획되었을 경우는 수리⋅수문학적인 검토를 하여 지표수와 갱문 배면의 침투수가 원활하게 배수처리 되도록 하여야 하며, 낙석, 산사태, 눈사태 등의 자연재해 발생가능성에 대비하여야 한다. (9) 갱구의 위치는 깎기 비탈면의 안정과 자연지형 보존을 위하여 깎기를 최소화할 수 있는 위치로 선정하여야 하며, 갱구 위치별 깎기량에 대한 경제성, 시공성, 경관성, 환경영향 등을 비교 검토하여야 한다. (10) 갱구부의 설계에 있어서는 비탈면의 안정성, 지반의 지내력, 터널 중심축선과 비탈면의 관계, 갱구비탈면 깎기 및 터널의 안정성 등을 검토하여야 한다. (11) 갱구비탈면의 기울기는 지반조건에 따라 적절히 선정하여야 하며, 필요시 비탈면 안정성 확보를 위하여 표면 보호공법과 활동 방지대책 등의 적절한 보강공법을 적용하여야 한다. (12) 갱구부는 일반적으로 지반의 강도와 고결도가 낮은 경우가 많고 암반층에서도 균열 발달이 심한 경우가 많으므로 지반의 자체 지보력 확보를 위하여 보다 적극적인 보강공법을 적용하여야 하며, 동일 지반조건에서의 일반 구간보다 안전한 굴착공법과 지보패턴의 작용을 검토하여야 한다. (13) 토피가 얇고, 지반 자체의 지보력 형성이 어려울 것으로 예상되는 경우에는 상재된 전토피 하중이 지보재로의 작용 여부를 검토하여야 한다. (14) 누수, 결빙 등이 발생하기 쉽기 때문에 적절한 방수 및 배수 조치를 하여야 하며, 갱구부에 작용하는 하중 및 기상조건에 따른 영향을 고려하여 콘크리트라이닝의 철근보강 여부, 동상방지층, 제설 시스템 및 방설시설의 적용 여부를 검토하여야 한다. (15) 갱구부에서는 지진영향에 대한 거동특성이 일반구간과는 다를 수 있으므로 지진하중에 의한 영향을 검토하여야 한다. (16) 갱구부 시공 시 지반이완과 비탈면 붕괴가 발생할 위험이 있는 경우에는 터널굴착에 앞서 낙석방지와 비탈면 안정대책을 수립하여야 한다. (17) 터널 중심축선과 비탈면의 위치 관계에서 3차원 거동이 예상되거나 편압이 작용되는 경우에는 터널안정성 해석 시 이에 대한 검토를 하여야 하며, 안정성이 확보되지 않는 경우에는 압성토와 깎기로서 지반압의 균형을 맞추도록 하거나 불균형의 응력 발생에 대비한 보강대책을 제시하여야 한다. (18) 갱구부는 지표부에 과다한 침하와 지표 함몰의 가능성이 있으므로 지표부에 침하의 제한이 필요한 시설물이 있는 경우에는 이에 대한 충분한 대책을 검토하여야 하며, 필요에 따라 보강공법을 제시하여야 한다. (19) 터널 갱구부 주위에 태풍 등의 영향으로 쓰러지거나 가지가 끊어져 열차운행에 지장을 줄 수 있는 수종은 식재하지 않도록 해야 한다. (20) 집중호우 시 터널 갱구부 비탈면으로 대량의 지표수가 직접 유입되지 않도록 비탈면 어깨부에 산마루 측구를 설치하고, 비탈면에는 식생공 등의 비탈면 보호공을 시공해야 한다. 비탈면의 지질이 불량한 경우에는 옹벽 또는 비탈면 보호블럭 등 영구시설물 설치를 고려해야 한다. 4.6 갱문의 설계 (1) 갱문의 위치 선정에 있어서는 기상 및 자연재해에 의한 영향을 최소화 할 수 있도록 갱문 배면의 지형, 지반조건, 깎기 및 비탈면의 안정성 등을 검토하여야 하며, 갱구부 주변의 유지관리시설과의 관계와 터널 외부의 구조물형식을 고려하여야 한다. (2) 갱문은 비탈면에서의 낙석, 토사붕락, 눈사태, 지표수 유입 등으로부터 갱구부를 보호할 수 있는 기능을 갖도록 하여야 하고, 지반조건이 허용하는 한 최소 토피구간을 선정하여 자연환경 훼손을 최소화하여야 하며, 역학적으로 안정한 구조로 하여야 한다. (3) 갱문의 외관과 형상은 터널의 사용 목적에 맞고 주변 경관과의 조화를 위한 조경계획과 유지관리상의 편의를 고려하여 선정하여야 한다. (4) 갱문의 형식 선정 ① 면벽형은 구조적으로 중력식과 날개식 등으로 나눌 수 있고 갱문 배면의 지반압을 받는 토류 옹벽구조로 하여야 한다. ② 돌출형은 터널 본체와 동일한 내공단면이 터널 갱구부에 연속하여 지반으로부터 돌출한 형식으로서 그 형상에 따라 파라펫트식, 원통깎기식, 벨마우스식 등이 있으며 각 형식별로 장⋅단점을 고려하여 선정하여야 한다. ③ 해빙기와 집중호우 시 낙석, 눈사태, 산사태로부터 이용자의 안전을 확보할 수 있도록 갱문형식을 선정⋅설계하여야 한다. (5) 갱문의 구조설계는 소요 하중 외에 지진, 온도 변화, 콘크리트의 건조수축 등의 영향을 고려하여야 하며, 갱문구조물의 기초안정성도 검토하여야 한다. (6) 갱문구조물의 일부로서 터널과 연결된 복개식 터널구조물은 개착구조물로 간주하여 설계하여야 하며, 편압이 작용할 경우에는 이에 대한 영향을 고려하여야 한다. (7) 갱문구조물과 본선 터널의 접합부는 분리구조로 하고 적합한 조인트를 설치하여야 하며, 재질이 서로 다른 두 종류의 방수막이 접합되는 경우, 방수막 상호간 접합이 용이한 재료를 선정하여 사용한다. 특히, 접합부에는 누수에 대비하여 구조물 횡방향을 따라 도수로를 설치하여야 한다. (8) 갱구부 개착구조물 설치 시 원지반의 특성을 감안하여 바닥 슬래브의 설치 여부를 검토하여야 한다. (9) 갱문 상부에는 낙석방지, 통행자의 안전을 위한 안전 난간 등의 보호시설을 설치해야 한다. 4.7 갱문부 주행 안전성 확보 (1) 갱문부에는 운전자의 안전을 확보하기 위하여 현장 여건을 고려하여 교통관리 안전시설, 차량방호 안전시설 등을 계획하여야 한다. (2) 토공부와 터널부의 횡단폭원이 변화하는 경우 운전자의 안전성을 확보하기 위하여 터널 갱문부의 길어깨 폭원의 점진적 변화구간 설정을 검토하여야 한다. 4.8 단면확폭부 및 접속부 (1) 단면확폭부 및 접속부는 터널용도에 따라 다음 표 4.8-1과 같이 구분되며, 터널 일반부에 비하여 단면이 크고 복잡한 형상이므로 그 기능과 지반조건을 감안하여 터널과 주변 지반의 안정을 확보할 수 있도록 설계하여야 한다. 표 4.8-1 단면확폭부와 접속부의 구분 표 4.8-1 단면확폭부와 접속부의 구분 구분 단면확폭부 접속부 도로터널 ·비상주차대 구간 ·오르막 차로 설치구간 ·갱구부 확폭구간 ·2-아치/3-아치 터널구간 ·피난연결통로 설치구간 ·환기용 터널 설치구간 ·수직구 설치구간 ·사갱 설치구간 철도터널 ·분기기 설치구간 ·구난정거장 구간 ·단복선 변화구간 ·정거장 구간 ·신호장 구간 ·변압기 설치구간 ·대형대피소 설치구간 ·환기용 및 대피용 터널 설치구간 ·수직구 설치구간 ·단복선 연결구간 ·사갱 설치구간 도시철도터널 ·정거장 구간 ·유치선 구간 ·신호소 설치구간 ·단복선 변화구간 ·단복선 연결구간 ·변전실 설치구간 ·대피용 터널 설치구간 기타 ·일반부보다 확폭된 단면이나, 터널 간 접속되는 구간 (2) 단면확폭부와 접속부는 지반조건이 양호한 구간에 설치하여야 하며, 지반조건이 불량한 구간에 위치하는 경우에는 설치 목적에 위배되지 않는 범위 내에서 위치 변경이 가능하도록 계획하여야 한다. (3) 단면확폭부와 접속부는 터널과 주변 지반이 역학적으로 충분히 안정하고 경제적인 시공이 되도록 확폭부와 접속부의 형상, 시공 방법 및 순서, 지보재, 콘크리트라이닝, 보강공법 등을 검토하여야 한다. (4) 단면확폭부는 안정성과 경제성을 고려하여 단면계획을 하여야 하며, 시공과정에서 단면의 형상이 여러 형태로 변화하므로 이를 감안하여 변화된 터널단면의 안정성을 확보하여야 한다. (5) 단면확폭의 범위가 크지 않을 경우에는 지반조건을 파악하여 지보패턴의 변경으로 대치할 수 있으며, 이 경우 지보재 증가수량을 합리적으로 산정하여야 한다. (6) 단면확폭부의 시공순서는 확폭단면의 크기, 확폭단부의 공간처리, 지반조건, 공기 등을 고려하여 결정하여야 한다. (7) 단면확폭부가 부득이 하게 지반조건이 불량한 위치에 계획된 경우에는 별도의 상세한 지반조사를 시행하여야 하며, 필요시 3차원 해석을 통하여 안정성을 검토하여야 한다. 4.9 접속부의 설계 (1) 접속부는 터널단면들이 여러 형태로 연결될 수 있으므로 이를 감안하여 접속된 터널단면들에 대하여 안정성을 검토하여야 한다. (2) 접속부의 시공방법, 시공순서 및 시공 이격거리는 선행굴진 터널의 지보재 및 주변 지반에 미치는 영향을 충분히 고려하여 결정하여야 한다. (3) 접속부는 터널의 크기와 지반조건에 적합한 필러(Pillar)의 폭을 유지하여야 한다. (4) 접속부의 소요의 필러 폭 확보가 곤란하거나 지반조건이 불량한 경우에는 강성이 충분한 지보재로 필러를 보강하거나 단면확폭부를 이용한 분기를 적용할 수 있다. (5) 접속부의 구조 및 형상은 안정성이 확보되도록 계획하여야 하며, 부득이하게 지반조건이 불량한 위치에 계획되거나 형상이 특수한 경우에는 별도의 상세한 지반조사를 시행하여야 하고, 필요시 3차원 해석을 통한 안정성을 검토하여야 한다. (6) 접속부의 보강범위는 접속각도 90°인 경우 접속터널은 접속터널 최대폭(d)의 1 d, 본선터널은 본선터널 최대폭(D)의 1 D를 표준으로 하는 것을 원칙으로 하되, 상세검토를 통하여 보강범위를 별도로 선정할 수 있으며, 기타 접속각도의 경우 접속각도에 따른 응력 집중 및 증가를 검토하여 보강범위를 선정하여야 한다. 4.10 침매터널 (1) 침매함은 필요에 따라 다음에 열거하는 사항을 감안하여 안전한 구조로 한다. ① 수밀성 ② 콘크리트의 균열 ③ 예항시의 안정과 침설과정에서의 하중 (2) 침매함 구조의 안정성을 확보하기 위해서는 다음에 열거하는 항목에 대하여도 검토하여야 한다. ① 완성 시 및 시공 시에 작용하는 하중 ② 시공성 ③ 침설 후 부력에 의한 함체의 부양 ④ 환기, 방재 등의 기능 ⑤ 병설되는 기능 집필위원 분야 성명 소속 직급 (집필위원장) 문상조 ㈜유신 부사장 (연구책임자) 유한규 한양대학교 교수 황제돈 ㈜에스코컨설턴트 대표이사 신영완 ㈜하경엔지니어링 사장 최재원 ㈜넥스지오 이사 (간 사) 이재국 ㈜경동엔지니어링 상무 자문위원 분야 성명 소속 터널 이상덕 아주대학교 터널 김상환 호서대학교 건설기준위원회 분야 성명 소속 터널 김시격 ㈜다산컨설턴트 터널 최해준 동명기술공단 터널 황제돈 ㈜에스코컨설턴트 터널 김홍문 ㈜평화엔지니어링 터널 박광준 ㈜대정컨설턴트 터널 신영완 ㈜하경엔지니어링 중앙건설기술심의위원회 성명 소속 조완형 ㈜다산컨설턴트 조태희 ㈜경호엔지니어링 이창윤 ㈜삼보기술단 한금숙 선창건설㈜ 김정호 ㈜다산컨설턴트 이래철 에스큐엔지니어링㈜ 국토교통부 성명 소속 직책 김인 국토교통부 간선도로과 과장 최규용 국토교통부 간선도로과 사무관 설계기준 KDS 27 10 15 : 2016 설계일반 2016년 6월 30일 발행 국토교통부 관련단체 한국터널지하공간학회 06720 서울시 서초구 효령로 304 14층 11호 ☎ 02-3465-3663/3665 E-mail : ktastaff@hanmail.net http://www.tunnel.or.kr 국가건설기준센터 10223 경기도 고양시 일산서구 고양대로 283(대화동) ☎ 031-910-0444 E-mail : kcsc@kict.re.kr http://www.kcsc.re.k",
    "sections": {
      "scope": "(1) 연직갱의 설계는 수직이거나 수직에 가까운 터널에 적용하여야 한다.\n(2) 경사갱의 설계는 경사진 터널에 적용하여야 한다. \n(3) 갱구부 및 갱문의 설계는 산악터널에 적용하여야  한다.",
      "materials": "콘크리트라이닝, 터널 입구와 출구부, 방재 및 부대시설, 시공순서 등을 계획 선정하여야 한다. (7) 터널안정성을 확보하기 위하여 터널구조물의 안전뿐만 아니라 주변 위험영향도 최소화되도록 하여야 하며, 터널 주위에 미치는 영향에 대하여는 필요시 합리적인 대책을 강구하여야 한다. (8) 터널설계는 환기, 조명, 방재시설 등의 제반설비 사항들도 고려하여야 하며 이들의 역할이 잘 발휘되도록 하여야 한다. (9) 터널설계는 굴착 시 원지반의 손상이나 여굴 발생이 최소화되도록 하여야 하며, 원지반의 손상이나 여굴 발생 시 그 처리방안을 제시하여야 한다. (10) 터널설계는 계획 터널노선에 대하여 시공성을 고려한 경제성 분석을 실시하여야 한다. (11) 터널설계는 안정성 확보를 우선으로 하되 지보재의 최적화를 도모하여야 한다. 이 경우 해석적인 방법 외에 설계⋅시공사례 등의 경험적인 방법도 고려해야 한다. (12) 콘크리트라이닝은 터널이 신선한 경암반을 통과하는 경우 지보재와 콘크리트라이닝의 역할에 따라 라이닝의 설치 여부를 검토할 수 있다. (13) 터널설계는 관계 법령이 정하는 바에 따라 제반 안전성 분석 및 피난계획을 수립하고, 터널 내 부착물 및 시설물은 화재 시를 고려하여 적절한 재료를 선정하여야 한다. (14) 터널설계에는 다음 사항이 포함되어야 한다. ① 평면 및 종단선형 ② 굴착대상지반의 분석 및 분류 ③ 터널단면의 형상 ④ 굴착 공법 및 방법 ⑥ 지보패턴 선정 ⑦ 각종 지보재의 규격 및 시공순서도 ⑧ 필요한 보조공법 ⑨ 방수 및 배수 방법 ⑩ 콘크리트라이닝의 타설시기 검토 및 시공도 ⑪ 계측계획 및 수행방법 ⑫ 갱구 및 갱문 계획 ⑬ 환기, 조명, 방재 계획 ⑭ 터널시공에 따른 환경영향분석 ⑮ 공사시방서 (15) 터널 부대시설에 사용하는 재료는 화재에 대한 내화성을 가진 재료를 사용해야 한다. (16) 터널 공사용 자재는 산업표준화법에 의한 한국산업규격 표시품(이하 KS 표시품이라 한다.) 또는 이와 동등 이상의 성능을 지닌 자재 이어야 하며, 친환경상품 구매촉진에 관한 법률에 의한 친환경상품 또는 중소기업제품 구매촉진 및 판로지원에 관한 법률에 따른 우선구매대상 기술개발제품이 설계에 반영될 수 있는지 검토해야 한다. (17) 향후 운영 시의 유지관리에 필요한 사항을 고려하여야 한다. 1.9 신규기술적용 내용 없음. 1.10 구조설계도서 내용 없음. 2. 조사 및 계획 2.1 일반사항 내용 없음. 2.2 조사 내용 없음. 2.3 계획 내용 없음. 3. 재료 3.1 일반사항 내용 없음. 3.2 재료특성 내용 없음. 3.3 품질 및 성능시험 내용 없음. 4. 설계 4.1 설계방법의 선정 (1) 설계방법의 선정에 있어서는 지반의 거동특성과 지보재의 지보력이 상호 연합하여 일체로 거동하여 터널의 안전성이 유지될 수 있는 방법을 선정하여야 한다. 단, 지반의 거동특성상 지반의 지보능력 활용이 불가능할 경우에는 지반보강을 시행하거나 지보재가 지반하중을 모두 지지하도록 하는 설계방법을 채택하여야 한다. (2) 암반 분류 후 해당 등급에 적용할 표준적인 지보패턴과 굴착방법을 정하여 설계할 수 있다. 이 경우 유사암반 조건에서의 시공실적 또는 RMR 방법 및 Q-시스템 등에서 제안한 지보패턴을 참조하여 지보패턴을 정하는 것을 원칙으로 하며 현장조건에 따라 변경할 수 있다. 암분류는 KDS 27 10 05, KDS 27 10 10(2.2.2), 기본설계 등에 관한 세부시행기준(국토교통부), KDS 11 10 10 등을 기본으로 하며 필요할 경우 별도로 정하여 실시한다. (3) 선정된 굴착계획, 굴착공법 및 지보패턴은 해석적인 방법을 통하여 그 안정성을 검증하여야 하며, 안정성의 검증과정에서는 작용하중, 사용되는 지반공학적 특성치, 해석기법 및 경계조건 등을 충실하게 검토하여 합리적인 검증이 되도록 하여야 한다. (4) 설계조건이 특수하거나 유사조건에서의 시공사례도 없는 경우에는 예상되는 제반문제를 면밀히 검토한 후 굴착방법, 굴착공법, 지보패턴 및 인버트 시공을 포함한 보조공법 등을 선정하고 해석적인 검증을 통하여 확정하여야 한다. 4.2 설계내용의 변경 (1) 시공 시의 제반 여건이 설계 시의 조건과 상이하여 예상되는 문제점에 대하여서는 표 4.2-1과 같은 사항들에 대하여 설계내용을 변경할 수 있도록 하여야 한다. 표 4.2-1 설계내용의 변경사항 표 4.2-1 설계내용의 변경사항 주요 항목 주요 내용 지반의 재분류 ·적용지반의 분류 설계단면 변경 ·지보재 ·변형 여유량 ·단면형상 적용지보패턴의 변경 ·숏크리트의 두께 ·숏크리트의 재질 ·록볼트의 길이, 본수 ·강지보재 설치간격 및 규격 굴착공법의 변경 ·벤치커트 공법 (코아(Core) 남김, 링커트 포함) ·선진도갱공법 ·기타 굴착단면 분할 보조공법 도입 ·굴진면 안정화 대책 ·지반보강 대책 ·용출수대책 ·지표면 침하 대책 ·근접 구조물 대책 단면의 폐합 ·인버트 부분 콘크리트 타설(조기시공) ·인버트 부분 숏크리트 타설(가폐합) ·콘크리트라이닝 강성증대 ·이중라이닝(임시라이닝) 터널공법 변경 ·개착터널공법으로 전환·토공구간으로 전환 기타 ·상기내용 외에 시공 시 제반 여건이 설계 시의 조건과 상이하여 변경이 요구되는 사항 4.3 품질보증에 대한 기본사항 (1) 활단층지역에는 구조물을 건설하지 않는 것이 바람직하다. 단, 이를 피하기 어려울 경우에는 지진 발생에 따른 손상이 최소화되도록 설계하여야 한다. 또한 기능 손상이 발생할 경우에 대비하여 보수⋅보강이 용이하도록 설계하여야 한다. (2) 중요 구조물의 경우, 설계 요구사항의 만족성, 설계 기법 및 가정사항의 적절성, 법규요건에 대한 만족성, 설계 결과의 시공성 등의 검증을 위하여 터널전문기술자에 의한 검토가 실시되어야 한다. 4.4 연직갱 및 경사갱 4.4.1 설계일반 (1) 연직갱 및 경사갱의 설계 시에는 사전에 충분한 지반조사를 실시하여 지반의 상태 및 특성을 파악하고 이를 설계에 반영하여야 한다. (2) 연직갱에서는 특수한 작업기계를 사용하게 되므로 지형 및 지반조건에 적합한 장비를 선정하여 제시하여야 하고, 지하수 유입에 대비하여 안정성, 시공성을 충분히 고려한 계획을 세워야 한다. 특히, 동절기 시공 중 지표 부근의 누수로 인한 고드름 및 기타 낙하물에 대한 안전대책을 사전에 강구하여야 한다. (3) 연직갱을 작업용으로 사용하고 공사 완공 후 타목적으로 전용하지 않는 경우에는 터널 본체 및 지표에 영향을 미치지 않도록 보강, 폐쇄, 매립 등의 적절한 방안을 제시하여야 한다. (4) 경사갱의 설계 시에는 용도, 지반조건, 버력 및 기자재의 반출입, 터널 내부설비, 측량, 시공, 유지보수, 점검 시의 안정성 등을 충분히 고려하여 위치, 유효단면, 기울기, 수평부의 연장, 수평분기점의 위치, 본 터널과의 교차각도 등을 정하여야 한다. (5) 경사갱의 수평부의 연장은 터널 내부설비 외에 측량의 정도, 버력설비, 차량의 교체작업 등을 고려하여 정하여야 한다. (6) 경사갱과 본 터널과의 교차각도는 직각을 표준으로 하되 연결부의 구조, 시공성, 차량의 선회반경 등 운행조건을 고려하여 교차각도를 별도로 정할 수 있다. (7) 연직갱 및 경사갱의 위치는 용도, 지반 및 지형조건, 유입 지하수, 연장 및 유지관리를 고려하여 경제적으로 유리한 장소를 선정하여야 한다. 유지 관리하여야 할 연직갱의 경우에는 인력 및 장비수송용 승강기를 연직갱 내에 설치하여야 하며, 심도에 따른 안전대책을 수립하여야 한다. (8) 연직갱 및 경사갱을 작업용으로 사용하는 경우에는 본 터널과 연결되는 갱저설비의 배치, 측량, 완성 후의 처리 등을 고려하여 위치를 선정하여야 한다. (9) 연직갱 및 경사갱을 환기, 배수, 비상용 통로 등 본 설비로 사용하는 경우에는 향후 지하시설의 확장에 대비하여 위치를 선정하여야 하며, 배출되는 오염물질이 주변 환경에 미치는 영향을 검토하여야 한다. (10) 연직갱 및 경사갱의 굴착대상인 지층에 대수층이 있거나 유입 지하수가 많을 것으로 예상되는 경우에는 지하수위 저하, 지수, 지반 강화 등의 보조공법을 계획하여야 한다. (11) 철도터널의 경우 차량의 터널 진입 시 발생하는 공기압 증가에 따른 이명감 및 공기 저항 증가 등을 해소하기 위하여 연직갱 또는 경사갱을 설계할 경우에는 사전에 필요로 하는 조사 및 검토를 실시해야 한다. 4.4.2 연직갱의 설계 (1) 연직갱의 단면은 용도에 따른 소요 내공단면, 시공방법, 연직갱 내에 설치될 모든 설비의 배치, 반입기자재의 크기, 지반조건 등을 종합적으로 고려하여 그 크기와 형상을 정하여야 한다. (2) 도로 및 철도터널의 환기용 연직갱은 터널 내의 소요 환기량을 충분히 확보할 수 있는 단면적을 확보하여야 한다. 연직갱의 단면은 연직갱 내 풍속이 20 m/sec 이하로 되는 단면으로 결정하여야 한다. (3) 철도터널에서 공기압의 저감을 위하여 설계하는 연직갱의 단면은 본선 터널의 단면, 열차속도 등 관련사항을 고려하여 결정해야 한다. (4) 도로 및 철도터널 등의 작업용 연직갱의 설계 시에는 케이지(Cage), 스킵(Skip) 등의 버력처리설비 및 배수관, 환기관, 급기관, 각종 배선류, 비상계단 등의 설치와 반입 기자재의 크기 등을 종합적으로 검토하여 단면을 결정하여야 한다. (5) 지보설치 후의 연직갱 유효단면은 지하시설 건설공사를 가장 경제적으로 수행하기 위한 시간당 버력, 인원, 소요 자재 운반량과 반입될 장비, 설비의 크기, 시간당 환기량과 각종 설비, 지반조건을 고려하여 결정하여야 한다. 4.4.3 경사갱의 설계 (1) 경사갱의 기울기는 용도, 연장, 본 터널과의 위치 관계, 지반조건, 시공법, 공기, 운반방법의 특성, 환기방법, 경제성 등에 대하여 검토를 하고 정하여야 하며, 버력반출용 경사갱의 경우에는 장비의 등판능력을 고려하여 계획하여야 한다. (2) 경사갱에서는 설치하는 설비의 반출입, 설치의 용이성, 유지보수, 점검 시의 안전성 등을 충분히 고려하여 기울기 및 연장을 정하여야 한다. (3) 경사갱의 단면은 용도, 시공을 위한 운반설비, 작업용 통로 및 공사용 제설비의 배치 등을 종합적으로 고려하여 크기와 형태를 정하여야 한다. (4) 작업용 경사갱의 단면은 버력반출설비, 배수관, 환기관, 급기관, 각종 배선류와 반입 기자재의 크기 등을 종합적으로 검토하여 정하여야 한다. (5) 배수관은 지하수의 유입 상태에 따라 증설의 필요성이 발생하므로 여유를 갖는 배치가 되도록 내공단면을 확보하여야 한다. 4.5 갱구부 (1) 갱구부는 일반적으로 갱문구조물 배면으로부터 터널길이 방향으로 터널직경의 1~2배 범위 또는 터널 천장부로부터 토피고 3~5 m에서 터널직경 1.5배의 토피고가 확보되는 범위까지로 정의한다. 단, 원지반 조건이 양호한 암반층 또는 붕적층, 충적층 등의 연약토사층에서는 별도의 구간을 갱구부 범위로 정의할 수 있다. NATM 터널시점토피고 3~5m계획면갱문구조물갱구부(1~2D)1.5D터널일반부그림 4.5-1 갱구부의 범위 NATM 터널시점 토피고 3~5m 계획면 갱문 구조물 갱구부(1~2D) 1.5D 터널일반부 그림 4.5-1 갱구부의 범위 (2) 갱구부는 터널 본선부와는 달리 지형, 기상, 입지조건, 근접시설물 등의 외적조건에 크게 영향을 받기 때문에 이를 고려하여 구조 및 시공법을 선정해야 한다. (3) 갱구부의 설계에는 아래의 사항들을 검토하여 안정성을 확보하고 환경훼손을 최소화할 수 있도록 해야 한다. ① 갱구의 위치 및 설치방법 ② 갱구부의 범위 ③ 갱구부의 굴착공법, 지보구조, 보조공법과 콘크리트라이닝 구조 ④ 갱구비탈면의 안정검토와 필요한 사면 안정공법 ⑤ 갱구비탈면의 지표수 및 지하수 배수 대책 ⑥ 기상재해의 가능성과 필요한 대책공법 ⑦ 지표 침하 등 갱구 주변의 구조물에 미치는 영향 (4) 터널 중심축선은 지형 경사면과 가급적 직교하도록 하여야 하며, 이 경우 경사면 하단보다 상부 지역에 갱구부가 계획될 때에는 공사용 진입로를 확보하도록 하여야 하고, 인접 구조물과의 관계 등도 고려하여야 한다. (5) 갱구부는 갱구부 깎기 최소화를 위하여 특수한 지형 및 지질조건을 제외하고는 갱구부 상단 토피 3~5 m 또는 암토피고 1~2 m 확보되는 지점에 갱구부를 형성하는 것을 표준으로 한다. (6) 터널 중심축선이 지형 비탈면에 대하여 사각으로 진입하는 경우에는 비대칭의 깎기 비탈면이나 갱문이 형성되게 되므로 횡방향 토피 확보 여부와 편압에 대한 검토를 하여야 한다. (7) 터널 중심축선과 지형경사면이 평행한 경우는 가급적 피해야 하며, 골짜기 쪽의 토피가 극단적으로 얇아질 경우가 있으므로 전 구간에 걸쳐 편압에 대한 검토와 이에 대한 대책을 수립하여야 한다. (8) 골짜기에는 일반적으로 지질구조대가 발달하여 있고 지표수 유입과 지하수위가 높을 경우가 많으므로 터널 중심축선이 골짜기로 진입하는 경우는 최대한 피하여야 한다. 부득이하게 계획되었을 경우는 수리⋅수문학적인 검토를 하여 지표수와 갱문 배면의 침투수가 원활하게 배수처리 되도록 하여야 하며, 낙석, 산사태, 눈사태 등의 자연재해 발생가능성에 대비하여야 한다. (9) 갱구의 위치는 깎기 비탈면의 안정과 자연지형 보존을 위하여 깎기를 최소화할 수 있는 위치로 선정하여야 하며, 갱구 위치별 깎기량에 대한 경제성, 시공성, 경관성, 환경영향 등을 비교 검토하여야 한다. (10) 갱구부의 설계에 있어서는 비탈면의 안정성, 지반의 지내력, 터널 중심축선과 비탈면의 관계, 갱구비탈면 깎기 및 터널의 안정성 등을 검토하여야 한다. (11) 갱구비탈면의 기울기는 지반조건에 따라 적절히 선정하여야 하며, 필요시 비탈면 안정성 확보를 위하여 표면 보호공법과 활동 방지대책 등의 적절한 보강공법을 적용하여야 한다. (12) 갱구부는 일반적으로 지반의 강도와 고결도가 낮은 경우가 많고 암반층에서도 균열 발달이 심한 경우가 많으므로 지반의 자체 지보력 확보를 위하여 보다 적극적인 보강공법을 적용하여야 하며, 동일 지반조건에서의 일반 구간보다 안전한 굴착공법과 지보패턴의 작용을 검토하여야 한다. (13) 토피가 얇고, 지반 자체의 지보력 형성이 어려울 것으로 예상되는 경우에는 상재된 전토피 하중이 지보재로의 작용 여부를 검토하여야 한다. (14) 누수, 결빙 등이 발생하기 쉽기 때문에 적절한 방수 및 배수 조치를 하여야 하며, 갱구부에 작용하는 하중 및 기상조건에 따른 영향을 고려하여 콘크리트라이닝의 철근보강 여부, 동상방지층, 제설 시스템 및 방설시설의 적용 여부를 검토하여야 한다. (15) 갱구부에서는 지진영향에 대한 거동특성이 일반구간과는 다를 수 있으므로 지진하중에 의한 영향을 검토하여야 한다. (16) 갱구부 시공 시 지반이완과 비탈면 붕괴가 발생할 위험이 있는 경우에는 터널굴착에 앞서 낙석방지와 비탈면 안정대책을 수립하여야 한다. (17) 터널 중심축선과 비탈면의 위치 관계에서 3차원 거동이 예상되거나 편압이 작용되는 경우에는 터널안정성 해석 시 이에 대한 검토를 하여야 하며, 안정성이 확보되지 않는 경우에는 압성토와 깎기로서 지반압의 균형을 맞추도록 하거나 불균형의 응력 발생에 대비한 보강대책을 제시하여야 한다. (18) 갱구부는 지표부에 과다한 침하와 지표 함몰의 가능성이 있으므로 지표부에 침하의 제한이 필요한 시설물이 있는 경우에는 이에 대한 충분한 대책을 검토하여야 하며, 필요에 따라 보강공법을 제시하여야 한다. (19) 터널 갱구부 주위에 태풍 등의 영향으로 쓰러지거나 가지가 끊어져 열차운행에 지장을 줄 수 있는 수종은 식재하지 않도록 해야 한다. (20) 집중호우 시 터널 갱구부 비탈면으로 대량의 지표수가 직접 유입되지 않도록 비탈면 어깨부에 산마루 측구를 설치하고, 비탈면에는 식생공 등의 비탈면 보호공을 시공해야 한다. 비탈면의 지질이 불량한 경우에는 옹벽 또는 비탈면 보호블럭 등 영구시설물 설치를 고려해야 한다. 4.6 갱문의 설계 (1) 갱문의 위치 선정에 있어서는 기상 및 자연재해에 의한 영향을 최소화 할 수 있도록 갱문 배면의 지형, 지반조건, 깎기 및 비탈면의 안정성 등을 검토하여야 하며, 갱구부 주변의 유지관리시설과의 관계와 터널 외부의 구조물형식을 고려하여야 한다. (2) 갱문은 비탈면에서의 낙석, 토사붕락, 눈사태, 지표수 유입 등으로부터 갱구부를 보호할 수 있는 기능을 갖도록 하여야 하고, 지반조건이 허용하는 한 최소 토피구간을 선정하여 자연환경 훼손을 최소화하여야 하며, 역학적으로 안정한 구조로 하여야 한다. (3) 갱문의 외관과 형상은 터널의 사용 목적에 맞고 주변 경관과의 조화를 위한 조경계획과 유지관리상의 편의를 고려하여 선정하여야 한다. (4) 갱문의 형식 선정 ① 면벽형은 구조적으로 중력식과 날개식 등으로 나눌 수 있고 갱문 배면의 지반압을 받는 토류 옹벽구조로 하여야 한다. ② 돌출형은 터널 본체와 동일한 내공단면이 터널 갱구부에 연속하여 지반으로부터 돌출한 형식으로서 그 형상에 따라 파라펫트식, 원통깎기식, 벨마우스식 등이 있으며 각 형식별로 장⋅단점을 고려하여 선정하여야 한다. ③ 해빙기와 집중호우 시 낙석, 눈사태, 산사태로부터 이용자의 안전을 확보할 수 있도록 갱문형식을 선정⋅설계하여야 한다. (5) 갱문의 구조설계는 소요 하중 외에 지진, 온도 변화, 콘크리트의 건조수축 등의 영향을 고려하여야 하며, 갱문구조물의 기초안정성도 검토하여야 한다. (6) 갱문구조물의 일부로서 터널과 연결된 복개식 터널구조물은 개착구조물로 간주하여 설계하여야 하며, 편압이 작용할 경우에는 이에 대한 영향을 고려하여야 한다. (7) 갱문구조물과 본선 터널의 접합부는 분리구조로 하고 적합한 조인트를 설치하여야 하며, 재질이 서로 다른 두 종류의 방수막이 접합되는 경우, 방수막 상호간 접합이 용이한 재료를 선정하여 사용한다. 특히, 접합부에는 누수에 대비하여 구조물 횡방향을 따라 도수로를 설치하여야 한다. (8) 갱구부 개착구조물 설치 시 원지반의 특성을 감안하여 바닥 슬래브의 설치 여부를 검토하여야 한다. (9) 갱문 상부에는 낙석방지, 통행자의 안전을 위한 안전 난간 등의 보호시설을 설치해야 한다. 4.7 갱문부 주행 안전성 확보 (1) 갱문부에는 운전자의 안전을 확보하기 위하여 현장 여건을 고려하여 교통관리 안전시설, 차량방호 안전시설 등을 계획하여야 한다. (2) 토공부와 터널부의 횡단폭원이 변화하는 경우 운전자의 안전성을 확보하기 위하여 터널 갱문부의 길어깨 폭원의 점진적 변화구간 설정을 검토하여야 한다. 4.8 단면확폭부 및 접속부 (1) 단면확폭부 및 접속부는 터널용도에 따라 다음 표 4.8-1과 같이 구분되며, 터널 일반부에 비하여 단면이 크고 복잡한 형상이므로 그 기능과 지반조건을 감안하여 터널과 주변 지반의 안정을 확보할 수 있도록 설계하여야 한다. 표 4.8-1 단면확폭부와 접속부의 구분 표 4.8-1 단면확폭부와 접속부의 구분 구분 단면확폭부 접속부 도로터널 ·비상주차대 구간 ·오르막 차로 설치구간 ·갱구부 확폭구간 ·2-아치/3-아치 터널구간 ·피난연결통로 설치구간 ·환기용 터널 설치구간 ·수직구 설치구간 ·사갱 설치구간 철도터널 ·분기기 설치구간 ·구난정거장 구간 ·단복선 변화구간 ·정거장 구간 ·신호장 구간 ·변압기 설치구간 ·대형대피소 설치구간 ·환기용 및 대피용 터널 설치구간 ·수직구 설치구간 ·단복선 연결구간 ·사갱 설치구간 도시철도터널 ·정거장 구간 ·유치선 구간 ·신호소 설치구간 ·단복선 변화구간 ·단복선 연결구간 ·변전실 설치구간 ·대피용 터널 설치구간 기타 ·일반부보다 확폭된 단면이나, 터널 간 접속되는 구간 (2) 단면확폭부와 접속부는 지반조건이 양호한 구간에 설치하여야 하며, 지반조건이 불량한 구간에 위치하는 경우에는 설치 목적에 위배되지 않는 범위 내에서 위치 변경이 가능하도록 계획하여야 한다. (3) 단면확폭부와 접속부는 터널과 주변 지반이 역학적으로 충분히 안정하고 경제적인 시공이 되도록 확폭부와 접속부의 형상, 시공 방법 및 순서, 지보재, 콘크리트라이닝, 보강공법 등을 검토하여야 한다. (4) 단면확폭부는 안정성과 경제성을 고려하여 단면계획을 하여야 하며, 시공과정에서 단면의 형상이 여러 형태로 변화하므로 이를 감안하여 변화된 터널단면의 안정성을 확보하여야 한다. (5) 단면확폭의 범위가 크지 않을 경우에는 지반조건을 파악하여 지보패턴의 변경으로 대치할 수 있으며, 이 경우 지보재 증가수량을 합리적으로 산정하여야 한다. (6) 단면확폭부의 시공순서는 확폭단면의 크기, 확폭단부의 공간처리, 지반조건, 공기 등을 고려하여 결정하여야 한다. (7) 단면확폭부가 부득이 하게 지반조건이 불량한 위치에 계획된 경우에는 별도의 상세한 지반조사를 시행하여야 하며, 필요시 3차원 해석을 통하여 안정성을 검토하여야 한다. 4.9 접속부의 설계 (1) 접속부는 터널단면들이 여러 형태로 연결될 수 있으므로 이를 감안하여 접속된 터널단면들에 대하여 안정성을 검토하여야 한다. (2) 접속부의 시공방법, 시공순서 및 시공 이격거리는 선행굴진 터널의 지보재 및 주변 지반에 미치는 영향을 충분히 고려하여 결정하여야 한다. (3) 접속부는 터널의 크기와 지반조건에 적합한 필러(Pillar)의 폭을 유지하여야 한다. (4) 접속부의 소요의 필러 폭 확보가 곤란하거나 지반조건이 불량한 경우에는 강성이 충분한 지보재로 필러를 보강하거나 단면확폭부를 이용한 분기를 적용할 수 있다. (5) 접속부의 구조 및 형상은 안정성이 확보되도록 계획하여야 하며, 부득이하게 지반조건이 불량한 위치에 계획되거나 형상이 특수한 경우에는 별도의 상세한 지반조사를 시행하여야 하고, 필요시 3차원 해석을 통한 안정성을 검토하여야 한다. (6) 접속부의 보강범위는 접속각도 90°인 경우 접속터널은 접속터널 최대폭(d)의 1 d, 본선터널은 본선터널 최대폭(D)의 1 D를 표준으로 하는 것을 원칙으로 하되, 상세검토를 통하여 보강범위를 별도로 선정할 수 있으며, 기타 접속각도의 경우 접속각도에 따른 응력 집중 및 증가를 검토하여 보강범위를 선정하여야 한다. 4.10 침매터널 (1) 침매함은 필요에 따라 다음에 열거하는 사항을 감안하여 안전한 구조로 한다. ① 수밀성 ② 콘크리트의 균열 ③ 예항시의 안정과 침설과정에서의 하중 (2) 침매함 구조의 안정성을 확보하기 위해서는 다음에 열거하는 항목에 대하여도 검토하여야 한다. ① 완성 시 및 시공 시에 작용하는 하중 ② 시공성 ③ 침설 후 부력에 의한 함체의 부양 ④ 환기, 방재 등의 기능 ⑤ 병설되는 기능 집필위원 분야 성명 소속 직급 (집필위원장) 문상조 ㈜유신 부사장 (연구책임자) 유한규 한양대학교 교수 황제돈 ㈜에스코컨설턴트 대표이사 신영완 ㈜하경엔지니어링 사장 최재원 ㈜넥스지오 이사 (간 사) 이재국 ㈜경동엔지니어링 상무 자문위원 분야 성명 소속 터널 이상덕 아주대학교 터널 김상환 호서대학교 건설기준위원회 분야 성명 소속 터널 김시격 ㈜다산컨설턴트 터널 최해준 동명기술공단 터널 황제돈 ㈜에스코컨설턴트 터널 김홍문 ㈜평화엔지니어링 터널 박광준 ㈜대정컨설턴트 터널 신영완 ㈜하경엔지니어링 중앙건설기술심의위원회 성명 소속 조완형 ㈜다산컨설턴트 조태희 ㈜경호엔지니어링 이창윤 ㈜삼보기술단 한금숙 선창건설㈜ 김정호 ㈜다산컨설턴트 이래철 에스큐엔지니어링㈜ 국토교통부 성명 소속 직책 김인 국토교통부 간선도로과 과장 최규용 국토교통부 간선도로과 사무관 설계기준 KDS 27 10 15 : 2016 설계일반 2016년 6월 30일 발행 국토교통부 관련단체 한국터널지하공간학회 06720 서울시 서초구 효령로 304 14층 11호 ☎ 02-3465-3663/3665 E-mail : ktastaff@hanmail.net http://www.tunnel.or.kr 국가건설기준센터 10223 경기도 고양시 일산서구 고양대로 283(대화동) ☎ 031-910-0444 E-mail : kcsc@kict.re.kr http://www.kcsc.re.k",
      "construction": "시공순서 등을 계획 선정하여야 한다. (7) 터널안정성을 확보하기 위하여 터널구조물의 안전뿐만 아니라 주변 위험영향도 최소화되도록 하여야 하며, 터널 주위에 미치는 영향에 대하여는 필요시 합리적인 대책을 강구하여야 한다. (8) 터널설계는 환기, 조명, 방재시설 등의 제반설비 사항들도 고려하여야 하며 이들의 역할이 잘 발휘되도록 하여야 한다. (9) 터널설계는 굴착 시 원지반의 손상이나 여굴 발생이 최소화되도록 하여야 하며, 원지반의 손상이나 여굴 발생 시 그 처리방안을 제시하여야 한다. (10) 터널설계는 계획 터널노선에 대하여 시공성을 고려한 경제성 분석을 실시하여야 한다. (11) 터널설계는 안정성 확보를 우선으로 하되 지보재의 최적화를 도모하여야 한다. 이 경우 해석적인 방법 외에 설계⋅시공사례 등의 경험적인 방법도 고려해야 한다. (12) 콘크리트라이닝은 터널이 신선한 경암반을 통과하는 경우 지보재와 콘크리트라이닝의 역할에 따라 라이닝의 설치 여부를 검토할 수 있다. (13) 터널설계는 관계 법령이 정하는 바에 따라 제반 안전성 분석 및 피난계획을 수립하고, 터널 내 부착물 및 시설물은 화재 시를 고려하여 적절한 재료를 선정하여야 한다. (14) 터널설계에는 다음 사항이 포함되어야 한다. ① 평면 및 종단선형 ② 굴착대상지반의 분석 및 분류 ③ 터널단면의 형상 ④ 굴착 공법 및 방법 ⑥ 지보패턴 선정 ⑦ 각종 지보재의 규격 및 시공순서도 ⑧ 필요한 보조공법 ⑨ 방수 및 배수 방법 ⑩ 콘크리트라이닝의 타설시기 검토 및 시공도 ⑪ 계측계획 및 수행방법 ⑫ 갱구 및 갱문 계획 ⑬ 환기, 조명, 방재 계획 ⑭ 터널시공에 따른 환경영향분석 ⑮ 공사시방서 (15) 터널 부대시설에 사용하는 재료는 화재에 대한 내화성을 가진 재료를 사용해야 한다. (16) 터널 공사용 자재는 산업표준화법에 의한 한국산업규격 표시품(이하 KS 표시품이라 한다.) 또는 이와 동등 이상의 성능을 지닌 자재 이어야 하며, 친환경상품 구매촉진에 관한 법률에 의한 친환경상품 또는 중소기업제품 구매촉진 및 판로지원에 관한 법률에 따른 우선구매대상 기술개발제품이 설계에 반영될 수 있는지 검토해야 한다. (17) 향후 운영 시의 유지관리에 필요한 사항을 고려하여야 한다. 1.9 신규기술적용 내용 없음. 1.10 구조설계도서 내용 없음. 2. 조사 및 계획 2.1 일반사항 내용 없음. 2.2 조사 내용 없음. 2.3 계획 내용 없음. 3. 재료 3.1 일반사항 내용 없음. 3.2 재료특성 내용 없음. 3.3 품질 및 성능시험 내용 없음. 4. 설계 4.1 설계방법의 선정 (1) 설계방법의 선정에 있어서는 지반의 거동특성과 지보재의 지보력이 상호 연합하여 일체로 거동하여 터널의 안전성이 유지될 수 있는 방법을 선정하여야 한다. 단, 지반의 거동특성상 지반의 지보능력 활용이 불가능할 경우에는 지반보강을 시행하거나 지보재가 지반하중을 모두 지지하도록 하는 설계방법을 채택하여야 한다. (2) 암반 분류 후 해당 등급에 적용할 표준적인 지보패턴과 굴착방법을 정하여 설계할 수 있다. 이 경우 유사암반 조건에서의 시공실적 또는 RMR 방법 및 Q-시스템 등에서 제안한 지보패턴을 참조하여 지보패턴을 정하는 것을 원칙으로 하며 현장조건에 따라 변경할 수 있다. 암분류는 KDS 27 10 05, KDS 27 10 10(2.2.2), 기본설계 등에 관한 세부시행기준(국토교통부), KDS 11 10 10 등을 기본으로 하며 필요할 경우 별도로 정하여 실시한다. (3) 선정된 굴착계획, 굴착공법 및 지보패턴은 해석적인 방법을 통하여 그 안정성을 검증하여야 하며, 안정성의 검증과정에서는 작용하중, 사용되는 지반공학적 특성치, 해석기법 및 경계조건 등을 충실하게 검토하여 합리적인 검증이 되도록 하여야 한다. (4) 설계조건이 특수하거나 유사조건에서의 시공사례도 없는 경우에는 예상되는 제반문제를 면밀히 검토한 후 굴착방법, 굴착공법, 지보패턴 및 인버트 시공을 포함한 보조공법 등을 선정하고 해석적인 검증을 통하여 확정하여야 한다. 4.2 설계내용의 변경 (1) 시공 시의 제반 여건이 설계 시의 조건과 상이하여 예상되는 문제점에 대하여서는 표 4.2-1과 같은 사항들에 대하여 설계내용을 변경할 수 있도록 하여야 한다. 표 4.2-1 설계내용의 변경사항 표 4.2-1 설계내용의 변경사항 주요 항목 주요 내용 지반의 재분류 ·적용지반의 분류 설계단면 변경 ·지보재 ·변형 여유량 ·단면형상 적용지보패턴의 변경 ·숏크리트의 두께 ·숏크리트의 재질 ·록볼트의 길이, 본수 ·강지보재 설치간격 및 규격 굴착공법의 변경 ·벤치커트 공법 (코아(Core) 남김, 링커트 포함) ·선진도갱공법 ·기타 굴착단면 분할 보조공법 도입 ·굴진면 안정화 대책 ·지반보강 대책 ·용출수대책 ·지표면 침하 대책 ·근접 구조물 대책 단면의 폐합 ·인버트 부분 콘크리트 타설(조기시공) ·인버트 부분 숏크리트 타설(가폐합) ·콘크리트라이닝 강성증대 ·이중라이닝(임시라이닝) 터널공법 변경 ·개착터널공법으로 전환·토공구간으로 전환 기타 ·상기내용 외에 시공 시 제반 여건이 설계 시의 조건과 상이하여 변경이 요구되는 사항 4.3 품질보증에 대한 기본사항 (1) 활단층지역에는 구조물을 건설하지 않는 것이 바람직하다. 단, 이를 피하기 어려울 경우에는 지진 발생에 따른 손상이 최소화되도록 설계하여야 한다. 또한 기능 손상이 발생할 경우에 대비하여 보수⋅보강이 용이하도록 설계하여야 한다. (2) 중요 구조물의 경우, 설계 요구사항의 만족성, 설계 기법 및 가정사항의 적절성, 법규요건에 대한 만족성, 설계 결과의 시공성 등의 검증을 위하여 터널전문기술자에 의한 검토가 실시되어야 한다. 4.4 연직갱 및 경사갱 4.4.1 설계일반 (1) 연직갱 및 경사갱의 설계 시에는 사전에 충분한 지반조사를 실시하여 지반의 상태 및 특성을 파악하고 이를 설계에 반영하여야 한다. (2) 연직갱에서는 특수한 작업기계를 사용하게 되므로 지형 및 지반조건에 적합한 장비를 선정하여 제시하여야 하고, 지하수 유입에 대비하여 안정성, 시공성을 충분히 고려한 계획을 세워야 한다. 특히, 동절기 시공 중 지표 부근의 누수로 인한 고드름 및 기타 낙하물에 대한 안전대책을 사전에 강구하여야 한다. (3) 연직갱을 작업용으로 사용하고 공사 완공 후 타목적으로 전용하지 않는 경우에는 터널 본체 및 지표에 영향을 미치지 않도록 보강, 폐쇄, 매립 등의 적절한 방안을 제시하여야 한다. (4) 경사갱의 설계 시에는 용도, 지반조건, 버력 및 기자재의 반출입, 터널 내부설비, 측량, 시공, 유지보수, 점검 시의 안정성 등을 충분히 고려하여 위치, 유효단면, 기울기, 수평부의 연장, 수평분기점의 위치, 본 터널과의 교차각도 등을 정하여야 한다. (5) 경사갱의 수평부의 연장은 터널 내부설비 외에 측량의 정도, 버력설비, 차량의 교체작업 등을 고려하여 정하여야 한다. (6) 경사갱과 본 터널과의 교차각도는 직각을 표준으로 하되 연결부의 구조, 시공성, 차량의 선회반경 등 운행조건을 고려하여 교차각도를 별도로 정할 수 있다. (7) 연직갱 및 경사갱의 위치는 용도, 지반 및 지형조건, 유입 지하수, 연장 및 유지관리를 고려하여 경제적으로 유리한 장소를 선정하여야 한다. 유지 관리하여야 할 연직갱의 경우에는 인력 및 장비수송용 승강기를 연직갱 내에 설치하여야 하며, 심도에 따른 안전대책을 수립하여야 한다. (8) 연직갱 및 경사갱을 작업용으로 사용하는 경우에는 본 터널과 연결되는 갱저설비의 배치, 측량, 완성 후의 처리 등을 고려하여 위치를 선정하여야 한다. (9) 연직갱 및 경사갱을 환기, 배수, 비상용 통로 등 본 설비로 사용하는 경우에는 향후 지하시설의 확장에 대비하여 위치를 선정하여야 하며, 배출되는 오염물질이 주변 환경에 미치는 영향을 검토하여야 한다. (10) 연직갱 및 경사갱의 굴착대상인 지층에 대수층이 있거나 유입 지하수가 많을 것으로 예상되는 경우에는 지하수위 저하, 지수, 지반 강화 등의 보조공법을 계획하여야 한다. (11) 철도터널의 경우 차량의 터널 진입 시 발생하는 공기압 증가에 따른 이명감 및 공기 저항 증가 등을 해소하기 위하여 연직갱 또는 경사갱을 설계할 경우에는 사전에 필요로 하는 조사 및 검토를 실시해야 한다. 4.4.2 연직갱의 설계 (1) 연직갱의 단면은 용도에 따른 소요 내공단면, 시공방법, 연직갱 내에 설치될 모든 설비의 배치, 반입기자재의 크기, 지반조건 등을 종합적으로 고려하여 그 크기와 형상을 정하여야 한다. (2) 도로 및 철도터널의 환기용 연직갱은 터널 내의 소요 환기량을 충분히 확보할 수 있는 단면적을 확보하여야 한다. 연직갱의 단면은 연직갱 내 풍속이 20 m/sec 이하로 되는 단면으로 결정하여야 한다. (3) 철도터널에서 공기압의 저감을 위하여 설계하는 연직갱의 단면은 본선 터널의 단면, 열차속도 등 관련사항을 고려하여 결정해야 한다. (4) 도로 및 철도터널 등의 작업용 연직갱의 설계 시에는 케이지(Cage), 스킵(Skip) 등의 버력처리설비 및 배수관, 환기관, 급기관, 각종 배선류, 비상계단 등의 설치와 반입 기자재의 크기 등을 종합적으로 검토하여 단면을 결정하여야 한다. (5) 지보설치 후의 연직갱 유효단면은 지하시설 건설공사를 가장 경제적으로 수행하기 위한 시간당 버력, 인원, 소요 자재 운반량과 반입될 장비, 설비의 크기, 시간당 환기량과 각종 설비, 지반조건을 고려하여 결정하여야 한다. 4.4.3 경사갱의 설계 (1) 경사갱의 기울기는 용도, 연장, 본 터널과의 위치 관계, 지반조건, 시공법, 공기, 운반방법의 특성, 환기방법, 경제성 등에 대하여 검토를 하고 정하여야 하며, 버력반출용 경사갱의 경우에는 장비의 등판능력을 고려하여 계획하여야 한다. (2) 경사갱에서는 설치하는 설비의 반출입, 설치의 용이성, 유지보수, 점검 시의 안전성 등을 충분히 고려하여 기울기 및 연장을 정하여야 한다. (3) 경사갱의 단면은 용도, 시공을 위한 운반설비, 작업용 통로 및 공사용 제설비의 배치 등을 종합적으로 고려하여 크기와 형태를 정하여야 한다. (4) 작업용 경사갱의 단면은 버력반출설비, 배수관, 환기관, 급기관, 각종 배선류와 반입 기자재의 크기 등을 종합적으로 검토하여 정하여야 한다. (5) 배수관은 지하수의 유입 상태에 따라 증설의 필요성이 발생하므로 여유를 갖는 배치가 되도록 내공단면을 확보하여야 한다. 4.5 갱구부 (1) 갱구부는 일반적으로 갱문구조물 배면으로부터 터널길이 방향으로 터널직경의 1~2배 범위 또는 터널 천장부로부터 토피고 3~5 m에서 터널직경 1.5배의 토피고가 확보되는 범위까지로 정의한다. 단, 원지반 조건이 양호한 암반층 또는 붕적층, 충적층 등의 연약토사층에서는 별도의 구간을 갱구부 범위로 정의할 수 있다. NATM 터널시점토피고 3~5m계획면갱문구조물갱구부(1~2D)1.5D터널일반부그림 4.5-1 갱구부의 범위 NATM 터널시점 토피고 3~5m 계획면 갱문 구조물 갱구부(1~2D) 1.5D 터널일반부 그림 4.5-1 갱구부의 범위 (2) 갱구부는 터널 본선부와는 달리 지형, 기상, 입지조건, 근접시설물 등의 외적조건에 크게 영향을 받기 때문에 이를 고려하여 구조 및 시공법을 선정해야 한다. (3) 갱구부의 설계에는 아래의 사항들을 검토하여 안정성을 확보하고 환경훼손을 최소화할 수 있도록 해야 한다. ① 갱구의 위치 및 설치방법 ② 갱구부의 범위 ③ 갱구부의 굴착공법, 지보구조, 보조공법과 콘크리트라이닝 구조 ④ 갱구비탈면의 안정검토와 필요한 사면 안정공법 ⑤ 갱구비탈면의 지표수 및 지하수 배수 대책 ⑥ 기상재해의 가능성과 필요한 대책공법 ⑦ 지표 침하 등 갱구 주변의 구조물에 미치는 영향 (4) 터널 중심축선은 지형 경사면과 가급적 직교하도록 하여야 하며, 이 경우 경사면 하단보다 상부 지역에 갱구부가 계획될 때에는 공사용 진입로를 확보하도록 하여야 하고, 인접 구조물과의 관계 등도 고려하여야 한다. (5) 갱구부는 갱구부 깎기 최소화를 위하여 특수한 지형 및 지질조건을 제외하고는 갱구부 상단 토피 3~5 m 또는 암토피고 1~2 m 확보되는 지점에 갱구부를 형성하는 것을 표준으로 한다. (6) 터널 중심축선이 지형 비탈면에 대하여 사각으로 진입하는 경우에는 비대칭의 깎기 비탈면이나 갱문이 형성되게 되므로 횡방향 토피 확보 여부와 편압에 대한 검토를 하여야 한다. (7) 터널 중심축선과 지형경사면이 평행한 경우는 가급적 피해야 하며, 골짜기 쪽의 토피가 극단적으로 얇아질 경우가 있으므로 전 구간에 걸쳐 편압에 대한 검토와 이에 대한 대책을 수립하여야 한다. (8) 골짜기에는 일반적으로 지질구조대가 발달하여 있고 지표수 유입과 지하수위가 높을 경우가 많으므로 터널 중심축선이 골짜기로 진입하는 경우는 최대한 피하여야 한다. 부득이하게 계획되었을 경우는 수리⋅수문학적인 검토를 하여 지표수와 갱문 배면의 침투수가 원활하게 배수처리 되도록 하여야 하며, 낙석, 산사태, 눈사태 등의 자연재해 발생가능성에 대비하여야 한다. (9) 갱구의 위치는 깎기 비탈면의 안정과 자연지형 보존을 위하여 깎기를 최소화할 수 있는 위치로 선정하여야 하며, 갱구 위치별 깎기량에 대한 경제성, 시공성, 경관성, 환경영향 등을 비교 검토하여야 한다. (10) 갱구부의 설계에 있어서는 비탈면의 안정성, 지반의 지내력, 터널 중심축선과 비탈면의 관계, 갱구비탈면 깎기 및 터널의 안정성 등을 검토하여야 한다. (11) 갱구비탈면의 기울기는 지반조건에 따라 적절히 선정하여야 하며, 필요시 비탈면 안정성 확보를 위하여 표면 보호공법과 활동 방지대책 등의 적절한 보강공법을 적용하여야 한다. (12) 갱구부는 일반적으로 지반의 강도와 고결도가 낮은 경우가 많고 암반층에서도 균열 발달이 심한 경우가 많으므로 지반의 자체 지보력 확보를 위하여 보다 적극적인 보강공법을 적용하여야 하며, 동일 지반조건에서의 일반 구간보다 안전한 굴착공법과 지보패턴의 작용을 검토하여야 한다. (13) 토피가 얇고, 지반 자체의 지보력 형성이 어려울 것으로 예상되는 경우에는 상재된 전토피 하중이 지보재로의 작용 여부를 검토하여야 한다. (14) 누수, 결빙 등이 발생하기 쉽기 때문에 적절한 방수 및 배수 조치를 하여야 하며, 갱구부에 작용하는 하중 및 기상조건에 따른 영향을 고려하여 콘크리트라이닝의 철근보강 여부, 동상방지층, 제설 시스템 및 방설시설의 적용 여부를 검토하여야 한다. (15) 갱구부에서는 지진영향에 대한 거동특성이 일반구간과는 다를 수 있으므로 지진하중에 의한 영향을 검토하여야 한다. (16) 갱구부 시공 시 지반이완과 비탈면 붕괴가 발생할 위험이 있는 경우에는 터널굴착에 앞서 낙석방지와 비탈면 안정대책을 수립하여야 한다. (17) 터널 중심축선과 비탈면의 위치 관계에서 3차원 거동이 예상되거나 편압이 작용되는 경우에는 터널안정성 해석 시 이에 대한 검토를 하여야 하며, 안정성이 확보되지 않는 경우에는 압성토와 깎기로서 지반압의 균형을 맞추도록 하거나 불균형의 응력 발생에 대비한 보강대책을 제시하여야 한다. (18) 갱구부는 지표부에 과다한 침하와 지표 함몰의 가능성이 있으므로 지표부에 침하의 제한이 필요한 시설물이 있는 경우에는 이에 대한 충분한 대책을 검토하여야 하며, 필요에 따라 보강공법을 제시하여야 한다. (19) 터널 갱구부 주위에 태풍 등의 영향으로 쓰러지거나 가지가 끊어져 열차운행에 지장을 줄 수 있는 수종은 식재하지 않도록 해야 한다. (20) 집중호우 시 터널 갱구부 비탈면으로 대량의 지표수가 직접 유입되지 않도록 비탈면 어깨부에 산마루 측구를 설치하고, 비탈면에는 식생공 등의 비탈면 보호공을 시공해야 한다. 비탈면의 지질이 불량한 경우에는 옹벽 또는 비탈면 보호블럭 등 영구시설물 설치를 고려해야 한다. 4.6 갱문의 설계 (1) 갱문의 위치 선정에 있어서는 기상 및 자연재해에 의한 영향을 최소화 할 수 있도록 갱문 배면의 지형, 지반조건, 깎기 및 비탈면의 안정성 등을 검토하여야 하며, 갱구부 주변의 유지관리시설과의 관계와 터널 외부의 구조물형식을 고려하여야 한다. (2) 갱문은 비탈면에서의 낙석, 토사붕락, 눈사태, 지표수 유입 등으로부터 갱구부를 보호할 수 있는 기능을 갖도록 하여야 하고, 지반조건이 허용하는 한 최소 토피구간을 선정하여 자연환경 훼손을 최소화하여야 하며, 역학적으로 안정한 구조로 하여야 한다. (3) 갱문의 외관과 형상은 터널의 사용 목적에 맞고 주변 경관과의 조화를 위한 조경계획과 유지관리상의 편의를 고려하여 선정하여야 한다. (4) 갱문의 형식 선정 ① 면벽형은 구조적으로 중력식과 날개식 등으로 나눌 수 있고 갱문 배면의 지반압을 받는 토류 옹벽구조로 하여야 한다. ② 돌출형은 터널 본체와 동일한 내공단면이 터널 갱구부에 연속하여 지반으로부터 돌출한 형식으로서 그 형상에 따라 파라펫트식, 원통깎기식, 벨마우스식 등이 있으며 각 형식별로 장⋅단점을 고려하여 선정하여야 한다. ③ 해빙기와 집중호우 시 낙석, 눈사태, 산사태로부터 이용자의 안전을 확보할 수 있도록 갱문형식을 선정⋅설계하여야 한다. (5) 갱문의 구조설계는 소요 하중 외에 지진, 온도 변화, 콘크리트의 건조수축 등의 영향을 고려하여야 하며, 갱문구조물의 기초안정성도 검토하여야 한다. (6) 갱문구조물의 일부로서 터널과 연결된 복개식 터널구조물은 개착구조물로 간주하여 설계하여야 하며, 편압이 작용할 경우에는 이에 대한 영향을 고려하여야 한다. (7) 갱문구조물과 본선 터널의 접합부는 분리구조로 하고 적합한 조인트를 설치하여야 하며, 재질이 서로 다른 두 종류의 방수막이 접합되는 경우, 방수막 상호간 접합이 용이한 재료를 선정하여 사용한다. 특히, 접합부에는 누수에 대비하여 구조물 횡방향을 따라 도수로를 설치하여야 한다. (8) 갱구부 개착구조물 설치 시 원지반의 특성을 감안하여 바닥 슬래브의 설치 여부를 검토하여야 한다. (9) 갱문 상부에는 낙석방지, 통행자의 안전을 위한 안전 난간 등의 보호시설을 설치해야 한다. 4.7 갱문부 주행 안전성 확보 (1) 갱문부에는 운전자의 안전을 확보하기 위하여 현장 여건을 고려하여 교통관리 안전시설, 차량방호 안전시설 등을 계획하여야 한다. (2) 토공부와 터널부의 횡단폭원이 변화하는 경우 운전자의 안전성을 확보하기 위하여 터널 갱문부의 길어깨 폭원의 점진적 변화구간 설정을 검토하여야 한다. 4.8 단면확폭부 및 접속부 (1) 단면확폭부 및 접속부는 터널용도에 따라 다음 표 4.8-1과 같이 구분되며, 터널 일반부에 비하여 단면이 크고 복잡한 형상이므로 그 기능과 지반조건을 감안하여 터널과 주변 지반의 안정을 확보할 수 있도록 설계하여야 한다. 표 4.8-1 단면확폭부와 접속부의 구분 표 4.8-1 단면확폭부와 접속부의 구분 구분 단면확폭부 접속부 도로터널 ·비상주차대 구간 ·오르막 차로 설치구간 ·갱구부 확폭구간 ·2-아치/3-아치 터널구간 ·피난연결통로 설치구간 ·환기용 터널 설치구간 ·수직구 설치구간 ·사갱 설치구간 철도터널 ·분기기 설치구간 ·구난정거장 구간 ·단복선 변화구간 ·정거장 구간 ·신호장 구간 ·변압기 설치구간 ·대형대피소 설치구간 ·환기용 및 대피용 터널 설치구간 ·수직구 설치구간 ·단복선 연결구간 ·사갱 설치구간 도시철도터널 ·정거장 구간 ·유치선 구간 ·신호소 설치구간 ·단복선 변화구간 ·단복선 연결구간 ·변전실 설치구간 ·대피용 터널 설치구간 기타 ·일반부보다 확폭된 단면이나, 터널 간 접속되는 구간 (2) 단면확폭부와 접속부는 지반조건이 양호한 구간에 설치하여야 하며, 지반조건이 불량한 구간에 위치하는 경우에는 설치 목적에 위배되지 않는 범위 내에서 위치 변경이 가능하도록 계획하여야 한다. (3) 단면확폭부와 접속부는 터널과 주변 지반이 역학적으로 충분히 안정하고 경제적인 시공이 되도록 확폭부와 접속부의 형상, 시공 방법 및 순서, 지보재, 콘크리트라이닝, 보강공법 등을 검토하여야 한다. (4) 단면확폭부는 안정성과 경제성을 고려하여 단면계획을 하여야 하며, 시공과정에서 단면의 형상이 여러 형태로 변화하므로 이를 감안하여 변화된 터널단면의 안정성을 확보하여야 한다. (5) 단면확폭의 범위가 크지 않을 경우에는 지반조건을 파악하여 지보패턴의 변경으로 대치할 수 있으며, 이 경우 지보재 증가수량을 합리적으로 산정하여야 한다. (6) 단면확폭부의 시공순서는 확폭단면의 크기, 확폭단부의 공간처리, 지반조건, 공기 등을 고려하여 결정하여야 한다. (7) 단면확폭부가 부득이 하게 지반조건이 불량한 위치에 계획된 경우에는 별도의 상세한 지반조사를 시행하여야 하며, 필요시 3차원 해석을 통하여 안정성을 검토하여야 한다. 4.9 접속부의 설계 (1) 접속부는 터널단면들이 여러 형태로 연결될 수 있으므로 이를 감안하여 접속된 터널단면들에 대하여 안정성을 검토하여야 한다. (2) 접속부의 시공방법, 시공순서 및 시공 이격거리는 선행굴진 터널의 지보재 및 주변 지반에 미치는 영향을 충분히 고려하여 결정하여야 한다. (3) 접속부는 터널의 크기와 지반조건에 적합한 필러(Pillar)의 폭을 유지하여야 한다. (4) 접속부의 소요의 필러 폭 확보가 곤란하거나 지반조건이 불량한 경우에는 강성이 충분한 지보재로 필러를 보강하거나 단면확폭부를 이용한 분기를 적용할 수 있다. (5) 접속부의 구조 및 형상은 안정성이 확보되도록 계획하여야 하며, 부득이하게 지반조건이 불량한 위치에 계획되거나 형상이 특수한 경우에는 별도의 상세한 지반조사를 시행하여야 하고, 필요시 3차원 해석을 통한 안정성을 검토하여야 한다. (6) 접속부의 보강범위는 접속각도 90°인 경우 접속터널은 접속터널 최대폭(d)의 1 d, 본선터널은 본선터널 최대폭(D)의 1 D를 표준으로 하는 것을 원칙으로 하되, 상세검토를 통하여 보강범위를 별도로 선정할 수 있으며, 기타 접속각도의 경우 접속각도에 따른 응력 집중 및 증가를 검토하여 보강범위를 선정하여야 한다. 4.10 침매터널 (1) 침매함은 필요에 따라 다음에 열거하는 사항을 감안하여 안전한 구조로 한다. ① 수밀성 ② 콘크리트의 균열 ③ 예항시의 안정과 침설과정에서의 하중 (2) 침매함 구조의 안정성을 확보하기 위해서는 다음에 열거하는 항목에 대하여도 검토하여야 한다. ① 완성 시 및 시공 시에 작용하는 하중 ② 시공성 ③ 침설 후 부력에 의한 함체의 부양 ④ 환기, 방재 등의 기능 ⑤ 병설되는 기능 집필위원 분야 성명 소속 직급 (집필위원장) 문상조 ㈜유신 부사장 (연구책임자) 유한규 한양대학교 교수 황제돈 ㈜에스코컨설턴트 대표이사 신영완 ㈜하경엔지니어링 사장 최재원 ㈜넥스지오 이사 (간 사) 이재국 ㈜경동엔지니어링 상무 자문위원 분야 성명 소속 터널 이상덕 아주대학교 터널 김상환 호서대학교 건설기준위원회 분야 성명 소속 터널 김시격 ㈜다산컨설턴트 터널 최해준 동명기술공단 터널 황제돈 ㈜에스코컨설턴트 터널 김홍문 ㈜평화엔지니어링 터널 박광준 ㈜대정컨설턴트 터널 신영완 ㈜하경엔지니어링 중앙건설기술심의위원회 성명 소속 조완형 ㈜다산컨설턴트 조태희 ㈜경호엔지니어링 이창윤 ㈜삼보기술단 한금숙 선창건설㈜ 김정호 ㈜다산컨설턴트 이래철 에스큐엔지니어링㈜ 국토교통부 성명 소속 직책 김인 국토교통부 간선도로과 과장 최규용 국토교통부 간선도로과 사무관 설계기준 KDS 27 10 15 : 2016 설계일반 2016년 6월 30일 발행 국토교통부 관련단체 한국터널지하공간학회 06720 서울시 서초구 효령로 304 14층 11호 ☎ 02-3465-3663/3665 E-mail : ktastaff@hanmail.net http://www.tunnel.or.kr 국가건설기준센터 10223 경기도 고양시 일산서구 고양대로 283(대화동) ☎ 031-910-0444 E-mail : kcsc@kict.re.kr http://www.kcsc.re.k",
      "quality": "(1) 활단층지역에는 구조물을 건설하지 않는 것이 바람직하다. 단, 이를 피하기 어려울 경우에는 지진 발생에 따른 손상이 최소화되도록 설계하여야 한다. 또한 기능 손상이 발생할 경우에 대비하여 보수⋅보강이 용이하도록 설계하여야 한다.\n(2) 중요 구조물의 경우, 설계 요구사항의 만족성, 설계 기법 및 가정사항의 적절성, 법규요건에 대한 만족성, 설계 결과의 시공성 등의 검증을 위하여 터널전문기술자에 의한 검토가 실시되어야 한다.",
      "safety": "(1) 갱문부에는 운전자의 안전을 확보하기 위하여 현장 여건을 고려하여 교통관리 안전시설, 차량방호 안전시설 등을 계획하여야 한다.\n(2) 토공부와 터널부의 횡단폭원이 변화하는 경우 운전자의 안전성을 확보하기 위하여 터널 갱문부의 길어깨 폭원의 점진적 변화구간 설정을 검토하여야 한다."
    }
  },
  "metadata": {
    "quality_score": 90,
    "keywords": [
      "철근",
      "콘크리트",
      "동바리",
      "볼트",
      "방수",
      "내진",
      "내화"
    ],
    "references": [
      "KDS"
    ],
    "equations": 0,
    "tables": 6
  },
  "standard_code": "KDS 27 10 15"
}