{
  "id": "KCS 32 10 10",
  "title": "KCS 32 10 10 전기설비공사일반사항",
  "category": "기타",
  "content": {
    "full": "**문서 제목**: 건설기준 연혁 **변환일시**: 2025-07-09 16:45:19 **첨부 이미지**: 1개 KCS 32 10 10 표준시방서 Korean Construction Specification KCS 32 10 10 : 2024 전기설비공사 일반사항 전기설비공사 일반사항 2024년 8월 22일 개정 http://www.kcsc.re.kr 건설기준 제정 또는 개정에 따른 경과 조치 이 기준은 발간 시점부터 사용하며, 이미 시행 중에 있는 설계용역이나 건설공사는 발주기관의 장이 필요하다고 인정하는 경우 종전에 적용하고 있는 기준을 그대로 사용할 수 있습니다. 건설기준 연혁 ∙ 이 기준은 건설기준 코드체계 전환에 따라 기존 건설기준(설계기준, 표준시방서) 간 중복· 상충을 비교 검토하여 코드로 통합 정비하였다. ∙ 이 기준은 기존의 KCS 전기설비 분야의 적합성 평가 연구결과에 따라서 전기설비공사 일반사항에 대한 시공기준을 제시하기 위하여 개정한 것으로 제ㆍ개정 연혁은 다음과 같다. 건설기준 주요내용 제·개정 (년.월) 건축전기설비공사 표준시방서 ∙ 건축전기설비공사표준시방서 제정 제정 (1998.09) 건축전기설비공사 표준시방서 ∙건축전기설비공사표준시방서 개정 개정 (2003.12) 건축전기설비공사 표준시방서 ∙ 건축전기설비공사표준시방서 개정 개정 (2009.12) KCS 31 10 21:2016 ∙ 건설기준 코드체계 전환에 따라 코드화로 통합 정비함 제정 (2016.6) KCS 31 10 21:2018 ∙ 한국산업표준과 건설기준 부합화에 따라 수정함 수정 (2018.7) KCS 31 10 21:2019 ∙ 전기설비 분야 적합성 평가 결과에 따라 개정 개정 (2019.2) KCS 32 10 10:2024 ∙ 최신 건설기술 반영을 위한 전기설비건설기준 정비연구 결과에 따라 개정 ∙ 설비 대분류 분리에 따른 코드번호 변경 개정 (2024.8) 제 정 : 2016년 6월 30일 심 의 : 중앙건설기술심의위원회 소관부서 : 국토교통부 건설산업과 관련단체 : 한국조명·전기설비학회 개 정 : 2024년 8월 22일 자문검토 : 국가건설기준센터 건설기준위원회 작성기관 : 한국조명·전기설비학회 ∙ 국토교통부장관은 「훈령·예규 등의 발령 및 관리에 관한 규정」에 따라 고시일을 기준으로 매 3년이 되는 시점마다 그 타당성을 검토하여 개선 등의 조치를 하여야 한다. 목 차 1. 일반사항 1 1.1 적용범위 1 1.2 참고 기준 1 1.3 용어의 정의 3 1.4 지급자재 4 1.5 설계도서 간 상충 4 1.6 관공서 등의 수속 4 1.7 제출물 4 1.8 공사기록 5 1.9 안전보건 5 1.10 별도계약 5 1.11 신기술·신공법 5 2. 자재 6 2.1 재료 7 2.2 자재 관리 7 2.3 자재 품질관리 7 2.4 발생자재의 처리 및 뒷정리 7 3. 시공 8 3.1 시공조건 확인 8 3.2 작업준비 8 3.3 공정표 및 시공계획서 8 3.4 정리 및 사고방지 9 3.5 시운전 및 유지관리 교육 9 3.6 시공상세도면 작성 10 3.7 준공검사 11 1. 일반사항 1.1 적용범위 1.1.1 전기설비공사 1.1.1.1 건축전기설비공사 (1) 전원설비공사는 수변전설비, 예비전원설비, 신전원설비 등을 말한다. (2) 배선 및 부하설비공사는 간선 및 배선설비, 동력설비, 반송설비 등을 말한다. (3) 조명설비공사는 옥내조명설비, 옥외 및 경관조명설비, 도로 및 터널조명설비 등을 말한다. (4) 제어 및 정보통신설비공사는 감시제어설비, 전기통신설비, 정보설비, 약전설비 등을 말한다. (5) 방재설비공사는 피뢰설비, 접지설비, 소방전기설비, 방범설비, 항공장애표시등설비 등을 말한다. 1.1.1.2 시설물별 전기설비공사 (1) 공동구, 조경, 구조물 등에 시설하는 전기설비공사를 말한다. (2) 구조물공사는 전기방식설비⋅전기방폭설비 등의 전기설비를 말한다. 1.1.1.3 항만 및 어항, 철도공사 등의 전기설비공사 (1) 해당하는 공사의 전기설비를 말한다. 1.1.1.4 건축공사, 토목공사의 부대 전기설비공사 (1) 가설공사에서 전기설비를 말한다. (2) 공사용 조명⋅동력⋅전기통신 등의 전기설비를 말한다. 1.1.1.5 다른 기준 준용 (1) 이 기준에 기재된 것 이외의 사항은 해당 공종의 표준시방서(KCS)에 따른다. (2) 이 기준에서 정하고 있지 않은 시공 시 필요한 사항과 예외 사항은 전문시방서(OCS) 또는 공사시방서를 따른다. 1.2 참고 기준 1.2.1 관련 법규 ∙건축물의 설비기준 등에 관한 규칙 ∙건축물의 구조기준 등에 관한 규칙 ∙건축물의 피난, 방화구조 등의 기준에 관한 규칙 ∙건축물에너지효율등급 인증 및 제로에너지건축물인증에 관한 규칙 ∙건축법 ∙건축사법 ∙건설산업기본법 ∙건설기술진흥법 ∙경관법 ∙공항시설법 ∙녹색건축물 조성지원법 ∙도로법 ∙도로교통법 ∙도시공원 및 녹지 등에 관한 법 ∙물환경보전법 ∙방송통신발전기본법 ∙산업안전보건법 ∙산업안전보건기준에 관한 규칙 ∙산업표준화법 ∙소방기본법 ∙소방시설공사업법 ∙소방시설 설치 및 관리에 관한 법 ∙신에너지 및 재생에너지 개발, 이용, 보급촉진법 ∙스마트 도시의 조성 및 산업진흥 등에 관한 법 ∙승강기안전관리법 ∙에너지이용합리화법 ∙옥외광고물 등의 관리와 산업진흥에 관한 법 ∙인공조명에 의한 빛공해 방지법 ∙의료법 ∙자연공원법 ∙자연재해대책법 ∙재난 및 안전관리 기본법 ∙전기사업법 ∙전기공사업법 ∙전력기술관리법 ∙전기안전관리법 ∙전기용품 및 생활용품 안전관리법 ∙전기통신기본법 ∙정보통신공사업법 ∙정보통신망 이용촉진 및 정보보호 등에 관한 법 ∙전파법 ∙주차장법 ∙주택법 ∙주택건설기준 등에 관한 규정 ∙중소기업제품 구매촉진 및 판로지원에 관한 법률 ∙지진·화산재해대책법 ∙지능형전력망의 구축 및 이용촉진에 관한 법 ∙초고층 및 지하연계 복합건축물 재난관리에 관한 특별법 ∙화재의 예방 및 안전관리에 관한 법 ∙환경친화적 자동차의 개발 및 보급촉진에 관한 법률 ∙항만법 1.2.2 관련 기준 ∙건축물의 에너지절약설계기준(국토교통부) ∙고효율에너지 기자재보급촉진에 관한 규정(산업통상자원부) ∙공공기관 에너지이용 합리화 추진에 관한 규정(산업통상자원부) ∙방송통신설비의 기술기준에 관한 규정(과학기술정보통신부) ∙소방시설의 내진설계기준(소방청) ∙소방시설 자체점검사항 등에 관한 고시(소방청) ∙신재생에너지설비의 지원 등에 관한 규정(산업통상자원부) ∙에너지관리기준(산업통상자원부) ∙전기설비 검사 및 점검의 방법 절차 등에 관한 고시(산업통상자원부) ∙전기설비기술기준(산업통상자원부) ∙접지설비·구내통신설비·선로설비 및 통신공동구 등에 대한 기술기준(과학기술정보통신부) ∙주택건설기준에 관한 규칙(국토교통부) ∙지능형 홈네트워크 설비 설치 및 기술기준(국토교통부, 과학기술정보통신부, 산업통상자원부) ∙지하공간 침수방지를 위한 수방기준(행정안전부) ∙화재안전성능기준(소방청) ∙한국전기설비규정(산업통상자원부) ∙KDS 41 17 00 건축물내진설계기준 1.2.3 관련 표준 ∙한국산업표준 ∙표준시방서(KCS)에서 인용한 한국산업표준(KS)은 최신판(모든 추록을 포함) 적용함을 원칙으로 한다. 1.2.4 기타 사항 (1) 설계도서의 내용이 관련 법규와 상충되는 경우는 해당 법규를 따라야 한다. (2) 설계도서 또는 관련 법규에 명시되지 않은 사항은 발주자 또는 감리자와 협의하여야 한다. (3) 기관이 전문시방서(OCS)를 사용하는 경우, 이를 공사시방서에 준하여 적용하여야 한다. 1.3 용어의 정의 1.3.1 시방서 ∙ KCS 코드(표준시방서): 건설기술진흥법에 의하여 시설물의 안전 및 공사시행의 적정성과 품질확보 등을 위하여 시설물별로 정한 표준적인 시공기준으로서 전문시방서 작성과 설계자가 공사시방서를 작성하는 경우에 활용하기 위한 시공기준을 말한다. ∙ OCS 코드(전문시방서): 건설기술진흥법에 의하여 시설물별 표준시방서를 기본으로 모든 공종을 대상으로 하여 전문시방서 관리기관의 시공 또는 공사시방서의 작성에 활용하기 위한 종합적인 시공기준을 말한다. ∙ 공사시방서: 건설기술진흥법에 의하여 KCS 코드(표준시방서) 및 OCS 코드(전문시방서)를 기본으로 하여, 각 현장별 공사의 특수성⋅지역여건⋅공사방법 등을 고려하고, 기본설계 및 실시설계도에 구체적으로 표시할 수 없는 내용과 공사에 대한 시공방법·자재의 성능 및 규격, 품질시험 및 검사 등 품질관리, 안전관리계획 등에 관한 사항을 기술한 것을 말한다. 1.3.2 관계자 ∙ 발주자 : 건설공사 또는 건설기술용역을 발주하는 국가, 지방자치단체, 국가 또는 지방자치단체가 납입 자본금의 50% 이상을 출자한 기업체의 장 또는 건설기술진흥법 시행령에 정하는 자를 말한다. ∙ 시공자 : 발주자로부터 건설공사를 도급받은 건설업자를 말하며, 하도급 관계에 있어서 하도급받은 건설업자를 포함하여 말한다. ∙ 감리자 : 관련 법규에서 정한 바에 따라 설계도서 및 기타 관계서류의 내용대로 시공되는지의 여부와 안전성능을 확인하고, 소관업무 등에 대한 기술지도를 할 수 있는 자를 말한다. ∙ 현장대리인 : 공사계약 일반조건 및 관련 법규에 의거하여 시공자가 지정하는 책임시공 기술자로서 해당 현장에서 공사관리 및 기술관리, 기타 공사업무를 총괄하는 자를 말한다. 1.3.3 설계도서 (1) 관련 법규에 따른 기본설계 및 실시설계도, 설계계산서, 공사시방서 등을 말한다. (2) 발주자가 요구한 도서 및 기타 관련 서류를 포함한다. 1.3.4 경미한 변경 (1) 공사 진행 중 현장의 마감 상태, 작업 상태 등으로 인하여 기기 및 자재의 설치 위치가 변경되거나 공법을 변경하는 등 경미한 변경이 필요한 경우 시행한다. (2) 변경사항 발생 시 해당 전기설비 설계자의 의견 청취 후 감리자와 협의하여야 한다. 1.4 지급자재 (1) 지급자재의 종류·수량 및 인도 방법은 공사시방서에 따른다. (2) 지급자재의 인도 시에는 발주자 또는 감리자 입회하에 검수하여 합격하여야 한다. (3) 합격 된 지급자재는 다른 자재와 구분하여 보관하여야 한다. 1.5 설계도서 간 상충 1.5.1 적용 우선순위 (1) 공사시방서 (2) 설계도면 (3) 내역서 (4) 기타 설계도서의 순서로 한다. 1.5.2 특별 사유에 따른 조정 (1) 계약서 등에 특별한 사유가 있는 경우, 이에 따른다. (2) 특별한 사유에 따른 해석은 발주자, 감리자 및 설계자의 의견으로 조정할 수 있다. 1.6 관공서 등의 수속 (1) 시공자는 공사의 진행에 필요한 관공서 및 기타 기관에 제출 서류를 준비하여야 한다. (2) 시공자의 수속은 기한 내에 수행하여야 한다. 1.7 제출물 (1) 준공검사가 끝난 후 다음의 관계 도면 및 서류 등은 발주자 또는 감리자에 제출하여야 하고, 이를 확인 및 승인을 받은 후 공사의 인계 및 인수 절차를 마쳐야 한다. ① 준공검사필증 ② 준공도서 ③ 준공사진 ④ 허가 관련서류 및 검사필증 ⑤ 각 설비별 자재 성능시험성적서 및 검사증 ⑥ 각 설비별 주요자재 목록 ⑦ 각 설비별 자재 취급설명서 ⑧ 기기에 부속된 공구류 및 예비품 ⑨ 기타 준공서류 (2) 제출물에 대한 추가적인 사항은 공사시방서 등에 따른다. 1.8 공사기록 (1) 공사와 관련한 협의 및 지시사항에 대해서는 그것들의 경과 내용을 기록하고, 정리 및 보관하여야 한다. (2) 시험⋅검사에 대해서는 기록을 하고 정리 및 보관하여야 한다. (3) 공사공정의 주요 부분 등에서 매입·은폐 등으로 확인 불가능한 부분은 사진 또는 영상물로 찍어 정리 보관하여야 한다. (4) 감리자의 지시가 있는 경우 기록물(영상·사진 포함)을 제출하여야 한다. (5) 시공일지, 감리일지는 당일 그 내용을 기록하고 정리 보관하여야 한다. (6) 모든 기록물(영상·사진 포함)은 정리하여 색인 후 준공서류의 일부로 제출하여야 한다. 1.9 안전보건 (1) 모든 공사는 산업재해 예방을 위해 관련 법규 및 부속기준을 준수하여 시공 중 재해 발생을 방지하여야 한다. (2) 시공자는 공사현장의 안전 및 보건을 유지하기 위하여 안전보건에 관한 관리체제 및 규정을 작성하여야 한다. (3) 발주자 또는 시공자는 공사비용에 산업안전보건관리비를 책정하여야 한다. 다만, 산업안전보건관리비는 해당 건설사업장에 근무하는 근로자의 산업재해 예방 및 건강 증진을 위한 목적으로만 사용하여야 한다. 1.10 별도계약 (1) 시공자는 본 공사와 별도로 계약된 공사에 대해서는 해당 공사의 관계자와 협의하여야 한다. (2) 별도계약 공사는 본 공사 진행에 지장이 없도록 하여야 한다. 1.11 신공법·특수공법 적용 (1) 전기설비 공사용 기술 및 자재는 국가 및 국가 기관에서 인증 한 신공법·특수공법을 우선하여 적용할 수 있다. (2) 공법의 채택은 설계도 및 공사시방서에 따른다. 2. 자재 2.1 재료 (1) 사용자재는 신제품으로 하여야 한다. 다만, 가설용 자재와 특별히 지정된 것은 제외한다. (2) 사용자재는 KS 표준품으로 신제품을 사용하여야 한다. 다만, KS 표준품이 없는 경우는 발주자 또는 감리자의 승인을 받은 동등 이상의 제품을 사용하여야 한다. (3) 자재의 품질을 명시하지 않은 경우, 발주자 또는 감리자의 품질 확인을 받아 선정하여야 한다. (4) 기기는 원칙적으로 제조자·제조번호·제조년월일·정격 및 성능 등을 명기한 명판을 부착하여야 한다. (5) 재료의 상세사항은 설계도 및 공사시방서에 따른다. 2.2 자재 관리 (1) 공사용 자재가 검사 및 시험에 합격한 경우는 감리자가 지시한 장소에 정리하여 보관하고 불합격품은 즉시 공사장 밖으로 반출하여야 한다. (2) 자재관리의 상세사항은 공사시방서에 따른다. 2.3 자재 품질관리 (1) 공사용 자재의 시험과 검사방법은 관련 법규 및 한국산업표준에 따르며, 기타 적용기준이 있을 때는 그것에 따른다. (2) 공사시방서 등에 명시되었거나 필요한 경우에는 반드시 기기, 자재 및 시공에 대한 시험 및 검사를 실시한다. 다만, KS 표준품과 제조업체 등의 시험성적서 및 검사 등에 의해 감리자가 인정하거나 경미한 사항에 대해서는 생략할 수 있다. (3) 시험은 시방서에 명시되었거나 필요한 단계에서 반드시 실시하고, 결과를 감리자에게 제출하여야 한다. (4) 품질검사는 각종 시방서에 명시된 사항, 필요한 단계 또는 감리자가 지정한 공정에 도달한 경우 검사를 받아야 한다. (5) 자재품질관리의 상세사항은 공사시방서에 따른다. 2.4 발생자재의 처리 및 뒷정리 (1) 시공 중 발생 자재 중 인도하도록 지정된 것은 지정된 장소에 정돈하고 관련 서류를 감리자에게 제출하여야 한다. (2) 시공을 하는 도중에 장애물의 처리에 대해서는 발주자 또는 감리자와 협의하여야 한다. (3) 공사 완료 시 가설물 등은 신속하게 철거하고 청소 및 뒷정리를 하여야 한다. (4) 자재 처리의 상세사항은 공사시방서에 따른다. 3. 시공 3.1 시공조건 확인 3.1.1 사전 평가 3.1.1.1 적합성 평가 항목 (1) 설치 또는 사용할 때의 적합성 (2) 보호조치에 대한 적합성·기계적 강도 및 내구성 (3) 전선 또는 배관의 굴곡과 접속 (4) 전기적 절연 3.1.1.2 시공조건 확인 항목 (1) 정상상태와 비정상적 상태에서의 열적 영향 (2) 정격·크기·전압·전류용량 및 특정한 용도에 따른 분류 (3) 사용 중 또는 기기와 접촉 시 인체보호 조건 3.1.2 일반조건 (1) 배선은 설치 완료 시 단락⋅지락 상태 없이 완전하여야 한다. (2) 전기기기는 사용환경을 확인하고 적합한 경우에 설치하여야 한다. 다만, 가스·연기·증기·고온 환경·기타의 원인으로 전선 또는 기기를 열화시킬 우려가 있는 경우에 이를 보강하는 공법으로 하여야 한다. (3) 전기기기는 각각의 특성에 따라 정확하고 기능적인 방법으로 다음과 같이 시공하여야 한다. ① 박스류·배선경로·캐비닛 및 기기 케이스 등에서 사용되지 않는 개구부는 효과적인 방법으로 폐쇄하여야 한다. ② 지중함(맨홀·핸드홀 등)은 전선 또는 기기의 설치나 유지관리하는 경우에 작업자가 쉽고 안전하게 접근할 수 있도록 하여야 한다. ③ 버스 바·배선단자·애자 및 기타 전기기기의 내부 부품은 손상되지 않아야 하고, 도료·충전재 및 잔여물 등 이물질에 오염되지 않아야 한다. (4) 접속 ① 압축단자·압축접속기·납땜 등을 사용하는 전기적 접속 시 사용이 가능한 전선의 재질을 확인하여야 한다. ② 서로 다른 금속으로 된 전선의 접속은 단자나 접속기를 사용하여야 한다. 3.1.3 전기적 위험 (1) 충전부분의 보호(저압인 경우) ① 안전전압(50 V) 이상에서 운전되는 전기기기의 충전 부분은 우발적으로 접촉되는 것을 방지하기 위해 승인된 외함을 사용하거나, 기타의 방법으로 보호해야 한다. 다만, 공사시방서 등에서 다르게 규정한 것은 제외한다. ② 전기기기가 물리적 손상을 입기 쉬운 장소에 설치된 경우 손상을 견딜 수 있는 강도의 외함이나 보호 장치를 하여야 한다. ③ 노출된 충전 부분이 있는 보호구역과 실의 입구에는 경고표지를 눈에 잘 띄게 설치하여 일반인의 출입을 방지하여야 한다. (2) 제한구역 ① 출입을 제한하는 구역의 전기시설은 자물쇠와 열쇠 기타 방법으로 허가된 전기기술자만이 출입할 수 있도록 하여야 한다. ② 옥외에 설치하는 위험한 전기설비는 허가된 전기기술자 이외의 출입을 제한하는 시설을 하여야 한다. 다만, 위험성 여부는 감리자와 협의하여야 한다. 3.2 작업준비 3.2.1 일반사항 (1) 공사는 설계도서에 표시된 제반설비가 그 기능을 충분히 발휘하도록 하고, 설계도서·공정표·시공계획서·제작도 및 시공 상세도 등에 따라 발주자 또는 감리자와 협의하여 진행하여야 한다. (2) 복수의 공종이 중복되어 시공되는 경우, 구조적안전·에너지절약 및 환경성 등 조건을 검토하여 작업순서를 정하여야 한다. (3) 다른 분야 시공자와 협의하여 원만한 시공이 이루어져야 한다. 3.2.2 손상방지 (1) 전기설비를 구조물에 고정하는 경우 배관 등에 과다한 변위가 발생하지 않아야 하고, 구조물의 접속부에 손상이 없도록 하여야 한다. 다만, 손상의 우려가 있는 경우 해당 감리자와 협의 하여야 한다. (2) 내진 및 방진장치를 설치한 기기가 다른 기기에 연결되는 경우의 접속부에는 유연성을 확보하여야 한다. 3.3 공정표 및 시공계획서 3.3.1 공정표 (1) 공사의 착공 전에 공정표를 작성하고 감리자의 승인을 받아야 한다. (2) 공정표에 변경이 발생한 경우는 즉시 변경공정표를 작성하여 감리자의 승인을 받아야 한다. (3) 별도로 계약한 공사에 대한 합의가 필요할 때는 발주자 또는 감리자와 협의하여야 한다. 3.3.2 시공계획서 (1) 착공 전에 공사 계획을 종합 정리하여 작성하고, 감리자에게 제출하여야 한다. (2) 공정별로 기기, 자재 및 공법 등을 구체적으로 기록하여 발주자 또는 감리자의 승인을 받아야 한다. 3.3.3 보고서 (1) 공정표 및 시공계획서에 따라서 공사에 관한 진척 사항·작업내용·자재의 반입·사용·기후조건 등 기타 감리자가 필요하다고 지시한 사항에 대해서 보고서를 제출하여야 한다. 3.4 정리 및 사고방지. 3.4.1 정리⋅정비 (1) 공사현장 내로 반입된 제반 자재 및 기계기구 등의 정리·정비·점검·관리 및 청소를 철저히 하여야 한다. (2) 현장은 청결하게 유지하여야 한다. 3.4.2 재해 및 공해방지 (1) 시공자는 공사현장의 재해방지를 하여야 한다. (2) 시공자는 공사현장 주변에 공해 및 재해가 미치지 않도록 조치하여야 한다. 3.4.3 조치 및 보호 (1) 공사현장에서 안전사고·재해 또는 공해가 발생하거나 발생의 우려가 있는 경우에는 우선 필요한 조치를 신속히 취하고 그 경위를 발주자와 감리자에게 보고하여야 한다. (2) 공사현장 주변에 대해서 보호를 필요로 할 때는 발주자 또는 감리자와 협의하여 공사 진행 중이라도 즉시 보강하여야 한다. (3) 시공 시 기존 부분·시공 완료 부분 및 자재 등이 오염이나 손상될 우려가 있는 경우는 적절한 방법으로 보호하여야 한다. 3.5 시운전 및 유지관리 교육 (1) 시운전이 요구되는 기계·장비는 일정 기간 이상 시운전하여 이상 유무를 확인하여야 한다. 다만, 시운전 방법 및 기간은 공사시방서에 따른다. (2) 유지관리에 필요한 사항은 충분한 교육을 시행하고 운전절차에 대한 상세한 사항을 서류로 제공하여야 한다. 3.6 시공상세도면 작성 3.6.1 일반사항 (1) 시공자는 시공에 필요한 시공상세도면을 작성하여 시공 시 활용하여야 한다. (2) 시공상세도면은 실시설계도서에 포함된 각종 도면 외에 시공자가 설계도서에 표시된 내용을 구체적으로 구현되도록 시공방법을 검토하여 도면을 작성하여야 한다. 3.6.2 기본사항 (1) 다른 분야(건축부분·기계설비 등)의 시공상세도면과 상호 유기적으로 연계되어야 한다. (2) 설계도서에 대한 시공상의 문제점을 해결하고, 합리적이고 능률적이며 견실한 시공이 되도록 하여야 한다. (3) 시공상세도면은 이를 작성한 책임기술자가 날인하고, 감독자(발주자 또는 감리자)의 승인으로 확정하여야 한다. 3.6.3 타 공종과 겹침 (1) 전기설비공사가 타 공종과 서로 겹치는 경우, 해당 공종의 기준에도 부합되어야 한다. 다만, 간섭을 고려한 도면을 작성하여야 한다. (2) 타 공종의 시공업체는 시공상세도면 작성에 서로 협력하여야 한다. 3.7 준공검사 (1) 시험 및 검사 ① 공사의 완료 전까지 설계도 및 공사시방서 등에서 시험 및 검사를 필요로 하는 자재는 해당 기준의 시험 및 검사를 완료하고 합격하여야 한다. (2) 준공검사 ① 시공자는 감리자의 입회 아래 각종 설비 및 시스템의 외관 및 정돈 상태, 동작시험, 준공서류의 준비, 용량 및 성능 확인, 정상적인 동작 상태 및 주위 환경에 따른 영향 등을 확인하는 준공검사를 받아야 한다. (3) 준공검사 상세사항은 공사시방서에 따른다. 집필위원 성 명 소 속 성 명 소 속 신효섭 ㈜더힐코리아 김세동 두원공과대학교 서동범 ㈜정우DC 장성규 ㈜하이텍이피씨 이주철 건일이엔지 SCEI연구소 류우찬 부경대학교 김한진 한국승강기안전공단 노준석 DL E&C 유홍국 건일이엔씨(주) 이종환 인천국제공항공사 한종선 에이플러스이엔씨(주) 자문위원 성 명 소 속 성 명 소 속 강형구 한국교통대학교 김시복 인천도시공사 류홍제 중앙대학교 김훈 강원대학교 이종필 중원대학교 송준석 한국토지주택공사 허재완 한국전기안전공사 국가건설기준센터 및 건설기준위원회 성 명 소 속 성 명 소 속 이영호 한국건설기술연구원 최봉혁 한국건설기술연구원 김기현 한국건설기술연구원 허원호 한국건설기술연구원 김나은 한국건설기술연구원 김광호 강원대학교 김민관 한국건설기술연구원 남기범 한국전기기술인협회 김재훈 한국건설기술연구원 신석하 ㈜엠알솔루텍 김태송 한국건설기술연구원 신형철 인천국제공항공사 김희석 한국건설기술연구원 신희경 엘피에스코리아 류상훈 한국건설기술연구원 박철규 서울도시주택공사 안준혁 한국건설기술연구원 이복희 인하대학교 원훈일 한국건설기술연구원 이이문 한국토지주택공사 이상규 한국건설기술연구원 이정호 한국전기연구원 이소정 한국건설기술연구원 정영호 한국교통대학교 이승재 한국건설기술연구원 조병우 석우엔지니어링(주) 이승환 한국건설기술연구원 최옥만 한국토지주택공사 이용수 한국건설기술연구원 이원종 한국건설기술연구원 주영경 한국건설기술연구원 중앙건설기술심의위원회 성 명 소 속 성 명 소 속 김영일 서울과학기술대학교 이영범 ㈜수성엔지니어링 송상빈 한국광기술원 박영 한밭대학교 최영욱 한국전기연구원 박경윤 LG전자 주강필 SK에코플랜트㈜ 국토교통부 성 명 소 속 성 명 소 속 전인재 국토교통부 건설산업과 이종문 국토교통부 건설산업과 이상민 국토교통부 건설산업과 KCS 32 10 10 : 2024 전기설비공사 일반사항 2024년 8월 22일 개정 소관부서 국토교통부 건설산업과 관련단체 (사)한국조명·전기설비학회 06130 서울특별시 강남구 테헤란로7길 22 1관 1104호 Tel : 02-564-6534 E-mail : kiiee@kiiee.or.kr http://www.kiiee.or.kr 작성기관 (사)한국조명·전기설비학회 06130 서울특별시 강남구 테헤란로7길 22 1관 1104호 Tel : 02-564-6534 E-mail : kiiee@kiiee.or.kr http://www.kiiee.or.kr 국가건설기준센터 10223 경기도 고양시 일산서구 고양대로 283(대화동) Tel : 031-910-0444 E-mail : kcsc@kict.re.kr http://www.kcsc.re.kr",
    "sections": {
      "scope": "1.1 적용범위 1 1.2 참고 기준 1 1.3 용어의 정의 3 1.4 지급자재 4 1.5 설계도서 간 상충 4 1.6 관공서 등의 수속 4 1.7 제출물 4 1.8 공사기록 5 1.9 안전보건 5 1.10 별도계약 5 1.11 신기술·신공법 5 2. 자재 6 2.1 재료 7 2.2 자재 관리 7 2.3 자재 품질관리 7 2.4 발생자재의 처리 및 뒷정리 7 3. 시공 8 3.1 시공조건 확인 8 3.2 작업준비 8 3.3 공정표 및 시공계획서 8 3.4 정리 및 사고방지 9 3.5 시운전 및 유지관리 교육 9 3.6 시공상세도면 작성 10 3.7 준공검사 11 1. 일반사항 1.1 적용범위 1.1.1 전기설비공사 1.1.1.1 건축전기설비공사 (1) 전원설비공사는 수변전설비, 예비전원설비, 신전원설비 등을 말한다. (2) 배선 및 부하설비공사는 간선 및 배선설비, 동력설비, 반송설비 등을 말한다. (3) 조명설비공사는 옥내조명설비, 옥외 및 경관조명설비, 도로 및 터널조명설비 등을 말한다. (4) 제어 및 정보통신설비공사는 감시제어설비, 전기통신설비, 정보설비, 약전설비 등을 말한다. (5) 방재설비공사는 피뢰설비, 접지설비, 소방전기설비, 방범설비, 항공장애표시등설비 등을 말한다. 1.1.1.2 시설물별 전기설비공사 (1) 공동구, 조경, 구조물 등에 시설하는 전기설비공사를 말한다. (2) 구조물공사는 전기방식설비⋅전기방폭설비 등의 전기설비를 말한다. 1.1.1.3 항만 및 어항, 철도공사 등의 전기설비공사 (1) 해당하는 공사의 전기설비를 말한다. 1.1.1.4 건축공사, 토목공사의 부대 전기설비공사 (1) 가설공사에서 전기설비를 말한다. (2) 공사용 조명⋅동력⋅전기통신 등의 전기설비를 말한다. 1.1.1.5 다른 기준 준용 (1) 이 기준에 기재된 것 이외의 사항은 해당 공종의 표준시방서(KCS)에 따른다. (2) 이 기준에서 정하고 있지 않은 시공 시 필요한 사항과 예외 사항은 전문시방서(OCS) 또는 공사시방서를 따른다. 1.2 참고 기준 1.2.1 관련 법규 ∙건축물의 설비기준 등에 관한 규칙 ∙건축물의 구조기준 등에 관한 규칙 ∙건축물의 피난, 방화구조 등의 기준에 관한 규칙 ∙건축물에너지효율등급 인증 및 제로에너지건축물인증에 관한 규칙 ∙건축법 ∙건축사법 ∙건설산업기본법 ∙건설기술진흥법 ∙경관법 ∙공항시설법 ∙녹색건축물 조성지원법 ∙도로법 ∙도로교통법 ∙도시공원 및 녹지 등에 관한 법 ∙물환경보전법 ∙방송통신발전기본법 ∙산업안전보건법 ∙산업안전보건기준에 관한 규칙 ∙산업표준화법 ∙소방기본법 ∙소방시설공사업법 ∙소방시설 설치 및 관리에 관한 법 ∙신에너지 및 재생에너지 개발, 이용, 보급촉진법 ∙스마트 도시의 조성 및 산업진흥 등에 관한 법 ∙승강기안전관리법 ∙에너지이용합리화법 ∙옥외광고물 등의 관리와 산업진흥에 관한 법 ∙인공조명에 의한 빛공해 방지법 ∙의료법 ∙자연공원법 ∙자연재해대책법 ∙재난 및 안전관리 기본법 ∙전기사업법 ∙전기공사업법 ∙전력기술관리법 ∙전기안전관리법 ∙전기용품 및 생활용품 안전관리법 ∙전기통신기본법 ∙정보통신공사업법 ∙정보통신망 이용촉진 및 정보보호 등에 관한 법 ∙전파법 ∙주차장법 ∙주택법 ∙주택건설기준 등에 관한 규정 ∙중소기업제품 구매촉진 및 판로지원에 관한 법률 ∙지진·화산재해대책법 ∙지능형전력망의 구축 및 이용촉진에 관한 법 ∙초고층 및 지하연계 복합건축물 재난관리에 관한 특별법 ∙화재의 예방 및 안전관리에 관한 법 ∙환경친화적 자동차의 개발 및 보급촉진에 관한 법률 ∙항만법 1.2.2 관련 기준 ∙건축물의 에너지절약설계기준(국토교통부) ∙고효율에너지 기자재보급촉진에 관한 규정(산업통상자원부) ∙공공기관 에너지이용 합리화 추진에 관한 규정(산업통상자원부) ∙방송통신설비의 기술기준에 관한 규정(과학기술정보통신부) ∙소방시설의 내진설계기준(소방청) ∙소방시설 자체점검사항 등에 관한 고시(소방청) ∙신재생에너지설비의 지원 등에 관한 규정(산업통상자원부) ∙에너지관리기준(산업통상자원부) ∙전기설비 검사 및 점검의 방법 절차 등에 관한 고시(산업통상자원부) ∙전기설비기술기준(산업통상자원부) ∙접지설비·구내통신설비·선로설비 및 통신공동구 등에 대한 기술기준(과학기술정보통신부) ∙주택건설기준에 관한 규칙(국토교통부) ∙지능형 홈네트워크 설비 설치 및 기술기준(국토교통부, 과학기술정보통신부, 산업통상자원부) ∙지하공간 침수방지를 위한 수방기준(행정안전부) ∙화재안전성능기준(소방청) ∙한국전기설비규정(산업통상자원부) ∙KDS 41 17 00 건축물내진설계기준 1.2.3 관련 표준 ∙한국산업표준 ∙표준시방서(KCS)에서 인용한 한국산업표준(KS)은 최신판(모든 추록을 포함) 적용함을 원칙으로 한다. 1.2.4 기타 사항 (1) 설계도서의 내용이 관련 법규와 상충되는 경우는 해당 법규를 따라야 한다. (2) 설계도서 또는 관련 법규에 명시되지 않은 사항은 발주자 또는 감리자와 협의하여야 한다. (3) 기관이 전문시방서(OCS)를 사용하는 경우, 이를 공사시방서에 준하여 적용하여야 한다. 1.3 용어의 정의 1.3.1 시방서 ∙ KCS 코드(표준시방서): 건설기술진흥법에 의하여 시설물의 안전 및 공사시행의 적정성과 품질확보 등을 위하여 시설물별로 정한 표준적인 시공기준으로서 전문시방서 작성과 설계자가 공사시방서를 작성하는 경우에 활용하기 위한 시공기준을 말한다. ∙ OCS 코드(전문시방서): 건설기술진흥법에 의하여 시설물별 표준시방서를 기본으로 모든 공종을 대상으로 하여 전문시방서 관리기관의 시공 또는 공사시방서의 작성에 활용하기 위한 종합적인 시공기준을 말한다. ∙ 공사시방서: 건설기술진흥법에 의하여 KCS 코드(표준시방서) 및 OCS 코드(전문시방서)를 기본으로 하여, 각 현장별 공사의 특수성⋅지역여건⋅공사방법 등을 고려하고, 기본설계 및 실시설계도에 구체적으로 표시할 수 없는 내용과 공사에 대한 시공방법·자재의 성능 및 규격, 품질시험 및 검사 등 품질관리, 안전관리계획 등에 관한 사항을 기술한 것을 말한다. 1.3.2 관계자 ∙ 발주자 : 건설공사 또는 건설기술용역을 발주하는 국가, 지방자치단체, 국가 또는 지방자치단체가 납입 자본금의 50% 이상을 출자한 기업체의 장 또는 건설기술진흥법 시행령에 정하는 자를 말한다. ∙ 시공자 : 발주자로부터 건설공사를 도급받은 건설업자를 말하며, 하도급 관계에 있어서 하도급받은 건설업자를 포함하여 말한다. ∙ 감리자 : 관련 법규에서 정한 바에 따라 설계도서 및 기타 관계서류의 내용대로 시공되는지의 여부와 안전성능을 확인하고, 소관업무 등에 대한 기술지도를 할 수 있는 자를 말한다. ∙ 현장대리인 : 공사계약 일반조건 및 관련 법규에 의거하여 시공자가 지정하는 책임시공 기술자로서 해당 현장에서 공사관리 및 기술관리, 기타 공사업무를 총괄하는 자를 말한다. 1.3.3 설계도서 (1) 관련 법규에 따른 기본설계 및 실시설계도, 설계계산서, 공사시방서 등을 말한다. (2) 발주자가 요구한 도서 및 기타 관련 서류를 포함한다. 1.3.4 경미한 변경 (1) 공사 진행 중 현장의 마감 상태, 작업 상태 등으로 인하여 기기 및 자재의 설치 위치가 변경되거나 공법을 변경하는 등 경미한 변경이 필요한 경우 시행한다. (2) 변경사항 발생 시 해당 전기설비 설계자의 의견 청취 후 감리자와 협의하여야 한다. 1.4 지급자재 (1) 지급자재의 종류·수량 및 인도 방법은 공사시방서에 따른다. (2) 지급자재의 인도 시에는 발주자 또는 감리자 입회하에 검수하여 합격하여야 한다. (3) 합격 된 지급자재는 다른 자재와 구분하여 보관하여야 한다. 1.5 설계도서 간 상충 1.5.1 적용 우선순위 (1) 공사시방서 (2) 설계도면 (3) 내역서 (4) 기타 설계도서의 순서로 한다. 1.5.2 특별 사유에 따른 조정 (1) 계약서 등에 특별한 사유가 있는 경우, 이에 따른다. (2) 특별한 사유에 따른 해석은 발주자, 감리자 및 설계자의 의견으로 조정할 수 있다. 1.6 관공서 등의 수속 (1) 시공자는 공사의 진행에 필요한 관공서 및 기타 기관에 제출 서류를 준비하여야 한다. (2) 시공자의 수속은 기한 내에 수행하여야 한다. 1.7 제출물 (1) 준공검사가 끝난 후 다음의 관계 도면 및 서류 등은 발주자 또는 감리자에 제출하여야 하고, 이를 확인 및 승인을 받은 후 공사의 인계 및 인수 절차를 마쳐야 한다. ① 준공검사필증 ② 준공도서 ③ 준공사진 ④ 허가 관련서류 및 검사필증 ⑤ 각 설비별 자재 성능시험성적서 및 검사증 ⑥ 각 설비별 주요자재 목록 ⑦ 각 설비별 자재 취급설명서 ⑧ 기기에 부속된 공구류 및 예비품 ⑨ 기타 준공서류 (2) 제출물에 대한 추가적인 사항은 공사시방서 등에 따른다. 1.8 공사기록 (1) 공사와 관련한 협의 및 지시사항에 대해서는 그것들의 경과 내용을 기록하고, 정리 및 보관하여야 한다. (2) 시험⋅검사에 대해서는 기록을 하고 정리 및 보관하여야 한다. (3) 공사공정의 주요 부분 등에서 매입·은폐 등으로 확인 불가능한 부분은 사진 또는 영상물로 찍어 정리 보관하여야 한다. (4) 감리자의 지시가 있는 경우 기록물(영상·사진 포함)을 제출하여야 한다. (5) 시공일지, 감리일지는 당일 그 내용을 기록하고 정리 보관하여야 한다. (6) 모든 기록물(영상·사진 포함)은 정리하여 색인 후 준공서류의 일부로 제출하여야 한다. 1.9 안전보건 (1) 모든 공사는 산업재해 예방을 위해 관련 법규 및 부속기준을 준수하여 시공 중 재해 발생을 방지하여야 한다. (2) 시공자는 공사현장의 안전 및 보건을 유지하기 위하여 안전보건에 관한 관리체제 및 규정을 작성하여야 한다. (3) 발주자 또는 시공자는 공사비용에 산업안전보건관리비를 책정하여야 한다. 다만, 산업안전보건관리비는 해당 건설사업장에 근무하는 근로자의 산업재해 예방 및 건강 증진을 위한 목적으로만 사용하여야 한다. 1.10 별도계약 (1) 시공자는 본 공사와 별도로 계약된 공사에 대해서는 해당 공사의 관계자와 협의하여야 한다. (2) 별도계약 공사는 본 공사 진행에 지장이 없도록 하여야 한다. 1.11 신공법·특수공법 적용 (1) 전기설비 공사용 기술 및 자재는 국가 및 국가 기관에서 인증 한 신공법·특수공법을 우선하여 적용할 수 있다. (2) 공법의 채택은 설계도 및 공사시방서에 따른다. 2. 자재 2.1 재료 (1) 사용자재는 신제품으로 하여야 한다. 다만, 가설용 자재와 특별히 지정된 것은 제외한다. (2) 사용자재는 KS 표준품으로 신제품을 사용하여야 한다. 다만, KS 표준품이 없는 경우는 발주자 또는 감리자의 승인을 받은 동등 이상의 제품을 사용하여야 한다. (3) 자재의 품질을 명시하지 않은 경우, 발주자 또는 감리자의 품질 확인을 받아 선정하여야 한다. (4) 기기는 원칙적으로 제조자·제조번호·제조년월일·정격 및 성능 등을 명기한 명판을 부착하여야 한다. (5) 재료의 상세사항은 설계도 및 공사시방서에 따른다. 2.2 자재 관리 (1) 공사용 자재가 검사 및 시험에 합격한 경우는 감리자가 지시한 장소에 정리하여 보관하고 불합격품은 즉시 공사장 밖으로 반출하여야 한다. (2) 자재관리의 상세사항은 공사시방서에 따른다. 2.3 자재 품질관리 (1) 공사용 자재의 시험과 검사방법은 관련 법규 및 한국산업표준에 따르며, 기타 적용기준이 있을 때는 그것에 따른다. (2) 공사시방서 등에 명시되었거나 필요한 경우에는 반드시 기기, 자재 및 시공에 대한 시험 및 검사를 실시한다. 다만, KS 표준품과 제조업체 등의 시험성적서 및 검사 등에 의해 감리자가 인정하거나 경미한 사항에 대해서는 생략할 수 있다. (3) 시험은 시방서에 명시되었거나 필요한 단계에서 반드시 실시하고, 결과를 감리자에게 제출하여야 한다. (4) 품질검사는 각종 시방서에 명시된 사항, 필요한 단계 또는 감리자가 지정한 공정에 도달한 경우 검사를 받아야 한다. (5) 자재품질관리의 상세사항은 공사시방서에 따른다. 2.4 발생자재의 처리 및 뒷정리 (1) 시공 중 발생 자재 중 인도하도록 지정된 것은 지정된 장소에 정돈하고 관련 서류를 감리자에게 제출하여야 한다. (2) 시공을 하는 도중에 장애물의 처리에 대해서는 발주자 또는 감리자와 협의하여야 한다. (3) 공사 완료 시 가설물 등은 신속하게 철거하고 청소 및 뒷정리를 하여야 한다. (4) 자재 처리의 상세사항은 공사시방서에 따른다. 3. 시공 3.1 시공조건 확인 3.1.1 사전 평가 3.1.1.1 적합성 평가 항목 (1) 설치 또는 사용할 때의 적합성 (2) 보호조치에 대한 적합성·기계적 강도 및 내구성 (3) 전선 또는 배관의 굴곡과 접속 (4) 전기적 절연 3.1.1.2 시공조건 확인 항목 (1) 정상상태와 비정상적 상태에서의 열적 영향 (2) 정격·크기·전압·전류용량 및 특정한 용도에 따른 분류 (3) 사용 중 또는 기기와 접촉 시 인체보호 조건 3.1.2 일반조건 (1) 배선은 설치 완료 시 단락⋅지락 상태 없이 완전하여야 한다. (2) 전기기기는 사용환경을 확인하고 적합한 경우에 설치하여야 한다. 다만, 가스·연기·증기·고온 환경·기타의 원인으로 전선 또는 기기를 열화시킬 우려가 있는 경우에 이를 보강하는 공법으로 하여야 한다. (3) 전기기기는 각각의 특성에 따라 정확하고 기능적인 방법으로 다음과 같이 시공하여야 한다. ① 박스류·배선경로·캐비닛 및 기기 케이스 등에서 사용되지 않는 개구부는 효과적인 방법으로 폐쇄하여야 한다. ② 지중함(맨홀·핸드홀 등)은 전선 또는 기기의 설치나 유지관리하는 경우에 작업자가 쉽고 안전하게 접근할 수 있도록 하여야 한다. ③ 버스 바·배선단자·애자 및 기타 전기기기의 내부 부품은 손상되지 않아야 하고, 도료·충전재 및 잔여물 등 이물질에 오염되지 않아야 한다. (4) 접속 ① 압축단자·압축접속기·납땜 등을 사용하는 전기적 접속 시 사용이 가능한 전선의 재질을 확인하여야 한다. ② 서로 다른 금속으로 된 전선의 접속은 단자나 접속기를 사용하여야 한다. 3.1.3 전기적 위험 (1) 충전부분의 보호(저압인 경우) ① 안전전압(50 V) 이상에서 운전되는 전기기기의 충전 부분은 우발적으로 접촉되는 것을 방지하기 위해 승인된 외함을 사용하거나, 기타의 방법으로 보호해야 한다. 다만, 공사시방서 등에서 다르게 규정한 것은 제외한다. ② 전기기기가 물리적 손상을 입기 쉬운 장소에 설치된 경우 손상을 견딜 수 있는 강도의 외함이나 보호 장치를 하여야 한다. ③ 노출된 충전 부분이 있는 보호구역과 실의 입구에는 경고표지를 눈에 잘 띄게 설치하여 일반인의 출입을 방지하여야 한다. (2) 제한구역 ① 출입을 제한하는 구역의 전기시설은 자물쇠와 열쇠 기타 방법으로 허가된 전기기술자만이 출입할 수 있도록 하여야 한다. ② 옥외에 설치하는 위험한 전기설비는 허가된 전기기술자 이외의 출입을 제한하는 시설을 하여야 한다. 다만, 위험성 여부는 감리자와 협의하여야 한다. 3.2 작업준비 3.2.1 일반사항 (1) 공사는 설계도서에 표시된 제반설비가 그 기능을 충분히 발휘하도록 하고, 설계도서·공정표·시공계획서·제작도 및 시공 상세도 등에 따라 발주자 또는 감리자와 협의하여 진행하여야 한다. (2) 복수의 공종이 중복되어 시공되는 경우, 구조적안전·에너지절약 및 환경성 등 조건을 검토하여 작업순서를 정하여야 한다. (3) 다른 분야 시공자와 협의하여 원만한 시공이 이루어져야 한다. 3.2.2 손상방지 (1) 전기설비를 구조물에 고정하는 경우 배관 등에 과다한 변위가 발생하지 않아야 하고, 구조물의 접속부에 손상이 없도록 하여야 한다. 다만, 손상의 우려가 있는 경우 해당 감리자와 협의 하여야 한다. (2) 내진 및 방진장치를 설치한 기기가 다른 기기에 연결되는 경우의 접속부에는 유연성을 확보하여야 한다. 3.3 공정표 및 시공계획서 3.3.1 공정표 (1) 공사의 착공 전에 공정표를 작성하고 감리자의 승인을 받아야 한다. (2) 공정표에 변경이 발생한 경우는 즉시 변경공정표를 작성하여 감리자의 승인을 받아야 한다. (3) 별도로 계약한 공사에 대한 합의가 필요할 때는 발주자 또는 감리자와 협의하여야 한다. 3.3.2 시공계획서 (1) 착공 전에 공사 계획을 종합 정리하여 작성하고, 감리자에게 제출하여야 한다. (2) 공정별로 기기, 자재 및 공법 등을 구체적으로 기록하여 발주자 또는 감리자의 승인을 받아야 한다. 3.3.3 보고서 (1) 공정표 및 시공계획서에 따라서 공사에 관한 진척 사항·작업내용·자재의 반입·사용·기후조건 등 기타 감리자가 필요하다고 지시한 사항에 대해서 보고서를 제출하여야 한다. 3.4 정리 및 사고방지. 3.4.1 정리⋅정비 (1) 공사현장 내로 반입된 제반 자재 및 기계기구 등의 정리·정비·점검·관리 및 청소를 철저히 하여야 한다. (2) 현장은 청결하게 유지하여야 한다. 3.4.2 재해 및 공해방지 (1) 시공자는 공사현장의 재해방지를 하여야 한다. (2) 시공자는 공사현장 주변에 공해 및 재해가 미치지 않도록 조치하여야 한다. 3.4.3 조치 및 보호 (1) 공사현장에서 안전사고·재해 또는 공해가 발생하거나 발생의 우려가 있는 경우에는 우선 필요한 조치를 신속히 취하고 그 경위를 발주자와 감리자에게 보고하여야 한다. (2) 공사현장 주변에 대해서 보호를 필요로 할 때는 발주자 또는 감리자와 협의하여 공사 진행 중이라도 즉시 보강하여야 한다. (3) 시공 시 기존 부분·시공 완료 부분 및 자재 등이 오염이나 손상될 우려가 있는 경우는 적절한 방법으로 보호하여야 한다. 3.5 시운전 및 유지관리 교육 (1) 시운전이 요구되는 기계·장비는 일정 기간 이상 시운전하여 이상 유무를 확인하여야 한다. 다만, 시운전 방법 및 기간은 공사시방서에 따른다. (2) 유지관리에 필요한 사항은 충분한 교육을 시행하고 운전절차에 대한 상세한 사항을 서류로 제공하여야 한다. 3.6 시공상세도면 작성 3.6.1 일반사항 (1) 시공자는 시공에 필요한 시공상세도면을 작성하여 시공 시 활용하여야 한다. (2) 시공상세도면은 실시설계도서에 포함된 각종 도면 외에 시공자가 설계도서에 표시된 내용을 구체적으로 구현되도록 시공방법을 검토하여 도면을 작성하여야 한다. 3.6.2 기본사항 (1) 다른 분야(건축부분·기계설비 등)의 시공상세도면과 상호 유기적으로 연계되어야 한다. (2) 설계도서에 대한 시공상의 문제점을 해결하고, 합리적이고 능률적이며 견실한 시공이 되도록 하여야 한다. (3) 시공상세도면은 이를 작성한 책임기술자가 날인하고, 감독자(발주자 또는 감리자)의 승인으로 확정하여야 한다. 3.6.3 타 공종과 겹침 (1) 전기설비공사가 타 공종과 서로 겹치는 경우, 해당 공종의 기준에도 부합되어야 한다. 다만, 간섭을 고려한 도면을 작성하여야 한다. (2) 타 공종의 시공업체는 시공상세도면 작성에 서로 협력하여야 한다. 3.7 준공검사 (1) 시험 및 검사 ① 공사의 완료 전까지 설계도 및 공사시방서 등에서 시험 및 검사를 필요로 하는 자재는 해당 기준의 시험 및 검사를 완료하고 합격하여야 한다. (2) 준공검사 ① 시공자는 감리자의 입회 아래 각종 설비 및 시스템의 외관 및 정돈 상태, 동작시험, 준공서류의 준비, 용량 및 성능 확인, 정상적인 동작 상태 및 주위 환경에 따른 영향 등을 확인하는 준공검사를 받아야 한다. (3) 준공검사 상세사항은 공사시방서에 따른다. 집필위원 성 명 소 속 성 명 소 속 신효섭 ㈜더힐코리아 김세동 두원공과대학교 서동범 ㈜정우DC 장성규 ㈜하이텍이피씨 이주철 건일이엔지 SCEI연구소 류우찬 부경대학교 김한진 한국승강기안전공단 노준석 DL E&C 유홍국 건일이엔씨(주) 이종환 인천국제공항공사 한종선 에이플러스이엔씨(주) 자문위원 성 명 소 속 성 명 소 속 강형구 한국교통대학교 김시복 인천도시공사 류홍제 중앙대학교 김훈 강원대학교 이종필 중원대학교 송준석 한국토지주택공사 허재완 한국전기안전공사 국가건설기준센터 및 건설기준위원회 성 명 소 속 성 명 소 속 이영호 한국건설기술연구원 최봉혁 한국건설기술연구원 김기현 한국건설기술연구원 허원호 한국건설기술연구원 김나은 한국건설기술연구원 김광호 강원대학교 김민관 한국건설기술연구원 남기범 한국전기기술인협회 김재훈 한국건설기술연구원 신석하 ㈜엠알솔루텍 김태송 한국건설기술연구원 신형철 인천국제공항공사 김희석 한국건설기술연구원 신희경 엘피에스코리아 류상훈 한국건설기술연구원 박철규 서울도시주택공사 안준혁 한국건설기술연구원 이복희 인하대학교 원훈일 한국건설기술연구원 이이문 한국토지주택공사 이상규 한국건설기술연구원 이정호 한국전기연구원 이소정 한국건설기술연구원 정영호 한국교통대학교 이승재 한국건설기술연구원 조병우 석우엔지니어링(주) 이승환 한국건설기술연구원 최옥만 한국토지주택공사 이용수 한국건설기술연구원 이원종 한국건설기술연구원 주영경 한국건설기술연구원 중앙건설기술심의위원회 성 명 소 속 성 명 소 속 김영일 서울과학기술대학교 이영범 ㈜수성엔지니어링 송상빈 한국광기술원 박영 한밭대학교 최영욱 한국전기연구원 박경윤 LG전자 주강필 SK에코플랜트㈜ 국토교통부 성 명 소 속 성 명 소 속 전인재 국토교통부 건설산업과 이종문 국토교통부 건설산업과 이상민 국토교통부 건설산업과 KCS 32 10 10 : 2024 전기설비공사 일반사항 2024년 8월 22일 개정 소관부서 국토교통부 건설산업과 관련단체 (사)한국조명·전기설비학회 06130 서울특별시 강남구 테헤란로7길 22 1관 1104호 Tel : 02-564-6534 E-mail : kiiee@kiiee.or.kr http://www.kiiee.or.kr 작성기관 (사)한국조명·전기설비학회 06130 서울특별시 강남구 테헤란로7길 22 1관 1104호 Tel : 02-564-6534 E-mail : kiiee@kiiee.or.kr http://www.kiiee.or.kr 국가건설기준센터 10223 경기도 고양시 일산서구 고양대로 283(대화동) Tel : 031-910-0444 E-mail : kcsc@kict.re.kr http://www.kcsc.re.kr",
      "materials": "(1) 시공 중 발생 자재 중 인도하도록 지정된 것은 지정된 장소에 정돈하고 관련 서류를 감리자에게 제출하여야 한다.\n(2) 시공을 하는 도중에 장애물의 처리에 대해서는 발주자 또는 감리자와 협의하여야 한다.\n(3) 공사 완료 시 가설물 등은 신속하게 철거하고 청소 및 뒷정리를 하여야 한다.\n(4) 자재 처리의 상세사항은 공사시방서에 따른다.",
      "construction": "(1) 착공 전에 공사 계획을 종합 정리하여 작성하고, 감리자에게 제출하여야 한다.\n(2) 공정별로 기기, 자재 및 공법 등을 구체적으로 기록하여 발주자 또는 감리자의 승인을 받아야 한다.",
      "quality": "품질관리 7 2.4 발생자재의 처리 및 뒷정리 7 3. 시공 8 3.1 시공조건 확인 8 3.2 작업준비 8 3.3 공정표 및 시공계획서 8 3.4 정리 및 사고방지 9 3.5 시운전 및 유지관리 교육 9 3.6 시공상세도면 작성 10 3.7 준공검사 11 1. 일반사항 1.1 적용범위 1.1.1 전기설비공사 1.1.1.1 건축전기설비공사 (1) 전원설비공사는 수변전설비, 예비전원설비, 신전원설비 등을 말한다. (2) 배선 및 부하설비공사는 간선 및 배선설비, 동력설비, 반송설비 등을 말한다. (3) 조명설비공사는 옥내조명설비, 옥외 및 경관조명설비, 도로 및 터널조명설비 등을 말한다. (4) 제어 및 정보통신설비공사는 감시제어설비, 전기통신설비, 정보설비, 약전설비 등을 말한다. (5) 방재설비공사는 피뢰설비, 접지설비, 소방전기설비, 방범설비, 항공장애표시등설비 등을 말한다. 1.1.1.2 시설물별 전기설비공사 (1) 공동구, 조경, 구조물 등에 시설하는 전기설비공사를 말한다. (2) 구조물공사는 전기방식설비⋅전기방폭설비 등의 전기설비를 말한다. 1.1.1.3 항만 및 어항, 철도공사 등의 전기설비공사 (1) 해당하는 공사의 전기설비를 말한다. 1.1.1.4 건축공사, 토목공사의 부대 전기설비공사 (1) 가설공사에서 전기설비를 말한다. (2) 공사용 조명⋅동력⋅전기통신 등의 전기설비를 말한다. 1.1.1.5 다른 기준 준용 (1) 이 기준에 기재된 것 이외의 사항은 해당 공종의 표준시방서(KCS)에 따른다. (2) 이 기준에서 정하고 있지 않은 시공 시 필요한 사항과 예외 사항은 전문시방서(OCS) 또는 공사시방서를 따른다. 1.2 참고 기준 1.2.1 관련 법규 ∙건축물의 설비기준 등에 관한 규칙 ∙건축물의 구조기준 등에 관한 규칙 ∙건축물의 피난, 방화구조 등의 기준에 관한 규칙 ∙건축물에너지효율등급 인증 및 제로에너지건축물인증에 관한 규칙 ∙건축법 ∙건축사법 ∙건설산업기본법 ∙건설기술진흥법 ∙경관법 ∙공항시설법 ∙녹색건축물 조성지원법 ∙도로법 ∙도로교통법 ∙도시공원 및 녹지 등에 관한 법 ∙물환경보전법 ∙방송통신발전기본법 ∙산업안전보건법 ∙산업안전보건기준에 관한 규칙 ∙산업표준화법 ∙소방기본법 ∙소방시설공사업법 ∙소방시설 설치 및 관리에 관한 법 ∙신에너지 및 재생에너지 개발, 이용, 보급촉진법 ∙스마트 도시의 조성 및 산업진흥 등에 관한 법 ∙승강기안전관리법 ∙에너지이용합리화법 ∙옥외광고물 등의 관리와 산업진흥에 관한 법 ∙인공조명에 의한 빛공해 방지법 ∙의료법 ∙자연공원법 ∙자연재해대책법 ∙재난 및 안전관리 기본법 ∙전기사업법 ∙전기공사업법 ∙전력기술관리법 ∙전기안전관리법 ∙전기용품 및 생활용품 안전관리법 ∙전기통신기본법 ∙정보통신공사업법 ∙정보통신망 이용촉진 및 정보보호 등에 관한 법 ∙전파법 ∙주차장법 ∙주택법 ∙주택건설기준 등에 관한 규정 ∙중소기업제품 구매촉진 및 판로지원에 관한 법률 ∙지진·화산재해대책법 ∙지능형전력망의 구축 및 이용촉진에 관한 법 ∙초고층 및 지하연계 복합건축물 재난관리에 관한 특별법 ∙화재의 예방 및 안전관리에 관한 법 ∙환경친화적 자동차의 개발 및 보급촉진에 관한 법률 ∙항만법 1.2.2 관련 기준 ∙건축물의 에너지절약설계기준(국토교통부) ∙고효율에너지 기자재보급촉진에 관한 규정(산업통상자원부) ∙공공기관 에너지이용 합리화 추진에 관한 규정(산업통상자원부) ∙방송통신설비의 기술기준에 관한 규정(과학기술정보통신부) ∙소방시설의 내진설계기준(소방청) ∙소방시설 자체점검사항 등에 관한 고시(소방청) ∙신재생에너지설비의 지원 등에 관한 규정(산업통상자원부) ∙에너지관리기준(산업통상자원부) ∙전기설비 검사 및 점검의 방법 절차 등에 관한 고시(산업통상자원부) ∙전기설비기술기준(산업통상자원부) ∙접지설비·구내통신설비·선로설비 및 통신공동구 등에 대한 기술기준(과학기술정보통신부) ∙주택건설기준에 관한 규칙(국토교통부) ∙지능형 홈네트워크 설비 설치 및 기술기준(국토교통부, 과학기술정보통신부, 산업통상자원부) ∙지하공간 침수방지를 위한 수방기준(행정안전부) ∙화재안전성능기준(소방청) ∙한국전기설비규정(산업통상자원부) ∙KDS 41 17 00 건축물내진설계기준 1.2.3 관련 표준 ∙한국산업표준 ∙표준시방서(KCS)에서 인용한 한국산업표준(KS)은 최신판(모든 추록을 포함) 적용함을 원칙으로 한다. 1.2.4 기타 사항 (1) 설계도서의 내용이 관련 법규와 상충되는 경우는 해당 법규를 따라야 한다. (2) 설계도서 또는 관련 법규에 명시되지 않은 사항은 발주자 또는 감리자와 협의하여야 한다. (3) 기관이 전문시방서(OCS)를 사용하는 경우, 이를 공사시방서에 준하여 적용하여야 한다. 1.3 용어의 정의 1.3.1 시방서 ∙ KCS 코드(표준시방서): 건설기술진흥법에 의하여 시설물의 안전 및 공사시행의 적정성과 품질확보 등을 위하여 시설물별로 정한 표준적인 시공기준으로서 전문시방서 작성과 설계자가 공사시방서를 작성하는 경우에 활용하기 위한 시공기준을 말한다. ∙ OCS 코드(전문시방서): 건설기술진흥법에 의하여 시설물별 표준시방서를 기본으로 모든 공종을 대상으로 하여 전문시방서 관리기관의 시공 또는 공사시방서의 작성에 활용하기 위한 종합적인 시공기준을 말한다. ∙ 공사시방서: 건설기술진흥법에 의하여 KCS 코드(표준시방서) 및 OCS 코드(전문시방서)를 기본으로 하여, 각 현장별 공사의 특수성⋅지역여건⋅공사방법 등을 고려하고, 기본설계 및 실시설계도에 구체적으로 표시할 수 없는 내용과 공사에 대한 시공방법·자재의 성능 및 규격, 품질시험 및 검사 등 품질관리, 안전관리계획 등에 관한 사항을 기술한 것을 말한다. 1.3.2 관계자 ∙ 발주자 : 건설공사 또는 건설기술용역을 발주하는 국가, 지방자치단체, 국가 또는 지방자치단체가 납입 자본금의 50% 이상을 출자한 기업체의 장 또는 건설기술진흥법 시행령에 정하는 자를 말한다. ∙ 시공자 : 발주자로부터 건설공사를 도급받은 건설업자를 말하며, 하도급 관계에 있어서 하도급받은 건설업자를 포함하여 말한다. ∙ 감리자 : 관련 법규에서 정한 바에 따라 설계도서 및 기타 관계서류의 내용대로 시공되는지의 여부와 안전성능을 확인하고, 소관업무 등에 대한 기술지도를 할 수 있는 자를 말한다. ∙ 현장대리인 : 공사계약 일반조건 및 관련 법규에 의거하여 시공자가 지정하는 책임시공 기술자로서 해당 현장에서 공사관리 및 기술관리, 기타 공사업무를 총괄하는 자를 말한다. 1.3.3 설계도서 (1) 관련 법규에 따른 기본설계 및 실시설계도, 설계계산서, 공사시방서 등을 말한다. (2) 발주자가 요구한 도서 및 기타 관련 서류를 포함한다. 1.3.4 경미한 변경 (1) 공사 진행 중 현장의 마감 상태, 작업 상태 등으로 인하여 기기 및 자재의 설치 위치가 변경되거나 공법을 변경하는 등 경미한 변경이 필요한 경우 시행한다. (2) 변경사항 발생 시 해당 전기설비 설계자의 의견 청취 후 감리자와 협의하여야 한다. 1.4 지급자재 (1) 지급자재의 종류·수량 및 인도 방법은 공사시방서에 따른다. (2) 지급자재의 인도 시에는 발주자 또는 감리자 입회하에 검수하여 합격하여야 한다. (3) 합격 된 지급자재는 다른 자재와 구분하여 보관하여야 한다. 1.5 설계도서 간 상충 1.5.1 적용 우선순위 (1) 공사시방서 (2) 설계도면 (3) 내역서 (4) 기타 설계도서의 순서로 한다. 1.5.2 특별 사유에 따른 조정 (1) 계약서 등에 특별한 사유가 있는 경우, 이에 따른다. (2) 특별한 사유에 따른 해석은 발주자, 감리자 및 설계자의 의견으로 조정할 수 있다. 1.6 관공서 등의 수속 (1) 시공자는 공사의 진행에 필요한 관공서 및 기타 기관에 제출 서류를 준비하여야 한다. (2) 시공자의 수속은 기한 내에 수행하여야 한다. 1.7 제출물 (1) 준공검사가 끝난 후 다음의 관계 도면 및 서류 등은 발주자 또는 감리자에 제출하여야 하고, 이를 확인 및 승인을 받은 후 공사의 인계 및 인수 절차를 마쳐야 한다. ① 준공검사필증 ② 준공도서 ③ 준공사진 ④ 허가 관련서류 및 검사필증 ⑤ 각 설비별 자재 성능시험성적서 및 검사증 ⑥ 각 설비별 주요자재 목록 ⑦ 각 설비별 자재 취급설명서 ⑧ 기기에 부속된 공구류 및 예비품 ⑨ 기타 준공서류 (2) 제출물에 대한 추가적인 사항은 공사시방서 등에 따른다. 1.8 공사기록 (1) 공사와 관련한 협의 및 지시사항에 대해서는 그것들의 경과 내용을 기록하고, 정리 및 보관하여야 한다. (2) 시험⋅검사에 대해서는 기록을 하고 정리 및 보관하여야 한다. (3) 공사공정의 주요 부분 등에서 매입·은폐 등으로 확인 불가능한 부분은 사진 또는 영상물로 찍어 정리 보관하여야 한다. (4) 감리자의 지시가 있는 경우 기록물(영상·사진 포함)을 제출하여야 한다. (5) 시공일지, 감리일지는 당일 그 내용을 기록하고 정리 보관하여야 한다. (6) 모든 기록물(영상·사진 포함)은 정리하여 색인 후 준공서류의 일부로 제출하여야 한다. 1.9 안전보건 (1) 모든 공사는 산업재해 예방을 위해 관련 법규 및 부속기준을 준수하여 시공 중 재해 발생을 방지하여야 한다. (2) 시공자는 공사현장의 안전 및 보건을 유지하기 위하여 안전보건에 관한 관리체제 및 규정을 작성하여야 한다. (3) 발주자 또는 시공자는 공사비용에 산업안전보건관리비를 책정하여야 한다. 다만, 산업안전보건관리비는 해당 건설사업장에 근무하는 근로자의 산업재해 예방 및 건강 증진을 위한 목적으로만 사용하여야 한다. 1.10 별도계약 (1) 시공자는 본 공사와 별도로 계약된 공사에 대해서는 해당 공사의 관계자와 협의하여야 한다. (2) 별도계약 공사는 본 공사 진행에 지장이 없도록 하여야 한다. 1.11 신공법·특수공법 적용 (1) 전기설비 공사용 기술 및 자재는 국가 및 국가 기관에서 인증 한 신공법·특수공법을 우선하여 적용할 수 있다. (2) 공법의 채택은 설계도 및 공사시방서에 따른다. 2. 자재 2.1 재료 (1) 사용자재는 신제품으로 하여야 한다. 다만, 가설용 자재와 특별히 지정된 것은 제외한다. (2) 사용자재는 KS 표준품으로 신제품을 사용하여야 한다. 다만, KS 표준품이 없는 경우는 발주자 또는 감리자의 승인을 받은 동등 이상의 제품을 사용하여야 한다. (3) 자재의 품질을 명시하지 않은 경우, 발주자 또는 감리자의 품질 확인을 받아 선정하여야 한다. (4) 기기는 원칙적으로 제조자·제조번호·제조년월일·정격 및 성능 등을 명기한 명판을 부착하여야 한다. (5) 재료의 상세사항은 설계도 및 공사시방서에 따른다. 2.2 자재 관리 (1) 공사용 자재가 검사 및 시험에 합격한 경우는 감리자가 지시한 장소에 정리하여 보관하고 불합격품은 즉시 공사장 밖으로 반출하여야 한다. (2) 자재관리의 상세사항은 공사시방서에 따른다. 2.3 자재 품질관리 (1) 공사용 자재의 시험과 검사방법은 관련 법규 및 한국산업표준에 따르며, 기타 적용기준이 있을 때는 그것에 따른다. (2) 공사시방서 등에 명시되었거나 필요한 경우에는 반드시 기기, 자재 및 시공에 대한 시험 및 검사를 실시한다. 다만, KS 표준품과 제조업체 등의 시험성적서 및 검사 등에 의해 감리자가 인정하거나 경미한 사항에 대해서는 생략할 수 있다. (3) 시험은 시방서에 명시되었거나 필요한 단계에서 반드시 실시하고, 결과를 감리자에게 제출하여야 한다. (4) 품질검사는 각종 시방서에 명시된 사항, 필요한 단계 또는 감리자가 지정한 공정에 도달한 경우 검사를 받아야 한다. (5) 자재품질관리의 상세사항은 공사시방서에 따른다. 2.4 발생자재의 처리 및 뒷정리 (1) 시공 중 발생 자재 중 인도하도록 지정된 것은 지정된 장소에 정돈하고 관련 서류를 감리자에게 제출하여야 한다. (2) 시공을 하는 도중에 장애물의 처리에 대해서는 발주자 또는 감리자와 협의하여야 한다. (3) 공사 완료 시 가설물 등은 신속하게 철거하고 청소 및 뒷정리를 하여야 한다. (4) 자재 처리의 상세사항은 공사시방서에 따른다. 3. 시공 3.1 시공조건 확인 3.1.1 사전 평가 3.1.1.1 적합성 평가 항목 (1) 설치 또는 사용할 때의 적합성 (2) 보호조치에 대한 적합성·기계적 강도 및 내구성 (3) 전선 또는 배관의 굴곡과 접속 (4) 전기적 절연 3.1.1.2 시공조건 확인 항목 (1) 정상상태와 비정상적 상태에서의 열적 영향 (2) 정격·크기·전압·전류용량 및 특정한 용도에 따른 분류 (3) 사용 중 또는 기기와 접촉 시 인체보호 조건 3.1.2 일반조건 (1) 배선은 설치 완료 시 단락⋅지락 상태 없이 완전하여야 한다. (2) 전기기기는 사용환경을 확인하고 적합한 경우에 설치하여야 한다. 다만, 가스·연기·증기·고온 환경·기타의 원인으로 전선 또는 기기를 열화시킬 우려가 있는 경우에 이를 보강하는 공법으로 하여야 한다. (3) 전기기기는 각각의 특성에 따라 정확하고 기능적인 방법으로 다음과 같이 시공하여야 한다. ① 박스류·배선경로·캐비닛 및 기기 케이스 등에서 사용되지 않는 개구부는 효과적인 방법으로 폐쇄하여야 한다. ② 지중함(맨홀·핸드홀 등)은 전선 또는 기기의 설치나 유지관리하는 경우에 작업자가 쉽고 안전하게 접근할 수 있도록 하여야 한다. ③ 버스 바·배선단자·애자 및 기타 전기기기의 내부 부품은 손상되지 않아야 하고, 도료·충전재 및 잔여물 등 이물질에 오염되지 않아야 한다. (4) 접속 ① 압축단자·압축접속기·납땜 등을 사용하는 전기적 접속 시 사용이 가능한 전선의 재질을 확인하여야 한다. ② 서로 다른 금속으로 된 전선의 접속은 단자나 접속기를 사용하여야 한다. 3.1.3 전기적 위험 (1) 충전부분의 보호(저압인 경우) ① 안전전압(50 V) 이상에서 운전되는 전기기기의 충전 부분은 우발적으로 접촉되는 것을 방지하기 위해 승인된 외함을 사용하거나, 기타의 방법으로 보호해야 한다. 다만, 공사시방서 등에서 다르게 규정한 것은 제외한다. ② 전기기기가 물리적 손상을 입기 쉬운 장소에 설치된 경우 손상을 견딜 수 있는 강도의 외함이나 보호 장치를 하여야 한다. ③ 노출된 충전 부분이 있는 보호구역과 실의 입구에는 경고표지를 눈에 잘 띄게 설치하여 일반인의 출입을 방지하여야 한다. (2) 제한구역 ① 출입을 제한하는 구역의 전기시설은 자물쇠와 열쇠 기타 방법으로 허가된 전기기술자만이 출입할 수 있도록 하여야 한다. ② 옥외에 설치하는 위험한 전기설비는 허가된 전기기술자 이외의 출입을 제한하는 시설을 하여야 한다. 다만, 위험성 여부는 감리자와 협의하여야 한다. 3.2 작업준비 3.2.1 일반사항 (1) 공사는 설계도서에 표시된 제반설비가 그 기능을 충분히 발휘하도록 하고, 설계도서·공정표·시공계획서·제작도 및 시공 상세도 등에 따라 발주자 또는 감리자와 협의하여 진행하여야 한다. (2) 복수의 공종이 중복되어 시공되는 경우, 구조적안전·에너지절약 및 환경성 등 조건을 검토하여 작업순서를 정하여야 한다. (3) 다른 분야 시공자와 협의하여 원만한 시공이 이루어져야 한다. 3.2.2 손상방지 (1) 전기설비를 구조물에 고정하는 경우 배관 등에 과다한 변위가 발생하지 않아야 하고, 구조물의 접속부에 손상이 없도록 하여야 한다. 다만, 손상의 우려가 있는 경우 해당 감리자와 협의 하여야 한다. (2) 내진 및 방진장치를 설치한 기기가 다른 기기에 연결되는 경우의 접속부에는 유연성을 확보하여야 한다. 3.3 공정표 및 시공계획서 3.3.1 공정표 (1) 공사의 착공 전에 공정표를 작성하고 감리자의 승인을 받아야 한다. (2) 공정표에 변경이 발생한 경우는 즉시 변경공정표를 작성하여 감리자의 승인을 받아야 한다. (3) 별도로 계약한 공사에 대한 합의가 필요할 때는 발주자 또는 감리자와 협의하여야 한다. 3.3.2 시공계획서 (1) 착공 전에 공사 계획을 종합 정리하여 작성하고, 감리자에게 제출하여야 한다. (2) 공정별로 기기, 자재 및 공법 등을 구체적으로 기록하여 발주자 또는 감리자의 승인을 받아야 한다. 3.3.3 보고서 (1) 공정표 및 시공계획서에 따라서 공사에 관한 진척 사항·작업내용·자재의 반입·사용·기후조건 등 기타 감리자가 필요하다고 지시한 사항에 대해서 보고서를 제출하여야 한다. 3.4 정리 및 사고방지. 3.4.1 정리⋅정비 (1) 공사현장 내로 반입된 제반 자재 및 기계기구 등의 정리·정비·점검·관리 및 청소를 철저히 하여야 한다. (2) 현장은 청결하게 유지하여야 한다. 3.4.2 재해 및 공해방지 (1) 시공자는 공사현장의 재해방지를 하여야 한다. (2) 시공자는 공사현장 주변에 공해 및 재해가 미치지 않도록 조치하여야 한다. 3.4.3 조치 및 보호 (1) 공사현장에서 안전사고·재해 또는 공해가 발생하거나 발생의 우려가 있는 경우에는 우선 필요한 조치를 신속히 취하고 그 경위를 발주자와 감리자에게 보고하여야 한다. (2) 공사현장 주변에 대해서 보호를 필요로 할 때는 발주자 또는 감리자와 협의하여 공사 진행 중이라도 즉시 보강하여야 한다. (3) 시공 시 기존 부분·시공 완료 부분 및 자재 등이 오염이나 손상될 우려가 있는 경우는 적절한 방법으로 보호하여야 한다. 3.5 시운전 및 유지관리 교육 (1) 시운전이 요구되는 기계·장비는 일정 기간 이상 시운전하여 이상 유무를 확인하여야 한다. 다만, 시운전 방법 및 기간은 공사시방서에 따른다. (2) 유지관리에 필요한 사항은 충분한 교육을 시행하고 운전절차에 대한 상세한 사항을 서류로 제공하여야 한다. 3.6 시공상세도면 작성 3.6.1 일반사항 (1) 시공자는 시공에 필요한 시공상세도면을 작성하여 시공 시 활용하여야 한다. (2) 시공상세도면은 실시설계도서에 포함된 각종 도면 외에 시공자가 설계도서에 표시된 내용을 구체적으로 구현되도록 시공방법을 검토하여 도면을 작성하여야 한다. 3.6.2 기본사항 (1) 다른 분야(건축부분·기계설비 등)의 시공상세도면과 상호 유기적으로 연계되어야 한다. (2) 설계도서에 대한 시공상의 문제점을 해결하고, 합리적이고 능률적이며 견실한 시공이 되도록 하여야 한다. (3) 시공상세도면은 이를 작성한 책임기술자가 날인하고, 감독자(발주자 또는 감리자)의 승인으로 확정하여야 한다. 3.6.3 타 공종과 겹침 (1) 전기설비공사가 타 공종과 서로 겹치는 경우, 해당 공종의 기준에도 부합되어야 한다. 다만, 간섭을 고려한 도면을 작성하여야 한다. (2) 타 공종의 시공업체는 시공상세도면 작성에 서로 협력하여야 한다. 3.7 준공검사 (1) 시험 및 검사 ① 공사의 완료 전까지 설계도 및 공사시방서 등에서 시험 및 검사를 필요로 하는 자재는 해당 기준의 시험 및 검사를 완료하고 합격하여야 한다. (2) 준공검사 ① 시공자는 감리자의 입회 아래 각종 설비 및 시스템의 외관 및 정돈 상태, 동작시험, 준공서류의 준비, 용량 및 성능 확인, 정상적인 동작 상태 및 주위 환경에 따른 영향 등을 확인하는 준공검사를 받아야 한다. (3) 준공검사 상세사항은 공사시방서에 따른다. 집필위원 성 명 소 속 성 명 소 속 신효섭 ㈜더힐코리아 김세동 두원공과대학교 서동범 ㈜정우DC 장성규 ㈜하이텍이피씨 이주철 건일이엔지 SCEI연구소 류우찬 부경대학교 김한진 한국승강기안전공단 노준석 DL E&C 유홍국 건일이엔씨(주) 이종환 인천국제공항공사 한종선 에이플러스이엔씨(주) 자문위원 성 명 소 속 성 명 소 속 강형구 한국교통대학교 김시복 인천도시공사 류홍제 중앙대학교 김훈 강원대학교 이종필 중원대학교 송준석 한국토지주택공사 허재완 한국전기안전공사 국가건설기준센터 및 건설기준위원회 성 명 소 속 성 명 소 속 이영호 한국건설기술연구원 최봉혁 한국건설기술연구원 김기현 한국건설기술연구원 허원호 한국건설기술연구원 김나은 한국건설기술연구원 김광호 강원대학교 김민관 한국건설기술연구원 남기범 한국전기기술인협회 김재훈 한국건설기술연구원 신석하 ㈜엠알솔루텍 김태송 한국건설기술연구원 신형철 인천국제공항공사 김희석 한국건설기술연구원 신희경 엘피에스코리아 류상훈 한국건설기술연구원 박철규 서울도시주택공사 안준혁 한국건설기술연구원 이복희 인하대학교 원훈일 한국건설기술연구원 이이문 한국토지주택공사 이상규 한국건설기술연구원 이정호 한국전기연구원 이소정 한국건설기술연구원 정영호 한국교통대학교 이승재 한국건설기술연구원 조병우 석우엔지니어링(주) 이승환 한국건설기술연구원 최옥만 한국토지주택공사 이용수 한국건설기술연구원 이원종 한국건설기술연구원 주영경 한국건설기술연구원 중앙건설기술심의위원회 성 명 소 속 성 명 소 속 김영일 서울과학기술대학교 이영범 ㈜수성엔지니어링 송상빈 한국광기술원 박영 한밭대학교 최영욱 한국전기연구원 박경윤 LG전자 주강필 SK에코플랜트㈜ 국토교통부 성 명 소 속 성 명 소 속 전인재 국토교통부 건설산업과 이종문 국토교통부 건설산업과 이상민 국토교통부 건설산업과 KCS 32 10 10 : 2024 전기설비공사 일반사항 2024년 8월 22일 개정 소관부서 국토교통부 건설산업과 관련단체 (사)한국조명·전기설비학회 06130 서울특별시 강남구 테헤란로7길 22 1관 1104호 Tel : 02-564-6534 E-mail : kiiee@kiiee.or.kr http://www.kiiee.or.kr 작성기관 (사)한국조명·전기설비학회 06130 서울특별시 강남구 테헤란로7길 22 1관 1104호 Tel : 02-564-6534 E-mail : kiiee@kiiee.or.kr http://www.kiiee.or.kr 국가건설기준센터 10223 경기도 고양시 일산서구 고양대로 283(대화동) Tel : 031-910-0444 E-mail : kcsc@kict.re.kr http://www.kcsc.re.kr",
      "safety": "(1) 모든 공사는 산업재해 예방을 위해 관련 법규 및 부속기준을 준수하여 시공 중 재해 발생을 방지하여야 한다.\n(2) 시공자는 공사현장의 안전 및 보건을 유지하기 위하여 안전보건에 관한 관리체제 및 규정을 작성하여야 한다.\n(3) 발주자 또는 시공자는 공사비용에 산업안전보건관리비를 책정하여야 한다. 다만, 산업안전보건관리비는 해당 건설사업장에 근무하는 근로자의 산업재해 예방 및 건강 증진을 위한 목적으로만 사용하여야 한다."
    }
  },
  "metadata": {
    "quality_score": 80,
    "keywords": [
      "내진",
      "품질시험"
    ],
    "references": [
      "KCS",
      "KDS"
    ],
    "equations": 0,
    "tables": 0
  },
  "standard_code": "KCS 32 10 10"
}