{
  "id": "KCS 14 20 41",
  "title": "KCS 14 20 41 서중 콘크리트_수정",
  "category": "콘크리트",
  "content": {
    "full": "**문서 제목**: 건설기준 연혁 **변환일시**: 2025-07-09 16:45:08 **첨부 이미지**: 1개 KCS 14 00 00 표준시방서 Korean Construction Specification 구조재료공사 KCS 14 20 41 : 2021 서중 콘크리트 2021년 2월 18일 개정 http://www.kcsc.re.kr 건설기준 제정 또는 개정에 따른 경과 조치 이 기준은 발간 시점부터 사용하며, 이미 시행 중에 있는 설계용역이나 건설공사는 발주기관의 장이 필요하다고 인정하는 경우 종전에 적용하고 있는 기준을 그대로 사용할 수 있습니다. 건설기준 연혁 ∙ 이 기준은 건설기준 코드체계 전환에 따라 기존 건설기준(설계기준, 표준시방서) 간 중복·상충을 비교 검토하여 코드로 통합 정비하였다. ∙ 이 기준은 기존의 콘크리트 설계기준에 해당되는 부분을 통합 정비하여 기준으로 제정한 것으로 제ㆍ개정 연혁은 다음과 같다. 건설기준 주요내용 제정 또는 개정 (년.월) 콘크리트 표준시방서 ∙ 콘크리트 표준시방서 제정 제정 (1962.5) 콘크리트 표준시방서 ∙ 무근, 철근, 포장, 댐 콘크리트 시방서 통합 ∙ 기존 국토건설청 규준, 제료규격 및 시험방법을 한국공업규격(KS)으로 개정 개정 (1968.12) 콘크리트 표준시방서 ∙ 건설기술의 대형화, 다양화, 새로운 공법 및 자재개발에 따른 시방서 일부개정 개정 (1977.12) 콘크리트 표준시방서 ∙ 강도설계법에 따라 시방서 개정 개정 (1985.1) 콘크리트 표준시방서 ∙ 국내외 시방서 및 지침서등의 연관성 검토 ∙ 구조물의 설계, 시공, 공사품질관리 전반에 대한 시방이 되도록 개정 개정 (1988.12) 콘크리트 표준시방서 ∙ 콘크리트 내구성 향성과 안전성 확보를 위한 기준안 마련 ∙ 유동화 콘크리트, 구조물 유지관리에 관한 규정 신설 개정 (1996.6) 콘크리트 표준시방서 ∙ 현행 설계편과 시공편으로 구성된 표준시방서를 시공기준으로 작성 개정 (1998.12) 콘크리트 표준시방서 ∙ 콘크리트 허용균열폭, 피복두께, 인장철근 정착길이 수정 ∙ 벽체의 부재 적용범위 구체화 개정 (2003.4) 콘크리트 표준시방서 ∙ 순환골재 재활용 등 친환경 콘크리트 품질확보방안 신설 ∙ 고유동, 폴리머, 섬유보강 콘크리트 신설 개정 (2009.9) KCS 14 20 41 : 2016 ∙ 건설기준 코드체계 전환에 따라 코드화로 통합 정비 제정 (2016.6) KCS 14 20 41 : 2016 ∙ 한국산업표준과 건설기준 부합화에 따라 수정함 수정 (2018.7) KCS 14 20 41 : 2020 ∙ 콘크리트 건설기준에 대한 최신 기술 반영 ∙ 콘크리트 건설기준의 적합성 검토 및 정비 개정 (2021.2) 제 정 : 2016년 6월 30일 심 의 : 중앙건설기술심의위원회 소관부서 : 국토교통부 기술혁신과 관련단체 : 한국콘크리트학회 개 정 : 2021년 02월 18일 자문검토 : 국가건설기준센터 건설기준위원회 작성기관 : 한국콘크리트학회 목 차 1. 일반사항 1 1.1 적용범위 1 1.2 참고 기준 1 1.3 용어의 정의 1 1.4 서중 콘크리트 일반 1 1.5 제출물 1 2. 자재 2 2.1 구성재료 2 2.2 배합 2 2.3 재료 품질관리 2 3. 시공 2 3.1 시공일반 2 3.2 운반 2 3.3 타설 2 3.4 양생 3 3.5 현장 품질관리 3 1. 일반사항 1.1 적용범위 (1) 이 기준은 서중 콘크리트의 재료 및 시공에 대한 일반적이고 기본적인 사항을 규정한다. (2) 하루평균기온이 25 ℃를 초과하는 것이 예상되는 경우 서중 콘크리트로 시공하여야 한다. 1.2 참고 기준 1.2.1 관련 법규 내용 없음. 1.2.2 관련 기준 ∙ KCS 14 20 01 콘크리트공사 일반사항 ∙ KCS 14 20 10 일반콘크리트 ∙ KCS 14 20 42 매스 콘크리트 ∙ KS F 2560 콘크리트용 화학 혼화제 1.3 용어의 정의 ∙ 서중 콘크리트(hot weather concreting) : 높은 외부기온으로 인하여 콘크리트의 슬럼프 또는 슬럼프 플로 저하나 수분의 급격한 증발 등의 우려가 있을 경우에 시공되는 콘크리트로서 하루평균기온이 25 ℃를 초과하는 경우 서중 콘크리트로 시공한다. 1.4 서중 콘크리트 일반 (1) 서중 콘크리트 환경에서 콘크리트를 타설 할 때와 타설 직후에는 콘크리트의 온도가 낮아지도록 재료의 취급, 비비기, 운반, 타설 및 양생 등에 대하여 적절한 조치를 취하여야 한다. (2) 공사 시작 전에 서중 콘크리트의 재료, 배합, 운반, 양생 등의 방법에 관한 시공계획서를 작성하여 책임기술자의 승인을 얻어야 한다. 1.5 제출물 (1) 제품 자료 (2) 그 밖의 사항은 KCS 14 20 10(1.6)의 해당요건에 따른다. 2. 자재 2.1 구성재료 서중 콘크리트에 사용하는 재료는 KCS 14 20 10(2)의 사항에 따른다. 2.2 배합 (1) 콘크리트의 배합은 소요의 강도 및 워커빌리티를 얻을 수 있는 범위 내에서 단위 수량을 적게 하고 단위 시멘트량이 많아지지 않도록 적절한 조치를 취하여야 한다. (2) 일반적으로는 기온 10 ℃의 상승에 대하여 단위수량은 (2 ~ 5) % 증가하므로 소요의 압축강도를 확보하기 위해서는 단위수량에 비례하여 단위 시멘트량의 증가를 검토하여야 한다. (3) 서중 콘크리트는 배합온도는 낮게 관리하여야 한다. (4) 재료의 온도를 알 수 있을 때에는 비빔 직후 콘크리트의 온도는 공용되는 적절한 식으로 계산하여 적용할 수 있다. 2.3 재료 품질관리 (1) 콘크리트 재료는 온도가 낮아질 수 있도록 하여야 한다. (2) 비빔 직후의 콘크리트 온도는 기상 조건, 운반 시간 등의 영향을 고려하여 타설 할 때 소요의 콘크리트 온도가 얻어지도록 하여야 한다. (3) 서중 콘크리트의 자재 품질관리는 KCS 14 20 10(2.3)의 해당 규정에 따른다. 3. 시공 3.1 시공일반 (1) 비빈 콘크리트는 가열되거나 건조로 인하여 슬럼프가 저하하지 않도록 적당한 장치를 사용하여 되도록 빨리 운송하여 타설하여야 한다. 덤프트럭 등을 사용하여 운반할 경우에는 콘크리트의 표면을 덮어서 일광의 직사나 바람으로부터 보호하여야 한다. 3.2 운반 (1) 펌프로 운반할 경우에는 관을 젖은 천으로 덮어야 하며, 레디믹스트 콘크리트를 사용하는 경우에는 에지테이터 트럭을 햇볕에 장시간 대기시키는 일이 없도록 사전에 배차계획까지 충분히 고려하여 시공계획을 세워야 한다. (2) 운반 및 대기시간의 트럭믹서 내 수분증발을 방지하고 폭우가 내릴 때 우수의 유입방지와 주차할 때 이물질 등의 유입을 방지할 수 있는 뚜껑을 설치하여야 한다. 3.3 타설 (1) 콘크리트를 타설하기 전에 지반과 거푸집 등을 조사하여 콘크리트로부터의 수분흡수로 품질변화의 우려가 있는 부분은 습윤 상태로 유지하는 등의 조치를 하여야 한다. 또 거푸집, 철근 등이 직사일광을 받아서 고온이 될 우려가 있는 경우에는 살수, 덮개 등의 적절한 조치를 하여야 한다. (2) 콘크리트는 비빈 후 즉시 타설하여야 하며, KS F 2560의 지연형 감수제를 사용하는 등의 일반적인 대책을 강구한 경우라도 1.5시간 이내에 타설하여야 한다. (3) 콘크리트를 타설할 때의 콘크리트의 온도는 35 ℃ 이하이어야 한다. 3.4 양생 (1) KCS 14 20 10(3.4)에 따른다. 3.5 현장 품질관리 (1) 서중 콘크리트의 현장 품질관리는 KCS 14 20 10(3.5.4) 및 표 3.5-1에 따른다. 표 3.5-1 서중 콘크리트의 품질 검사 표 3.5-1 서중 콘크리트의 품질 검사 항목 시험·검사 방법 시기·회수 판단 기준 외기온도 온도측정 공사시작 전 및 공사 중 하루일평균기온이 25 ℃를 초과하는 경우 재료온도 계획한 온도 범위 내 비빔온도 계획한 온도 범위 내 타설온도 공사 중 35 ℃ 이하 및 계획한 온도의 범위 내(3.3 타설에 적합할 것), 매스 콘크리트의 경우는 KCS 14 20 42(3.3)에 준할 것 운반시간 시간 확인 공사시작 전 및 공사 중 비비기로부터 타설 종료까지의 시간은 1.5시간 이내 및 계획한 시간 이내일 것 (2) 콘크리트 품질관리에 사용하는 공시체는 시험목적에 적합하게 제작, 양생, 관리하여야 한다. 집필위원 성 명 소 속 성 명 소 속 김경민 서울기술연구원 이재삼 울산레미콘 유재강 대우건설 정용욱 계명대학교 이건철 한국교통대학교 자문위원 성 명 소 속 성 명 소 속 김은겸 서울과학기술대학교 김재요 광운대학교 신영수 이화여자대학교 이성로 목포대학교 장승엽 한국교통대학교 최기봉 가천대학교 최연왕 세명대학교 최완철 숭실대학교 한천구 청주대학교 홍건호 호서대학교 국가건설기준센터 및 건설기준위원회 성 명 소 속 성 명 소 속 이영호 한국건설기술연구원 김현욱 포스코건설 구재동 한국건설기술연구원 노병철 상지대학교 김기현 한국건설기술연구원 박성용 한국건설기술연구원 김나은 한국건설기술연구원 박완신 충남대학교 김태송 한국건설기술연구원 박홍근 서울대학교 김희석 한국건설기술연구원 승종명 ㈜승이엔지 류상훈 한국건설기술연구원 윤현도 충남대학교 소병진 한국건설기술연구원 이선호 ㈜삼안 원훈일 한국건설기술연구원 이재훈 영남대학교 이승환 한국건설기술연구원 이종석 한국건설기술연구원 이용수 한국건설기술연구원 이지훈 ㈜서영엔지니어링 이용준 한국건설기술연구원 장봉석 K-water 주영경 한국건설기술연구원 장승엽 한국교통대학교 최봉혁 한국건설기술연구원 정해문 한국도로공사 허원호 한국건설기술연구원 차경렬 현대건설 김선우 충남대학교 차수원 울산대학교 김성수 대진대학교 최광호 남서울대학교 김순환 창민우구조컨설턴트 최석환 국민대학교 김영진 한국콘크리트학회 최정욱 한국콘크리트학회 김점한 ㈜크로스구조연구소기술사 홍건호 호서대학교 김지상 서경대학교 중앙건설기술심의위원회 성 명 소 속 성 명 소 속 곽종원 한국건설기술연구원 박정권 LH 한국토지주택공사 김성민 LH 한국토지주택공사 임동현 한국도로공사 김성수 대진대학교 전진구 서경대학교 김희대 세광종합기술단 국토교통부 성 명 소 속 성 명 소 속 박명주 국토교통부 기술혁신과 양성모 국토교통부 기술혁신과 KCS 14 20 41 : 2021 서중 콘크리트 2021년 2월 18일 개정 소관부서 국토교통부 기술혁신과 관련단체 한국콘크리트학회 06130 서울특별시 강남구 테헤란로7길 22 한국과학기술회관 신관 1009호 Tel : 02-568-5985 E-mail : kci@kci.or.kr http://www.kci.or.kr 작성기관 한국콘크리트학회 06130 서울특별시 강남구 테헤란로7길 22 한국과학기술회관 신관 1009호 Tel : 02-568-5985 E-mail : kci@kci.or.kr http://www.kci.or.kr 국가건설기준센터 10223 경기도 고양시 일산서구 고양대로 283(대화동) Tel : 031-910-0444 E-mail : kcsc@kict.re.kr http://www.kcsc.re.kr",
    "sections": {
      "scope": "(1) 이 기준은 서중 콘크리트의 재료 및 시공에 대한 일반적이고 기본적인 사항을 규정한다.\n(2) 하루평균기온이 25 ℃를 초과하는 것이 예상되는 경우 서중 콘크리트로 시공하여야 한다.",
      "materials": "2. 자재 2 2.1 구성재료 2 2.2 배합 2 2.3 재료 품질관리 2 3. 시공 2 3.1 시공일반 2 3.2 운반 2 3.3 타설 2 3.4 양생 3 3.5 현장 품질관리 3 1. 일반사항 1.1 적용범위 (1) 이 기준은 서중 콘크리트의 재료 및 시공에 대한 일반적이고 기본적인 사항을 규정한다. (2) 하루평균기온이 25 ℃를 초과하는 것이 예상되는 경우 서중 콘크리트로 시공하여야 한다. 1.2 참고 기준 1.2.1 관련 법규 내용 없음. 1.2.2 관련 기준 ∙ KCS 14 20 01 콘크리트공사 일반사항 ∙ KCS 14 20 10 일반콘크리트 ∙ KCS 14 20 42 매스 콘크리트 ∙ KS F 2560 콘크리트용 화학 혼화제 1.3 용어의 정의 ∙ 서중 콘크리트(hot weather concreting) : 높은 외부기온으로 인하여 콘크리트의 슬럼프 또는 슬럼프 플로 저하나 수분의 급격한 증발 등의 우려가 있을 경우에 시공되는 콘크리트로서 하루평균기온이 25 ℃를 초과하는 경우 서중 콘크리트로 시공한다. 1.4 서중 콘크리트 일반 (1) 서중 콘크리트 환경에서 콘크리트를 타설 할 때와 타설 직후에는 콘크리트의 온도가 낮아지도록 재료의 취급, 비비기, 운반, 타설 및 양생 등에 대하여 적절한 조치를 취하여야 한다. (2) 공사 시작 전에 서중 콘크리트의 재료, 배합, 운반, 양생 등의 방법에 관한 시공계획서를 작성하여 책임기술자의 승인을 얻어야 한다. 1.5 제출물 (1) 제품 자료 (2) 그 밖의 사항은 KCS 14 20 10(1.6)의 해당요건에 따른다. 2. 자재 2.1 구성재료 서중 콘크리트에 사용하는 재료는 KCS 14 20 10(2)의 사항에 따른다. 2.2 배합 (1) 콘크리트의 배합은 소요의 강도 및 워커빌리티를 얻을 수 있는 범위 내에서 단위 수량을 적게 하고 단위 시멘트량이 많아지지 않도록 적절한 조치를 취하여야 한다. (2) 일반적으로는 기온 10 ℃의 상승에 대하여 단위수량은 (2 ~ 5) % 증가하므로 소요의 압축강도를 확보하기 위해서는 단위수량에 비례하여 단위 시멘트량의 증가를 검토하여야 한다. (3) 서중 콘크리트는 배합온도는 낮게 관리하여야 한다. (4) 재료의 온도를 알 수 있을 때에는 비빔 직후 콘크리트의 온도는 공용되는 적절한 식으로 계산하여 적용할 수 있다. 2.3 재료 품질관리 (1) 콘크리트 재료는 온도가 낮아질 수 있도록 하여야 한다. (2) 비빔 직후의 콘크리트 온도는 기상 조건, 운반 시간 등의 영향을 고려하여 타설 할 때 소요의 콘크리트 온도가 얻어지도록 하여야 한다. (3) 서중 콘크리트의 자재 품질관리는 KCS 14 20 10(2.3)의 해당 규정에 따른다. 3. 시공 3.1 시공일반 (1) 비빈 콘크리트는 가열되거나 건조로 인하여 슬럼프가 저하하지 않도록 적당한 장치를 사용하여 되도록 빨리 운송하여 타설하여야 한다. 덤프트럭 등을 사용하여 운반할 경우에는 콘크리트의 표면을 덮어서 일광의 직사나 바람으로부터 보호하여야 한다. 3.2 운반 (1) 펌프로 운반할 경우에는 관을 젖은 천으로 덮어야 하며, 레디믹스트 콘크리트를 사용하는 경우에는 에지테이터 트럭을 햇볕에 장시간 대기시키는 일이 없도록 사전에 배차계획까지 충분히 고려하여 시공계획을 세워야 한다. (2) 운반 및 대기시간의 트럭믹서 내 수분증발을 방지하고 폭우가 내릴 때 우수의 유입방지와 주차할 때 이물질 등의 유입을 방지할 수 있는 뚜껑을 설치하여야 한다. 3.3 타설 (1) 콘크리트를 타설하기 전에 지반과 거푸집 등을 조사하여 콘크리트로부터의 수분흡수로 품질변화의 우려가 있는 부분은 습윤 상태로 유지하는 등의 조치를 하여야 한다. 또 거푸집, 철근 등이 직사일광을 받아서 고온이 될 우려가 있는 경우에는 살수, 덮개 등의 적절한 조치를 하여야 한다. (2) 콘크리트는 비빈 후 즉시 타설하여야 하며, KS F 2560의 지연형 감수제를 사용하는 등의 일반적인 대책을 강구한 경우라도 1.5시간 이내에 타설하여야 한다. (3) 콘크리트를 타설할 때의 콘크리트의 온도는 35 ℃ 이하이어야 한다. 3.4 양생 (1) KCS 14 20 10(3.4)에 따른다. 3.5 현장 품질관리 (1) 서중 콘크리트의 현장 품질관리는 KCS 14 20 10(3.5.4) 및 표 3.5-1에 따른다. 표 3.5-1 서중 콘크리트의 품질 검사 표 3.5-1 서중 콘크리트의 품질 검사 항목 시험·검사 방법 시기·회수 판단 기준 외기온도 온도측정 공사시작 전 및 공사 중 하루일평균기온이 25 ℃를 초과하는 경우 재료온도 계획한 온도 범위 내 비빔온도 계획한 온도 범위 내 타설온도 공사 중 35 ℃ 이하 및 계획한 온도의 범위 내(3.3 타설에 적합할 것), 매스 콘크리트의 경우는 KCS 14 20 42(3.3)에 준할 것 운반시간 시간 확인 공사시작 전 및 공사 중 비비기로부터 타설 종료까지의 시간은 1.5시간 이내 및 계획한 시간 이내일 것 (2) 콘크리트 품질관리에 사용하는 공시체는 시험목적에 적합하게 제작, 양생, 관리하여야 한다. 집필위원 성 명 소 속 성 명 소 속 김경민 서울기술연구원 이재삼 울산레미콘 유재강 대우건설 정용욱 계명대학교 이건철 한국교통대학교 자문위원 성 명 소 속 성 명 소 속 김은겸 서울과학기술대학교 김재요 광운대학교 신영수 이화여자대학교 이성로 목포대학교 장승엽 한국교통대학교 최기봉 가천대학교 최연왕 세명대학교 최완철 숭실대학교 한천구 청주대학교 홍건호 호서대학교 국가건설기준센터 및 건설기준위원회 성 명 소 속 성 명 소 속 이영호 한국건설기술연구원 김현욱 포스코건설 구재동 한국건설기술연구원 노병철 상지대학교 김기현 한국건설기술연구원 박성용 한국건설기술연구원 김나은 한국건설기술연구원 박완신 충남대학교 김태송 한국건설기술연구원 박홍근 서울대학교 김희석 한국건설기술연구원 승종명 ㈜승이엔지 류상훈 한국건설기술연구원 윤현도 충남대학교 소병진 한국건설기술연구원 이선호 ㈜삼안 원훈일 한국건설기술연구원 이재훈 영남대학교 이승환 한국건설기술연구원 이종석 한국건설기술연구원 이용수 한국건설기술연구원 이지훈 ㈜서영엔지니어링 이용준 한국건설기술연구원 장봉석 K-water 주영경 한국건설기술연구원 장승엽 한국교통대학교 최봉혁 한국건설기술연구원 정해문 한국도로공사 허원호 한국건설기술연구원 차경렬 현대건설 김선우 충남대학교 차수원 울산대학교 김성수 대진대학교 최광호 남서울대학교 김순환 창민우구조컨설턴트 최석환 국민대학교 김영진 한국콘크리트학회 최정욱 한국콘크리트학회 김점한 ㈜크로스구조연구소기술사 홍건호 호서대학교 김지상 서경대학교 중앙건설기술심의위원회 성 명 소 속 성 명 소 속 곽종원 한국건설기술연구원 박정권 LH 한국토지주택공사 김성민 LH 한국토지주택공사 임동현 한국도로공사 김성수 대진대학교 전진구 서경대학교 김희대 세광종합기술단 국토교통부 성 명 소 속 성 명 소 속 박명주 국토교통부 기술혁신과 양성모 국토교통부 기술혁신과 KCS 14 20 41 : 2021 서중 콘크리트 2021년 2월 18일 개정 소관부서 국토교통부 기술혁신과 관련단체 한국콘크리트학회 06130 서울특별시 강남구 테헤란로7길 22 한국과학기술회관 신관 1009호 Tel : 02-568-5985 E-mail : kci@kci.or.kr http://www.kci.or.kr 작성기관 한국콘크리트학회 06130 서울특별시 강남구 테헤란로7길 22 한국과학기술회관 신관 1009호 Tel : 02-568-5985 E-mail : kci@kci.or.kr http://www.kci.or.kr 국가건설기준센터 10223 경기도 고양시 일산서구 고양대로 283(대화동) Tel : 031-910-0444 E-mail : kcsc@kict.re.kr http://www.kcsc.re.kr",
      "construction": "(1) 비빈 콘크리트는 가열되거나 건조로 인하여 슬럼프가 저하하지 않도록 적당한 장치를 사용하여 되도록 빨리 운송하여 타설하여야 한다. 덤프트럭 등을 사용하여 운반할 경우에는 콘크리트의 표면을 덮어서 일광의 직사나 바람으로부터 보호하여야 한다.",
      "quality": "(1) 서중 콘크리트의 현장 품질관리는 KCS 14 20 10(3.5.4) 및 표 3.5-1에 따른다.\n표 3.5-1 서중 콘크리트의 품질 검사\n표 3.5-1 서중 콘크리트의 품질 검사\n항목\n시험·검사 방법\n시기·회수\n판단 기준\n외기온도\n온도측정\n공사시작 전 및 공사 중\n하루일평균기온이 25 ℃를 초과하는 경우\n재료온도\n계획한 온도 \n범위 내\n비빔온도\n계획한 온도 \n범위 내\n타설온도\n공사 중\n35 ℃ 이하 및 계획한 온도의 범위 내(3.3 타설에 적합할 것), 매스 콘크리트의 경우는 KCS 14 20 42(3.3)에 준할 것\n운반시간\n시간 확인\n공사시작 전 및 공사 중\n비비기로부터 타설 종료까지의 시간은 1.5시간 이내 및 계획한 시간 이내일 것\n(2) 콘크리트 품질관리에 사용하는 공시체는 시험목적에 적합하게 제작, 양생, 관리하여야 한다.\n집필위원\n성 명\n소 속\n성 명\n소 속\n김경민\n서울기술연구원\n이재삼\n울산레미콘\n유재강\n대우건설\n정용욱\n계명대학교\n이건철\n한국교통대학교\n자문위원\n성 명\n소 속\n성 명\n소 속\n김은겸\n서울과학기술대학교\n김재요\n광운대학교\n신영수\n이화여자대학교\n이성로\n목포대학교\n장승엽\n한국교통대학교\n최기봉\n가천대학교\n최연왕\n세명대학교\n최완철\n숭실대학교\n한천구\n청주대학교\n홍건호\n호서대학교\n국가건설기준센터 및 건설기준위원회\n성 명\n소 속\n성 명\n소 속\n이영호\n한국건설기술연구원\n김현욱\n포스코건설\n구재동\n한국건설기술연구원\n노병철\n상지대학교\n김기현\n한국건설기술연구원\n박성용\n한국건설기술연구원\n김나은\n한국건설기술연구원\n박완신\n충남대학교\n김태송\n한국건설기술연구원\n박홍근\n서울대학교\n김희석\n한국건설기술연구원\n승종명\n㈜승이엔지\n류상훈\n한국건설기술연구원\n윤현도\n충남대학교\n소병진\n한국건설기술연구원\n이선호\n㈜삼안\n원훈일\n한국건설기술연구원\n이재훈\n영남대학교\n이승환\n한국건설기술연구원\n이종석\n한국건설기술연구원\n이용수\n한국건설기술연구원\n이지훈\n㈜서영엔지니어링\n이용준\n한국건설기술연구원\n장봉석\nK-water \n주영경\n한국건설기술연구원\n장승엽\n한국교통대학교\n최봉혁\n한국건설기술연구원\n정해문\n한국도로공사\n허원호\n한국건설기술연구원\n차경렬\n현대건설\n김선우\n충남대학교\n차수원\n울산대학교\n김성수\n대진대학교\n최광호\n남서울대학교\n김순환\n창민우구조컨설턴트\n최석환\n국민대학교\n김영진\n한국콘크리트학회\n최정욱\n한국콘크리트학회\n김점한\n㈜크로스구조연구소기술사\n홍건호\n호서대학교\n김지상\n서경대학교\n중앙건설기술심의위원회\n성 명\n소 속\n성 명\n소 속\n곽종원\n한국건설기술연구원\n박정권\nLH 한국토지주택공사\n김성민\nLH 한국토지주택공사\n임동현\n한국도로공사\n김성수\n대진대학교\n전진구\n서경대학교\n김희대\n세광종합기술단\n국토교통부\n성 명\n소 속\n성 명\n소 속\n박명주\n국토교통부 기술혁신과\n양성모\n국토교통부 기술혁신과\nKCS 14 20 41 : 2021\n서중 콘크리트\n2021년 2월 18일 개정\n소관부서   국토교통부 기술혁신과\n관련단체   한국콘크리트학회\n           06130 서울특별시 강남구 테헤란로7길 22 한국과학기술회관 신관 1009호\n           Tel : 02-568-5985      E-mail : kci@kci.or.kr\n           http://www.kci.or.kr\n작성기관   한국콘크리트학회\n           06130 서울특별시 강남구 테헤란로7길 22 한국과학기술회관 신관 1009호\n           Tel : 02-568-5985      E-mail : kci@kci.or.kr\n           http://www.kci.or.kr\n국가건설기준센터\n10223 경기도 고양시 일산서구 고양대로 283(대화동)\nTel : 031-910-0444     E-mail : kcsc@kict.re.kr\nhttp://www.kcsc.re.kr\n## 테이블\n### 테이블 1\n### 테이블 2\n### 테이블 3\n### 테이블 4\n### 테이블 5\n### 테이블 6\n### 테이블 7\n### 테이블 8\n### 테이블 9\n### 테이블 10\n### 테이블 11\n### 테이블 12\n### 테이블 13\n### 테이블 14\n### 테이블 15\n### 테이블 16\n### 테이블 17",
      "safety": "안전성 확보를 위한 기준안 마련 ∙ 유동화 콘크리트, 구조물 유지관리에 관한 규정 신설 개정 (1996.6) 콘크리트 표준시방서 ∙ 현행 설계편과 시공편으로 구성된 표준시방서를 시공기준으로 작성 개정 (1998.12) 콘크리트 표준시방서 ∙ 콘크리트 허용균열폭, 피복두께, 인장철근 정착길이 수정 ∙ 벽체의 부재 적용범위 구체화 개정 (2003.4) 콘크리트 표준시방서 ∙ 순환골재 재활용 등 친환경 콘크리트 품질확보방안 신설 ∙ 고유동, 폴리머, 섬유보강 콘크리트 신설 개정 (2009.9) KCS 14 20 41 : 2016 ∙ 건설기준 코드체계 전환에 따라 코드화로 통합 정비 제정 (2016.6) KCS 14 20 41 : 2016 ∙ 한국산업표준과 건설기준 부합화에 따라 수정함 수정 (2018.7) KCS 14 20 41 : 2020 ∙ 콘크리트 건설기준에 대한 최신 기술 반영 ∙ 콘크리트 건설기준의 적합성 검토 및 정비 개정 (2021.2) 제 정 : 2016년 6월 30일 심 의 : 중앙건설기술심의위원회 소관부서 : 국토교통부 기술혁신과 관련단체 : 한국콘크리트학회 개 정 : 2021년 02월 18일 자문검토 : 국가건설기준센터 건설기준위원회 작성기관 : 한국콘크리트학회 목 차 1. 일반사항 1 1.1 적용범위 1 1.2 참고 기준 1 1.3 용어의 정의 1 1.4 서중 콘크리트 일반 1 1.5 제출물 1 2. 자재 2 2.1 구성재료 2 2.2 배합 2 2.3 재료 품질관리 2 3. 시공 2 3.1 시공일반 2 3.2 운반 2 3.3 타설 2 3.4 양생 3 3.5 현장 품질관리 3 1. 일반사항 1.1 적용범위 (1) 이 기준은 서중 콘크리트의 재료 및 시공에 대한 일반적이고 기본적인 사항을 규정한다. (2) 하루평균기온이 25 ℃를 초과하는 것이 예상되는 경우 서중 콘크리트로 시공하여야 한다. 1.2 참고 기준 1.2.1 관련 법규 내용 없음. 1.2.2 관련 기준 ∙ KCS 14 20 01 콘크리트공사 일반사항 ∙ KCS 14 20 10 일반콘크리트 ∙ KCS 14 20 42 매스 콘크리트 ∙ KS F 2560 콘크리트용 화학 혼화제 1.3 용어의 정의 ∙ 서중 콘크리트(hot weather concreting) : 높은 외부기온으로 인하여 콘크리트의 슬럼프 또는 슬럼프 플로 저하나 수분의 급격한 증발 등의 우려가 있을 경우에 시공되는 콘크리트로서 하루평균기온이 25 ℃를 초과하는 경우 서중 콘크리트로 시공한다. 1.4 서중 콘크리트 일반 (1) 서중 콘크리트 환경에서 콘크리트를 타설 할 때와 타설 직후에는 콘크리트의 온도가 낮아지도록 재료의 취급, 비비기, 운반, 타설 및 양생 등에 대하여 적절한 조치를 취하여야 한다. (2) 공사 시작 전에 서중 콘크리트의 재료, 배합, 운반, 양생 등의 방법에 관한 시공계획서를 작성하여 책임기술자의 승인을 얻어야 한다. 1.5 제출물 (1) 제품 자료 (2) 그 밖의 사항은 KCS 14 20 10(1.6)의 해당요건에 따른다. 2. 자재 2.1 구성재료 서중 콘크리트에 사용하는 재료는 KCS 14 20 10(2)의 사항에 따른다. 2.2 배합 (1) 콘크리트의 배합은 소요의 강도 및 워커빌리티를 얻을 수 있는 범위 내에서 단위 수량을 적게 하고 단위 시멘트량이 많아지지 않도록 적절한 조치를 취하여야 한다. (2) 일반적으로는 기온 10 ℃의 상승에 대하여 단위수량은 (2 ~ 5) % 증가하므로 소요의 압축강도를 확보하기 위해서는 단위수량에 비례하여 단위 시멘트량의 증가를 검토하여야 한다. (3) 서중 콘크리트는 배합온도는 낮게 관리하여야 한다. (4) 재료의 온도를 알 수 있을 때에는 비빔 직후 콘크리트의 온도는 공용되는 적절한 식으로 계산하여 적용할 수 있다. 2.3 재료 품질관리 (1) 콘크리트 재료는 온도가 낮아질 수 있도록 하여야 한다. (2) 비빔 직후의 콘크리트 온도는 기상 조건, 운반 시간 등의 영향을 고려하여 타설 할 때 소요의 콘크리트 온도가 얻어지도록 하여야 한다. (3) 서중 콘크리트의 자재 품질관리는 KCS 14 20 10(2.3)의 해당 규정에 따른다. 3. 시공 3.1 시공일반 (1) 비빈 콘크리트는 가열되거나 건조로 인하여 슬럼프가 저하하지 않도록 적당한 장치를 사용하여 되도록 빨리 운송하여 타설하여야 한다. 덤프트럭 등을 사용하여 운반할 경우에는 콘크리트의 표면을 덮어서 일광의 직사나 바람으로부터 보호하여야 한다. 3.2 운반 (1) 펌프로 운반할 경우에는 관을 젖은 천으로 덮어야 하며, 레디믹스트 콘크리트를 사용하는 경우에는 에지테이터 트럭을 햇볕에 장시간 대기시키는 일이 없도록 사전에 배차계획까지 충분히 고려하여 시공계획을 세워야 한다. (2) 운반 및 대기시간의 트럭믹서 내 수분증발을 방지하고 폭우가 내릴 때 우수의 유입방지와 주차할 때 이물질 등의 유입을 방지할 수 있는 뚜껑을 설치하여야 한다. 3.3 타설 (1) 콘크리트를 타설하기 전에 지반과 거푸집 등을 조사하여 콘크리트로부터의 수분흡수로 품질변화의 우려가 있는 부분은 습윤 상태로 유지하는 등의 조치를 하여야 한다. 또 거푸집, 철근 등이 직사일광을 받아서 고온이 될 우려가 있는 경우에는 살수, 덮개 등의 적절한 조치를 하여야 한다. (2) 콘크리트는 비빈 후 즉시 타설하여야 하며, KS F 2560의 지연형 감수제를 사용하는 등의 일반적인 대책을 강구한 경우라도 1.5시간 이내에 타설하여야 한다. (3) 콘크리트를 타설할 때의 콘크리트의 온도는 35 ℃ 이하이어야 한다. 3.4 양생 (1) KCS 14 20 10(3.4)에 따른다. 3.5 현장 품질관리 (1) 서중 콘크리트의 현장 품질관리는 KCS 14 20 10(3.5.4) 및 표 3.5-1에 따른다. 표 3.5-1 서중 콘크리트의 품질 검사 표 3.5-1 서중 콘크리트의 품질 검사 항목 시험·검사 방법 시기·회수 판단 기준 외기온도 온도측정 공사시작 전 및 공사 중 하루일평균기온이 25 ℃를 초과하는 경우 재료온도 계획한 온도 범위 내 비빔온도 계획한 온도 범위 내 타설온도 공사 중 35 ℃ 이하 및 계획한 온도의 범위 내(3.3 타설에 적합할 것), 매스 콘크리트의 경우는 KCS 14 20 42(3.3)에 준할 것 운반시간 시간 확인 공사시작 전 및 공사 중 비비기로부터 타설 종료까지의 시간은 1.5시간 이내 및 계획한 시간 이내일 것 (2) 콘크리트 품질관리에 사용하는 공시체는 시험목적에 적합하게 제작, 양생, 관리하여야 한다. 집필위원 성 명 소 속 성 명 소 속 김경민 서울기술연구원 이재삼 울산레미콘 유재강 대우건설 정용욱 계명대학교 이건철 한국교통대학교 자문위원 성 명 소 속 성 명 소 속 김은겸 서울과학기술대학교 김재요 광운대학교 신영수 이화여자대학교 이성로 목포대학교 장승엽 한국교통대학교 최기봉 가천대학교 최연왕 세명대학교 최완철 숭실대학교 한천구 청주대학교 홍건호 호서대학교 국가건설기준센터 및 건설기준위원회 성 명 소 속 성 명 소 속 이영호 한국건설기술연구원 김현욱 포스코건설 구재동 한국건설기술연구원 노병철 상지대학교 김기현 한국건설기술연구원 박성용 한국건설기술연구원 김나은 한국건설기술연구원 박완신 충남대학교 김태송 한국건설기술연구원 박홍근 서울대학교 김희석 한국건설기술연구원 승종명 ㈜승이엔지 류상훈 한국건설기술연구원 윤현도 충남대학교 소병진 한국건설기술연구원 이선호 ㈜삼안 원훈일 한국건설기술연구원 이재훈 영남대학교 이승환 한국건설기술연구원 이종석 한국건설기술연구원 이용수 한국건설기술연구원 이지훈 ㈜서영엔지니어링 이용준 한국건설기술연구원 장봉석 K-water 주영경 한국건설기술연구원 장승엽 한국교통대학교 최봉혁 한국건설기술연구원 정해문 한국도로공사 허원호 한국건설기술연구원 차경렬 현대건설 김선우 충남대학교 차수원 울산대학교 김성수 대진대학교 최광호 남서울대학교 김순환 창민우구조컨설턴트 최석환 국민대학교 김영진 한국콘크리트학회 최정욱 한국콘크리트학회 김점한 ㈜크로스구조연구소기술사 홍건호 호서대학교 김지상 서경대학교 중앙건설기술심의위원회 성 명 소 속 성 명 소 속 곽종원 한국건설기술연구원 박정권 LH 한국토지주택공사 김성민 LH 한국토지주택공사 임동현 한국도로공사 김성수 대진대학교 전진구 서경대학교 김희대 세광종합기술단 국토교통부 성 명 소 속 성 명 소 속 박명주 국토교통부 기술혁신과 양성모 국토교통부 기술혁신과 KCS 14 20 41 : 2021 서중 콘크리트 2021년 2월 18일 개정 소관부서 국토교통부 기술혁신과 관련단체 한국콘크리트학회 06130 서울특별시 강남구 테헤란로7길 22 한국과학기술회관 신관 1009호 Tel : 02-568-5985 E-mail : kci@kci.or.kr http://www.kci.or.kr 작성기관 한국콘크리트학회 06130 서울특별시 강남구 테헤란로7길 22 한국과학기술회관 신관 1009호 Tel : 02-568-5985 E-mail : kci@kci.or.kr http://www.kci.or.kr 국가건설기준센터 10223 경기도 고양시 일산서구 고양대로 283(대화동) Tel : 031-910-0444 E-mail : kcsc@kict.re.kr http://www.kcsc.re.kr"
    }
  },
  "metadata": {
    "quality_score": 85,
    "keywords": [
      "압축강도",
      "슬럼프",
      "철근",
      "콘크리트",
      "시멘트",
      "골재",
      "배합",
      "양생",
      "거푸집"
    ],
    "references": [
      "KCS"
    ],
    "equations": 0,
    "tables": 3
  }
}