{
  "id": "KCS 41 40 08",
  "title": "KCS 41 40 08 시멘트 모르타르계 방수공사_수정",
  "category": "건축",
  "content": {
    "full": "**문서 제목**: 목적 **변환일시**: 2025-07-09 16:45:30 **첨부 이미지**: 1개 KCS 41 00 00 표준시방서 Korean Construction Specification 건축공사 KCS 41 40 08: 2021 아스팔트 방수공사 2021년 8월 13일 제정 http://www.kcsc.re.kr 건설기준 제⋅개정에 따른 경과 조치 이 기준은 발간 시점부터 사용하며, 이미 시행 중에 있는 설계용역이나 건설공사는 발주기관의 장이 필요하다고 인정하는 경우 종전에 적용하고 있는 기준을 그대로 사용할 수 있습니다. 건설기준 제・개정 연혁 ∙ 이 기준은 건설기준 코드체계 전환에 따라 기존 건설기준(설계기준, 표준시방서)간 중복⋅ 상충을 비교 검토하여 코드로 통합 정비하였다. ∙ 이 기준은 기존의 건축물의 조적공사, 석공사, 목공사, 방수공사 미장공사 등에 해당되는 부분을 통합 정비하여 기준으로 제정한 것으로 제⋅개정 연혁은 다음과 같다. 건설기준 주요내용 제·개정 (년.월) 건축공사표준시방서 ∙ 건설부 제정 건축공사표준시방서 제정 (1967.12.29.) 건축공사표준시방서(상), (하) 개정 (1978.12.26.) 건축공사표준시방서(상), (하) ∙ 건설부 제정 1985년도 개정판 개정 (1985) 건축공사표준시방서 ∙ 건설부 제정 1988년도 개정판 개정 (1989.8.20.) 건축공사표준시방서 ∙ 건설부 제정 1994년 전면개정 개정 (1994.8.30.) 건축공사표준시방서 ∙ 전면개정 개정 (1999.5.10.) 건축공사표준시방서 ∙ 개정판 개정 (2006.4.25.) 건축공사표준시방서 ∙ 개정판 개정 (2013.7.30.) KCS 41 40 08 : 2016 ∙ 건설기준 코드체계 전환에 따라 코드화로 통합 정비함 제정 (2016.6) KCS 41 40 08 : 2016 ∙ 한국산업표준과 건설기준 부합화에 따라 수정함 수정 (2018.7) KCS 41 40 08 : 2021 ∙ 건축공사 안전 및 성능 증대 등을 위한 전면 개정 개정 (2021.8) 목 차 1. 일반사항 1 1.1 적용범위 1 1.2 참고 기준 1 1.3 용어의 정의 1 1.4 제출물 1 1.5 품질보증 1 1.6 환경유의사항 2 2. 자재 2 2.1 시멘트 액체방수공사용 자재 및 방수층의 품질기준 2 2.2 폴리머 시멘트 모르타르 방수공사용 자재 및 방수층의 품질기준 3 2.3 시멘트 혼입 폴리머계 방수공사용 자재 및 방수층의 품질기준 4 3. 시공 5 3.1 시멘트 모르타르계 방수공사 일반 5 3.2 시멘트 액체 방수공사 6 3.3 폴리머 시멘트 모르타르 방수공사 8 3.4 시멘트 혼입 폴리머계 방수공사 9 시멘트 모르타르계 방수공사 1. 일반사항 1.1 적용범위 이 기준은 건축물의 옥상, 실내 및 지하의 RC 표면에 시멘트 액체 방수층, 폴리머 시멘트 모르타르 방수층 또는 시멘트 혼입 폴리머계 방수층(이하 방수층이라 함.)을 시공할 경우에 적용한다. 1.2 참고 기준 1.2.1 관련 법규 내용 없음 1.2.2 관련 기준 (1) 시멘트 모르타르계 방수공사에 있어서 일반적인 사항 및 이 절에서 기술된 이외의 사항은 KCS 41 40 01을 참조하여 적용한다. (2) 기타 시멘트류 및 미장과 관련한 사항에 대하여 KCS 41 46 00을 참조하여 적용한다. KCS 41 40 01 방수공사 일반 KCS 41 46 00 미장공사 KCS 41 40 08 시멘트모르타르계 방수공사 KS F 4910 건축용 실링재 KS F 4916 시멘트 혼화용 폴리머 KS F 4919 시멘트 혼입 폴리머계 방수재 KS F 4925 시멘트 액체형 방수제 KS L 5201 포틀랜드 시멘트 1.3 용어의 정의 KCS 41 40 01 (1.3)에 따른다. 1.4 제출물 KCS 41 40 01 (1.4)에 따른다. 1.5 품질보증 KCS 41 40 01 (1.5)에 따른다. 1.6 환경유의사항 KCS 41 40 01 (1.6)에 따른다. 2. 자재 2.1 시멘트 액체방수공사용 자재 및 방수층의 품질기준 2.1.1 시멘트 시멘트는 KS L 5201의 규정에 합격하는 1종 보통 포틀랜드 시멘트를 사용한다. 2.1.2 모래 모래는 양질의 것으로 유해량의 철분, 염분, 진흙, 먼지 및 유기불순물을 함유하지 않는 표 2.1-1의 입도의 것을 사용한다. 다만, 바름두께에 지장을 주지 않는 범위 내에서 입도가 큰 것을 사용한다. 표 2.1-1 모래의 표준입도 표 2.1-1 모래의 표준입도 체의 호칭치수(mm) 종류 체를 통과하는 것의 질량 백분율(%) 5 2.5 1.2 0.6 0.3 0.15 페이스트용 모르타르용 100 80∼100 100 50∼90 45∼90 25∼65 20∼60 10∼35 5∼15 2∼10 주 : 1) 0.15 mm 이하의 입자가 표 중의 값보다 작은 것은, 이 입자 대신에 포졸란이나 기타 무기질 분말을 적량 혼입하여 사용하여도 된다. 2.1.3 물 물은 유해 함유량의 염분, 철분, 이온 및 유기물 등이 포함되지 않은 깨끗한 것을 사용한다. 2.1.4 방수제 방수제는 표 2.1-2과 같이 주성분별로 무기질계, 유기질계, 폴리머계의 3가지로 구분하며, 각 성분별 시멘트 액체 방수제는 KS F 4925의 품질기준에 적합하여야 하며, 품질의 변화가 없도록 저장하고 유효기간 내에 사용한다. 표 2.1-2 시멘트 액체 방수제의 화학조성 분류 표 2.1-2 시멘트 액체 방수제의 화학조성 분류 종류 주성분 무기질계 염화칼슘계, 규산소다계, 실리케이트계 유기질계 지방산계 지방산계, 파라핀계 폴리머계 합성고무 라텍스계, 에틸렌비닐아세테이트 에멀션계, 아크릴 에멀션계 2.1.5 기타 보조재료 시멘트 액체 방수층의 시공 시 기상적 제약 대응, 공기단축, 바탕처리 및 친화, 지수작업 및 작업성능 개선 등을 목적으로 사용하는 기타 보조 재료에는 표 2.1-3과 같은 것이 있으며, 종류 및 품질은 방수제 제조자가 지정하는 것을 사용한다. 표 2.1-3 시멘트 액체 방수공사를 위한 보조재료 표 2.1-3 시멘트 액체 방수공사를 위한 보조재료 보조재료 용도 지수제 바탕 결함부로부터의 누수를 막기 위하여 사용한다. 시멘트에 혼화하는 액체형, 물과 혼련하는 분체형 및 가수분해하는 폴리머 등이 있다. 접착제 바탕과의 접착효과 및 물적 시기 효과를 증진시키기 위하여 사용하며, 고형분 15 % 이상의 재유화형 에멀션으로 한다. 방동제 한랭시의 시공 시, 방수층의 동해를 방지할 목적으로 사용한다. 보수제 보수성의 향상과 작업성의 향상을 목적으로 사용한다. 경화촉진제 공기단축을 위하여 경화를 촉진시킬 목적으로 사용한다. 실링재 바탕 균열부의 충전 및 접합철물 주위를 실링할 목적으로 사용. KS F 4910 및 KS F 3211에 모두 충족하는 제품을 사용한다. 2.1.6 시멘트 액체 방수층의 품질 시멘트 액체 방수층은 KS F 4925의 품질기준에 적합한 것을 사용하여 방수층을 시공한 후 부착강도를 측정하고, 해당 품질기준에 적합하여야 한다. 2.2 폴리머 시멘트 모르타르 방수공사용 자재 및 방수층의 품질기준 2.2.1 시멘트 시멘트는 KS L 5201의 규정에 합격하는 1종 보통 포틀랜드 시멘트를 사용한다. 2.2.2 모 래 모래는 양질의 것으로 유해량의 철분, 염분, 진흙, 먼지 및 유기불순물을 함유하지 않은 표 2.2-1의 입도의 것을 사용한다. 다만, 바름두께에 지장을 주지 않는 범위 내에서 입도가 큰 것을 사용한다. 표 2.2-1 모래의 표준입도 표 2.2-1 모래의 표준입도 체의 호칭치수(mm) 종류 체를 통과하는 것의 질량 백분율(%) 5 2.5 1.2 0.6 0.3 0.15 초벌 바름용 재벌 바름용 정벌 바름용 100 80∼100 100 100 50∼90 70∼90 45∼90 25∼65 35∼80 20∼60 10∼35 15∼45 5∼15 2∼10 2∼10 주 : 1) 0.15 mm 이하의 입자가 표 중의 값보다 작은 것은 이 입자 대신에 포졸란이나 기타 무기질 분말을 적량 혼입하여 사용하여도 된다. 2.2.3 물 물은 유해 함유량의 염분, 철분, 이온 및 유기물 등이 포함되지 않은 깨끗한 것을 사용한다. 2.2.4 폴리머 분산제 폴리머 분산제는 KS F 4916의 규정에 적합한 것으로서 품질의 변화가 없도록 저장하고 유효기간 내에 사용한다. 2.2.5 보조재료 보조재료는 그 효과와 소요성능이 입증된 것으로서, 방수제 제조자가 지정하는 것을 사용한다. 2.2.6 폴리머 시멘트 모르타르 방수층의 품질 폴리머 시멘트 모르타르 방수층의 품질은 KS F 4916의 품질기준에 적합한 것을 사용하여 방수층을 시공한 후 부착강도를 측정하고, 해당 품질기준에 적합하여야 한다. 2.3 시멘트 혼입 폴리머계 방수공사용 자재 및 방수층의 품질기준 2.3.1 수경성 무기분체 시멘트는 KS L 5201의 규정에 합격하는 1종 보통 포틀랜드 시멘트 또는 특수 시멘트를 사용하고, 기타 무기분체(규사 및 기타)는 방수재 제조자의 지정에 따른다. 2.3.2 폴리머 분산제 시멘트 혼입 폴리머계 방수층에 사용하는 폴리머 분산제는 KS F 4916의 규정에 적합한 것으로서 품질의 변화가 없도록 저장하고, 저장 유효기간 내에 사용한다. 2.3.3 물 물은 유해 함유량의 염분, 철분, 이온 및 유기물 등이 포함되지 않은 깨끗한 것을 사용한다. 2.3.4 보조재료 (1) 도막 두께와 강도 확보를 위한 보강포(합성섬유 부직포, 유리섬유 또는 성형시트)는 그 효과와 소요성능이 입증된 것으로서 방수제 제조자가 지정하는 것을 사용한다. (2) 바탕 균열부의 충전 및 접합철물 주위를 실링할 목적으로 사용하는 실링재는 KS F 4910에 적합한 것을 사용한다. 2.3.5 시멘트 혼입 폴리머계 방수재의 품질 시멘트 혼입 폴리머계 방수재의 품질은 KS F 4919의 품질기준에 적합한 것을 사용하여야 하며, 방수층을 시공한 후 에는 부착강도를 측정하여, 해당 품질기준에 적합한지 확인하여야 한다. 3. 시공 3.1 시멘트 모르타르계 방수공사 일반 3.1.1 방수층의 종류와 적용 방수층의 종류와 적용은 표 3.1-1을 표준으로 하고, 각 방수층의 종류별 두께, 보호층 및 마감층은 공사시방에 의한다. 표 3.1-1 방수층의 종류와 적용구분 표 3.1-1 방수층의 종류와 적용구분 종류 공정 시멘트 액체방수층 폴리머 시멘트 모르타르방수층 시멘트 혼입 폴리머계 방수층 바닥용 벽체/천장용 1 종 2 종 1 층 바탕면 정리 및 물청소 바탕면 정리 및 물청소 폴리머 시멘트모르타르 폴리머 시멘트모르타르 프라이머 (0.3 ㎏/㎡) 2 층 방수액 침투 바탕접착재 도포 폴리머 시멘트모르타르 폴리머 시멘트모르타르 방수재 (0.7 ㎏/㎡) 3 층 방수시멘트 페이스트 방수시멘트 페이스트 폴리머 시멘트모르타르 － 방수재 (1.0 ㎏/㎡) 4 층 방수 모르타르 방수 모르타르 － － 보강포 5 층 - － － － 방수재 (1.0 ㎏/㎡) 6 층 － － － － 방수재 (0.7 ㎏/㎡) 적 용 부 위 실내 ○ ○ ○ ○ ○ 지하 내면 △ △ ○ △ ○ 외면 X X X X ○3) 수조1) 내면 X X X X X 외면 X X X X △ 옥상2) X X △ X △ 주 : 1) ○ 적용 가능, △ 적용 가능하나 사용 환경(수압, 태양열, 진동, 대기 온도 등)에 따라 주의를 요함, × 적용 불가 특히 음료용 수조 내부에서의 사용은 피한다. 2) 차양 또는 옥상의 배수 홈 등의 소면적 부위 사용 3) 지하벽체 외면에 적용할 경우에는 다음의 공정에 의하여 실시한다. 공정 1층 2층 3층 종류 방수재(1.0 ㎏/㎡) 방수재(1.0 ㎏/㎡) 방수재(1.0 ㎏/㎡) 3.2 시멘트 액체 방수공사 3.2.1 방수제의 배합 및 비빔 (1) 방수제는 방수제 제조자가 지정하는 비율로 혼입하고, 모르타르 믹서를 사용하여 충분히 비빈다. 이때, 방수 시멘트 페이스트의 경우에는 시멘트를 먼저 2분 이상 건비빔한 다음에 소정의 물로 희석시킨 방수제를 혼입하여 균질하게 될 때까지 5분 이상 비빈다. 방수 모르타르의 경우에는 모래, 시멘트의 순으로 믹서에 투입하고 2분 이상 건비빔한 다음에 소정의 물로 희석시킨 방수제를 혼입하여 균질하게 될 때까지 5분 이상 비빈다. (2) 믹서의 회전을 멈춘 다음 모르타르 내의 수분이나 모래의 분리가 없어야 하며, 불순물 등이 포함되지 않아야 한다. (3) 방수시멘트 모르타르의 비빔 후 사용 가능한 시간은 20 ℃에서 45분 정도가 적정하며, 그 외에는 방수제 제조자의 지정에 따른다. 3.2.2 방수층 바름 (1) 목적물의 인수 전 바탕 상태는 평탄하고, 휨, 단차, 들뜸, 레이턴스, 취약부 및 현저한 돌기물과 콘크리트 관통 크랙 등의 결함이 없는 것을 표준으로 한다(방수층 작업 완료 후 검측 및 완전한 품질점검이 완료된 최적의 상태로 후속공정에 인계한다). (2) 방수층 시공 전에 다음과 같은 부위는 실링재 또는 폴리머 시멘트 모르타르 등으로 바탕면처리를 한다(이하 “방수 바탕면정리” 작업으로 분류). ① 콘크리트 곰보 ② 콜드 조인트, 이음타설부, 콘크리트 표면 단순 균열 ③ 콘크리트를 관통하는 거푸집 고정재에 의한 구멍, 볼트, 철골, 배관 주위 ④ 콘크리트 표면의 방수층 시공 후 품질을 저해한다고 판단되는 취약부 (3) 바탕이 건조할 경우에는 시멘트 액체방수층 내부의 수분이 과도하게 흡수되지 않도록 바탕을 물로 적신다. (4) 방수층은 흙손 및 뿜칠기 등을 사용하여 소정의 두께(부착강도 측정이 가능하도록 최소 4 mm 두께 이상을 표준으로 한다)가 될 때까지 균일하게 바른다. (5) 각 공정의 바름간격은 방수제 제조자의 지정에 따른다. (6) 치켜올림 부위에는 미리 방수 시멘트 페이스트를 바르고, 그 위를 100 ㎜ 이상의 겹침을 두고 평면부와 치켜올림부를 바른다. (7) 각 공정의 이어 바르기의 겹침은 100 mm 정도로 하여 소정의 두께로 조정하고, 끝부분은 솔로 바탕과 잘 밀착시킨다. (8) 각 공정의 이어 바르기 또는 다음 공정이 미장공사일 경우에는 솔 또는 빗자루로 표면을 거칠게 마감한다. 3.2.3 양생 및 점검 (1) 바름 완료 후 재료의 특성 및 시공 장소에 따라 적절한 양생을 한다. (2) 직사일광이나 바람, 고온 등에 의한 급속한 건조가 예상되는 경우에는 살수 또는 시트 등으로 보호하여 양생한다. (3) 특히 재령의 초기에는 충격 및 진동 등의 영향을 받지 않도록 한다. (4) 저온에 의한 동결이 예상되는 경우에는 보온 또는 시트 등으로 보호하여 양생한다. (5) 양생이 끝난 방수층을 대상으로 부착강도를 측정하여 방수층의 성능을 확인한다. 3.3 폴리머 시멘트 모르타르 방수공사 3.3.1 방수제의 배합 및 비빔 (1) 배합 및 바름두께 폴리머 시멘트 모르타르의 배합 및 도막두께는 표 3.3-1에 따른다. 표 3.3-1 배합 및 바름두께의 표준치 표 3.3-1 배합 및 바름두께의 표준치 시공장소 1층(초벌바름) 2층(재벌 또는 정벌바름) 3층(정벌바름) 배합 도막두께 (mm) 배합 도막두께 (mm) 배합 도막두께 (mm) 시멘트 모래 시멘트 모래 시멘트 모래 수직부위 1 0∼1 1∼3 1 2∼2.5 7∼9 － － － 1 0∼0.5 1∼3 1 2∼2.5 7∼9 1 2∼3 10 수평부위 1 0∼1 1∼3 1 2∼2.5 20∼25 － － － 주 : 1) 용적비는 다음의 상태를 표준으로 한다. 2) 시멘트: 포틀랜드 시멘트의 단위용적 질량으로 1.2 kg 정도 3) 모래: 표면건조 포수상태에서 가볍게 채워 넣은 상태 4) 사용하는 모래가 건조되어 있을 때에는 모래의 양을 줄이고, 젖어 있을 경우에는 증가하는 등의 조정을 한다. (2) 폴리머 시멘트 모르타르의 폴리머 분산제의 혼입비율 및 물시멘트비 폴리머 시멘트 모르타르의 폴리머 분산제의 혼입비율은 10 % 이상으로 정하고, 물시멘트비는 30∼60 %의 범위 내에서 용도에 따른 작업가능성을 고려하여 최저비의 시험비빔으로 결정한다. (3) 폴리머 시멘트 모르타르의 비빔 및 사용 가능 시간 ① 폴리머 시멘트 모르타르의 비빔은 배처 믹서에 의한 기계비빔을 원칙으로 한다. ② 비빔 전에 소정량의 폴리머 분산제와 시험비빔에 의하여 결정한 물을 혼합한다. 이때 필요한 경우에는 보조재료를 첨가한다. ③ 모래, 시멘트, 필요에 따라 혼화재료의 순으로 믹서에 투입하고, 전체가 균질하게 되도록 건비빔한다. 다만, 이때의 모래는 함수율이 작은 것을 사용한다. ④ 상기의 건비빔한 혼합체에 소정량의 물로 희석한 폴리머 분산제를 첨가하여 폴리머 시멘트 모르타르의 색상이 균등하게 될 때까지 비빈다. ⑤ 폴리머 시멘트 모르타르는 비빔 후, 20 ℃의 경우에 45분 이내의 사용을 기준으로 한다. 3.3.2 방수층 바름 (1) 목적물의 인수 전 바탕 상태는 평탄하고, 휨, 단차, 들뜸, 레이턴스, 취약부 및 현저한 돌기물과 콘크리트 관통크랙 등의 결함이 없는 것을 표준으로 한다 (방수층 작업 완료 후 검측 및 완전한 품질점검이 완료된 목적물을 최적의 상태로 후속공정에 인계한다). (2) 방수층 시공 전에 다음과 같은 부위는 실링재 또는 폴리머 시멘트 모르타르 등으로 바탕면처리를 한다(이하 “방수 바탕면정리” 작업으로 분류). ① 콘크리트 곰보 ② 콜드 조인트, 이음타설부, 콘크리트 표면 단순 균열 ③ 콘크리트를 관통하는 거푸집 고정재에 의한 구멍, 볼트, 철골, 배관 주위 ④ 콘크리트 표면의 방수층 시공 후 품질을 저해한다고 판단되는 취약부 (3) 표면의 취약층, 먼지, 기름기 및 거푸집 박리제 등과 같은 방수층의 접착을 저해하는 것은 미리 제거한다. (4) 바탕이 건조할 경우에는 폴리머 시멘트 모르타르의 수분이 과도하게 흡수되지 않도록 바탕을 물로 적신다. (5) 방수층은 흙손 및 뿜칠기 등을 사용하여 소정의 두께가 될 때까지 균일하게 바른다. (6) 각 층의 시공간격은 방수제 제조자의 지정에 따른다. (7) 각 층의 이어 바르기 겹침은 100 mm 정도로 하여 소정의 두께로 조정하고, 끝 부분은 솔로 바탕과 잘 밀착시킨다. (8) 솔 또는 빗자루로 표면을 거칠게 한 다음에 이어바르기를 한다. 3.3.3 양생 및 점검 (1) 3.2.3에 따른다. (2) 양생이 끝난 방수층을 대상으로 부착강도를 측정하여 방수층의 성능을 확인한다. 3.4 시멘트 혼입 폴리머계 방수공사 3.4.1 방수제의 배합 및 비빔 (1) 방수제의 배합비율은 방수제 제조자의 지정에 따른다. (2) 에멀션 용액 중에 수경성 무기분체를 조금씩 넣어가면서 핸드믹서로 3∼5분 정도 균질하게 될 때까지 비빈다. 이때 재료분리가 일어나지 않아야 한다. (3) 방수제는 방수재 제조자가 정하는 시간 내에 사용하며, 응결된 것은 사용하지 않는다. 3.4.2 방수층 바름 (1) 목적물의 인수 전 바탕 상태는 평탄하고, 휨, 단차, 들뜸, 레이턴스, 취약부 및 현저한 돌기물 과 콘크리트 관통크랙 등의 결함이 없는 것을 표준으로 한다(방수층 작업 완료 후 검측 및 완전한 품질점검이 완료된 최적의 상태로 후속공정에 인계한다). (2) 방수층 시공 전에 다음과 같은 부위는 실링재 또는 폴리머 시멘트 모르타르 등으로 바탕면처리를 한다 (이하 “방수 바탕면정리” 작업으로 분류). ① 콘크리트 곰보 ② 콜드 조인트, 이음타설부, 콘크리트 표면 단순 균열 ③ 콘크리트를 관통하는 거푸집 고정재에 의한 구멍, 볼트, 철골, 배관 주위 ④ 콘크리트 표면의 방수층 시공 후 품질을 저해한다고 판단되는 취약부 (3) 콘크리트 표면의 취약층, 먼지, 기름기 및 거푸집 박리제 등과 같은 방수층의 접착을 저해하는 것은 미리 제거한다. (4) 바탕이 건조할 경우에는 수화응고형 방수재의 수분이 과도하게 흡수되지 않도록 바탕을 물로 적신다. (5) 프라이머는 솔, 롤러 또는 뿜칠기로 규정량을 균일하게 도포하고, 흡수가 현저할 경우에는 추가 도포하여 조정한다. (6) 방수제는 흙손을 사용하여 핀홀의 발생 등에 주의하면서 규정량을 균일하게 바른다. (7) 각 층의 시공간격은 온도 20 ℃에서 5∼6시간을 표준으로 한다. (8) 보강재는 1층 째의 방수층 시공이 끝난 직후, 주름 또는 변형이 생기지 않도록 주의하여 삽입한다. 3.4.3 양생 및 점검 (1) 3.2.3에 따른다. (2) 양생이 끝난 방수층을 대상으로 부착강도를 측정하여 방수층의 성능을 확인한다. 집필위원 분야 성명 소속 직급 건축 오상근 서울과학기술대학교 교수 김영근 한국건설생활환경시험연구원 수석전문위원 김수연 서울과학기술대학교 연구교수 송제영 BK방수기술연구소 소장 손종규 한국토지주택공사 부장 공민호 ㈜현대엔지니어링 책임매니저 곽규성 ㈜삼성물산 부장 조일규 ㈜제이에스기술 상무 김병일 서울과학기술대학교 부교수 최성민 ㈜나비티엔시 이사 김영삼 한국건설생활환경시험연구원 책임연구원 이정훈 BK방수기술연구소 책임연구원 박진상 ㈜신소재융합연구소 소장 이선규 한국화학융합시험연구원 선임연구원 자문위원 분야 성명 소속 강부성 서울과학기술대학교 이현수 서울대학교 김학영 대한전문건설협회 장성주 ㈜스페이스인코 정환목 경동대학교 안상로 한국지하안전협회 권기주 이노시스기술(주) 방수도료 함영재 ㈜노루페인트 방수도료 임세준 삼화페인트공업(주) 방수일반 제창현 포스코건설(주) 자착식 시트 김정일 GCP KOREA(주) 합성고분자계 시트 김승수 강남이앤알(주) 아스팔트계 시트 김진성 ㈜페트로산업 수팽창지수재 김도일 대룡공업(주) 누수보수재 박수남 ㈜성창 건설기준위원회 분야 성명 소속 건축 김갑득 포스코 김영수 부산대학교 서명석 경동대학교 신성수 한국기술사회 임남기 동명대학교 장덕배 동양미래대학교 조도연 디엔비건축사사무소 최수경 한서대학교 중앙건설기술심의위원회 성명 소속 류성룡 고려대학교 이지은 LH 토지주택 심강희 ㈜디자인그룹바탕 이준성 이화여자대학교 배시화 가천대학교 이강민 충남대학교 김강식 국토교통부 국토교통부 성명 소속 직책 오진수 국토교통부 건축안전과 과장 이지형 국토교통부 건축안전과 사무관 정연수 국토교통부 건축안전과 주무관 표준시방서 KCS 41 40 08 : 2021 시멘트 모르타르계 방수공사 2021년 8월 13일 발행 국토교통부 관련단체 대한건축학회 06687 서울특별시 서초구 효령로 87(방배동 917-9) ☎ 02-525-1841 E-mail : webmaster@aik.or.kr http://www.aik.or.kr/ 국가건설기준센터 10223 경기도 고양시 일산서구 고양대로 283(대화동) ☎ 031-910-0444 E-mail : kcsc@kict.re.kr http://www.kcsc.re.kr",
    "sections": {
      "scope": "이 기준은 건축물의 옥상, 실내 및 지하의 RC 표면에 시멘트 액체 방수층, 폴리머 시멘트 모르타르 방수층 또는 시멘트 혼입 폴리머계 방수층(이하 방수층이라 함.)을 시공할 경우에 적용한다.",
      "materials": "2. 자재 2 2.1 시멘트 액체방수공사용 자재 및 방수층의 품질기준 2 2.2 폴리머 시멘트 모르타르 방수공사용 자재 및 방수층의 품질기준 3 2.3 시멘트 혼입 폴리머계 방수공사용 자재 및 방수층의 품질기준 4 3. 시공 5 3.1 시멘트 모르타르계 방수공사 일반 5 3.2 시멘트 액체 방수공사 6 3.3 폴리머 시멘트 모르타르 방수공사 8 3.4 시멘트 혼입 폴리머계 방수공사 9 시멘트 모르타르계 방수공사 1. 일반사항 1.1 적용범위 이 기준은 건축물의 옥상, 실내 및 지하의 RC 표면에 시멘트 액체 방수층, 폴리머 시멘트 모르타르 방수층 또는 시멘트 혼입 폴리머계 방수층(이하 방수층이라 함.)을 시공할 경우에 적용한다. 1.2 참고 기준 1.2.1 관련 법규 내용 없음 1.2.2 관련 기준 (1) 시멘트 모르타르계 방수공사에 있어서 일반적인 사항 및 이 절에서 기술된 이외의 사항은 KCS 41 40 01을 참조하여 적용한다. (2) 기타 시멘트류 및 미장과 관련한 사항에 대하여 KCS 41 46 00을 참조하여 적용한다. KCS 41 40 01 방수공사 일반 KCS 41 46 00 미장공사 KCS 41 40 08 시멘트모르타르계 방수공사 KS F 4910 건축용 실링재 KS F 4916 시멘트 혼화용 폴리머 KS F 4919 시멘트 혼입 폴리머계 방수재 KS F 4925 시멘트 액체형 방수제 KS L 5201 포틀랜드 시멘트 1.3 용어의 정의 KCS 41 40 01 (1.3)에 따른다. 1.4 제출물 KCS 41 40 01 (1.4)에 따른다. 1.5 품질보증 KCS 41 40 01 (1.5)에 따른다. 1.6 환경유의사항 KCS 41 40 01 (1.6)에 따른다. 2. 자재 2.1 시멘트 액체방수공사용 자재 및 방수층의 품질기준 2.1.1 시멘트 시멘트는 KS L 5201의 규정에 합격하는 1종 보통 포틀랜드 시멘트를 사용한다. 2.1.2 모래 모래는 양질의 것으로 유해량의 철분, 염분, 진흙, 먼지 및 유기불순물을 함유하지 않는 표 2.1-1의 입도의 것을 사용한다. 다만, 바름두께에 지장을 주지 않는 범위 내에서 입도가 큰 것을 사용한다. 표 2.1-1 모래의 표준입도 표 2.1-1 모래의 표준입도 체의 호칭치수(mm) 종류 체를 통과하는 것의 질량 백분율(%) 5 2.5 1.2 0.6 0.3 0.15 페이스트용 모르타르용 100 80∼100 100 50∼90 45∼90 25∼65 20∼60 10∼35 5∼15 2∼10 주 : 1) 0.15 mm 이하의 입자가 표 중의 값보다 작은 것은, 이 입자 대신에 포졸란이나 기타 무기질 분말을 적량 혼입하여 사용하여도 된다. 2.1.3 물 물은 유해 함유량의 염분, 철분, 이온 및 유기물 등이 포함되지 않은 깨끗한 것을 사용한다. 2.1.4 방수제 방수제는 표 2.1-2과 같이 주성분별로 무기질계, 유기질계, 폴리머계의 3가지로 구분하며, 각 성분별 시멘트 액체 방수제는 KS F 4925의 품질기준에 적합하여야 하며, 품질의 변화가 없도록 저장하고 유효기간 내에 사용한다. 표 2.1-2 시멘트 액체 방수제의 화학조성 분류 표 2.1-2 시멘트 액체 방수제의 화학조성 분류 종류 주성분 무기질계 염화칼슘계, 규산소다계, 실리케이트계 유기질계 지방산계 지방산계, 파라핀계 폴리머계 합성고무 라텍스계, 에틸렌비닐아세테이트 에멀션계, 아크릴 에멀션계 2.1.5 기타 보조재료 시멘트 액체 방수층의 시공 시 기상적 제약 대응, 공기단축, 바탕처리 및 친화, 지수작업 및 작업성능 개선 등을 목적으로 사용하는 기타 보조 재료에는 표 2.1-3과 같은 것이 있으며, 종류 및 품질은 방수제 제조자가 지정하는 것을 사용한다. 표 2.1-3 시멘트 액체 방수공사를 위한 보조재료 표 2.1-3 시멘트 액체 방수공사를 위한 보조재료 보조재료 용도 지수제 바탕 결함부로부터의 누수를 막기 위하여 사용한다. 시멘트에 혼화하는 액체형, 물과 혼련하는 분체형 및 가수분해하는 폴리머 등이 있다. 접착제 바탕과의 접착효과 및 물적 시기 효과를 증진시키기 위하여 사용하며, 고형분 15 % 이상의 재유화형 에멀션으로 한다. 방동제 한랭시의 시공 시, 방수층의 동해를 방지할 목적으로 사용한다. 보수제 보수성의 향상과 작업성의 향상을 목적으로 사용한다. 경화촉진제 공기단축을 위하여 경화를 촉진시킬 목적으로 사용한다. 실링재 바탕 균열부의 충전 및 접합철물 주위를 실링할 목적으로 사용. KS F 4910 및 KS F 3211에 모두 충족하는 제품을 사용한다. 2.1.6 시멘트 액체 방수층의 품질 시멘트 액체 방수층은 KS F 4925의 품질기준에 적합한 것을 사용하여 방수층을 시공한 후 부착강도를 측정하고, 해당 품질기준에 적합하여야 한다. 2.2 폴리머 시멘트 모르타르 방수공사용 자재 및 방수층의 품질기준 2.2.1 시멘트 시멘트는 KS L 5201의 규정에 합격하는 1종 보통 포틀랜드 시멘트를 사용한다. 2.2.2 모 래 모래는 양질의 것으로 유해량의 철분, 염분, 진흙, 먼지 및 유기불순물을 함유하지 않은 표 2.2-1의 입도의 것을 사용한다. 다만, 바름두께에 지장을 주지 않는 범위 내에서 입도가 큰 것을 사용한다. 표 2.2-1 모래의 표준입도 표 2.2-1 모래의 표준입도 체의 호칭치수(mm) 종류 체를 통과하는 것의 질량 백분율(%) 5 2.5 1.2 0.6 0.3 0.15 초벌 바름용 재벌 바름용 정벌 바름용 100 80∼100 100 100 50∼90 70∼90 45∼90 25∼65 35∼80 20∼60 10∼35 15∼45 5∼15 2∼10 2∼10 주 : 1) 0.15 mm 이하의 입자가 표 중의 값보다 작은 것은 이 입자 대신에 포졸란이나 기타 무기질 분말을 적량 혼입하여 사용하여도 된다. 2.2.3 물 물은 유해 함유량의 염분, 철분, 이온 및 유기물 등이 포함되지 않은 깨끗한 것을 사용한다. 2.2.4 폴리머 분산제 폴리머 분산제는 KS F 4916의 규정에 적합한 것으로서 품질의 변화가 없도록 저장하고 유효기간 내에 사용한다. 2.2.5 보조재료 보조재료는 그 효과와 소요성능이 입증된 것으로서, 방수제 제조자가 지정하는 것을 사용한다. 2.2.6 폴리머 시멘트 모르타르 방수층의 품질 폴리머 시멘트 모르타르 방수층의 품질은 KS F 4916의 품질기준에 적합한 것을 사용하여 방수층을 시공한 후 부착강도를 측정하고, 해당 품질기준에 적합하여야 한다. 2.3 시멘트 혼입 폴리머계 방수공사용 자재 및 방수층의 품질기준 2.3.1 수경성 무기분체 시멘트는 KS L 5201의 규정에 합격하는 1종 보통 포틀랜드 시멘트 또는 특수 시멘트를 사용하고, 기타 무기분체(규사 및 기타)는 방수재 제조자의 지정에 따른다. 2.3.2 폴리머 분산제 시멘트 혼입 폴리머계 방수층에 사용하는 폴리머 분산제는 KS F 4916의 규정에 적합한 것으로서 품질의 변화가 없도록 저장하고, 저장 유효기간 내에 사용한다. 2.3.3 물 물은 유해 함유량의 염분, 철분, 이온 및 유기물 등이 포함되지 않은 깨끗한 것을 사용한다. 2.3.4 보조재료 (1) 도막 두께와 강도 확보를 위한 보강포(합성섬유 부직포, 유리섬유 또는 성형시트)는 그 효과와 소요성능이 입증된 것으로서 방수제 제조자가 지정하는 것을 사용한다. (2) 바탕 균열부의 충전 및 접합철물 주위를 실링할 목적으로 사용하는 실링재는 KS F 4910에 적합한 것을 사용한다. 2.3.5 시멘트 혼입 폴리머계 방수재의 품질 시멘트 혼입 폴리머계 방수재의 품질은 KS F 4919의 품질기준에 적합한 것을 사용하여야 하며, 방수층을 시공한 후 에는 부착강도를 측정하여, 해당 품질기준에 적합한지 확인하여야 한다. 3. 시공 3.1 시멘트 모르타르계 방수공사 일반 3.1.1 방수층의 종류와 적용 방수층의 종류와 적용은 표 3.1-1을 표준으로 하고, 각 방수층의 종류별 두께, 보호층 및 마감층은 공사시방에 의한다. 표 3.1-1 방수층의 종류와 적용구분 표 3.1-1 방수층의 종류와 적용구분 종류 공정 시멘트 액체방수층 폴리머 시멘트 모르타르방수층 시멘트 혼입 폴리머계 방수층 바닥용 벽체/천장용 1 종 2 종 1 층 바탕면 정리 및 물청소 바탕면 정리 및 물청소 폴리머 시멘트모르타르 폴리머 시멘트모르타르 프라이머 (0.3 ㎏/㎡) 2 층 방수액 침투 바탕접착재 도포 폴리머 시멘트모르타르 폴리머 시멘트모르타르 방수재 (0.7 ㎏/㎡) 3 층 방수시멘트 페이스트 방수시멘트 페이스트 폴리머 시멘트모르타르 － 방수재 (1.0 ㎏/㎡) 4 층 방수 모르타르 방수 모르타르 － － 보강포 5 층 - － － － 방수재 (1.0 ㎏/㎡) 6 층 － － － － 방수재 (0.7 ㎏/㎡) 적 용 부 위 실내 ○ ○ ○ ○ ○ 지하 내면 △ △ ○ △ ○ 외면 X X X X ○3) 수조1) 내면 X X X X X 외면 X X X X △ 옥상2) X X △ X △ 주 : 1) ○ 적용 가능, △ 적용 가능하나 사용 환경(수압, 태양열, 진동, 대기 온도 등)에 따라 주의를 요함, × 적용 불가 특히 음료용 수조 내부에서의 사용은 피한다. 2) 차양 또는 옥상의 배수 홈 등의 소면적 부위 사용 3) 지하벽체 외면에 적용할 경우에는 다음의 공정에 의하여 실시한다. 공정 1층 2층 3층 종류 방수재(1.0 ㎏/㎡) 방수재(1.0 ㎏/㎡) 방수재(1.0 ㎏/㎡) 3.2 시멘트 액체 방수공사 3.2.1 방수제의 배합 및 비빔 (1) 방수제는 방수제 제조자가 지정하는 비율로 혼입하고, 모르타르 믹서를 사용하여 충분히 비빈다. 이때, 방수 시멘트 페이스트의 경우에는 시멘트를 먼저 2분 이상 건비빔한 다음에 소정의 물로 희석시킨 방수제를 혼입하여 균질하게 될 때까지 5분 이상 비빈다. 방수 모르타르의 경우에는 모래, 시멘트의 순으로 믹서에 투입하고 2분 이상 건비빔한 다음에 소정의 물로 희석시킨 방수제를 혼입하여 균질하게 될 때까지 5분 이상 비빈다. (2) 믹서의 회전을 멈춘 다음 모르타르 내의 수분이나 모래의 분리가 없어야 하며, 불순물 등이 포함되지 않아야 한다. (3) 방수시멘트 모르타르의 비빔 후 사용 가능한 시간은 20 ℃에서 45분 정도가 적정하며, 그 외에는 방수제 제조자의 지정에 따른다. 3.2.2 방수층 바름 (1) 목적물의 인수 전 바탕 상태는 평탄하고, 휨, 단차, 들뜸, 레이턴스, 취약부 및 현저한 돌기물과 콘크리트 관통 크랙 등의 결함이 없는 것을 표준으로 한다(방수층 작업 완료 후 검측 및 완전한 품질점검이 완료된 최적의 상태로 후속공정에 인계한다). (2) 방수층 시공 전에 다음과 같은 부위는 실링재 또는 폴리머 시멘트 모르타르 등으로 바탕면처리를 한다(이하 “방수 바탕면정리” 작업으로 분류). ① 콘크리트 곰보 ② 콜드 조인트, 이음타설부, 콘크리트 표면 단순 균열 ③ 콘크리트를 관통하는 거푸집 고정재에 의한 구멍, 볼트, 철골, 배관 주위 ④ 콘크리트 표면의 방수층 시공 후 품질을 저해한다고 판단되는 취약부 (3) 바탕이 건조할 경우에는 시멘트 액체방수층 내부의 수분이 과도하게 흡수되지 않도록 바탕을 물로 적신다. (4) 방수층은 흙손 및 뿜칠기 등을 사용하여 소정의 두께(부착강도 측정이 가능하도록 최소 4 mm 두께 이상을 표준으로 한다)가 될 때까지 균일하게 바른다. (5) 각 공정의 바름간격은 방수제 제조자의 지정에 따른다. (6) 치켜올림 부위에는 미리 방수 시멘트 페이스트를 바르고, 그 위를 100 ㎜ 이상의 겹침을 두고 평면부와 치켜올림부를 바른다. (7) 각 공정의 이어 바르기의 겹침은 100 mm 정도로 하여 소정의 두께로 조정하고, 끝부분은 솔로 바탕과 잘 밀착시킨다. (8) 각 공정의 이어 바르기 또는 다음 공정이 미장공사일 경우에는 솔 또는 빗자루로 표면을 거칠게 마감한다. 3.2.3 양생 및 점검 (1) 바름 완료 후 재료의 특성 및 시공 장소에 따라 적절한 양생을 한다. (2) 직사일광이나 바람, 고온 등에 의한 급속한 건조가 예상되는 경우에는 살수 또는 시트 등으로 보호하여 양생한다. (3) 특히 재령의 초기에는 충격 및 진동 등의 영향을 받지 않도록 한다. (4) 저온에 의한 동결이 예상되는 경우에는 보온 또는 시트 등으로 보호하여 양생한다. (5) 양생이 끝난 방수층을 대상으로 부착강도를 측정하여 방수층의 성능을 확인한다. 3.3 폴리머 시멘트 모르타르 방수공사 3.3.1 방수제의 배합 및 비빔 (1) 배합 및 바름두께 폴리머 시멘트 모르타르의 배합 및 도막두께는 표 3.3-1에 따른다. 표 3.3-1 배합 및 바름두께의 표준치 표 3.3-1 배합 및 바름두께의 표준치 시공장소 1층(초벌바름) 2층(재벌 또는 정벌바름) 3층(정벌바름) 배합 도막두께 (mm) 배합 도막두께 (mm) 배합 도막두께 (mm) 시멘트 모래 시멘트 모래 시멘트 모래 수직부위 1 0∼1 1∼3 1 2∼2.5 7∼9 － － － 1 0∼0.5 1∼3 1 2∼2.5 7∼9 1 2∼3 10 수평부위 1 0∼1 1∼3 1 2∼2.5 20∼25 － － － 주 : 1) 용적비는 다음의 상태를 표준으로 한다. 2) 시멘트: 포틀랜드 시멘트의 단위용적 질량으로 1.2 kg 정도 3) 모래: 표면건조 포수상태에서 가볍게 채워 넣은 상태 4) 사용하는 모래가 건조되어 있을 때에는 모래의 양을 줄이고, 젖어 있을 경우에는 증가하는 등의 조정을 한다. (2) 폴리머 시멘트 모르타르의 폴리머 분산제의 혼입비율 및 물시멘트비 폴리머 시멘트 모르타르의 폴리머 분산제의 혼입비율은 10 % 이상으로 정하고, 물시멘트비는 30∼60 %의 범위 내에서 용도에 따른 작업가능성을 고려하여 최저비의 시험비빔으로 결정한다. (3) 폴리머 시멘트 모르타르의 비빔 및 사용 가능 시간 ① 폴리머 시멘트 모르타르의 비빔은 배처 믹서에 의한 기계비빔을 원칙으로 한다. ② 비빔 전에 소정량의 폴리머 분산제와 시험비빔에 의하여 결정한 물을 혼합한다. 이때 필요한 경우에는 보조재료를 첨가한다. ③ 모래, 시멘트, 필요에 따라 혼화재료의 순으로 믹서에 투입하고, 전체가 균질하게 되도록 건비빔한다. 다만, 이때의 모래는 함수율이 작은 것을 사용한다. ④ 상기의 건비빔한 혼합체에 소정량의 물로 희석한 폴리머 분산제를 첨가하여 폴리머 시멘트 모르타르의 색상이 균등하게 될 때까지 비빈다. ⑤ 폴리머 시멘트 모르타르는 비빔 후, 20 ℃의 경우에 45분 이내의 사용을 기준으로 한다. 3.3.2 방수층 바름 (1) 목적물의 인수 전 바탕 상태는 평탄하고, 휨, 단차, 들뜸, 레이턴스, 취약부 및 현저한 돌기물과 콘크리트 관통크랙 등의 결함이 없는 것을 표준으로 한다 (방수층 작업 완료 후 검측 및 완전한 품질점검이 완료된 목적물을 최적의 상태로 후속공정에 인계한다). (2) 방수층 시공 전에 다음과 같은 부위는 실링재 또는 폴리머 시멘트 모르타르 등으로 바탕면처리를 한다(이하 “방수 바탕면정리” 작업으로 분류). ① 콘크리트 곰보 ② 콜드 조인트, 이음타설부, 콘크리트 표면 단순 균열 ③ 콘크리트를 관통하는 거푸집 고정재에 의한 구멍, 볼트, 철골, 배관 주위 ④ 콘크리트 표면의 방수층 시공 후 품질을 저해한다고 판단되는 취약부 (3) 표면의 취약층, 먼지, 기름기 및 거푸집 박리제 등과 같은 방수층의 접착을 저해하는 것은 미리 제거한다. (4) 바탕이 건조할 경우에는 폴리머 시멘트 모르타르의 수분이 과도하게 흡수되지 않도록 바탕을 물로 적신다. (5) 방수층은 흙손 및 뿜칠기 등을 사용하여 소정의 두께가 될 때까지 균일하게 바른다. (6) 각 층의 시공간격은 방수제 제조자의 지정에 따른다. (7) 각 층의 이어 바르기 겹침은 100 mm 정도로 하여 소정의 두께로 조정하고, 끝 부분은 솔로 바탕과 잘 밀착시킨다. (8) 솔 또는 빗자루로 표면을 거칠게 한 다음에 이어바르기를 한다. 3.3.3 양생 및 점검 (1) 3.2.3에 따른다. (2) 양생이 끝난 방수층을 대상으로 부착강도를 측정하여 방수층의 성능을 확인한다. 3.4 시멘트 혼입 폴리머계 방수공사 3.4.1 방수제의 배합 및 비빔 (1) 방수제의 배합비율은 방수제 제조자의 지정에 따른다. (2) 에멀션 용액 중에 수경성 무기분체를 조금씩 넣어가면서 핸드믹서로 3∼5분 정도 균질하게 될 때까지 비빈다. 이때 재료분리가 일어나지 않아야 한다. (3) 방수제는 방수재 제조자가 정하는 시간 내에 사용하며, 응결된 것은 사용하지 않는다. 3.4.2 방수층 바름 (1) 목적물의 인수 전 바탕 상태는 평탄하고, 휨, 단차, 들뜸, 레이턴스, 취약부 및 현저한 돌기물 과 콘크리트 관통크랙 등의 결함이 없는 것을 표준으로 한다(방수층 작업 완료 후 검측 및 완전한 품질점검이 완료된 최적의 상태로 후속공정에 인계한다). (2) 방수층 시공 전에 다음과 같은 부위는 실링재 또는 폴리머 시멘트 모르타르 등으로 바탕면처리를 한다 (이하 “방수 바탕면정리” 작업으로 분류). ① 콘크리트 곰보 ② 콜드 조인트, 이음타설부, 콘크리트 표면 단순 균열 ③ 콘크리트를 관통하는 거푸집 고정재에 의한 구멍, 볼트, 철골, 배관 주위 ④ 콘크리트 표면의 방수층 시공 후 품질을 저해한다고 판단되는 취약부 (3) 콘크리트 표면의 취약층, 먼지, 기름기 및 거푸집 박리제 등과 같은 방수층의 접착을 저해하는 것은 미리 제거한다. (4) 바탕이 건조할 경우에는 수화응고형 방수재의 수분이 과도하게 흡수되지 않도록 바탕을 물로 적신다. (5) 프라이머는 솔, 롤러 또는 뿜칠기로 규정량을 균일하게 도포하고, 흡수가 현저할 경우에는 추가 도포하여 조정한다. (6) 방수제는 흙손을 사용하여 핀홀의 발생 등에 주의하면서 규정량을 균일하게 바른다. (7) 각 층의 시공간격은 온도 20 ℃에서 5∼6시간을 표준으로 한다. (8) 보강재는 1층 째의 방수층 시공이 끝난 직후, 주름 또는 변형이 생기지 않도록 주의하여 삽입한다. 3.4.3 양생 및 점검 (1) 3.2.3에 따른다. (2) 양생이 끝난 방수층을 대상으로 부착강도를 측정하여 방수층의 성능을 확인한다. 집필위원 분야 성명 소속 직급 건축 오상근 서울과학기술대학교 교수 김영근 한국건설생활환경시험연구원 수석전문위원 김수연 서울과학기술대학교 연구교수 송제영 BK방수기술연구소 소장 손종규 한국토지주택공사 부장 공민호 ㈜현대엔지니어링 책임매니저 곽규성 ㈜삼성물산 부장 조일규 ㈜제이에스기술 상무 김병일 서울과학기술대학교 부교수 최성민 ㈜나비티엔시 이사 김영삼 한국건설생활환경시험연구원 책임연구원 이정훈 BK방수기술연구소 책임연구원 박진상 ㈜신소재융합연구소 소장 이선규 한국화학융합시험연구원 선임연구원 자문위원 분야 성명 소속 강부성 서울과학기술대학교 이현수 서울대학교 김학영 대한전문건설협회 장성주 ㈜스페이스인코 정환목 경동대학교 안상로 한국지하안전협회 권기주 이노시스기술(주) 방수도료 함영재 ㈜노루페인트 방수도료 임세준 삼화페인트공업(주) 방수일반 제창현 포스코건설(주) 자착식 시트 김정일 GCP KOREA(주) 합성고분자계 시트 김승수 강남이앤알(주) 아스팔트계 시트 김진성 ㈜페트로산업 수팽창지수재 김도일 대룡공업(주) 누수보수재 박수남 ㈜성창 건설기준위원회 분야 성명 소속 건축 김갑득 포스코 김영수 부산대학교 서명석 경동대학교 신성수 한국기술사회 임남기 동명대학교 장덕배 동양미래대학교 조도연 디엔비건축사사무소 최수경 한서대학교 중앙건설기술심의위원회 성명 소속 류성룡 고려대학교 이지은 LH 토지주택 심강희 ㈜디자인그룹바탕 이준성 이화여자대학교 배시화 가천대학교 이강민 충남대학교 김강식 국토교통부 국토교통부 성명 소속 직책 오진수 국토교통부 건축안전과 과장 이지형 국토교통부 건축안전과 사무관 정연수 국토교통부 건축안전과 주무관 표준시방서 KCS 41 40 08 : 2021 시멘트 모르타르계 방수공사 2021년 8월 13일 발행 국토교통부 관련단체 대한건축학회 06687 서울특별시 서초구 효령로 87(방배동 917-9) ☎ 02-525-1841 E-mail : webmaster@aik.or.kr http://www.aik.or.kr/ 국가건설기준센터 10223 경기도 고양시 일산서구 고양대로 283(대화동) ☎ 031-910-0444 E-mail : kcsc@kict.re.kr http://www.kcsc.re.kr",
      "construction": "3. 시공 5 3.1 시멘트 모르타르계 방수공사 일반 5 3.2 시멘트 액체 방수공사 6 3.3 폴리머 시멘트 모르타르 방수공사 8 3.4 시멘트 혼입 폴리머계 방수공사 9 시멘트 모르타르계 방수공사 1. 일반사항 1.1 적용범위 이 기준은 건축물의 옥상, 실내 및 지하의 RC 표면에 시멘트 액체 방수층, 폴리머 시멘트 모르타르 방수층 또는 시멘트 혼입 폴리머계 방수층(이하 방수층이라 함.)을 시공할 경우에 적용한다. 1.2 참고 기준 1.2.1 관련 법규 내용 없음 1.2.2 관련 기준 (1) 시멘트 모르타르계 방수공사에 있어서 일반적인 사항 및 이 절에서 기술된 이외의 사항은 KCS 41 40 01을 참조하여 적용한다. (2) 기타 시멘트류 및 미장과 관련한 사항에 대하여 KCS 41 46 00을 참조하여 적용한다. KCS 41 40 01 방수공사 일반 KCS 41 46 00 미장공사 KCS 41 40 08 시멘트모르타르계 방수공사 KS F 4910 건축용 실링재 KS F 4916 시멘트 혼화용 폴리머 KS F 4919 시멘트 혼입 폴리머계 방수재 KS F 4925 시멘트 액체형 방수제 KS L 5201 포틀랜드 시멘트 1.3 용어의 정의 KCS 41 40 01 (1.3)에 따른다. 1.4 제출물 KCS 41 40 01 (1.4)에 따른다. 1.5 품질보증 KCS 41 40 01 (1.5)에 따른다. 1.6 환경유의사항 KCS 41 40 01 (1.6)에 따른다. 2. 자재 2.1 시멘트 액체방수공사용 자재 및 방수층의 품질기준 2.1.1 시멘트 시멘트는 KS L 5201의 규정에 합격하는 1종 보통 포틀랜드 시멘트를 사용한다. 2.1.2 모래 모래는 양질의 것으로 유해량의 철분, 염분, 진흙, 먼지 및 유기불순물을 함유하지 않는 표 2.1-1의 입도의 것을 사용한다. 다만, 바름두께에 지장을 주지 않는 범위 내에서 입도가 큰 것을 사용한다. 표 2.1-1 모래의 표준입도 표 2.1-1 모래의 표준입도 체의 호칭치수(mm) 종류 체를 통과하는 것의 질량 백분율(%) 5 2.5 1.2 0.6 0.3 0.15 페이스트용 모르타르용 100 80∼100 100 50∼90 45∼90 25∼65 20∼60 10∼35 5∼15 2∼10 주 : 1) 0.15 mm 이하의 입자가 표 중의 값보다 작은 것은, 이 입자 대신에 포졸란이나 기타 무기질 분말을 적량 혼입하여 사용하여도 된다. 2.1.3 물 물은 유해 함유량의 염분, 철분, 이온 및 유기물 등이 포함되지 않은 깨끗한 것을 사용한다. 2.1.4 방수제 방수제는 표 2.1-2과 같이 주성분별로 무기질계, 유기질계, 폴리머계의 3가지로 구분하며, 각 성분별 시멘트 액체 방수제는 KS F 4925의 품질기준에 적합하여야 하며, 품질의 변화가 없도록 저장하고 유효기간 내에 사용한다. 표 2.1-2 시멘트 액체 방수제의 화학조성 분류 표 2.1-2 시멘트 액체 방수제의 화학조성 분류 종류 주성분 무기질계 염화칼슘계, 규산소다계, 실리케이트계 유기질계 지방산계 지방산계, 파라핀계 폴리머계 합성고무 라텍스계, 에틸렌비닐아세테이트 에멀션계, 아크릴 에멀션계 2.1.5 기타 보조재료 시멘트 액체 방수층의 시공 시 기상적 제약 대응, 공기단축, 바탕처리 및 친화, 지수작업 및 작업성능 개선 등을 목적으로 사용하는 기타 보조 재료에는 표 2.1-3과 같은 것이 있으며, 종류 및 품질은 방수제 제조자가 지정하는 것을 사용한다. 표 2.1-3 시멘트 액체 방수공사를 위한 보조재료 표 2.1-3 시멘트 액체 방수공사를 위한 보조재료 보조재료 용도 지수제 바탕 결함부로부터의 누수를 막기 위하여 사용한다. 시멘트에 혼화하는 액체형, 물과 혼련하는 분체형 및 가수분해하는 폴리머 등이 있다. 접착제 바탕과의 접착효과 및 물적 시기 효과를 증진시키기 위하여 사용하며, 고형분 15 % 이상의 재유화형 에멀션으로 한다. 방동제 한랭시의 시공 시, 방수층의 동해를 방지할 목적으로 사용한다. 보수제 보수성의 향상과 작업성의 향상을 목적으로 사용한다. 경화촉진제 공기단축을 위하여 경화를 촉진시킬 목적으로 사용한다. 실링재 바탕 균열부의 충전 및 접합철물 주위를 실링할 목적으로 사용. KS F 4910 및 KS F 3211에 모두 충족하는 제품을 사용한다. 2.1.6 시멘트 액체 방수층의 품질 시멘트 액체 방수층은 KS F 4925의 품질기준에 적합한 것을 사용하여 방수층을 시공한 후 부착강도를 측정하고, 해당 품질기준에 적합하여야 한다. 2.2 폴리머 시멘트 모르타르 방수공사용 자재 및 방수층의 품질기준 2.2.1 시멘트 시멘트는 KS L 5201의 규정에 합격하는 1종 보통 포틀랜드 시멘트를 사용한다. 2.2.2 모 래 모래는 양질의 것으로 유해량의 철분, 염분, 진흙, 먼지 및 유기불순물을 함유하지 않은 표 2.2-1의 입도의 것을 사용한다. 다만, 바름두께에 지장을 주지 않는 범위 내에서 입도가 큰 것을 사용한다. 표 2.2-1 모래의 표준입도 표 2.2-1 모래의 표준입도 체의 호칭치수(mm) 종류 체를 통과하는 것의 질량 백분율(%) 5 2.5 1.2 0.6 0.3 0.15 초벌 바름용 재벌 바름용 정벌 바름용 100 80∼100 100 100 50∼90 70∼90 45∼90 25∼65 35∼80 20∼60 10∼35 15∼45 5∼15 2∼10 2∼10 주 : 1) 0.15 mm 이하의 입자가 표 중의 값보다 작은 것은 이 입자 대신에 포졸란이나 기타 무기질 분말을 적량 혼입하여 사용하여도 된다. 2.2.3 물 물은 유해 함유량의 염분, 철분, 이온 및 유기물 등이 포함되지 않은 깨끗한 것을 사용한다. 2.2.4 폴리머 분산제 폴리머 분산제는 KS F 4916의 규정에 적합한 것으로서 품질의 변화가 없도록 저장하고 유효기간 내에 사용한다. 2.2.5 보조재료 보조재료는 그 효과와 소요성능이 입증된 것으로서, 방수제 제조자가 지정하는 것을 사용한다. 2.2.6 폴리머 시멘트 모르타르 방수층의 품질 폴리머 시멘트 모르타르 방수층의 품질은 KS F 4916의 품질기준에 적합한 것을 사용하여 방수층을 시공한 후 부착강도를 측정하고, 해당 품질기준에 적합하여야 한다. 2.3 시멘트 혼입 폴리머계 방수공사용 자재 및 방수층의 품질기준 2.3.1 수경성 무기분체 시멘트는 KS L 5201의 규정에 합격하는 1종 보통 포틀랜드 시멘트 또는 특수 시멘트를 사용하고, 기타 무기분체(규사 및 기타)는 방수재 제조자의 지정에 따른다. 2.3.2 폴리머 분산제 시멘트 혼입 폴리머계 방수층에 사용하는 폴리머 분산제는 KS F 4916의 규정에 적합한 것으로서 품질의 변화가 없도록 저장하고, 저장 유효기간 내에 사용한다. 2.3.3 물 물은 유해 함유량의 염분, 철분, 이온 및 유기물 등이 포함되지 않은 깨끗한 것을 사용한다. 2.3.4 보조재료 (1) 도막 두께와 강도 확보를 위한 보강포(합성섬유 부직포, 유리섬유 또는 성형시트)는 그 효과와 소요성능이 입증된 것으로서 방수제 제조자가 지정하는 것을 사용한다. (2) 바탕 균열부의 충전 및 접합철물 주위를 실링할 목적으로 사용하는 실링재는 KS F 4910에 적합한 것을 사용한다. 2.3.5 시멘트 혼입 폴리머계 방수재의 품질 시멘트 혼입 폴리머계 방수재의 품질은 KS F 4919의 품질기준에 적합한 것을 사용하여야 하며, 방수층을 시공한 후 에는 부착강도를 측정하여, 해당 품질기준에 적합한지 확인하여야 한다. 3. 시공 3.1 시멘트 모르타르계 방수공사 일반 3.1.1 방수층의 종류와 적용 방수층의 종류와 적용은 표 3.1-1을 표준으로 하고, 각 방수층의 종류별 두께, 보호층 및 마감층은 공사시방에 의한다. 표 3.1-1 방수층의 종류와 적용구분 표 3.1-1 방수층의 종류와 적용구분 종류 공정 시멘트 액체방수층 폴리머 시멘트 모르타르방수층 시멘트 혼입 폴리머계 방수층 바닥용 벽체/천장용 1 종 2 종 1 층 바탕면 정리 및 물청소 바탕면 정리 및 물청소 폴리머 시멘트모르타르 폴리머 시멘트모르타르 프라이머 (0.3 ㎏/㎡) 2 층 방수액 침투 바탕접착재 도포 폴리머 시멘트모르타르 폴리머 시멘트모르타르 방수재 (0.7 ㎏/㎡) 3 층 방수시멘트 페이스트 방수시멘트 페이스트 폴리머 시멘트모르타르 － 방수재 (1.0 ㎏/㎡) 4 층 방수 모르타르 방수 모르타르 － － 보강포 5 층 - － － － 방수재 (1.0 ㎏/㎡) 6 층 － － － － 방수재 (0.7 ㎏/㎡) 적 용 부 위 실내 ○ ○ ○ ○ ○ 지하 내면 △ △ ○ △ ○ 외면 X X X X ○3) 수조1) 내면 X X X X X 외면 X X X X △ 옥상2) X X △ X △ 주 : 1) ○ 적용 가능, △ 적용 가능하나 사용 환경(수압, 태양열, 진동, 대기 온도 등)에 따라 주의를 요함, × 적용 불가 특히 음료용 수조 내부에서의 사용은 피한다. 2) 차양 또는 옥상의 배수 홈 등의 소면적 부위 사용 3) 지하벽체 외면에 적용할 경우에는 다음의 공정에 의하여 실시한다. 공정 1층 2층 3층 종류 방수재(1.0 ㎏/㎡) 방수재(1.0 ㎏/㎡) 방수재(1.0 ㎏/㎡) 3.2 시멘트 액체 방수공사 3.2.1 방수제의 배합 및 비빔 (1) 방수제는 방수제 제조자가 지정하는 비율로 혼입하고, 모르타르 믹서를 사용하여 충분히 비빈다. 이때, 방수 시멘트 페이스트의 경우에는 시멘트를 먼저 2분 이상 건비빔한 다음에 소정의 물로 희석시킨 방수제를 혼입하여 균질하게 될 때까지 5분 이상 비빈다. 방수 모르타르의 경우에는 모래, 시멘트의 순으로 믹서에 투입하고 2분 이상 건비빔한 다음에 소정의 물로 희석시킨 방수제를 혼입하여 균질하게 될 때까지 5분 이상 비빈다. (2) 믹서의 회전을 멈춘 다음 모르타르 내의 수분이나 모래의 분리가 없어야 하며, 불순물 등이 포함되지 않아야 한다. (3) 방수시멘트 모르타르의 비빔 후 사용 가능한 시간은 20 ℃에서 45분 정도가 적정하며, 그 외에는 방수제 제조자의 지정에 따른다. 3.2.2 방수층 바름 (1) 목적물의 인수 전 바탕 상태는 평탄하고, 휨, 단차, 들뜸, 레이턴스, 취약부 및 현저한 돌기물과 콘크리트 관통 크랙 등의 결함이 없는 것을 표준으로 한다(방수층 작업 완료 후 검측 및 완전한 품질점검이 완료된 최적의 상태로 후속공정에 인계한다). (2) 방수층 시공 전에 다음과 같은 부위는 실링재 또는 폴리머 시멘트 모르타르 등으로 바탕면처리를 한다(이하 “방수 바탕면정리” 작업으로 분류). ① 콘크리트 곰보 ② 콜드 조인트, 이음타설부, 콘크리트 표면 단순 균열 ③ 콘크리트를 관통하는 거푸집 고정재에 의한 구멍, 볼트, 철골, 배관 주위 ④ 콘크리트 표면의 방수층 시공 후 품질을 저해한다고 판단되는 취약부 (3) 바탕이 건조할 경우에는 시멘트 액체방수층 내부의 수분이 과도하게 흡수되지 않도록 바탕을 물로 적신다. (4) 방수층은 흙손 및 뿜칠기 등을 사용하여 소정의 두께(부착강도 측정이 가능하도록 최소 4 mm 두께 이상을 표준으로 한다)가 될 때까지 균일하게 바른다. (5) 각 공정의 바름간격은 방수제 제조자의 지정에 따른다. (6) 치켜올림 부위에는 미리 방수 시멘트 페이스트를 바르고, 그 위를 100 ㎜ 이상의 겹침을 두고 평면부와 치켜올림부를 바른다. (7) 각 공정의 이어 바르기의 겹침은 100 mm 정도로 하여 소정의 두께로 조정하고, 끝부분은 솔로 바탕과 잘 밀착시킨다. (8) 각 공정의 이어 바르기 또는 다음 공정이 미장공사일 경우에는 솔 또는 빗자루로 표면을 거칠게 마감한다. 3.2.3 양생 및 점검 (1) 바름 완료 후 재료의 특성 및 시공 장소에 따라 적절한 양생을 한다. (2) 직사일광이나 바람, 고온 등에 의한 급속한 건조가 예상되는 경우에는 살수 또는 시트 등으로 보호하여 양생한다. (3) 특히 재령의 초기에는 충격 및 진동 등의 영향을 받지 않도록 한다. (4) 저온에 의한 동결이 예상되는 경우에는 보온 또는 시트 등으로 보호하여 양생한다. (5) 양생이 끝난 방수층을 대상으로 부착강도를 측정하여 방수층의 성능을 확인한다. 3.3 폴리머 시멘트 모르타르 방수공사 3.3.1 방수제의 배합 및 비빔 (1) 배합 및 바름두께 폴리머 시멘트 모르타르의 배합 및 도막두께는 표 3.3-1에 따른다. 표 3.3-1 배합 및 바름두께의 표준치 표 3.3-1 배합 및 바름두께의 표준치 시공장소 1층(초벌바름) 2층(재벌 또는 정벌바름) 3층(정벌바름) 배합 도막두께 (mm) 배합 도막두께 (mm) 배합 도막두께 (mm) 시멘트 모래 시멘트 모래 시멘트 모래 수직부위 1 0∼1 1∼3 1 2∼2.5 7∼9 － － － 1 0∼0.5 1∼3 1 2∼2.5 7∼9 1 2∼3 10 수평부위 1 0∼1 1∼3 1 2∼2.5 20∼25 － － － 주 : 1) 용적비는 다음의 상태를 표준으로 한다. 2) 시멘트: 포틀랜드 시멘트의 단위용적 질량으로 1.2 kg 정도 3) 모래: 표면건조 포수상태에서 가볍게 채워 넣은 상태 4) 사용하는 모래가 건조되어 있을 때에는 모래의 양을 줄이고, 젖어 있을 경우에는 증가하는 등의 조정을 한다. (2) 폴리머 시멘트 모르타르의 폴리머 분산제의 혼입비율 및 물시멘트비 폴리머 시멘트 모르타르의 폴리머 분산제의 혼입비율은 10 % 이상으로 정하고, 물시멘트비는 30∼60 %의 범위 내에서 용도에 따른 작업가능성을 고려하여 최저비의 시험비빔으로 결정한다. (3) 폴리머 시멘트 모르타르의 비빔 및 사용 가능 시간 ① 폴리머 시멘트 모르타르의 비빔은 배처 믹서에 의한 기계비빔을 원칙으로 한다. ② 비빔 전에 소정량의 폴리머 분산제와 시험비빔에 의하여 결정한 물을 혼합한다. 이때 필요한 경우에는 보조재료를 첨가한다. ③ 모래, 시멘트, 필요에 따라 혼화재료의 순으로 믹서에 투입하고, 전체가 균질하게 되도록 건비빔한다. 다만, 이때의 모래는 함수율이 작은 것을 사용한다. ④ 상기의 건비빔한 혼합체에 소정량의 물로 희석한 폴리머 분산제를 첨가하여 폴리머 시멘트 모르타르의 색상이 균등하게 될 때까지 비빈다. ⑤ 폴리머 시멘트 모르타르는 비빔 후, 20 ℃의 경우에 45분 이내의 사용을 기준으로 한다. 3.3.2 방수층 바름 (1) 목적물의 인수 전 바탕 상태는 평탄하고, 휨, 단차, 들뜸, 레이턴스, 취약부 및 현저한 돌기물과 콘크리트 관통크랙 등의 결함이 없는 것을 표준으로 한다 (방수층 작업 완료 후 검측 및 완전한 품질점검이 완료된 목적물을 최적의 상태로 후속공정에 인계한다). (2) 방수층 시공 전에 다음과 같은 부위는 실링재 또는 폴리머 시멘트 모르타르 등으로 바탕면처리를 한다(이하 “방수 바탕면정리” 작업으로 분류). ① 콘크리트 곰보 ② 콜드 조인트, 이음타설부, 콘크리트 표면 단순 균열 ③ 콘크리트를 관통하는 거푸집 고정재에 의한 구멍, 볼트, 철골, 배관 주위 ④ 콘크리트 표면의 방수층 시공 후 품질을 저해한다고 판단되는 취약부 (3) 표면의 취약층, 먼지, 기름기 및 거푸집 박리제 등과 같은 방수층의 접착을 저해하는 것은 미리 제거한다. (4) 바탕이 건조할 경우에는 폴리머 시멘트 모르타르의 수분이 과도하게 흡수되지 않도록 바탕을 물로 적신다. (5) 방수층은 흙손 및 뿜칠기 등을 사용하여 소정의 두께가 될 때까지 균일하게 바른다. (6) 각 층의 시공간격은 방수제 제조자의 지정에 따른다. (7) 각 층의 이어 바르기 겹침은 100 mm 정도로 하여 소정의 두께로 조정하고, 끝 부분은 솔로 바탕과 잘 밀착시킨다. (8) 솔 또는 빗자루로 표면을 거칠게 한 다음에 이어바르기를 한다. 3.3.3 양생 및 점검 (1) 3.2.3에 따른다. (2) 양생이 끝난 방수층을 대상으로 부착강도를 측정하여 방수층의 성능을 확인한다. 3.4 시멘트 혼입 폴리머계 방수공사 3.4.1 방수제의 배합 및 비빔 (1) 방수제의 배합비율은 방수제 제조자의 지정에 따른다. (2) 에멀션 용액 중에 수경성 무기분체를 조금씩 넣어가면서 핸드믹서로 3∼5분 정도 균질하게 될 때까지 비빈다. 이때 재료분리가 일어나지 않아야 한다. (3) 방수제는 방수재 제조자가 정하는 시간 내에 사용하며, 응결된 것은 사용하지 않는다. 3.4.2 방수층 바름 (1) 목적물의 인수 전 바탕 상태는 평탄하고, 휨, 단차, 들뜸, 레이턴스, 취약부 및 현저한 돌기물 과 콘크리트 관통크랙 등의 결함이 없는 것을 표준으로 한다(방수층 작업 완료 후 검측 및 완전한 품질점검이 완료된 최적의 상태로 후속공정에 인계한다). (2) 방수층 시공 전에 다음과 같은 부위는 실링재 또는 폴리머 시멘트 모르타르 등으로 바탕면처리를 한다 (이하 “방수 바탕면정리” 작업으로 분류). ① 콘크리트 곰보 ② 콜드 조인트, 이음타설부, 콘크리트 표면 단순 균열 ③ 콘크리트를 관통하는 거푸집 고정재에 의한 구멍, 볼트, 철골, 배관 주위 ④ 콘크리트 표면의 방수층 시공 후 품질을 저해한다고 판단되는 취약부 (3) 콘크리트 표면의 취약층, 먼지, 기름기 및 거푸집 박리제 등과 같은 방수층의 접착을 저해하는 것은 미리 제거한다. (4) 바탕이 건조할 경우에는 수화응고형 방수재의 수분이 과도하게 흡수되지 않도록 바탕을 물로 적신다. (5) 프라이머는 솔, 롤러 또는 뿜칠기로 규정량을 균일하게 도포하고, 흡수가 현저할 경우에는 추가 도포하여 조정한다. (6) 방수제는 흙손을 사용하여 핀홀의 발생 등에 주의하면서 규정량을 균일하게 바른다. (7) 각 층의 시공간격은 온도 20 ℃에서 5∼6시간을 표준으로 한다. (8) 보강재는 1층 째의 방수층 시공이 끝난 직후, 주름 또는 변형이 생기지 않도록 주의하여 삽입한다. 3.4.3 양생 및 점검 (1) 3.2.3에 따른다. (2) 양생이 끝난 방수층을 대상으로 부착강도를 측정하여 방수층의 성능을 확인한다. 집필위원 분야 성명 소속 직급 건축 오상근 서울과학기술대학교 교수 김영근 한국건설생활환경시험연구원 수석전문위원 김수연 서울과학기술대학교 연구교수 송제영 BK방수기술연구소 소장 손종규 한국토지주택공사 부장 공민호 ㈜현대엔지니어링 책임매니저 곽규성 ㈜삼성물산 부장 조일규 ㈜제이에스기술 상무 김병일 서울과학기술대학교 부교수 최성민 ㈜나비티엔시 이사 김영삼 한국건설생활환경시험연구원 책임연구원 이정훈 BK방수기술연구소 책임연구원 박진상 ㈜신소재융합연구소 소장 이선규 한국화학융합시험연구원 선임연구원 자문위원 분야 성명 소속 강부성 서울과학기술대학교 이현수 서울대학교 김학영 대한전문건설협회 장성주 ㈜스페이스인코 정환목 경동대학교 안상로 한국지하안전협회 권기주 이노시스기술(주) 방수도료 함영재 ㈜노루페인트 방수도료 임세준 삼화페인트공업(주) 방수일반 제창현 포스코건설(주) 자착식 시트 김정일 GCP KOREA(주) 합성고분자계 시트 김승수 강남이앤알(주) 아스팔트계 시트 김진성 ㈜페트로산업 수팽창지수재 김도일 대룡공업(주) 누수보수재 박수남 ㈜성창 건설기준위원회 분야 성명 소속 건축 김갑득 포스코 김영수 부산대학교 서명석 경동대학교 신성수 한국기술사회 임남기 동명대학교 장덕배 동양미래대학교 조도연 디엔비건축사사무소 최수경 한서대학교 중앙건설기술심의위원회 성명 소속 류성룡 고려대학교 이지은 LH 토지주택 심강희 ㈜디자인그룹바탕 이준성 이화여자대학교 배시화 가천대학교 이강민 충남대학교 김강식 국토교통부 국토교통부 성명 소속 직책 오진수 국토교통부 건축안전과 과장 이지형 국토교통부 건축안전과 사무관 정연수 국토교통부 건축안전과 주무관 표준시방서 KCS 41 40 08 : 2021 시멘트 모르타르계 방수공사 2021년 8월 13일 발행 국토교통부 관련단체 대한건축학회 06687 서울특별시 서초구 효령로 87(방배동 917-9) ☎ 02-525-1841 E-mail : webmaster@aik.or.kr http://www.aik.or.kr/ 국가건설기준센터 10223 경기도 고양시 일산서구 고양대로 283(대화동) ☎ 031-910-0444 E-mail : kcsc@kict.re.kr http://www.kcsc.re.kr",
      "quality": "시멘트 혼입 폴리머계 방수재의 품질은 KS F 4919의 품질기준에 적합한 것을 사용하여야 하며,  방수층을 시공한 후 에는 부착강도를 측정하여, 해당 품질기준에 적합한지 확인하여야 한다.",
      "safety": "안전 및 성능 증대 등을 위한 전면 개정 개정 (2021.8) 목 차 1. 일반사항 1 1.1 적용범위 1 1.2 참고 기준 1 1.3 용어의 정의 1 1.4 제출물 1 1.5 품질보증 1 1.6 환경유의사항 2 2. 자재 2 2.1 시멘트 액체방수공사용 자재 및 방수층의 품질기준 2 2.2 폴리머 시멘트 모르타르 방수공사용 자재 및 방수층의 품질기준 3 2.3 시멘트 혼입 폴리머계 방수공사용 자재 및 방수층의 품질기준 4 3. 시공 5 3.1 시멘트 모르타르계 방수공사 일반 5 3.2 시멘트 액체 방수공사 6 3.3 폴리머 시멘트 모르타르 방수공사 8 3.4 시멘트 혼입 폴리머계 방수공사 9 시멘트 모르타르계 방수공사 1. 일반사항 1.1 적용범위 이 기준은 건축물의 옥상, 실내 및 지하의 RC 표면에 시멘트 액체 방수층, 폴리머 시멘트 모르타르 방수층 또는 시멘트 혼입 폴리머계 방수층(이하 방수층이라 함.)을 시공할 경우에 적용한다. 1.2 참고 기준 1.2.1 관련 법규 내용 없음 1.2.2 관련 기준 (1) 시멘트 모르타르계 방수공사에 있어서 일반적인 사항 및 이 절에서 기술된 이외의 사항은 KCS 41 40 01을 참조하여 적용한다. (2) 기타 시멘트류 및 미장과 관련한 사항에 대하여 KCS 41 46 00을 참조하여 적용한다. KCS 41 40 01 방수공사 일반 KCS 41 46 00 미장공사 KCS 41 40 08 시멘트모르타르계 방수공사 KS F 4910 건축용 실링재 KS F 4916 시멘트 혼화용 폴리머 KS F 4919 시멘트 혼입 폴리머계 방수재 KS F 4925 시멘트 액체형 방수제 KS L 5201 포틀랜드 시멘트 1.3 용어의 정의 KCS 41 40 01 (1.3)에 따른다. 1.4 제출물 KCS 41 40 01 (1.4)에 따른다. 1.5 품질보증 KCS 41 40 01 (1.5)에 따른다. 1.6 환경유의사항 KCS 41 40 01 (1.6)에 따른다. 2. 자재 2.1 시멘트 액체방수공사용 자재 및 방수층의 품질기준 2.1.1 시멘트 시멘트는 KS L 5201의 규정에 합격하는 1종 보통 포틀랜드 시멘트를 사용한다. 2.1.2 모래 모래는 양질의 것으로 유해량의 철분, 염분, 진흙, 먼지 및 유기불순물을 함유하지 않는 표 2.1-1의 입도의 것을 사용한다. 다만, 바름두께에 지장을 주지 않는 범위 내에서 입도가 큰 것을 사용한다. 표 2.1-1 모래의 표준입도 표 2.1-1 모래의 표준입도 체의 호칭치수(mm) 종류 체를 통과하는 것의 질량 백분율(%) 5 2.5 1.2 0.6 0.3 0.15 페이스트용 모르타르용 100 80∼100 100 50∼90 45∼90 25∼65 20∼60 10∼35 5∼15 2∼10 주 : 1) 0.15 mm 이하의 입자가 표 중의 값보다 작은 것은, 이 입자 대신에 포졸란이나 기타 무기질 분말을 적량 혼입하여 사용하여도 된다. 2.1.3 물 물은 유해 함유량의 염분, 철분, 이온 및 유기물 등이 포함되지 않은 깨끗한 것을 사용한다. 2.1.4 방수제 방수제는 표 2.1-2과 같이 주성분별로 무기질계, 유기질계, 폴리머계의 3가지로 구분하며, 각 성분별 시멘트 액체 방수제는 KS F 4925의 품질기준에 적합하여야 하며, 품질의 변화가 없도록 저장하고 유효기간 내에 사용한다. 표 2.1-2 시멘트 액체 방수제의 화학조성 분류 표 2.1-2 시멘트 액체 방수제의 화학조성 분류 종류 주성분 무기질계 염화칼슘계, 규산소다계, 실리케이트계 유기질계 지방산계 지방산계, 파라핀계 폴리머계 합성고무 라텍스계, 에틸렌비닐아세테이트 에멀션계, 아크릴 에멀션계 2.1.5 기타 보조재료 시멘트 액체 방수층의 시공 시 기상적 제약 대응, 공기단축, 바탕처리 및 친화, 지수작업 및 작업성능 개선 등을 목적으로 사용하는 기타 보조 재료에는 표 2.1-3과 같은 것이 있으며, 종류 및 품질은 방수제 제조자가 지정하는 것을 사용한다. 표 2.1-3 시멘트 액체 방수공사를 위한 보조재료 표 2.1-3 시멘트 액체 방수공사를 위한 보조재료 보조재료 용도 지수제 바탕 결함부로부터의 누수를 막기 위하여 사용한다. 시멘트에 혼화하는 액체형, 물과 혼련하는 분체형 및 가수분해하는 폴리머 등이 있다. 접착제 바탕과의 접착효과 및 물적 시기 효과를 증진시키기 위하여 사용하며, 고형분 15 % 이상의 재유화형 에멀션으로 한다. 방동제 한랭시의 시공 시, 방수층의 동해를 방지할 목적으로 사용한다. 보수제 보수성의 향상과 작업성의 향상을 목적으로 사용한다. 경화촉진제 공기단축을 위하여 경화를 촉진시킬 목적으로 사용한다. 실링재 바탕 균열부의 충전 및 접합철물 주위를 실링할 목적으로 사용. KS F 4910 및 KS F 3211에 모두 충족하는 제품을 사용한다. 2.1.6 시멘트 액체 방수층의 품질 시멘트 액체 방수층은 KS F 4925의 품질기준에 적합한 것을 사용하여 방수층을 시공한 후 부착강도를 측정하고, 해당 품질기준에 적합하여야 한다. 2.2 폴리머 시멘트 모르타르 방수공사용 자재 및 방수층의 품질기준 2.2.1 시멘트 시멘트는 KS L 5201의 규정에 합격하는 1종 보통 포틀랜드 시멘트를 사용한다. 2.2.2 모 래 모래는 양질의 것으로 유해량의 철분, 염분, 진흙, 먼지 및 유기불순물을 함유하지 않은 표 2.2-1의 입도의 것을 사용한다. 다만, 바름두께에 지장을 주지 않는 범위 내에서 입도가 큰 것을 사용한다. 표 2.2-1 모래의 표준입도 표 2.2-1 모래의 표준입도 체의 호칭치수(mm) 종류 체를 통과하는 것의 질량 백분율(%) 5 2.5 1.2 0.6 0.3 0.15 초벌 바름용 재벌 바름용 정벌 바름용 100 80∼100 100 100 50∼90 70∼90 45∼90 25∼65 35∼80 20∼60 10∼35 15∼45 5∼15 2∼10 2∼10 주 : 1) 0.15 mm 이하의 입자가 표 중의 값보다 작은 것은 이 입자 대신에 포졸란이나 기타 무기질 분말을 적량 혼입하여 사용하여도 된다. 2.2.3 물 물은 유해 함유량의 염분, 철분, 이온 및 유기물 등이 포함되지 않은 깨끗한 것을 사용한다. 2.2.4 폴리머 분산제 폴리머 분산제는 KS F 4916의 규정에 적합한 것으로서 품질의 변화가 없도록 저장하고 유효기간 내에 사용한다. 2.2.5 보조재료 보조재료는 그 효과와 소요성능이 입증된 것으로서, 방수제 제조자가 지정하는 것을 사용한다. 2.2.6 폴리머 시멘트 모르타르 방수층의 품질 폴리머 시멘트 모르타르 방수층의 품질은 KS F 4916의 품질기준에 적합한 것을 사용하여 방수층을 시공한 후 부착강도를 측정하고, 해당 품질기준에 적합하여야 한다. 2.3 시멘트 혼입 폴리머계 방수공사용 자재 및 방수층의 품질기준 2.3.1 수경성 무기분체 시멘트는 KS L 5201의 규정에 합격하는 1종 보통 포틀랜드 시멘트 또는 특수 시멘트를 사용하고, 기타 무기분체(규사 및 기타)는 방수재 제조자의 지정에 따른다. 2.3.2 폴리머 분산제 시멘트 혼입 폴리머계 방수층에 사용하는 폴리머 분산제는 KS F 4916의 규정에 적합한 것으로서 품질의 변화가 없도록 저장하고, 저장 유효기간 내에 사용한다. 2.3.3 물 물은 유해 함유량의 염분, 철분, 이온 및 유기물 등이 포함되지 않은 깨끗한 것을 사용한다. 2.3.4 보조재료 (1) 도막 두께와 강도 확보를 위한 보강포(합성섬유 부직포, 유리섬유 또는 성형시트)는 그 효과와 소요성능이 입증된 것으로서 방수제 제조자가 지정하는 것을 사용한다. (2) 바탕 균열부의 충전 및 접합철물 주위를 실링할 목적으로 사용하는 실링재는 KS F 4910에 적합한 것을 사용한다. 2.3.5 시멘트 혼입 폴리머계 방수재의 품질 시멘트 혼입 폴리머계 방수재의 품질은 KS F 4919의 품질기준에 적합한 것을 사용하여야 하며, 방수층을 시공한 후 에는 부착강도를 측정하여, 해당 품질기준에 적합한지 확인하여야 한다. 3. 시공 3.1 시멘트 모르타르계 방수공사 일반 3.1.1 방수층의 종류와 적용 방수층의 종류와 적용은 표 3.1-1을 표준으로 하고, 각 방수층의 종류별 두께, 보호층 및 마감층은 공사시방에 의한다. 표 3.1-1 방수층의 종류와 적용구분 표 3.1-1 방수층의 종류와 적용구분 종류 공정 시멘트 액체방수층 폴리머 시멘트 모르타르방수층 시멘트 혼입 폴리머계 방수층 바닥용 벽체/천장용 1 종 2 종 1 층 바탕면 정리 및 물청소 바탕면 정리 및 물청소 폴리머 시멘트모르타르 폴리머 시멘트모르타르 프라이머 (0.3 ㎏/㎡) 2 층 방수액 침투 바탕접착재 도포 폴리머 시멘트모르타르 폴리머 시멘트모르타르 방수재 (0.7 ㎏/㎡) 3 층 방수시멘트 페이스트 방수시멘트 페이스트 폴리머 시멘트모르타르 － 방수재 (1.0 ㎏/㎡) 4 층 방수 모르타르 방수 모르타르 － － 보강포 5 층 - － － － 방수재 (1.0 ㎏/㎡) 6 층 － － － － 방수재 (0.7 ㎏/㎡) 적 용 부 위 실내 ○ ○ ○ ○ ○ 지하 내면 △ △ ○ △ ○ 외면 X X X X ○3) 수조1) 내면 X X X X X 외면 X X X X △ 옥상2) X X △ X △ 주 : 1) ○ 적용 가능, △ 적용 가능하나 사용 환경(수압, 태양열, 진동, 대기 온도 등)에 따라 주의를 요함, × 적용 불가 특히 음료용 수조 내부에서의 사용은 피한다. 2) 차양 또는 옥상의 배수 홈 등의 소면적 부위 사용 3) 지하벽체 외면에 적용할 경우에는 다음의 공정에 의하여 실시한다. 공정 1층 2층 3층 종류 방수재(1.0 ㎏/㎡) 방수재(1.0 ㎏/㎡) 방수재(1.0 ㎏/㎡) 3.2 시멘트 액체 방수공사 3.2.1 방수제의 배합 및 비빔 (1) 방수제는 방수제 제조자가 지정하는 비율로 혼입하고, 모르타르 믹서를 사용하여 충분히 비빈다. 이때, 방수 시멘트 페이스트의 경우에는 시멘트를 먼저 2분 이상 건비빔한 다음에 소정의 물로 희석시킨 방수제를 혼입하여 균질하게 될 때까지 5분 이상 비빈다. 방수 모르타르의 경우에는 모래, 시멘트의 순으로 믹서에 투입하고 2분 이상 건비빔한 다음에 소정의 물로 희석시킨 방수제를 혼입하여 균질하게 될 때까지 5분 이상 비빈다. (2) 믹서의 회전을 멈춘 다음 모르타르 내의 수분이나 모래의 분리가 없어야 하며, 불순물 등이 포함되지 않아야 한다. (3) 방수시멘트 모르타르의 비빔 후 사용 가능한 시간은 20 ℃에서 45분 정도가 적정하며, 그 외에는 방수제 제조자의 지정에 따른다. 3.2.2 방수층 바름 (1) 목적물의 인수 전 바탕 상태는 평탄하고, 휨, 단차, 들뜸, 레이턴스, 취약부 및 현저한 돌기물과 콘크리트 관통 크랙 등의 결함이 없는 것을 표준으로 한다(방수층 작업 완료 후 검측 및 완전한 품질점검이 완료된 최적의 상태로 후속공정에 인계한다). (2) 방수층 시공 전에 다음과 같은 부위는 실링재 또는 폴리머 시멘트 모르타르 등으로 바탕면처리를 한다(이하 “방수 바탕면정리” 작업으로 분류). ① 콘크리트 곰보 ② 콜드 조인트, 이음타설부, 콘크리트 표면 단순 균열 ③ 콘크리트를 관통하는 거푸집 고정재에 의한 구멍, 볼트, 철골, 배관 주위 ④ 콘크리트 표면의 방수층 시공 후 품질을 저해한다고 판단되는 취약부 (3) 바탕이 건조할 경우에는 시멘트 액체방수층 내부의 수분이 과도하게 흡수되지 않도록 바탕을 물로 적신다. (4) 방수층은 흙손 및 뿜칠기 등을 사용하여 소정의 두께(부착강도 측정이 가능하도록 최소 4 mm 두께 이상을 표준으로 한다)가 될 때까지 균일하게 바른다. (5) 각 공정의 바름간격은 방수제 제조자의 지정에 따른다. (6) 치켜올림 부위에는 미리 방수 시멘트 페이스트를 바르고, 그 위를 100 ㎜ 이상의 겹침을 두고 평면부와 치켜올림부를 바른다. (7) 각 공정의 이어 바르기의 겹침은 100 mm 정도로 하여 소정의 두께로 조정하고, 끝부분은 솔로 바탕과 잘 밀착시킨다. (8) 각 공정의 이어 바르기 또는 다음 공정이 미장공사일 경우에는 솔 또는 빗자루로 표면을 거칠게 마감한다. 3.2.3 양생 및 점검 (1) 바름 완료 후 재료의 특성 및 시공 장소에 따라 적절한 양생을 한다. (2) 직사일광이나 바람, 고온 등에 의한 급속한 건조가 예상되는 경우에는 살수 또는 시트 등으로 보호하여 양생한다. (3) 특히 재령의 초기에는 충격 및 진동 등의 영향을 받지 않도록 한다. (4) 저온에 의한 동결이 예상되는 경우에는 보온 또는 시트 등으로 보호하여 양생한다. (5) 양생이 끝난 방수층을 대상으로 부착강도를 측정하여 방수층의 성능을 확인한다. 3.3 폴리머 시멘트 모르타르 방수공사 3.3.1 방수제의 배합 및 비빔 (1) 배합 및 바름두께 폴리머 시멘트 모르타르의 배합 및 도막두께는 표 3.3-1에 따른다. 표 3.3-1 배합 및 바름두께의 표준치 표 3.3-1 배합 및 바름두께의 표준치 시공장소 1층(초벌바름) 2층(재벌 또는 정벌바름) 3층(정벌바름) 배합 도막두께 (mm) 배합 도막두께 (mm) 배합 도막두께 (mm) 시멘트 모래 시멘트 모래 시멘트 모래 수직부위 1 0∼1 1∼3 1 2∼2.5 7∼9 － － － 1 0∼0.5 1∼3 1 2∼2.5 7∼9 1 2∼3 10 수평부위 1 0∼1 1∼3 1 2∼2.5 20∼25 － － － 주 : 1) 용적비는 다음의 상태를 표준으로 한다. 2) 시멘트: 포틀랜드 시멘트의 단위용적 질량으로 1.2 kg 정도 3) 모래: 표면건조 포수상태에서 가볍게 채워 넣은 상태 4) 사용하는 모래가 건조되어 있을 때에는 모래의 양을 줄이고, 젖어 있을 경우에는 증가하는 등의 조정을 한다. (2) 폴리머 시멘트 모르타르의 폴리머 분산제의 혼입비율 및 물시멘트비 폴리머 시멘트 모르타르의 폴리머 분산제의 혼입비율은 10 % 이상으로 정하고, 물시멘트비는 30∼60 %의 범위 내에서 용도에 따른 작업가능성을 고려하여 최저비의 시험비빔으로 결정한다. (3) 폴리머 시멘트 모르타르의 비빔 및 사용 가능 시간 ① 폴리머 시멘트 모르타르의 비빔은 배처 믹서에 의한 기계비빔을 원칙으로 한다. ② 비빔 전에 소정량의 폴리머 분산제와 시험비빔에 의하여 결정한 물을 혼합한다. 이때 필요한 경우에는 보조재료를 첨가한다. ③ 모래, 시멘트, 필요에 따라 혼화재료의 순으로 믹서에 투입하고, 전체가 균질하게 되도록 건비빔한다. 다만, 이때의 모래는 함수율이 작은 것을 사용한다. ④ 상기의 건비빔한 혼합체에 소정량의 물로 희석한 폴리머 분산제를 첨가하여 폴리머 시멘트 모르타르의 색상이 균등하게 될 때까지 비빈다. ⑤ 폴리머 시멘트 모르타르는 비빔 후, 20 ℃의 경우에 45분 이내의 사용을 기준으로 한다. 3.3.2 방수층 바름 (1) 목적물의 인수 전 바탕 상태는 평탄하고, 휨, 단차, 들뜸, 레이턴스, 취약부 및 현저한 돌기물과 콘크리트 관통크랙 등의 결함이 없는 것을 표준으로 한다 (방수층 작업 완료 후 검측 및 완전한 품질점검이 완료된 목적물을 최적의 상태로 후속공정에 인계한다). (2) 방수층 시공 전에 다음과 같은 부위는 실링재 또는 폴리머 시멘트 모르타르 등으로 바탕면처리를 한다(이하 “방수 바탕면정리” 작업으로 분류). ① 콘크리트 곰보 ② 콜드 조인트, 이음타설부, 콘크리트 표면 단순 균열 ③ 콘크리트를 관통하는 거푸집 고정재에 의한 구멍, 볼트, 철골, 배관 주위 ④ 콘크리트 표면의 방수층 시공 후 품질을 저해한다고 판단되는 취약부 (3) 표면의 취약층, 먼지, 기름기 및 거푸집 박리제 등과 같은 방수층의 접착을 저해하는 것은 미리 제거한다. (4) 바탕이 건조할 경우에는 폴리머 시멘트 모르타르의 수분이 과도하게 흡수되지 않도록 바탕을 물로 적신다. (5) 방수층은 흙손 및 뿜칠기 등을 사용하여 소정의 두께가 될 때까지 균일하게 바른다. (6) 각 층의 시공간격은 방수제 제조자의 지정에 따른다. (7) 각 층의 이어 바르기 겹침은 100 mm 정도로 하여 소정의 두께로 조정하고, 끝 부분은 솔로 바탕과 잘 밀착시킨다. (8) 솔 또는 빗자루로 표면을 거칠게 한 다음에 이어바르기를 한다. 3.3.3 양생 및 점검 (1) 3.2.3에 따른다. (2) 양생이 끝난 방수층을 대상으로 부착강도를 측정하여 방수층의 성능을 확인한다. 3.4 시멘트 혼입 폴리머계 방수공사 3.4.1 방수제의 배합 및 비빔 (1) 방수제의 배합비율은 방수제 제조자의 지정에 따른다. (2) 에멀션 용액 중에 수경성 무기분체를 조금씩 넣어가면서 핸드믹서로 3∼5분 정도 균질하게 될 때까지 비빈다. 이때 재료분리가 일어나지 않아야 한다. (3) 방수제는 방수재 제조자가 정하는 시간 내에 사용하며, 응결된 것은 사용하지 않는다. 3.4.2 방수층 바름 (1) 목적물의 인수 전 바탕 상태는 평탄하고, 휨, 단차, 들뜸, 레이턴스, 취약부 및 현저한 돌기물 과 콘크리트 관통크랙 등의 결함이 없는 것을 표준으로 한다(방수층 작업 완료 후 검측 및 완전한 품질점검이 완료된 최적의 상태로 후속공정에 인계한다). (2) 방수층 시공 전에 다음과 같은 부위는 실링재 또는 폴리머 시멘트 모르타르 등으로 바탕면처리를 한다 (이하 “방수 바탕면정리” 작업으로 분류). ① 콘크리트 곰보 ② 콜드 조인트, 이음타설부, 콘크리트 표면 단순 균열 ③ 콘크리트를 관통하는 거푸집 고정재에 의한 구멍, 볼트, 철골, 배관 주위 ④ 콘크리트 표면의 방수층 시공 후 품질을 저해한다고 판단되는 취약부 (3) 콘크리트 표면의 취약층, 먼지, 기름기 및 거푸집 박리제 등과 같은 방수층의 접착을 저해하는 것은 미리 제거한다. (4) 바탕이 건조할 경우에는 수화응고형 방수재의 수분이 과도하게 흡수되지 않도록 바탕을 물로 적신다. (5) 프라이머는 솔, 롤러 또는 뿜칠기로 규정량을 균일하게 도포하고, 흡수가 현저할 경우에는 추가 도포하여 조정한다. (6) 방수제는 흙손을 사용하여 핀홀의 발생 등에 주의하면서 규정량을 균일하게 바른다. (7) 각 층의 시공간격은 온도 20 ℃에서 5∼6시간을 표준으로 한다. (8) 보강재는 1층 째의 방수층 시공이 끝난 직후, 주름 또는 변형이 생기지 않도록 주의하여 삽입한다. 3.4.3 양생 및 점검 (1) 3.2.3에 따른다. (2) 양생이 끝난 방수층을 대상으로 부착강도를 측정하여 방수층의 성능을 확인한다. 집필위원 분야 성명 소속 직급 건축 오상근 서울과학기술대학교 교수 김영근 한국건설생활환경시험연구원 수석전문위원 김수연 서울과학기술대학교 연구교수 송제영 BK방수기술연구소 소장 손종규 한국토지주택공사 부장 공민호 ㈜현대엔지니어링 책임매니저 곽규성 ㈜삼성물산 부장 조일규 ㈜제이에스기술 상무 김병일 서울과학기술대학교 부교수 최성민 ㈜나비티엔시 이사 김영삼 한국건설생활환경시험연구원 책임연구원 이정훈 BK방수기술연구소 책임연구원 박진상 ㈜신소재융합연구소 소장 이선규 한국화학융합시험연구원 선임연구원 자문위원 분야 성명 소속 강부성 서울과학기술대학교 이현수 서울대학교 김학영 대한전문건설협회 장성주 ㈜스페이스인코 정환목 경동대학교 안상로 한국지하안전협회 권기주 이노시스기술(주) 방수도료 함영재 ㈜노루페인트 방수도료 임세준 삼화페인트공업(주) 방수일반 제창현 포스코건설(주) 자착식 시트 김정일 GCP KOREA(주) 합성고분자계 시트 김승수 강남이앤알(주) 아스팔트계 시트 김진성 ㈜페트로산업 수팽창지수재 김도일 대룡공업(주) 누수보수재 박수남 ㈜성창 건설기준위원회 분야 성명 소속 건축 김갑득 포스코 김영수 부산대학교 서명석 경동대학교 신성수 한국기술사회 임남기 동명대학교 장덕배 동양미래대학교 조도연 디엔비건축사사무소 최수경 한서대학교 중앙건설기술심의위원회 성명 소속 류성룡 고려대학교 이지은 LH 토지주택 심강희 ㈜디자인그룹바탕 이준성 이화여자대학교 배시화 가천대학교 이강민 충남대학교 김강식 국토교통부 국토교통부 성명 소속 직책 오진수 국토교통부 건축안전과 과장 이지형 국토교통부 건축안전과 사무관 정연수 국토교통부 건축안전과 주무관 표준시방서 KCS 41 40 08 : 2021 시멘트 모르타르계 방수공사 2021년 8월 13일 발행 국토교통부 관련단체 대한건축학회 06687 서울특별시 서초구 효령로 87(방배동 917-9) ☎ 02-525-1841 E-mail : webmaster@aik.or.kr http://www.aik.or.kr/ 국가건설기준센터 10223 경기도 고양시 일산서구 고양대로 283(대화동) ☎ 031-910-0444 E-mail : kcsc@kict.re.kr http://www.kcsc.re.kr"
    }
  },
  "metadata": {
    "quality_score": 90,
    "keywords": [
      "콘크리트",
      "시멘트",
      "배합",
      "양생",
      "거푸집",
      "볼트",
      "방수"
    ],
    "references": [
      "KCS"
    ],
    "equations": 0,
    "tables": 18
  },
  "standard_code": "KCS 41 40 08"
}