{
  "id": "EXCS 14 20 51",
  "title": "숏크리트",
  "category": "콘크리트",
  "content": {
    "full": "**표준코드**: EXCS 14 20 51 **문서 제목**: 목적 **변환일시**: 2025-07-09 16:44:45 **첨부 이미지**: 2개 Expressway Construction Specification EXCS 14 20 51 고속도로공사 전문시방서 Expressway Construction Specification EXCS 14 20 51 : 2021 숏크리트 2021년 10월 19일 개정 http://www.ex.co.kr/research 고속도로공사 전문시방서 제·개정에 따른 경과 조치 「고속도로공사 전문시방서(EXCS ; Expressway Construction Specification)」는 국가건설기준(KCS ; Korea Construction Specification)를 기본으로 하여 고속도로 시공에 관련된 공종을 대상으로 작성한 종합적인 시방기준으로서, 단위공사 설계시 해당 공사의 특성과 여건 등에 맞게 「공사시방서」를 작성하는데 활용하기 위한 「전문시방서」(Guide Specification)이므로 관계법상 구속력과 계약도서로서의 효력이 없습니다. 이 시방기준 발간 시점에 이미 시행 중인 설계용역이나 건설공사는 발주기관의 장이 필요하다고 인정하는 경우 종전에 적용하고 있는 기준을 그대로 사용할 수 있으며, 이 시방기준으로 공사시방서 작성 시 도로교통연구원 홈페이지 및 국가건설기준센터 홈페이지에 등재된 최신 시방기준을 반드시 확인 후 작성하시기 바랍니다. ※ 도로교통연구원 홈페이지 : http://www.ex.co.kr/research/ 국가건설기준센터 홈페이지 : http://www.kcsc.re.kr/ 전문시방서 제・개정 연혁 ∙ 이 시방기준은 건설기준 코드체계 전환에 따라 기존 고속도로공사 전문시방서와 국가건설기준(KCS) 간 중복·상충을 비교 검토하여 코드로 통합 정비하였다. ∙ 이 기준은 기존의 고속도로공사 전문시방서를 중심으로 KCS 14 20 51 등의 해당하는 부분을 통합 정비하여 기준으로 제정한 것으로 제⋅개정 연혁은 다음과 같다. 전문시방서 주요내용 제·개정 (년.월) 고속도로공사 전문시방서 ∙ 고속도로공사 전문시방서를 제정 제정 (1998.5) 고속도로공사 전문시방서 ∙ 제정이후 개발된 신기술 및 신공법을 고속도로공사현장에 적용하기 위하여 개정함 개정 (2000.11) 고속도로공사 전문시방서 ∙ 시대적 흐름을 반영하고 건설기술 발전에 이바지함으로써 ‘신뢰받는 국민기업 실현’을 달성하기 위하여 개정함 개정 (2004.12) 고속도로공사 전문시방서 ∙ 2차 개정 이후 기술발전과 축적된 건설기술 노하우를 반영하기 위하여 개정함 개정 (2009.7) 고속도로공사 전문시방서 ∙ 도로건설현장에 발전된 기술을 신속히 적용하기 위해 그간의 많은 연구성과와 축적된 건설기술 노하우를 반영하여 개정함 개정 (2012.10) EXCS 14 20 51 :2018 ∙ 건설기준 코드체계 전환에 따라 코드화로 통합 정비함 제정 (2018.6) EXCS 14 20 51 :2021 ∙ 코드체계화 이후 최신 건설기준을 신속히 적용하기 위해 개정함 개정 (2021.10) 제 정 : 2018년 6월 19일 심 의 : 중앙건설기술심의위원회 소 관 부 서 : 국토교통부 도로정책과 개 정 : 2021년 10월 19일 자 문 검 토 : 국가건설기준센터 건설기준위원회 관련단체 (작성기관) : 한국도로공사 (도로교통연구원) 목 차 1. 일반사항 1 1.1 적용 범위 1 1.2 참고 기준 1 1.3 용어의 정의 1 1.4 제출물 1 1.5 숏크리트 일반 1 1.6 성능의 설정 1 2. 자재 1 3. 시공 1 숏크리트 1. 일반사항 1.1 적용 범위 (1) 숏크리트의 적용 범위는 KCS 14 20 51 (1.1)에 따른다. 1.2 참고 기준 ∙ EXCS 27 30 00 터널지보재 ∙ KCS 14 20 51 숏크리트 1.3 용어의 정의 ∙ 숏크리트 용어의 정의는 KCS 14 20 51 (1.5)에 따른다. 1.4 제출물 (1) 숏크리트의 제출물은 KCS 14 20 51 (1.6)에 따른다. 1.5 숏크리트 일반 (1) 숏크리트 일반은 KCS 14 20 51 (1.2)에 따른다. 1.6 성능의 설정 (1) 성능의 설정은 KCS 14 20 51 (1.6)에 따른다. 단, 터널 지보재로 사용되는 숏크리트의 성능은 EXCS 27 30 00 (3.2.5.2)의 기준을 적용한다. 2. 자재 (1) 숏크리트의 자재는 KCS 14 20 51 (2)에 따른다. 3. 시공 (1) 숏크리트의 시공은 KCS 14 20 51 (3)에 따른다. 집필위원 성 명 소 속 성 명 소 속 김진철 한국도로공사 이상돈 한국도로공사 김홍삼 한국도로공사 김정학 한국도로공사 조현식 한국도로공사 박아론 한국도로공사 자문위원 성 명 소 속 성 명 소 속 이지훈 서영엔지니어링 이원철 삼보기술단 엄종욱 (주)케이에스엠기술 이선호 도담 ENG 김충언 삼현 PF 국가건설기준센터 및 건설기준위원회 성 명 소 속 성 명 소 속 이영호 한국건설기술연구원 이재훈 영남대학교 이용수 한국건설기술연구원 정해문 한국도로공사 구재동 한국건설기술연구원 김영진 한국콘크리트학회 김태송 한국건설기술연구원 최정욱 한국콘크리트학회 최봉혁 한국건설기술연구원 김선우 충남대학교 김기현 한국건설기술연구원 김성수 대진대학교 김희석 한국건설기술연구원 김지상 서경대학교 류상훈 한국건설기술연구원 노병철 상지대학교 허원호 한국건설기술연구원 윤현도 충남대학교 김나은 한국건설기술연구원 장승엽 한국교통대학교 주영경 한국건설기술연구원 최석환 국민대학교 이승환 한국건설기술연구원 홍건호 호서대학교 이여경 한국건설기술연구원 장봉석 K-water 원훈일 한국건설기술연구원 승종명 (주)승이엔지 이지훈 ㈜서영엔지니어링 김현욱 포스코건설 중앙건설기술심의위원회 성 명 소 속 성 명 소 속 곽재진 서울지방국토관리청 안지환 한국건설기술연구원 임광수 ㈜이산 정평기 ㈜화인씨이엠테크 이수빈 고려개발(주) 신중호 한국지질자원연구원 이충원 행정안전부 소관부처 성 명 소 속 성 명 소 속 장순재 국토교통부 도로정책과 김 호 국토교통부 도로정책과 고속도로공사 전문시방서 EXCS 14 20 51 : 2021 숏크리트 2021년 10월 발행 소관부서 국토교통부 관련단체 한국도로공사 (39660) 경상북도 김천시 혁신8로 77 한국도로공사 ☎ 1588-2504(대표) http://www.ex.co.kr 작성기관 한국도로공사 도로교통연구원 (18489) 경기도 화성시 동부대로 922번길 208-96 ☎ 031-8098-6044(품질시험센터) http://www.ex.co.kr/research 국가건설기준센터 (10223) 경기도 고양시 일산서구 고양대로 283(대화동) ☎ 031-910-0444 http://www.kcsc.re.kr",
    "sections": {
      "scope": "1.1 적용 범위 1 1.2 참고 기준 1 1.3 용어의 정의 1 1.4 제출물 1 1.5 숏크리트 일반 1 1.6 성능의 설정 1 2. 자재 1 3. 시공 1 숏크리트 1. 일반사항 1.1 적용 범위 (1) 숏크리트의 적용 범위는 KCS 14 20 51 (1.1)에 따른다. 1.2 참고 기준 ∙ EXCS 27 30 00 터널지보재 ∙ KCS 14 20 51 숏크리트 1.3 용어의 정의 ∙ 숏크리트 용어의 정의는 KCS 14 20 51 (1.5)에 따른다. 1.4 제출물 (1) 숏크리트의 제출물은 KCS 14 20 51 (1.6)에 따른다. 1.5 숏크리트 일반 (1) 숏크리트 일반은 KCS 14 20 51 (1.2)에 따른다. 1.6 성능의 설정 (1) 성능의 설정은 KCS 14 20 51 (1.6)에 따른다. 단, 터널 지보재로 사용되는 숏크리트의 성능은 EXCS 27 30 00 (3.2.5.2)의 기준을 적용한다. 2. 자재 (1) 숏크리트의 자재는 KCS 14 20 51 (2)에 따른다. 3. 시공 (1) 숏크리트의 시공은 KCS 14 20 51 (3)에 따른다. 집필위원 성 명 소 속 성 명 소 속 김진철 한국도로공사 이상돈 한국도로공사 김홍삼 한국도로공사 김정학 한국도로공사 조현식 한국도로공사 박아론 한국도로공사 자문위원 성 명 소 속 성 명 소 속 이지훈 서영엔지니어링 이원철 삼보기술단 엄종욱 (주)케이에스엠기술 이선호 도담 ENG 김충언 삼현 PF 국가건설기준센터 및 건설기준위원회 성 명 소 속 성 명 소 속 이영호 한국건설기술연구원 이재훈 영남대학교 이용수 한국건설기술연구원 정해문 한국도로공사 구재동 한국건설기술연구원 김영진 한국콘크리트학회 김태송 한국건설기술연구원 최정욱 한국콘크리트학회 최봉혁 한국건설기술연구원 김선우 충남대학교 김기현 한국건설기술연구원 김성수 대진대학교 김희석 한국건설기술연구원 김지상 서경대학교 류상훈 한국건설기술연구원 노병철 상지대학교 허원호 한국건설기술연구원 윤현도 충남대학교 김나은 한국건설기술연구원 장승엽 한국교통대학교 주영경 한국건설기술연구원 최석환 국민대학교 이승환 한국건설기술연구원 홍건호 호서대학교 이여경 한국건설기술연구원 장봉석 K-water 원훈일 한국건설기술연구원 승종명 (주)승이엔지 이지훈 ㈜서영엔지니어링 김현욱 포스코건설 중앙건설기술심의위원회 성 명 소 속 성 명 소 속 곽재진 서울지방국토관리청 안지환 한국건설기술연구원 임광수 ㈜이산 정평기 ㈜화인씨이엠테크 이수빈 고려개발(주) 신중호 한국지질자원연구원 이충원 행정안전부 소관부처 성 명 소 속 성 명 소 속 장순재 국토교통부 도로정책과 김 호 국토교통부 도로정책과 고속도로공사 전문시방서 EXCS 14 20 51 : 2021 숏크리트 2021년 10월 발행 소관부서 국토교통부 관련단체 한국도로공사 (39660) 경상북도 김천시 혁신8로 77 한국도로공사 ☎ 1588-2504(대표) http://www.ex.co.kr 작성기관 한국도로공사 도로교통연구원 (18489) 경기도 화성시 동부대로 922번길 208-96 ☎ 031-8098-6044(품질시험센터) http://www.ex.co.kr/research 국가건설기준센터 (10223) 경기도 고양시 일산서구 고양대로 283(대화동) ☎ 031-910-0444 http://www.kcsc.re.kr",
      "materials": "2. 자재 1 3. 시공 1 숏크리트 1. 일반사항 1.1 적용 범위 (1) 숏크리트의 적용 범위는 KCS 14 20 51 (1.1)에 따른다. 1.2 참고 기준 ∙ EXCS 27 30 00 터널지보재 ∙ KCS 14 20 51 숏크리트 1.3 용어의 정의 ∙ 숏크리트 용어의 정의는 KCS 14 20 51 (1.5)에 따른다. 1.4 제출물 (1) 숏크리트의 제출물은 KCS 14 20 51 (1.6)에 따른다. 1.5 숏크리트 일반 (1) 숏크리트 일반은 KCS 14 20 51 (1.2)에 따른다. 1.6 성능의 설정 (1) 성능의 설정은 KCS 14 20 51 (1.6)에 따른다. 단, 터널 지보재로 사용되는 숏크리트의 성능은 EXCS 27 30 00 (3.2.5.2)의 기준을 적용한다. 2. 자재 (1) 숏크리트의 자재는 KCS 14 20 51 (2)에 따른다. 3. 시공 (1) 숏크리트의 시공은 KCS 14 20 51 (3)에 따른다. 집필위원 성 명 소 속 성 명 소 속 김진철 한국도로공사 이상돈 한국도로공사 김홍삼 한국도로공사 김정학 한국도로공사 조현식 한국도로공사 박아론 한국도로공사 자문위원 성 명 소 속 성 명 소 속 이지훈 서영엔지니어링 이원철 삼보기술단 엄종욱 (주)케이에스엠기술 이선호 도담 ENG 김충언 삼현 PF 국가건설기준센터 및 건설기준위원회 성 명 소 속 성 명 소 속 이영호 한국건설기술연구원 이재훈 영남대학교 이용수 한국건설기술연구원 정해문 한국도로공사 구재동 한국건설기술연구원 김영진 한국콘크리트학회 김태송 한국건설기술연구원 최정욱 한국콘크리트학회 최봉혁 한국건설기술연구원 김선우 충남대학교 김기현 한국건설기술연구원 김성수 대진대학교 김희석 한국건설기술연구원 김지상 서경대학교 류상훈 한국건설기술연구원 노병철 상지대학교 허원호 한국건설기술연구원 윤현도 충남대학교 김나은 한국건설기술연구원 장승엽 한국교통대학교 주영경 한국건설기술연구원 최석환 국민대학교 이승환 한국건설기술연구원 홍건호 호서대학교 이여경 한국건설기술연구원 장봉석 K-water 원훈일 한국건설기술연구원 승종명 (주)승이엔지 이지훈 ㈜서영엔지니어링 김현욱 포스코건설 중앙건설기술심의위원회 성 명 소 속 성 명 소 속 곽재진 서울지방국토관리청 안지환 한국건설기술연구원 임광수 ㈜이산 정평기 ㈜화인씨이엠테크 이수빈 고려개발(주) 신중호 한국지질자원연구원 이충원 행정안전부 소관부처 성 명 소 속 성 명 소 속 장순재 국토교통부 도로정책과 김 호 국토교통부 도로정책과 고속도로공사 전문시방서 EXCS 14 20 51 : 2021 숏크리트 2021년 10월 발행 소관부서 국토교통부 관련단체 한국도로공사 (39660) 경상북도 김천시 혁신8로 77 한국도로공사 ☎ 1588-2504(대표) http://www.ex.co.kr 작성기관 한국도로공사 도로교통연구원 (18489) 경기도 화성시 동부대로 922번길 208-96 ☎ 031-8098-6044(품질시험센터) http://www.ex.co.kr/research 국가건설기준센터 (10223) 경기도 고양시 일산서구 고양대로 283(대화동) ☎ 031-910-0444 http://www.kcsc.re.kr",
      "construction": "(1) 숏크리트의 시공은 KCS 14 20 51 (3)에 따른다.\n집필위원\n성 명\n소 속\n성 명\n소 속\n김진철\n한국도로공사\n이상돈\n한국도로공사\n김홍삼\n한국도로공사\n김정학\n한국도로공사\n조현식\n한국도로공사\n박아론\n한국도로공사\n자문위원\n성 명\n소 속\n성 명\n소 속\n이지훈\n서영엔지니어링\n이원철\n삼보기술단\n엄종욱\n(주)케이에스엠기술\n이선호\n도담 ENG\n김충언\n삼현 PF\n국가건설기준센터 및 건설기준위원회\n성 명\n소 속\n성 명\n소 속\n이영호\n한국건설기술연구원\n이재훈\n영남대학교\n이용수\n한국건설기술연구원\n정해문\n한국도로공사\n구재동\n한국건설기술연구원\n김영진\n한국콘크리트학회\n김태송\n한국건설기술연구원\n최정욱\n한국콘크리트학회\n최봉혁\n한국건설기술연구원\n김선우\n충남대학교\n김기현\n한국건설기술연구원\n김성수\n대진대학교\n김희석\n한국건설기술연구원\n김지상\n서경대학교\n류상훈\n한국건설기술연구원\n노병철\n상지대학교\n허원호\n한국건설기술연구원\n윤현도\n충남대학교\n김나은\n한국건설기술연구원\n장승엽\n한국교통대학교\n주영경\n한국건설기술연구원\n최석환\n국민대학교\n이승환\n한국건설기술연구원\n홍건호\n호서대학교\n이여경\n한국건설기술연구원\n장봉석\nK-water \n원훈일\n한국건설기술연구원\n승종명\n(주)승이엔지\n이지훈\n㈜서영엔지니어링\n김현욱\n포스코건설\n중앙건설기술심의위원회\n성 명\n소 속\n성 명\n소 속\n곽재진\n서울지방국토관리청\n안지환\n한국건설기술연구원\n임광수\n㈜이산\n정평기\n㈜화인씨이엠테크\n이수빈\n고려개발(주)\n신중호\n한국지질자원연구원\n이충원\n행정안전부\n소관부처\n성 명\n소 속\n성 명\n소 속\n장순재\n국토교통부 도로정책과\n김 호\n국토교통부 도로정책과\n고속도로공사 전문시방서\nEXCS 14 20 51 : 2021\n숏크리트\n2021년 10월 발행\n소관부서 국토교통부\n관련단체 한국도로공사\n(39660) 경상북도 김천시 혁신8로 77 한국도로공사\n☎ 1588-2504(대표)\nhttp://www.ex.co.kr\n작성기관 한국도로공사 도로교통연구원\n(18489) 경기도 화성시 동부대로 922번길 208-96\n☎ 031-8098-6044(품질시험센터)\nhttp://www.ex.co.kr/research\n국가건설기준센터\n(10223) 경기도 고양시 일산서구 고양대로 283(대화동)\n☎ 031-910-0444\nhttp://www.kcsc.re.kr\n## 테이블\n### 테이블 1\n### 테이블 2\n### 테이블 3\n### 테이블 4\n### 테이블 5\n### 테이블 6\n### 테이블 7\n### 테이블 8\n### 테이블 9\n### 테이블 10\n### 테이블 11\n### 테이블 12\n### 테이블 13\n### 테이블 14\n### 테이블 15\n### 테이블 16\n### 테이블 17",
      "quality": "품질시험센터) http://www.ex.co.kr/research 국가건설기준센터 (10223) 경기도 고양시 일산서구 고양대로 283(대화동) ☎ 031-910-0444 http://www.kcsc.re.kr",
      "safety": ""
    }
  },
  "metadata": {
    "quality_score": 60,
    "keywords": [
      "콘크리트",
      "품질시험"
    ],
    "references": [
      "KCS",
      "EXCS"
    ],
    "equations": 0,
    "tables": 0
  },
  "standard_code": "EXCS 14 20 51"
}