{
  "id": "EXCS 41 40 03",
  "title": "개량아스팔트 시트방수(부대시설편)",
  "category": "건축",
  "content": {
    "full": "**표준코드**: EXCS 41 40 03 **문서 제목**: 목적 **변환일시**: 2025-07-09 16:44:54 **첨부 이미지**: 1개 Expressway Construction Specification EXCS 41 40 03 고속도로공사 전문시방서 Expressway Construction Specification EXCS 41 40 03 : 2021 개량아스팔트 시트방수 (부대시설편) 2021년 8월 5일 제정 http://www.kcsc.re.kr 고속도로공사 전문시방서 제·개정에 따른 경과 조치 「고속도로공사 전문시방서(EXCS ; Expressway Construction Specification)」는 국가건설기준(KCS ; Korea Construction Specification)를 기본으로 하여 고속도로 시공에 관련된 공종을 대상으로 작성한 종합적인 시방기준으로서, 단위공사 설계시 해당 공사의 특성과 여건 등에 맞게 「공사시방서」를 작성하는데 활용하기 위한 「전문시방서」(Guide Specification)이므로 관계법상 구속력과 계약도서로서의 효력이 없습니다. 이 시방기준 발간 시점에 이미 시행 중인 설계용역이나 건설공사는 발주기관의 장이 필요하다고 인정하는 경우 종전에 적용하고 있는 기준을 그대로 사용할 수 있으며, 이 시방기준으로 공사시방서 작성 시 도로교통연구원 홈페이지 및 국가건설기준센터 홈페이지에 등재된 최신 시방기준을 반드시 확인 후 작성하시기 바랍니다. ※ 도로교통연구원 홈페이지 : http://www.ex.co.kr/research/ 국가건설기준센터 홈페이지 : http://www.kcsc.re.kr/ 건설기준 연혁 ∙ 이 시방기준은 건설기준 코드체계 전환에 따라 기존 고속도로공사 전문시방서와 건설기준(표준시방서) 간 중복·상충을 비교 검토하여 코드로 통합 정비하였다. ∙ 이 기준은 기존의 고속도로공사 전문시방서를 중심으로 KCS 41 40 03 등의 해당하는 부분을 통합 정비하여 기준으로 제정한 것으로 제⋅개정 연혁은 다음과 같다. 건설기준 주요내용 제정 또는 개정 (년.월) 고속도로공사 전문시방서(부대시설편) ∙ 고속도로공사 전문시방서 부대시설편을 제정 제정 (2002.2) 고속도로공사 전문시방서(부대시설편) ∙ 시대적 흐름을 반영하고 건설기술 발전에 이바지함으로써 ‘신뢰받는 국민기업 실현’을 달성하기 위하여 개정함 개정 (2005.12) EXCS 41 40 03 :2021 ∙ 건설기준 코드체계 전환에 따라 코드화로 통합 정비함 제정 (2021.8) 제 정 : 2021년 8월 5일 심 의 : 중앙건설기술심의위원회 소관부서 : 국토교통부 도로정책과 관련단체 : 한국도로공사 개 정 : 년 월 일 자문검토 : 국가건설기준센터 건설기준위원회 작성기관 : 한국도로공사 목 차 1. 일반사항 1 1.1 적용 범위 1 1.2 참고 기준 1 1.3 용어의 정의 1 1.4 제출물 1 1.4.1 시공상세도면 1 1.4.2 제품자료 1 1.4.3 자격 1 1.4.4 시공계획서 1 1.4.5 시공상태 확인서 2 1.4.6 견본 2 1.5 품질보증 2 1.5.1 시험시공 2 1.5.2 보증 2 1.6 운반, 보관 및 취급 2 1.7 환경조건 2 2. 자재 2 2.1 프라이머 2 2.2 개량아스팔트 방수 2 2.3 덧붙임용 시트 3 2.4 점착층 붙은 시트 3 2.5 실링재 3 2.6 단열재 3 2.7 단열재용 접착제 3 2.8 부속재 3 2.8.1 마감도료 3 2.8.2 보호완충재 3 2.8.3 누름철물 3 2.8.4 탈기장치 4 2.9 자재품질관리 4 2.9.1 시험 4 2.9.2 자재검수 4 2.10 기타 재료 4 3. 시공 4 3.1 바탕준비 4 3.2 방수층 시공 4 3.2.1 시공순서 4 3.2.2 프라이머 도포 6 3.2.3 방수시트 붙이기 6 3.2.4 단열재 붙이기 6 3.2.5 특수부위 처리 6 3.3 보호층 시공 7 3.3.1 바닥(옥내･ 외) 7 3.3.2 벽(치켜올림부 포함) 7 3.4 현장품질관리 7 3.4.1 담수시험 7 3.4.2 시공상태 확인 7 1. 일반사항 1.1 적용범위 (1) 개량아스팔트 시트방수 적용범위는 설계도면이 지정하는 개량아스팔트 시트방수에 관하여 적용한다. 1.2 참고 기준 (1) 개량아스팔트 시트방수의 참고 기준은 KCS 41 40 03 (1.2.2)을 따르되 아래의 사항을 추가하여 적용한다. (2) EXCS 41 40 02 아스팔트 방수공사(부대시설편) (3) EXCS 41 40 04 합성고분자계 시트방수(부대시설편) 1.3 용어의 정의 내용 없음 1.4 제출물 (1) 다음 사항은 EXCS 10 10 10에 따라 제출한다. 1.4.1 시공상세도면 (1) 부위별 방수시공상세도 ① 치켜올림, 감아내림, 오목모서리, 볼록모서리, 단차, 신축줄눈, 이음타설부, 드레인주위, 파라펫 주위, 고정철물주위 및 설비배관 관통부주위의 방수시공상세도 1.4.2 제품자료 (1) 개량아스팔트 시트방수에 대한 제조업자의 제품자료로서 프라이머, 실링재, 부속재에 관한 자료가 포함되어야 한다. 1.4.3 자격 (1) 방수공사 시공자는 해당부분의 시공자 또는 기능공의 방수 시공 경력이 3년 이상이며 동종의 방수시공 경험이 3회 이상 되는 자의 자격을 확인할 수 있는 증빙자료를 방수전문 건설업체로 하여금 제출하도록 한다. 1.4.4 시공계획서 (1) 다음 사항이 포함되어야 한다. ① 자재의 운반 및 보관계획 ② 방수층 및 보호층 시공계획 ③ 품질관리 및 담수시험계획 1.4.5 시공상태 확인서 (1) 이 기준의 3.4.2 시공상태확인의 규정에 의하여 시공상태 확인을 받도록 되어 있는 항목에 대하여 시공상태확인서를 제출한다. 1.4.6 견본 (1) 다음 품목에 대한 제조업자의 제품견본 및 성능 분석표를 제출하여야 한다. ① 시트방수재 (규격 300×300 mm 하드롱지 또는 합판에 부착) ② 방수부자재 1.5 품질보증 1.5.1 시험시공 (1) 공사감독자가 지정하는 위치에 방수부위의 유형별로 1개소씩 견본시공을 한다. (2) 공사감독자의 승인을 득한 경우 시험 시공부위를 시공등의 일부분으로 간주한다. 1.5.2 보증 (1) 누수, 재료의 노후와 퇴락, 파괴를 포함하여 부실공사와 부실재료는 품질보증기간 내에 개수 또는 교체하여야 한다. 1.6 운반, 보관 및 취급 (1) 시트 방수재는 비나 서리가 맞지 않는 장소에 직사광선을 피하여 보관하여야하며 박리지 및 모서리가 손상되지 않도록 취급하여야 한다. (2) 접착제 : 밀봉 상태로 보관하고 화기에 주의하여야 한다. 1.7 환경조건 (1) 강우 강설시 또는 강우 강설이 예상될 경우, 바탕이 건조되지 않은 경우 시공해서는 안 된다. (2) 방수작업중과 작업 전 24시간은 주위온도가 5 ℃이상 되도록 하여야 하며 바탕에는 얼음, 서리, 습기가 없어야 한다. 2. 자재 2.1 프라이머 (1) 프라이머는 KCS 41 40 03 (2.1)에 따른다. 2.2 개량아스팔트 방수 (1) 개량아스팔트 시트방수는 KCS 41 40 03 (2.2.1)에 따르되 아래의 사항을 추가하여 적용한다. 표 2.2-1 개량 아스팔트 시트방수의 치수 용도에 의한 구분 두께(mm)* 나비(cm) 길이(m) 노출 단층방수용 3.5 이상 (4.0 이상) 인수･인도 당사자간의 협정에 따르나 100 이상을 표준으로 한다. 인수･인도 당사자간의 협정에 따르나 7.0 이상을 표준으로 한다. 노출 복층방수용 2.5 이상 (3.0 이상) 비노출 단층방수용 3.0 이상 (3.5 이상) 비노출 복층방수용 2.0 이상 (2.5 이상) [범례]* : ( )내의 숫자는 토오치 버너를 사용하여 시공하는 시트방수에 적용한다. 2.3 덧붙임용 시트 (1) 덧붙임용 시트는 KCS 41 40 03 (2.2.2)에 따른다. 2.4 점착층 붙은 시트 (1) 점착층 붙은 시트는 KCS 41 40 03 (2.2.3)에 따른다. 2.5 실링재 (1) 실링재는 KCS 41 40 03 (2.3)에 따른다. 2.6 단열재 (1) 단열재는 KCS 41 40 03 (2.4)에 따른다. 2.7 단열재용 접착제 (1) 단열재용 접착제는 KCS 41 40 03 (2.4.1)에 따른다. 2.8 부속재 (1) 부속재는 KCS 41 40 03 (2.5)에 따른다. 2.8.1 마감도료 (1) 마감도료는 KCS 41 40 03 (2.5.1)에 따른다. 2.8.2 보호완충재 (1) 개량아스팔트 시트방수의 덧붙임용 시트는 KCS 41 40 03 (2.2.2)을 따른다. 2.8.3 누름철물 (1) 누름철물는 KCS 41 40 03 (2.5.3)을 따른다. 2.8.4 탈기장치 (1) 탈기장치는 KCS 41 40 03 (2.5.4)을 따른다. 2.9 자재품질관리 2.9.1 시험 (1) 시트방수재 : 제조회사별, 제품규격별 KS F 4917에 규정된 인장강도, 신장율, 가열 신축성상, 접착성능 시험을 하여야 한다. 2.9.2 자재검수 (1) 방수자재 현장 반입 시 제조업자명, 제조년월일, 유효사용기간에 대하여 공사감독자 입회검수를 받고 사전에 제출한 자재 공급 승인된 바와 같은 제품의 내용이 확인, 승인된 자재에 대하여 현장에 반입하여야 한다. 2.10 기타 재료 (1) 기타 재료는 KCS 41 40 03 (2.6)을 따른다. 3. 시공 3.1 바탕준비 (1) 시공부위는 레이턴스 및 시멘트 등의 부스러기, 기름, 흙 등 방수재의 밀착을 저해하는 불순물이 없어야 하며, 충분히 건조되어 있어야 한다. 돌출물 등이 있어 면이 평탄치 못할 경우에는 면 고르기를 한 후 깨끗이 청소하되, 이 때 청소기 등을 이용하여 미세한 분말도 제거하여 프라이머의 접착성능을 확보한다. 청소 완료 후 곧바로 프라이머 처리를 한다. (2) 콘크리트면에 균열이 있는 경우 에폭시 수지를 주입하고 들뜸부위는 에폭시 모르타르로 보수하되, 세부 보수방법은 보수재료 및 방수재 제조업자의 관련 제품자료에 따른다. (3) 방수시공 부위 이외의 주변은 방수재로 인해 오염되지 않도록 한다. (4) 벽돌면 바탕은 특기가 없는 경우, 60 mm 초벌 시멘트 모르타르 바르기를 하여야 한다. 3.2 방수층 시공 3.2.1 시공순서 (1) 개량 아스팔트 시트방수층의 시공순서는 아래표의 방수층 종류에 따른다. 표 3.2-1 개량 아스팔트 시트 방수층의 종류 종별 공정 보행용 전면접착 (M‐PrF) 노출용 전면접착(M‐MiF*) 노출용 단열재 삽입 (M‐MiT) a b 1 층 프라이머 (0.4 kg/m2) 프라이머 (0.4 kg/m2) 프라이머 (0.4 kg/m2) 프라이머 (0.4 kg/m2) 2 층 개량 아스팔트 시트 (비노출복층방수용) 2.5 mm 이상 개량 아스팔트 시트 (노출단층방수용) 4.0 mm 이상 개량 아스팔트 시트 (비노출복층방수용) 2.5 mm 이상 접 착 제 3 층 개량 아스팔트 시트 (비노출복층방수용) 2.5 mm 이상 ‐ 개량 아스팔트 시트 (노출복층방수용) 3.0 mm 이상 단 열 재 4 층 ‐ ‐ ‐ 점착층 붙은 개량 아스팔트 시트 2.0 mm 이상 5 층 ‐ ‐ ‐ 개량 아스팔트 시트 (노출복층방수용) 3.0 mm 이상 보호 ･마감 현장타설콘크리트･아스팔트콘크리트･콘크리트블록･ 모르타르･자갈 마감도료 또는 없음 주) 최상층에 노출용의 개량 아스팔트 시트를 사용하여 전면밀착으로 하는 공법은 a, b의 2종류가 있으며, 적용부위에 따라 자유로이 선택하여 적용할 수 있다. 1) 치켜올림 및 감아내림부는 누름철물로 고정하고 실링재로 처리한다. 다만, 실내에서 방수층의 치켜올림 높이가 낮을 경우에는 누름철물을 제외할 수도 있다. 2) 오목모서리에는 미리 폭 200 mm 정도의 덧붙임용 시트를 붙여둔다. 3) 보행용 전면접착(M‐PrF) 공법에서 치켜올림부의 보호･마감을 마감도료 또는 하지 않을 경우에는, 평면의 공정 3의 개량 아스팔트 시트를 오목모서리 앞에서 시공을 멈추고, 두께 3 mm 이상의 노출 복층방수용 개량 아스팔트 시트를 200 mm 걸쳐 붙인 다음에 치켜올림부를 붙인다. 4) 드레인 주변에는 500 mm 각 정도의 덧붙임용 시트를 사용한다. 5) 파이프 주변에는 덧붙임용 시트를 적절하게 혼합하여 사용한다. 6) ALC를 바탕으로 할 경우에는 표면을 미장마감 하거나, 공정 1의 프라이머를 0.6 kg/m2로 한다. 7) 노출용 단열재 삽입(M‐MiT) 공법의 공정 1의 프라이머, 공정 2의 접착제의 사용량은 접착제의 종류에 따라 달라진다. 8) PC 또는 ALC패널의 이음줄눈부는 덧붙임용 시트로 양쪽으로 100 mm 정도씩 걸쳐 붙인다. 9) 노출용 단열재 삽입(M‐MiT) 공법에서의 단열재의 두께는 공사기준에 의한다. 10) 보행용 전면접착(M‐PrF) 공법에서 단열재를 사용할 경우에는 방수층과 보호･마감 사이에 두고, 그 두께는 공사기준에 의한다. 11) 노출용 전면접착(M‐MiF)과 노출용 단열재 삽입(M‐MiT) 공법에는 필요에 따라서 구멍뚫린 아스팔트 루핑을 붙이고, 탈기장치를 설치한다. 12) 마감도료의 종류와 기준은 개량 아스팔트 시트 제조자의 지정에 따른다. 13) 루핑류는 바탕면적에 대하여 1.2 kg/m2 사용을 원칙으로 한다. (2) 방수층의 적용은 아래표를 표준으로 하며 그 지정은 공사기준에 의한다. 단열재를 사용하는 경우와 탈기장치를 설치할 경우에는 공사기준에 따른다. 표 3.2-2 방수층의 적용 종 별 보행용 전면접착 (M-PrF) 노출용 전면접착(M‐MiF) 노출용 단열재 삽입(M‐MiT) 적용부위 적용바탕 a b 지 붕 RC ○ ○ ○ ○ PC ○* ○ ○ ○ ALC - ○ ○ ○ 차 양 RC - ○ - - PC - ○ - - 지하외벽(외부쪽) RC ○ - - - 실 내 욕실 등 RC ○ - - - 주차장 RC ○ - - - 수 영 장 RC ○ - - - 인공연못･정원 RC ○ - - - 바탕(바닥)의 구배 1/100 ~ 1/50 1/50 ~ 1/20 [범례] ○ : 적용, -: 표준외 * : 아스팔트 콘크리트, 콘크리트 블록, 자갈에 의한 보호 ･ 마감에 한함 3.2.2 프라이머의 도포 (1) 프라이머의 도포는 KCS 41 40 03 (3.1)에 따른다. 3.2.3 방수시트 붙이기 (1) 방수시트 붙이기는 KCS 41 40 03 (3.2)에 따른다. 3.2.4 단열재 붙이기 (1) 단열재 붙이기는 KCS 41 40 03 (3.3)에 따른다. 3.2.5 특수부위 처리 (1) 특수부위 처리는 KCS 41 40 03 (3.4)에 따른다. 3.3 보호층 시공 (1) 개량 아스팔트 시트방수층을 후속공정이나 관련공정 작업으로 인하여 파손되지 않게 잘 보호 양생하기 위하여 다음과 같은 보호층을 시공한다. 다만, 땅속에 묻히는 외벽이나 바닥의 경우에는 보호 완충재를 부착하는 등의 방법으로 할 수 있으며 이 경우에 반드시 공사기준으로 그 자재 및 시공방법 등을 명기하여야 한다. 기타 관련사항은 EXCS 41 40 02 (3.4)에 따른다. 3.3.1 바닥(옥내 ･ 외) (1) 시트 방수층위에 두께 15 mm 이상의 보호 모르타르를 시공한 후에 마감층(누름콘크리트, 타일, 기타)을 시공한다. 3.3.2 벽(치켜올림부 포함) (1) 방수층에서 20 mm 이상 떨어지게 조적 등으로 쌓되 반드시 공간을 모르타르 등으로 잘 채워주고, 조적벽에 마감층을 시공한다. 3.4 현장 품질관리 3.4.1 담수시험 (1) 담수시험은 아래순서에 따라서 실시하며, 기타 방법으로 담수 및 살수 시험을 할 경우는 공사기준에 의한다. ① 배수관계의 구멍(배수트랩, 루프드레인)은 이물질 등이 들어가지 않도록 막아둔다. ② 치켜올림한 방수층의 끝부분이 잠기지 않도록 물을 채우고, 24시간 정도 누수여부를 확인한다. 필요에 따라서는 치켜올림 높이까지 물을 채우고 24시간 더 누수 여부를 확인할 수도 있다. ③ 누수 없음을 확인한 다음, 담수한 물을 배수구로 흘려보내 배수의 양부나 급격한 배수로 인해 발생될 수 있는 누수를 확인한다. ④ 누수부위가 발견되면 물을 배수시키고 건조후 보수하고 보수가 완료되면 위와 같은 순서로 누수가 발견되지 않을 때까지 반복한다. 3.4.2 시공상태 확인 (1) 바탕건조 및 표면상태 검사 (2) 방수층 구성 및 두께검사 (3) 루프드레인, 개구부, 슬리브, 치켜올림부위 검사 (4) 방수층의 손상, 파단, 겹침길이, 주름, 들뜸 검사 (5) 방수층 보호 시공 검사 집필위원 성 명 소 속 성 명 소 속 박경탁 한국도로공사 자문위원 성 명 소 속 성 명 소 속 국가건설기준센터 및 건설기준위원회 성 명 소 속 성 명 소 속 이영호 한국건설기술연구원 이여경 한국건설기술연구원 이용수 한국건설기술연구원 원훈일 한국건설기술연구원 구재동 한국건설기술연구원 김한수 건국대학교 김태송 한국건설기술연구원 남정수 충남대학교 최봉혁 한국건설기술연구원 박순규 서울특별시 김기현 한국건설기술연구원 서명석 경동대학교 김희석 한국건설기술연구원 송제영 BK방수기술연구소 류상훈 한국건설기술연구원 신성수 한국기술사회 허원호 한국건설기술연구원 오상근 서울과학기술대학교 김나은 한국건설기술연구원 장덕배 동양미래대학교 주영경 한국건설기술연구원 최수경 한서대학교 이승환 한국건설기술연구원 중앙건설기술심의위원회 성 명 소 속 성 명 소 속 강선영 ㈜선엔지니어링종합건축사사무소 빈혜진 다옴스페이스 김동관 청주대학교 유정한 서울과학기술대학교 김성민 LH 최윤기 숭실대학교 김천학 한국시설안전공단 국토교통부 성 명 소 속 성 명 소 속 장순재 국토교통부 도로정책과 김호 국토교통부 도로정책과 EXCS 41 40 03 : 2021 개량아스팔트 시트방수(부대시설편) 2021년 8월 5일 발행 소관부서 국토교통부 관련단체 한국도로공사 (39660) 경상북도 김천시 혁신8로 77 한국도로공사 ☎ 1588-2504(대표) http://www.ex.co.kr 국가건설기준센터 10223 경기도 고양시 일산서구 고양대로 283(대화동) Tel : 031-910-0444 http://www.kcsc.re.kr",
    "sections": {
      "scope": "1.1 적용 범위 1 1.2 참고 기준 1 1.3 용어의 정의 1 1.4 제출물 1 1.4.1 시공상세도면 1 1.4.2 제품자료 1 1.4.3 자격 1 1.4.4 시공계획서 1 1.4.5 시공상태 확인서 2 1.4.6 견본 2 1.5 품질보증 2 1.5.1 시험시공 2 1.5.2 보증 2 1.6 운반, 보관 및 취급 2 1.7 환경조건 2 2. 자재 2 2.1 프라이머 2 2.2 개량아스팔트 방수 2 2.3 덧붙임용 시트 3 2.4 점착층 붙은 시트 3 2.5 실링재 3 2.6 단열재 3 2.7 단열재용 접착제 3 2.8 부속재 3 2.8.1 마감도료 3 2.8.2 보호완충재 3 2.8.3 누름철물 3 2.8.4 탈기장치 4 2.9 자재품질관리 4 2.9.1 시험 4 2.9.2 자재검수 4 2.10 기타 재료 4 3. 시공 4 3.1 바탕준비 4 3.2 방수층 시공 4 3.2.1 시공순서 4 3.2.2 프라이머 도포 6 3.2.3 방수시트 붙이기 6 3.2.4 단열재 붙이기 6 3.2.5 특수부위 처리 6 3.3 보호층 시공 7 3.3.1 바닥(옥내･ 외) 7 3.3.2 벽(치켜올림부 포함) 7 3.4 현장품질관리 7 3.4.1 담수시험 7 3.4.2 시공상태 확인 7 1. 일반사항 1.1 적용범위 (1) 개량아스팔트 시트방수 적용범위는 설계도면이 지정하는 개량아스팔트 시트방수에 관하여 적용한다. 1.2 참고 기준 (1) 개량아스팔트 시트방수의 참고 기준은 KCS 41 40 03 (1.2.2)을 따르되 아래의 사항을 추가하여 적용한다. (2) EXCS 41 40 02 아스팔트 방수공사(부대시설편) (3) EXCS 41 40 04 합성고분자계 시트방수(부대시설편) 1.3 용어의 정의 내용 없음 1.4 제출물 (1) 다음 사항은 EXCS 10 10 10에 따라 제출한다. 1.4.1 시공상세도면 (1) 부위별 방수시공상세도 ① 치켜올림, 감아내림, 오목모서리, 볼록모서리, 단차, 신축줄눈, 이음타설부, 드레인주위, 파라펫 주위, 고정철물주위 및 설비배관 관통부주위의 방수시공상세도 1.4.2 제품자료 (1) 개량아스팔트 시트방수에 대한 제조업자의 제품자료로서 프라이머, 실링재, 부속재에 관한 자료가 포함되어야 한다. 1.4.3 자격 (1) 방수공사 시공자는 해당부분의 시공자 또는 기능공의 방수 시공 경력이 3년 이상이며 동종의 방수시공 경험이 3회 이상 되는 자의 자격을 확인할 수 있는 증빙자료를 방수전문 건설업체로 하여금 제출하도록 한다. 1.4.4 시공계획서 (1) 다음 사항이 포함되어야 한다. ① 자재의 운반 및 보관계획 ② 방수층 및 보호층 시공계획 ③ 품질관리 및 담수시험계획 1.4.5 시공상태 확인서 (1) 이 기준의 3.4.2 시공상태확인의 규정에 의하여 시공상태 확인을 받도록 되어 있는 항목에 대하여 시공상태확인서를 제출한다. 1.4.6 견본 (1) 다음 품목에 대한 제조업자의 제품견본 및 성능 분석표를 제출하여야 한다. ① 시트방수재 (규격 300×300 mm 하드롱지 또는 합판에 부착) ② 방수부자재 1.5 품질보증 1.5.1 시험시공 (1) 공사감독자가 지정하는 위치에 방수부위의 유형별로 1개소씩 견본시공을 한다. (2) 공사감독자의 승인을 득한 경우 시험 시공부위를 시공등의 일부분으로 간주한다. 1.5.2 보증 (1) 누수, 재료의 노후와 퇴락, 파괴를 포함하여 부실공사와 부실재료는 품질보증기간 내에 개수 또는 교체하여야 한다. 1.6 운반, 보관 및 취급 (1) 시트 방수재는 비나 서리가 맞지 않는 장소에 직사광선을 피하여 보관하여야하며 박리지 및 모서리가 손상되지 않도록 취급하여야 한다. (2) 접착제 : 밀봉 상태로 보관하고 화기에 주의하여야 한다. 1.7 환경조건 (1) 강우 강설시 또는 강우 강설이 예상될 경우, 바탕이 건조되지 않은 경우 시공해서는 안 된다. (2) 방수작업중과 작업 전 24시간은 주위온도가 5 ℃이상 되도록 하여야 하며 바탕에는 얼음, 서리, 습기가 없어야 한다. 2. 자재 2.1 프라이머 (1) 프라이머는 KCS 41 40 03 (2.1)에 따른다. 2.2 개량아스팔트 방수 (1) 개량아스팔트 시트방수는 KCS 41 40 03 (2.2.1)에 따르되 아래의 사항을 추가하여 적용한다. 표 2.2-1 개량 아스팔트 시트방수의 치수 용도에 의한 구분 두께(mm)* 나비(cm) 길이(m) 노출 단층방수용 3.5 이상 (4.0 이상) 인수･인도 당사자간의 협정에 따르나 100 이상을 표준으로 한다. 인수･인도 당사자간의 협정에 따르나 7.0 이상을 표준으로 한다. 노출 복층방수용 2.5 이상 (3.0 이상) 비노출 단층방수용 3.0 이상 (3.5 이상) 비노출 복층방수용 2.0 이상 (2.5 이상) [범례]* : ( )내의 숫자는 토오치 버너를 사용하여 시공하는 시트방수에 적용한다. 2.3 덧붙임용 시트 (1) 덧붙임용 시트는 KCS 41 40 03 (2.2.2)에 따른다. 2.4 점착층 붙은 시트 (1) 점착층 붙은 시트는 KCS 41 40 03 (2.2.3)에 따른다. 2.5 실링재 (1) 실링재는 KCS 41 40 03 (2.3)에 따른다. 2.6 단열재 (1) 단열재는 KCS 41 40 03 (2.4)에 따른다. 2.7 단열재용 접착제 (1) 단열재용 접착제는 KCS 41 40 03 (2.4.1)에 따른다. 2.8 부속재 (1) 부속재는 KCS 41 40 03 (2.5)에 따른다. 2.8.1 마감도료 (1) 마감도료는 KCS 41 40 03 (2.5.1)에 따른다. 2.8.2 보호완충재 (1) 개량아스팔트 시트방수의 덧붙임용 시트는 KCS 41 40 03 (2.2.2)을 따른다. 2.8.3 누름철물 (1) 누름철물는 KCS 41 40 03 (2.5.3)을 따른다. 2.8.4 탈기장치 (1) 탈기장치는 KCS 41 40 03 (2.5.4)을 따른다. 2.9 자재품질관리 2.9.1 시험 (1) 시트방수재 : 제조회사별, 제품규격별 KS F 4917에 규정된 인장강도, 신장율, 가열 신축성상, 접착성능 시험을 하여야 한다. 2.9.2 자재검수 (1) 방수자재 현장 반입 시 제조업자명, 제조년월일, 유효사용기간에 대하여 공사감독자 입회검수를 받고 사전에 제출한 자재 공급 승인된 바와 같은 제품의 내용이 확인, 승인된 자재에 대하여 현장에 반입하여야 한다. 2.10 기타 재료 (1) 기타 재료는 KCS 41 40 03 (2.6)을 따른다. 3. 시공 3.1 바탕준비 (1) 시공부위는 레이턴스 및 시멘트 등의 부스러기, 기름, 흙 등 방수재의 밀착을 저해하는 불순물이 없어야 하며, 충분히 건조되어 있어야 한다. 돌출물 등이 있어 면이 평탄치 못할 경우에는 면 고르기를 한 후 깨끗이 청소하되, 이 때 청소기 등을 이용하여 미세한 분말도 제거하여 프라이머의 접착성능을 확보한다. 청소 완료 후 곧바로 프라이머 처리를 한다. (2) 콘크리트면에 균열이 있는 경우 에폭시 수지를 주입하고 들뜸부위는 에폭시 모르타르로 보수하되, 세부 보수방법은 보수재료 및 방수재 제조업자의 관련 제품자료에 따른다. (3) 방수시공 부위 이외의 주변은 방수재로 인해 오염되지 않도록 한다. (4) 벽돌면 바탕은 특기가 없는 경우, 60 mm 초벌 시멘트 모르타르 바르기를 하여야 한다. 3.2 방수층 시공 3.2.1 시공순서 (1) 개량 아스팔트 시트방수층의 시공순서는 아래표의 방수층 종류에 따른다. 표 3.2-1 개량 아스팔트 시트 방수층의 종류 종별 공정 보행용 전면접착 (M‐PrF) 노출용 전면접착(M‐MiF*) 노출용 단열재 삽입 (M‐MiT) a b 1 층 프라이머 (0.4 kg/m2) 프라이머 (0.4 kg/m2) 프라이머 (0.4 kg/m2) 프라이머 (0.4 kg/m2) 2 층 개량 아스팔트 시트 (비노출복층방수용) 2.5 mm 이상 개량 아스팔트 시트 (노출단층방수용) 4.0 mm 이상 개량 아스팔트 시트 (비노출복층방수용) 2.5 mm 이상 접 착 제 3 층 개량 아스팔트 시트 (비노출복층방수용) 2.5 mm 이상 ‐ 개량 아스팔트 시트 (노출복층방수용) 3.0 mm 이상 단 열 재 4 층 ‐ ‐ ‐ 점착층 붙은 개량 아스팔트 시트 2.0 mm 이상 5 층 ‐ ‐ ‐ 개량 아스팔트 시트 (노출복층방수용) 3.0 mm 이상 보호 ･마감 현장타설콘크리트･아스팔트콘크리트･콘크리트블록･ 모르타르･자갈 마감도료 또는 없음 주) 최상층에 노출용의 개량 아스팔트 시트를 사용하여 전면밀착으로 하는 공법은 a, b의 2종류가 있으며, 적용부위에 따라 자유로이 선택하여 적용할 수 있다. 1) 치켜올림 및 감아내림부는 누름철물로 고정하고 실링재로 처리한다. 다만, 실내에서 방수층의 치켜올림 높이가 낮을 경우에는 누름철물을 제외할 수도 있다. 2) 오목모서리에는 미리 폭 200 mm 정도의 덧붙임용 시트를 붙여둔다. 3) 보행용 전면접착(M‐PrF) 공법에서 치켜올림부의 보호･마감을 마감도료 또는 하지 않을 경우에는, 평면의 공정 3의 개량 아스팔트 시트를 오목모서리 앞에서 시공을 멈추고, 두께 3 mm 이상의 노출 복층방수용 개량 아스팔트 시트를 200 mm 걸쳐 붙인 다음에 치켜올림부를 붙인다. 4) 드레인 주변에는 500 mm 각 정도의 덧붙임용 시트를 사용한다. 5) 파이프 주변에는 덧붙임용 시트를 적절하게 혼합하여 사용한다. 6) ALC를 바탕으로 할 경우에는 표면을 미장마감 하거나, 공정 1의 프라이머를 0.6 kg/m2로 한다. 7) 노출용 단열재 삽입(M‐MiT) 공법의 공정 1의 프라이머, 공정 2의 접착제의 사용량은 접착제의 종류에 따라 달라진다. 8) PC 또는 ALC패널의 이음줄눈부는 덧붙임용 시트로 양쪽으로 100 mm 정도씩 걸쳐 붙인다. 9) 노출용 단열재 삽입(M‐MiT) 공법에서의 단열재의 두께는 공사기준에 의한다. 10) 보행용 전면접착(M‐PrF) 공법에서 단열재를 사용할 경우에는 방수층과 보호･마감 사이에 두고, 그 두께는 공사기준에 의한다. 11) 노출용 전면접착(M‐MiF)과 노출용 단열재 삽입(M‐MiT) 공법에는 필요에 따라서 구멍뚫린 아스팔트 루핑을 붙이고, 탈기장치를 설치한다. 12) 마감도료의 종류와 기준은 개량 아스팔트 시트 제조자의 지정에 따른다. 13) 루핑류는 바탕면적에 대하여 1.2 kg/m2 사용을 원칙으로 한다. (2) 방수층의 적용은 아래표를 표준으로 하며 그 지정은 공사기준에 의한다. 단열재를 사용하는 경우와 탈기장치를 설치할 경우에는 공사기준에 따른다. 표 3.2-2 방수층의 적용 종 별 보행용 전면접착 (M-PrF) 노출용 전면접착(M‐MiF) 노출용 단열재 삽입(M‐MiT) 적용부위 적용바탕 a b 지 붕 RC ○ ○ ○ ○ PC ○* ○ ○ ○ ALC - ○ ○ ○ 차 양 RC - ○ - - PC - ○ - - 지하외벽(외부쪽) RC ○ - - - 실 내 욕실 등 RC ○ - - - 주차장 RC ○ - - - 수 영 장 RC ○ - - - 인공연못･정원 RC ○ - - - 바탕(바닥)의 구배 1/100 ~ 1/50 1/50 ~ 1/20 [범례] ○ : 적용, -: 표준외 * : 아스팔트 콘크리트, 콘크리트 블록, 자갈에 의한 보호 ･ 마감에 한함 3.2.2 프라이머의 도포 (1) 프라이머의 도포는 KCS 41 40 03 (3.1)에 따른다. 3.2.3 방수시트 붙이기 (1) 방수시트 붙이기는 KCS 41 40 03 (3.2)에 따른다. 3.2.4 단열재 붙이기 (1) 단열재 붙이기는 KCS 41 40 03 (3.3)에 따른다. 3.2.5 특수부위 처리 (1) 특수부위 처리는 KCS 41 40 03 (3.4)에 따른다. 3.3 보호층 시공 (1) 개량 아스팔트 시트방수층을 후속공정이나 관련공정 작업으로 인하여 파손되지 않게 잘 보호 양생하기 위하여 다음과 같은 보호층을 시공한다. 다만, 땅속에 묻히는 외벽이나 바닥의 경우에는 보호 완충재를 부착하는 등의 방법으로 할 수 있으며 이 경우에 반드시 공사기준으로 그 자재 및 시공방법 등을 명기하여야 한다. 기타 관련사항은 EXCS 41 40 02 (3.4)에 따른다. 3.3.1 바닥(옥내 ･ 외) (1) 시트 방수층위에 두께 15 mm 이상의 보호 모르타르를 시공한 후에 마감층(누름콘크리트, 타일, 기타)을 시공한다. 3.3.2 벽(치켜올림부 포함) (1) 방수층에서 20 mm 이상 떨어지게 조적 등으로 쌓되 반드시 공간을 모르타르 등으로 잘 채워주고, 조적벽에 마감층을 시공한다. 3.4 현장 품질관리 3.4.1 담수시험 (1) 담수시험은 아래순서에 따라서 실시하며, 기타 방법으로 담수 및 살수 시험을 할 경우는 공사기준에 의한다. ① 배수관계의 구멍(배수트랩, 루프드레인)은 이물질 등이 들어가지 않도록 막아둔다. ② 치켜올림한 방수층의 끝부분이 잠기지 않도록 물을 채우고, 24시간 정도 누수여부를 확인한다. 필요에 따라서는 치켜올림 높이까지 물을 채우고 24시간 더 누수 여부를 확인할 수도 있다. ③ 누수 없음을 확인한 다음, 담수한 물을 배수구로 흘려보내 배수의 양부나 급격한 배수로 인해 발생될 수 있는 누수를 확인한다. ④ 누수부위가 발견되면 물을 배수시키고 건조후 보수하고 보수가 완료되면 위와 같은 순서로 누수가 발견되지 않을 때까지 반복한다. 3.4.2 시공상태 확인 (1) 바탕건조 및 표면상태 검사 (2) 방수층 구성 및 두께검사 (3) 루프드레인, 개구부, 슬리브, 치켜올림부위 검사 (4) 방수층의 손상, 파단, 겹침길이, 주름, 들뜸 검사 (5) 방수층 보호 시공 검사 집필위원 성 명 소 속 성 명 소 속 박경탁 한국도로공사 자문위원 성 명 소 속 성 명 소 속 국가건설기준센터 및 건설기준위원회 성 명 소 속 성 명 소 속 이영호 한국건설기술연구원 이여경 한국건설기술연구원 이용수 한국건설기술연구원 원훈일 한국건설기술연구원 구재동 한국건설기술연구원 김한수 건국대학교 김태송 한국건설기술연구원 남정수 충남대학교 최봉혁 한국건설기술연구원 박순규 서울특별시 김기현 한국건설기술연구원 서명석 경동대학교 김희석 한국건설기술연구원 송제영 BK방수기술연구소 류상훈 한국건설기술연구원 신성수 한국기술사회 허원호 한국건설기술연구원 오상근 서울과학기술대학교 김나은 한국건설기술연구원 장덕배 동양미래대학교 주영경 한국건설기술연구원 최수경 한서대학교 이승환 한국건설기술연구원 중앙건설기술심의위원회 성 명 소 속 성 명 소 속 강선영 ㈜선엔지니어링종합건축사사무소 빈혜진 다옴스페이스 김동관 청주대학교 유정한 서울과학기술대학교 김성민 LH 최윤기 숭실대학교 김천학 한국시설안전공단 국토교통부 성 명 소 속 성 명 소 속 장순재 국토교통부 도로정책과 김호 국토교통부 도로정책과 EXCS 41 40 03 : 2021 개량아스팔트 시트방수(부대시설편) 2021년 8월 5일 발행 소관부서 국토교통부 관련단체 한국도로공사 (39660) 경상북도 김천시 혁신8로 77 한국도로공사 ☎ 1588-2504(대표) http://www.ex.co.kr 국가건설기준센터 10223 경기도 고양시 일산서구 고양대로 283(대화동) Tel : 031-910-0444 http://www.kcsc.re.kr",
      "materials": "(1) 방수자재 현장 반입 시 제조업자명, 제조년월일, 유효사용기간에 대하여 공사감독자 입회검수를 받고 사전에 제출한 자재 공급 승인된 바와 같은 제품의 내용이 확인, 승인된 자재에 대하여 현장에 반입하여야 한다.",
      "construction": "(1) 바탕건조 및 표면상태 검사 \n(2) 방수층 구성 및 두께검사 \n(3) 루프드레인, 개구부, 슬리브, 치켜올림부위 검사 \n(4) 방수층의 손상, 파단, 겹침길이, 주름, 들뜸 검사 \n(5) 방수층 보호 시공 검사 \n집필위원\n성 명\n소 속\n성 명\n소 속\n박경탁\n한국도로공사\n자문위원\n성 명\n소 속\n성 명\n소 속\n국가건설기준센터 및 건설기준위원회\n성 명\n소 속\n성 명\n소 속\n이영호\n한국건설기술연구원\n이여경\n한국건설기술연구원\n이용수\n한국건설기술연구원\n원훈일\n한국건설기술연구원\n구재동\n한국건설기술연구원\n김한수\n건국대학교\n김태송\n한국건설기술연구원\n남정수\n충남대학교\n최봉혁\n한국건설기술연구원\n박순규\n서울특별시\n김기현\n한국건설기술연구원\n서명석\n경동대학교\n김희석\n한국건설기술연구원\n송제영\nBK방수기술연구소\n류상훈\n한국건설기술연구원\n신성수\n한국기술사회\n허원호\n한국건설기술연구원\n오상근\n서울과학기술대학교\n김나은\n한국건설기술연구원\n장덕배\n동양미래대학교\n주영경\n한국건설기술연구원\n최수경\n한서대학교\n이승환\n한국건설기술연구원\n중앙건설기술심의위원회\n성 명\n소 속\n성 명\n소 속\n강선영\n㈜선엔지니어링종합건축사사무소\n빈혜진\n다옴스페이스\n김동관\n청주대학교\n유정한\n서울과학기술대학교\n김성민\nLH\n최윤기\n숭실대학교\n김천학\n한국시설안전공단\n국토교통부\n성 명\n소 속\n성 명\n소 속\n장순재\n국토교통부 도로정책과\n김호\n국토교통부 도로정책과\nEXCS 41 40 03 : 2021\n개량아스팔트 시트방수(부대시설편)\n2021년 8월 5일 발행\n소관부서   국토교통부\n관련단체   한국도로공사\n(39660) 경상북도 김천시 혁신8로 77 한국도로공사\n☎ 1588-2504(대표)\nhttp://www.ex.co.kr\n국가건설기준센터\n10223 경기도 고양시 일산서구 고양대로 283(대화동)\nTel : 031-910-0444\nhttp://www.kcsc.re.kr\n## 테이블\n### 테이블 1\n### 테이블 2\n### 테이블 3\n### 테이블 4\n### 테이블 5\n### 테이블 6\n### 테이블 7\n### 테이블 8\n### 테이블 9\n### 테이블 10\n### 테이블 11\n### 테이블 12\n### 테이블 13\n### 테이블 14\n### 테이블 15\n### 테이블 16\n### 테이블 17\n### 테이블 18\n### 테이블 19\n### 테이블 20",
      "quality": "품질관리 4 2.9.1 시험 4 2.9.2 자재검수 4 2.10 기타 재료 4 3. 시공 4 3.1 바탕준비 4 3.2 방수층 시공 4 3.2.1 시공순서 4 3.2.2 프라이머 도포 6 3.2.3 방수시트 붙이기 6 3.2.4 단열재 붙이기 6 3.2.5 특수부위 처리 6 3.3 보호층 시공 7 3.3.1 바닥(옥내･ 외) 7 3.3.2 벽(치켜올림부 포함) 7 3.4 현장품질관리 7 3.4.1 담수시험 7 3.4.2 시공상태 확인 7 1. 일반사항 1.1 적용범위 (1) 개량아스팔트 시트방수 적용범위는 설계도면이 지정하는 개량아스팔트 시트방수에 관하여 적용한다. 1.2 참고 기준 (1) 개량아스팔트 시트방수의 참고 기준은 KCS 41 40 03 (1.2.2)을 따르되 아래의 사항을 추가하여 적용한다. (2) EXCS 41 40 02 아스팔트 방수공사(부대시설편) (3) EXCS 41 40 04 합성고분자계 시트방수(부대시설편) 1.3 용어의 정의 내용 없음 1.4 제출물 (1) 다음 사항은 EXCS 10 10 10에 따라 제출한다. 1.4.1 시공상세도면 (1) 부위별 방수시공상세도 ① 치켜올림, 감아내림, 오목모서리, 볼록모서리, 단차, 신축줄눈, 이음타설부, 드레인주위, 파라펫 주위, 고정철물주위 및 설비배관 관통부주위의 방수시공상세도 1.4.2 제품자료 (1) 개량아스팔트 시트방수에 대한 제조업자의 제품자료로서 프라이머, 실링재, 부속재에 관한 자료가 포함되어야 한다. 1.4.3 자격 (1) 방수공사 시공자는 해당부분의 시공자 또는 기능공의 방수 시공 경력이 3년 이상이며 동종의 방수시공 경험이 3회 이상 되는 자의 자격을 확인할 수 있는 증빙자료를 방수전문 건설업체로 하여금 제출하도록 한다. 1.4.4 시공계획서 (1) 다음 사항이 포함되어야 한다. ① 자재의 운반 및 보관계획 ② 방수층 및 보호층 시공계획 ③ 품질관리 및 담수시험계획 1.4.5 시공상태 확인서 (1) 이 기준의 3.4.2 시공상태확인의 규정에 의하여 시공상태 확인을 받도록 되어 있는 항목에 대하여 시공상태확인서를 제출한다. 1.4.6 견본 (1) 다음 품목에 대한 제조업자의 제품견본 및 성능 분석표를 제출하여야 한다. ① 시트방수재 (규격 300×300 mm 하드롱지 또는 합판에 부착) ② 방수부자재 1.5 품질보증 1.5.1 시험시공 (1) 공사감독자가 지정하는 위치에 방수부위의 유형별로 1개소씩 견본시공을 한다. (2) 공사감독자의 승인을 득한 경우 시험 시공부위를 시공등의 일부분으로 간주한다. 1.5.2 보증 (1) 누수, 재료의 노후와 퇴락, 파괴를 포함하여 부실공사와 부실재료는 품질보증기간 내에 개수 또는 교체하여야 한다. 1.6 운반, 보관 및 취급 (1) 시트 방수재는 비나 서리가 맞지 않는 장소에 직사광선을 피하여 보관하여야하며 박리지 및 모서리가 손상되지 않도록 취급하여야 한다. (2) 접착제 : 밀봉 상태로 보관하고 화기에 주의하여야 한다. 1.7 환경조건 (1) 강우 강설시 또는 강우 강설이 예상될 경우, 바탕이 건조되지 않은 경우 시공해서는 안 된다. (2) 방수작업중과 작업 전 24시간은 주위온도가 5 ℃이상 되도록 하여야 하며 바탕에는 얼음, 서리, 습기가 없어야 한다. 2. 자재 2.1 프라이머 (1) 프라이머는 KCS 41 40 03 (2.1)에 따른다. 2.2 개량아스팔트 방수 (1) 개량아스팔트 시트방수는 KCS 41 40 03 (2.2.1)에 따르되 아래의 사항을 추가하여 적용한다. 표 2.2-1 개량 아스팔트 시트방수의 치수 용도에 의한 구분 두께(mm)* 나비(cm) 길이(m) 노출 단층방수용 3.5 이상 (4.0 이상) 인수･인도 당사자간의 협정에 따르나 100 이상을 표준으로 한다. 인수･인도 당사자간의 협정에 따르나 7.0 이상을 표준으로 한다. 노출 복층방수용 2.5 이상 (3.0 이상) 비노출 단층방수용 3.0 이상 (3.5 이상) 비노출 복층방수용 2.0 이상 (2.5 이상) [범례]* : ( )내의 숫자는 토오치 버너를 사용하여 시공하는 시트방수에 적용한다. 2.3 덧붙임용 시트 (1) 덧붙임용 시트는 KCS 41 40 03 (2.2.2)에 따른다. 2.4 점착층 붙은 시트 (1) 점착층 붙은 시트는 KCS 41 40 03 (2.2.3)에 따른다. 2.5 실링재 (1) 실링재는 KCS 41 40 03 (2.3)에 따른다. 2.6 단열재 (1) 단열재는 KCS 41 40 03 (2.4)에 따른다. 2.7 단열재용 접착제 (1) 단열재용 접착제는 KCS 41 40 03 (2.4.1)에 따른다. 2.8 부속재 (1) 부속재는 KCS 41 40 03 (2.5)에 따른다. 2.8.1 마감도료 (1) 마감도료는 KCS 41 40 03 (2.5.1)에 따른다. 2.8.2 보호완충재 (1) 개량아스팔트 시트방수의 덧붙임용 시트는 KCS 41 40 03 (2.2.2)을 따른다. 2.8.3 누름철물 (1) 누름철물는 KCS 41 40 03 (2.5.3)을 따른다. 2.8.4 탈기장치 (1) 탈기장치는 KCS 41 40 03 (2.5.4)을 따른다. 2.9 자재품질관리 2.9.1 시험 (1) 시트방수재 : 제조회사별, 제품규격별 KS F 4917에 규정된 인장강도, 신장율, 가열 신축성상, 접착성능 시험을 하여야 한다. 2.9.2 자재검수 (1) 방수자재 현장 반입 시 제조업자명, 제조년월일, 유효사용기간에 대하여 공사감독자 입회검수를 받고 사전에 제출한 자재 공급 승인된 바와 같은 제품의 내용이 확인, 승인된 자재에 대하여 현장에 반입하여야 한다. 2.10 기타 재료 (1) 기타 재료는 KCS 41 40 03 (2.6)을 따른다. 3. 시공 3.1 바탕준비 (1) 시공부위는 레이턴스 및 시멘트 등의 부스러기, 기름, 흙 등 방수재의 밀착을 저해하는 불순물이 없어야 하며, 충분히 건조되어 있어야 한다. 돌출물 등이 있어 면이 평탄치 못할 경우에는 면 고르기를 한 후 깨끗이 청소하되, 이 때 청소기 등을 이용하여 미세한 분말도 제거하여 프라이머의 접착성능을 확보한다. 청소 완료 후 곧바로 프라이머 처리를 한다. (2) 콘크리트면에 균열이 있는 경우 에폭시 수지를 주입하고 들뜸부위는 에폭시 모르타르로 보수하되, 세부 보수방법은 보수재료 및 방수재 제조업자의 관련 제품자료에 따른다. (3) 방수시공 부위 이외의 주변은 방수재로 인해 오염되지 않도록 한다. (4) 벽돌면 바탕은 특기가 없는 경우, 60 mm 초벌 시멘트 모르타르 바르기를 하여야 한다. 3.2 방수층 시공 3.2.1 시공순서 (1) 개량 아스팔트 시트방수층의 시공순서는 아래표의 방수층 종류에 따른다. 표 3.2-1 개량 아스팔트 시트 방수층의 종류 종별 공정 보행용 전면접착 (M‐PrF) 노출용 전면접착(M‐MiF*) 노출용 단열재 삽입 (M‐MiT) a b 1 층 프라이머 (0.4 kg/m2) 프라이머 (0.4 kg/m2) 프라이머 (0.4 kg/m2) 프라이머 (0.4 kg/m2) 2 층 개량 아스팔트 시트 (비노출복층방수용) 2.5 mm 이상 개량 아스팔트 시트 (노출단층방수용) 4.0 mm 이상 개량 아스팔트 시트 (비노출복층방수용) 2.5 mm 이상 접 착 제 3 층 개량 아스팔트 시트 (비노출복층방수용) 2.5 mm 이상 ‐ 개량 아스팔트 시트 (노출복층방수용) 3.0 mm 이상 단 열 재 4 층 ‐ ‐ ‐ 점착층 붙은 개량 아스팔트 시트 2.0 mm 이상 5 층 ‐ ‐ ‐ 개량 아스팔트 시트 (노출복층방수용) 3.0 mm 이상 보호 ･마감 현장타설콘크리트･아스팔트콘크리트･콘크리트블록･ 모르타르･자갈 마감도료 또는 없음 주) 최상층에 노출용의 개량 아스팔트 시트를 사용하여 전면밀착으로 하는 공법은 a, b의 2종류가 있으며, 적용부위에 따라 자유로이 선택하여 적용할 수 있다. 1) 치켜올림 및 감아내림부는 누름철물로 고정하고 실링재로 처리한다. 다만, 실내에서 방수층의 치켜올림 높이가 낮을 경우에는 누름철물을 제외할 수도 있다. 2) 오목모서리에는 미리 폭 200 mm 정도의 덧붙임용 시트를 붙여둔다. 3) 보행용 전면접착(M‐PrF) 공법에서 치켜올림부의 보호･마감을 마감도료 또는 하지 않을 경우에는, 평면의 공정 3의 개량 아스팔트 시트를 오목모서리 앞에서 시공을 멈추고, 두께 3 mm 이상의 노출 복층방수용 개량 아스팔트 시트를 200 mm 걸쳐 붙인 다음에 치켜올림부를 붙인다. 4) 드레인 주변에는 500 mm 각 정도의 덧붙임용 시트를 사용한다. 5) 파이프 주변에는 덧붙임용 시트를 적절하게 혼합하여 사용한다. 6) ALC를 바탕으로 할 경우에는 표면을 미장마감 하거나, 공정 1의 프라이머를 0.6 kg/m2로 한다. 7) 노출용 단열재 삽입(M‐MiT) 공법의 공정 1의 프라이머, 공정 2의 접착제의 사용량은 접착제의 종류에 따라 달라진다. 8) PC 또는 ALC패널의 이음줄눈부는 덧붙임용 시트로 양쪽으로 100 mm 정도씩 걸쳐 붙인다. 9) 노출용 단열재 삽입(M‐MiT) 공법에서의 단열재의 두께는 공사기준에 의한다. 10) 보행용 전면접착(M‐PrF) 공법에서 단열재를 사용할 경우에는 방수층과 보호･마감 사이에 두고, 그 두께는 공사기준에 의한다. 11) 노출용 전면접착(M‐MiF)과 노출용 단열재 삽입(M‐MiT) 공법에는 필요에 따라서 구멍뚫린 아스팔트 루핑을 붙이고, 탈기장치를 설치한다. 12) 마감도료의 종류와 기준은 개량 아스팔트 시트 제조자의 지정에 따른다. 13) 루핑류는 바탕면적에 대하여 1.2 kg/m2 사용을 원칙으로 한다. (2) 방수층의 적용은 아래표를 표준으로 하며 그 지정은 공사기준에 의한다. 단열재를 사용하는 경우와 탈기장치를 설치할 경우에는 공사기준에 따른다. 표 3.2-2 방수층의 적용 종 별 보행용 전면접착 (M-PrF) 노출용 전면접착(M‐MiF) 노출용 단열재 삽입(M‐MiT) 적용부위 적용바탕 a b 지 붕 RC ○ ○ ○ ○ PC ○* ○ ○ ○ ALC - ○ ○ ○ 차 양 RC - ○ - - PC - ○ - - 지하외벽(외부쪽) RC ○ - - - 실 내 욕실 등 RC ○ - - - 주차장 RC ○ - - - 수 영 장 RC ○ - - - 인공연못･정원 RC ○ - - - 바탕(바닥)의 구배 1/100 ~ 1/50 1/50 ~ 1/20 [범례] ○ : 적용, -: 표준외 * : 아스팔트 콘크리트, 콘크리트 블록, 자갈에 의한 보호 ･ 마감에 한함 3.2.2 프라이머의 도포 (1) 프라이머의 도포는 KCS 41 40 03 (3.1)에 따른다. 3.2.3 방수시트 붙이기 (1) 방수시트 붙이기는 KCS 41 40 03 (3.2)에 따른다. 3.2.4 단열재 붙이기 (1) 단열재 붙이기는 KCS 41 40 03 (3.3)에 따른다. 3.2.5 특수부위 처리 (1) 특수부위 처리는 KCS 41 40 03 (3.4)에 따른다. 3.3 보호층 시공 (1) 개량 아스팔트 시트방수층을 후속공정이나 관련공정 작업으로 인하여 파손되지 않게 잘 보호 양생하기 위하여 다음과 같은 보호층을 시공한다. 다만, 땅속에 묻히는 외벽이나 바닥의 경우에는 보호 완충재를 부착하는 등의 방법으로 할 수 있으며 이 경우에 반드시 공사기준으로 그 자재 및 시공방법 등을 명기하여야 한다. 기타 관련사항은 EXCS 41 40 02 (3.4)에 따른다. 3.3.1 바닥(옥내 ･ 외) (1) 시트 방수층위에 두께 15 mm 이상의 보호 모르타르를 시공한 후에 마감층(누름콘크리트, 타일, 기타)을 시공한다. 3.3.2 벽(치켜올림부 포함) (1) 방수층에서 20 mm 이상 떨어지게 조적 등으로 쌓되 반드시 공간을 모르타르 등으로 잘 채워주고, 조적벽에 마감층을 시공한다. 3.4 현장 품질관리 3.4.1 담수시험 (1) 담수시험은 아래순서에 따라서 실시하며, 기타 방법으로 담수 및 살수 시험을 할 경우는 공사기준에 의한다. ① 배수관계의 구멍(배수트랩, 루프드레인)은 이물질 등이 들어가지 않도록 막아둔다. ② 치켜올림한 방수층의 끝부분이 잠기지 않도록 물을 채우고, 24시간 정도 누수여부를 확인한다. 필요에 따라서는 치켜올림 높이까지 물을 채우고 24시간 더 누수 여부를 확인할 수도 있다. ③ 누수 없음을 확인한 다음, 담수한 물을 배수구로 흘려보내 배수의 양부나 급격한 배수로 인해 발생될 수 있는 누수를 확인한다. ④ 누수부위가 발견되면 물을 배수시키고 건조후 보수하고 보수가 완료되면 위와 같은 순서로 누수가 발견되지 않을 때까지 반복한다. 3.4.2 시공상태 확인 (1) 바탕건조 및 표면상태 검사 (2) 방수층 구성 및 두께검사 (3) 루프드레인, 개구부, 슬리브, 치켜올림부위 검사 (4) 방수층의 손상, 파단, 겹침길이, 주름, 들뜸 검사 (5) 방수층 보호 시공 검사 집필위원 성 명 소 속 성 명 소 속 박경탁 한국도로공사 자문위원 성 명 소 속 성 명 소 속 국가건설기준센터 및 건설기준위원회 성 명 소 속 성 명 소 속 이영호 한국건설기술연구원 이여경 한국건설기술연구원 이용수 한국건설기술연구원 원훈일 한국건설기술연구원 구재동 한국건설기술연구원 김한수 건국대학교 김태송 한국건설기술연구원 남정수 충남대학교 최봉혁 한국건설기술연구원 박순규 서울특별시 김기현 한국건설기술연구원 서명석 경동대학교 김희석 한국건설기술연구원 송제영 BK방수기술연구소 류상훈 한국건설기술연구원 신성수 한국기술사회 허원호 한국건설기술연구원 오상근 서울과학기술대학교 김나은 한국건설기술연구원 장덕배 동양미래대학교 주영경 한국건설기술연구원 최수경 한서대학교 이승환 한국건설기술연구원 중앙건설기술심의위원회 성 명 소 속 성 명 소 속 강선영 ㈜선엔지니어링종합건축사사무소 빈혜진 다옴스페이스 김동관 청주대학교 유정한 서울과학기술대학교 김성민 LH 최윤기 숭실대학교 김천학 한국시설안전공단 국토교통부 성 명 소 속 성 명 소 속 장순재 국토교통부 도로정책과 김호 국토교통부 도로정책과 EXCS 41 40 03 : 2021 개량아스팔트 시트방수(부대시설편) 2021년 8월 5일 발행 소관부서 국토교통부 관련단체 한국도로공사 (39660) 경상북도 김천시 혁신8로 77 한국도로공사 ☎ 1588-2504(대표) http://www.ex.co.kr 국가건설기준센터 10223 경기도 고양시 일산서구 고양대로 283(대화동) Tel : 031-910-0444 http://www.kcsc.re.kr",
      "safety": ""
    }
  },
  "metadata": {
    "quality_score": 75,
    "keywords": [
      "인장강도",
      "콘크리트",
      "시멘트",
      "양생",
      "방수",
      "단열"
    ],
    "references": [
      "KCS",
      "EXCS"
    ],
    "equations": 0,
    "tables": 3
  },
  "standard_code": "EXCS 41 40 03"
}