{
  "id": "EXCS 11 80 05",
  "title": "콘크리트 옹벽",
  "category": "흙막이및차수",
  "content": {
    "full": "**표준코드**: EXCS 11 80 05 **문서 제목**: 목적 **변환일시**: 2025-07-09 16:44:44 **첨부 이미지**: 2개 Expressway Construction Specification EXCS 11 80 05 고속도로공사 전문시방서 Expressway Construction Specification EXCS 11 80 05 : 2021 콘크리트 옹벽 2021년 10월 19일 개정 http://www.ex.co.kr/research 고속도로공사 전문시방서 제·개정에 따른 경과 조치 「고속도로공사 전문시방서(EXCS ; Expressway Construction Specification)」는 국가건설기준(KCS ; Korea Construction Specification)를 기본으로 하여 고속도로 시공에 관련된 공종을 대상으로 작성한 종합적인 시방기준으로서, 단위공사 설계시 해당 공사의 특성과 여건 등에 맞게 「공사시방서」를 작성하는데 활용하기 위한 「전문시방서」(Guide Specification)이므로 관계법상 구속력과 계약도서로서의 효력이 없습니다. 이 시방기준 발간 시점에 이미 시행 중인 설계용역이나 건설공사는 발주기관의 장이 필요하다고 인정하는 경우 종전에 적용하고 있는 기준을 그대로 사용할 수 있으며, 이 시방기준으로 공사시방서 작성 시 도로교통연구원 홈페이지 및 국가건설기준센터 홈페이지에 등재된 최신 시방기준을 반드시 확인 후 작성하시기 바랍니다. ※ 도로교통연구원 홈페이지 : http://www.ex.co.kr/research/ 국가건설기준센터 홈페이지 : http://www.kcsc.re.kr/ 전문시방서 제・개정 연혁 ∙ 이 시방기준은 건설기준 코드체계 전환에 따라 기존 고속도로공사 전문시방서와 국가건설기준(KCS) 간 중복·상충을 비교 검토하여 코드로 통합 정비하였다. ∙ 이 기준은 기존의 고속도로공사 전문시방서를 중심으로 KCS 11 80 05 등의 해당하는 부분을 통합 정비하여 기준으로 제정한 것으로 제⋅개정 연혁은 다음과 같다. 전문시방서 주요내용 제·개정 (년.월) 고속도로공사 전문시방서 ∙ 고속도로공사 전문시방서를 제정 제정 (1998.5) 고속도로공사 전문시방서 ∙ 제정이후 개발된 신기술 및 신공법을 고속도로공사현장에 적용하기 위하여 개정함 개정 (2000.11) 고속도로공사 전문시방서 ∙ 시대적 흐름을 반영하고 건설기술 발전에 이바지함으로써 ‘신뢰받는 국민기업 실현’을 달성하기 위하여 개정함 개정 (2004.12) 고속도로공사 전문시방서 ∙ 2차 개정 이후 기술발전과 축적된 건설기술 노하우를 반영하기 위하여 개정함 개정 (2009.7) 고속도로공사 전문시방서 ∙ 도로건설현장에 발전된 기술을 신속히 적용하기 위해 그간의 많은 연구성과와 축적된 건설기술 노하우를 반영하여 개정함 개정 (2012.10) EXCS 11 80 05 :2018 ∙ 건설기준 코드체계 전환에 따라 코드화로 통합 정비함 제정 (2018.6) EXCS 11 80 05 :2021 ∙ 코드체계화 이후 최신 건설기준을 신속히 적용하기 위해 개정함 개정 (2021.10) 제 정 : 2018년 6월 19일 심 의 : 중앙건설기술심의위원회 소 관 부 서 : 국토교통부 도로정책과 개 정 : 2021년 10월 19일 자 문 검 토 : 국가건설기준센터 건설기준위원회 관련단체 (작성기관) : 한국도로공사 (도로교통연구원) 목 차 1. 일반사항 1 1.1 적용 범위 1 1.2 참고 기준 1 1.3 용어의 정의 1 1.4 제출물 1 2. 자재 1 3. 시공 1 콘크리트 옹벽 1. 일반사항 1.1 적용 범위 (1) 콘크리트 옹벽의 적용 범위는 KCS 11 80 05 (1.1)에 따른다. 1.2 참고 기준 ∙ 콘크리트 옹벽의 참고 기준은 KCS 11 80 05 (1.2)에 따른다. ∙ EXCS 10 10 05 공사일반 ∙ EXCS 10 10 10 공무행정요건 1.3 용어의 정의 내용 없음 1.4 제출물 (1) EXCS 10 10 05 (1.7 (12)) 및 EXCS 10 10 10 (1.8)에 따라 해당 공사의 공사계획에 맞추어 시공계획서를 작성한 후 제출하여야 한다. 2. 자재 (1) 콘크리트 옹벽의 자재는 KCS 11 80 05 (2)에 따른다. 3. 시공 (1) 콘크리트 옹벽의 시공은 KCS 11 80 05 (3)에 따른다. 집필위원 성 명 소 속 성 명 소 속 도종남 한국도로공사 정종홍 한국도로공사 이상래 한국도로공사 조현식 한국도로공사 박아론 한국도로공사 자문위원 성 명 소 속 성 명 소 속 송평현 세일지오텍 국가건설기준센터 및 건설기준위원회 성 명 소 속 성 명 소 속 이영호 한국건설기술연구원 김제경 경동엔지니어링 이용수 한국건설기술연구원 김기석 (주)희송지오텍 구재동 한국건설기술연구원 김동민 (주)한국종합기술 김태송 한국건설기술연구원 박이근 (주)지오알앤디 최봉혁 한국건설기술연구원 최재희 (주)이산 김기현 한국건설기술연구원 김운형 (주)다산컨설턴트 김희석 한국건설기술연구원 한상재 (주)지구환경전문가그룹 류상훈 한국건설기술연구원 이규환 건양대학교 허원호 한국건설기술연구원 최용규 경성대학교 김나은 한국건설기술연구원 최원일 한국철도시설공단 주영경 한국건설기술연구원 김상환 호서대학교 이승환 한국건설기술연구원 김대홍 서울시립대학교 이여경 한국건설기술연구원 이용주 서울과학기술대학교 원훈일 한국건설기술연구원 최항석 고려대학교 중앙건설기술심의위원회 성 명 소 속 성 명 소 속 곽재진 서울지방국토관리청 안지환 한국건설기술연구원 임광수 ㈜이산 정평기 ㈜화인씨이엠테크 이수빈 고려개발(주) 신중호 한국지질자원연구원 이충원 행정안전부 소관부처 성 명 소 속 성 명 소 속 장순재 국토교통부 도로정책과 김 호 국토교통부 도로정책과 고속도로공사 전문시방서 EXCS 11 80 05 : 2021 콘크리트 옹벽 2021년 10월 발행 소관부서 국토교통부 관련단체 한국도로공사 (39660) 경상북도 김천시 혁신8로 77 한국도로공사 ☎ 1588-2504(대표) http://www.ex.co.kr 작성기관 한국도로공사 도로교통연구원 (18489) 경기도 화성시 동부대로 922번길 208-96 ☎ 031-8098-6044(품질시험센터) http://www.ex.co.kr/research 국가건설기준센터 (10223) 경기도 고양시 일산서구 고양대로 283(대화동) ☎ 031-910-0444 http://www.kcsc.re.kr",
    "sections": {
      "scope": "1.1 적용 범위 1 1.2 참고 기준 1 1.3 용어의 정의 1 1.4 제출물 1 2. 자재 1 3. 시공 1 콘크리트 옹벽 1. 일반사항 1.1 적용 범위 (1) 콘크리트 옹벽의 적용 범위는 KCS 11 80 05 (1.1)에 따른다. 1.2 참고 기준 ∙ 콘크리트 옹벽의 참고 기준은 KCS 11 80 05 (1.2)에 따른다. ∙ EXCS 10 10 05 공사일반 ∙ EXCS 10 10 10 공무행정요건 1.3 용어의 정의 내용 없음 1.4 제출물 (1) EXCS 10 10 05 (1.7 (12)) 및 EXCS 10 10 10 (1.8)에 따라 해당 공사의 공사계획에 맞추어 시공계획서를 작성한 후 제출하여야 한다. 2. 자재 (1) 콘크리트 옹벽의 자재는 KCS 11 80 05 (2)에 따른다. 3. 시공 (1) 콘크리트 옹벽의 시공은 KCS 11 80 05 (3)에 따른다. 집필위원 성 명 소 속 성 명 소 속 도종남 한국도로공사 정종홍 한국도로공사 이상래 한국도로공사 조현식 한국도로공사 박아론 한국도로공사 자문위원 성 명 소 속 성 명 소 속 송평현 세일지오텍 국가건설기준센터 및 건설기준위원회 성 명 소 속 성 명 소 속 이영호 한국건설기술연구원 김제경 경동엔지니어링 이용수 한국건설기술연구원 김기석 (주)희송지오텍 구재동 한국건설기술연구원 김동민 (주)한국종합기술 김태송 한국건설기술연구원 박이근 (주)지오알앤디 최봉혁 한국건설기술연구원 최재희 (주)이산 김기현 한국건설기술연구원 김운형 (주)다산컨설턴트 김희석 한국건설기술연구원 한상재 (주)지구환경전문가그룹 류상훈 한국건설기술연구원 이규환 건양대학교 허원호 한국건설기술연구원 최용규 경성대학교 김나은 한국건설기술연구원 최원일 한국철도시설공단 주영경 한국건설기술연구원 김상환 호서대학교 이승환 한국건설기술연구원 김대홍 서울시립대학교 이여경 한국건설기술연구원 이용주 서울과학기술대학교 원훈일 한국건설기술연구원 최항석 고려대학교 중앙건설기술심의위원회 성 명 소 속 성 명 소 속 곽재진 서울지방국토관리청 안지환 한국건설기술연구원 임광수 ㈜이산 정평기 ㈜화인씨이엠테크 이수빈 고려개발(주) 신중호 한국지질자원연구원 이충원 행정안전부 소관부처 성 명 소 속 성 명 소 속 장순재 국토교통부 도로정책과 김 호 국토교통부 도로정책과 고속도로공사 전문시방서 EXCS 11 80 05 : 2021 콘크리트 옹벽 2021년 10월 발행 소관부서 국토교통부 관련단체 한국도로공사 (39660) 경상북도 김천시 혁신8로 77 한국도로공사 ☎ 1588-2504(대표) http://www.ex.co.kr 작성기관 한국도로공사 도로교통연구원 (18489) 경기도 화성시 동부대로 922번길 208-96 ☎ 031-8098-6044(품질시험센터) http://www.ex.co.kr/research 국가건설기준센터 (10223) 경기도 고양시 일산서구 고양대로 283(대화동) ☎ 031-910-0444 http://www.kcsc.re.kr",
      "materials": "2. 자재 1 3. 시공 1 콘크리트 옹벽 1. 일반사항 1.1 적용 범위 (1) 콘크리트 옹벽의 적용 범위는 KCS 11 80 05 (1.1)에 따른다. 1.2 참고 기준 ∙ 콘크리트 옹벽의 참고 기준은 KCS 11 80 05 (1.2)에 따른다. ∙ EXCS 10 10 05 공사일반 ∙ EXCS 10 10 10 공무행정요건 1.3 용어의 정의 내용 없음 1.4 제출물 (1) EXCS 10 10 05 (1.7 (12)) 및 EXCS 10 10 10 (1.8)에 따라 해당 공사의 공사계획에 맞추어 시공계획서를 작성한 후 제출하여야 한다. 2. 자재 (1) 콘크리트 옹벽의 자재는 KCS 11 80 05 (2)에 따른다. 3. 시공 (1) 콘크리트 옹벽의 시공은 KCS 11 80 05 (3)에 따른다. 집필위원 성 명 소 속 성 명 소 속 도종남 한국도로공사 정종홍 한국도로공사 이상래 한국도로공사 조현식 한국도로공사 박아론 한국도로공사 자문위원 성 명 소 속 성 명 소 속 송평현 세일지오텍 국가건설기준센터 및 건설기준위원회 성 명 소 속 성 명 소 속 이영호 한국건설기술연구원 김제경 경동엔지니어링 이용수 한국건설기술연구원 김기석 (주)희송지오텍 구재동 한국건설기술연구원 김동민 (주)한국종합기술 김태송 한국건설기술연구원 박이근 (주)지오알앤디 최봉혁 한국건설기술연구원 최재희 (주)이산 김기현 한국건설기술연구원 김운형 (주)다산컨설턴트 김희석 한국건설기술연구원 한상재 (주)지구환경전문가그룹 류상훈 한국건설기술연구원 이규환 건양대학교 허원호 한국건설기술연구원 최용규 경성대학교 김나은 한국건설기술연구원 최원일 한국철도시설공단 주영경 한국건설기술연구원 김상환 호서대학교 이승환 한국건설기술연구원 김대홍 서울시립대학교 이여경 한국건설기술연구원 이용주 서울과학기술대학교 원훈일 한국건설기술연구원 최항석 고려대학교 중앙건설기술심의위원회 성 명 소 속 성 명 소 속 곽재진 서울지방국토관리청 안지환 한국건설기술연구원 임광수 ㈜이산 정평기 ㈜화인씨이엠테크 이수빈 고려개발(주) 신중호 한국지질자원연구원 이충원 행정안전부 소관부처 성 명 소 속 성 명 소 속 장순재 국토교통부 도로정책과 김 호 국토교통부 도로정책과 고속도로공사 전문시방서 EXCS 11 80 05 : 2021 콘크리트 옹벽 2021년 10월 발행 소관부서 국토교통부 관련단체 한국도로공사 (39660) 경상북도 김천시 혁신8로 77 한국도로공사 ☎ 1588-2504(대표) http://www.ex.co.kr 작성기관 한국도로공사 도로교통연구원 (18489) 경기도 화성시 동부대로 922번길 208-96 ☎ 031-8098-6044(품질시험센터) http://www.ex.co.kr/research 국가건설기준센터 (10223) 경기도 고양시 일산서구 고양대로 283(대화동) ☎ 031-910-0444 http://www.kcsc.re.kr",
      "construction": "(1) 콘크리트 옹벽의 시공은 KCS 11 80 05 (3)에 따른다.\n집필위원\n성 명\n소 속\n성 명\n소 속\n도종남\n한국도로공사\n정종홍\n한국도로공사\n이상래\n한국도로공사\n조현식\n한국도로공사\n박아론\n한국도로공사\n자문위원\n성 명\n소 속\n성 명\n소 속\n송평현\n세일지오텍\n국가건설기준센터 및 건설기준위원회\n성 명\n소 속\n성 명\n소 속\n이영호\n한국건설기술연구원\n김제경\n경동엔지니어링\n이용수\n한국건설기술연구원\n김기석\n(주)희송지오텍\n구재동\n한국건설기술연구원\n김동민\n(주)한국종합기술\n김태송\n한국건설기술연구원\n박이근\n(주)지오알앤디\n최봉혁\n한국건설기술연구원\n최재희\n(주)이산\n김기현\n한국건설기술연구원\n김운형\n(주)다산컨설턴트\n김희석\n한국건설기술연구원\n한상재\n(주)지구환경전문가그룹\n류상훈\n한국건설기술연구원\n이규환\n건양대학교\n허원호\n한국건설기술연구원\n최용규\n경성대학교\n김나은\n한국건설기술연구원\n최원일\n한국철도시설공단\n주영경\n한국건설기술연구원\n김상환\n호서대학교\n이승환\n한국건설기술연구원\n김대홍\n서울시립대학교\n이여경\n한국건설기술연구원\n이용주\n서울과학기술대학교\n원훈일\n한국건설기술연구원\n최항석\n고려대학교\n중앙건설기술심의위원회\n성 명\n소 속\n성 명\n소 속\n곽재진\n서울지방국토관리청\n안지환\n한국건설기술연구원\n임광수\n㈜이산\n정평기\n㈜화인씨이엠테크\n이수빈\n고려개발(주)\n신중호\n한국지질자원연구원\n이충원\n행정안전부\n소관부처\n성 명\n소 속\n성 명\n소 속\n장순재\n국토교통부 도로정책과\n김 호\n국토교통부 도로정책과\n고속도로공사 전문시방서\nEXCS 11 80 05 : 2021\n콘크리트 옹벽\n2021년 10월 발행\n소관부서 국토교통부\n관련단체 한국도로공사\n(39660) 경상북도 김천시 혁신8로 77 한국도로공사\n☎ 1588-2504(대표)\nhttp://www.ex.co.kr\n작성기관 한국도로공사 도로교통연구원\n(18489) 경기도 화성시 동부대로 922번길 208-96\n☎ 031-8098-6044(품질시험센터)\nhttp://www.ex.co.kr/research\n국가건설기준센터\n(10223) 경기도 고양시 일산서구 고양대로 283(대화동)\n☎ 031-910-0444\nhttp://www.kcsc.re.kr\n## 테이블\n### 테이블 1\n### 테이블 2\n### 테이블 3\n### 테이블 4\n### 테이블 5\n### 테이블 6\n### 테이블 7\n### 테이블 8\n### 테이블 9\n### 테이블 10\n### 테이블 11\n### 테이블 12\n### 테이블 13\n### 테이블 14\n### 테이블 15\n### 테이블 16\n### 테이블 17",
      "quality": "품질시험센터) http://www.ex.co.kr/research 국가건설기준센터 (10223) 경기도 고양시 일산서구 고양대로 283(대화동) ☎ 031-910-0444 http://www.kcsc.re.kr",
      "safety": ""
    }
  },
  "metadata": {
    "quality_score": 60,
    "keywords": [
      "콘크리트",
      "품질시험"
    ],
    "references": [
      "KCS",
      "EXCS"
    ],
    "equations": 0,
    "tables": 0
  },
  "standard_code": "EXCS 11 80 05"
}