{
  "id": "EXCS 14 20 36",
  "title": "고강도 콘크리트(부대시설편)",
  "category": "콘크리트",
  "content": {
    "full": "**표준코드**: EXCS 14 20 36 **문서 제목**: 목적 **변환일시**: 2025-07-09 16:44:45 **첨부 이미지**: 1개 Expressway Construction Specification EXCS 14 20 33 고속도로공사 전문시방서 Expressway Construction Specification EXCS 14 20 36 : 2021 고강도 콘크리트 (부대시설편) 2021년 8월 5일 제정 http://www.kcsc.re.kr 고속도로공사 전문시방서 제·개정에 따른 경과 조치 「고속도로공사 전문시방서(EXCS ; Expressway Construction Specification)」는 국가건설기준(KCS ; Korea Construction Specification)를 기본으로 하여 고속도로 시공에 관련된 공종을 대상으로 작성한 종합적인 시방기준으로서, 단위공사 설계시 해당 공사의 특성과 여건 등에 맞게 「공사시방서」를 작성하는데 활용하기 위한 「전문시방서」(Guide Specification)이므로 관계법상 구속력과 계약도서로서의 효력이 없습니다. 이 시방기준 발간 시점에 이미 시행 중인 설계용역이나 건설공사는 발주기관의 장이 필요하다고 인정하는 경우 종전에 적용하고 있는 기준을 그대로 사용할 수 있으며, 이 시방기준으로 공사시방서 작성 시 도로교통연구원 홈페이지 및 국가건설기준센터 홈페이지에 등재된 최신 시방기준을 반드시 확인 후 작성하시기 바랍니다. ※ 도로교통연구원 홈페이지 : http://www.ex.co.kr/research/ 국가건설기준센터 홈페이지 : http://www.kcsc.re.kr/ 건설기준 연혁 ∙ 이 시방기준은 건설기준 코드체계 전환에 따라 기존 고속도로공사 전문시방서와 건설기준(표준시방서) 간 중복·상충을 비교 검토하여 코드로 통합 정비하였다. ∙ 이 기준은 기존의 고속도로공사 전문시방서를 중심으로 KCS 14 20 33 등의 해당하는 부분을 통합 정비하여 기준으로 제정한 것으로 제⋅개정 연혁은 다음과 같다. 건설기준 주요내용 제정 또는 개정 (년.월) 고속도로공사 전문시방서(부대시설편) ∙ 고속도로공사 전문시방서 부대시설편을 제정 제정 (2002.2) 고속도로공사 전문시방서(부대시설편) ∙ 시대적 흐름을 반영하고 건설기술 발전에 이바지함으로써 ‘신뢰받는 국민기업 실현’을 달성하기 위하여 개정함 개정 (2005.12) EXCS 14 20 36 :2021 ∙ 건설기준 코드체계 전환에 따라 코드화로 통합 정비함 제정 (2021.8) 제 정 : 2021년 8월 5일 심 의 : 중앙건설기술심의위원회 소관부서 : 국토교통부 도로정책과 관련단체 : 한국도로공사 개 정 : 년 월 일 자문검토 : 국가건설기준센터 건설기준위원회 작성기관 : 한국도로공사 목 차 1. 일반사항 1 1.1 적용 범위 1 1.2 참고 기준 1 1.3 용어의 정의 1 1.4 제출물 1 1.4.1 제품자료 1 1.5 운반, 보관 및 취급 1 2. 자재 1 2.1 자재 1 2.1.1 시멘트 1 2.1.2 고성능감수제 1 2.1.3 혼화재 2 2.1.4 잔골재 2 2.1.5 굵은골재 2 2.2 배합 3 3. 시공 4 3.1 운반 4 3.2 부어넣기 및 양생 4 3.2.1 부어넣기 4 3.2.2 양생 4 3.3 거푸집 및 동바리 4 3.4 현장품질관리 4 1. 일반사항 1.1 적용 범위 (1) 고강도 콘크리트의 적용범위는 보통콘크리트에서 설계기준 강도가 40 MPa 이상의 고강도 콘크리트 시공에 필요한 일반적인 사항에 대하여 적용하며 콘크리트의 생산 및 태설, 양생과 관련하여 본 절에 명시되지 아니한 사항은 EXCS 14 20 00을 적용한다. 1.2 참고 기준 (1) 고강도 콘크리트의 잔골재는 KCS 14 20 33 (1.4)을 따르되 아래의 사항을 추가하여 적용한다. (2) EXCS 14 20 00 콘크리트공사 (3) KS F 2405 콘크리트의 압축 강도 시험 방법 1.3 용어의 정의 내용 없음 1.4 제출물 (1) 다음 사항은 EXCS 10 10 10에 따라 제출한다. 1.4.1 제품자료 (1) 다음 품목에 대한 제조업자 제품자료 ① 혼화제 ② 시멘트 1.5 운반, 보관 및 취급 (1) 혼화제 : 혼화제의 운반, 보관 및 취급은 승인된 제조업자의 제품자료에 따른다. (2) 시멘트 : 시멘트의 운반, 보관 및 취급은 EXCS 14 20 00에 따른다. 2. 자재 2.1 자재 2.1.1 시멘트 (1) 고강도 콘크리트의 시멘트는 KCS 14 20 33 (2.1.1)을 따른다. 2.1.2 고성능감수제 (1) 고강도 콘크리트의 고성능감수제는 KCS 14 20 33 (2.1.2 (1))을 따른다. 2.1.3 혼화재 (1) 고강도 콘크리트의 혼화재는 KCS 14 20 33 (2.1.2 (2))을 따른다. 2.1.4 잔골재 (1) 고강도 콘크리트의 잔골재는 KCS 14 20 33 (2.1.3)을 따르되 아래의 사항을 추가하여 적용한다. 표 2.1-1 골재의 품질 항목 종류 절건 비중 흡수율 (%) 실적률 (%) 점토량 (%) 씻기시험에의한 손실량 (%) 유기 불순물 염분 (NaCl) (%) 안정성 (%) 굵은골재 2.5 이상 2.0 이하 59 이상 0.25 이하 1.0 이하 - - 12 이하 잔골재 2.5 이상 3.0 이하 - 1.0 이하 2.0 이하 표준색 이하 0.04 이하 10 이하 표 2.1-2 잔골재의 입도의 표준 체의 호칭 체를 통과한 것의 중량 백분율(%) 10 mm 100 5 mm 95 ~ 100 2.5 mm 80 ~ 100 1.2 mm 50 ~ 85 0.6 mm 25 ~ 60 0.3 mm* 10 ~ 30 0.15 mm* 2 ~ 10 * 이 경우 물시멘트비를 낮추기 위하여 0.3 mm, 0.15 mm체를 통과하는 양은 가능한한 적게 하는 것이 좋다. 2.1.5 굵은골재 (1) 고강도 콘크리트의 굵은골재는 KCS 14 20 33 (2.1.4 (2))을 따르되 아래의 사항을 추가하여 적용한다. (2) 굵은골재는 깨끗하고, 강하고, 내구적이며, 알맞는 입도를 갖고 얇은 석편, 유기불순물, 염분 등의 유해량을 함유해서는 안되며, 표 2.1-1의 기준을 만족하여야 한다. (3) 고강도 콘크리트에 사용되는 굵은골재의 입도분포는 굵고, 가는 골재들이 골고루 섞이어 공극률을 줄임으로써 시멘트페이스트이 최소가 되도록 하는 것이 좋으며, 그 입도는 아래표의 범위를 표준으로 한다. 체가름 시험은 KS F 2502에 따른다. 표 2.1-3 굵은골재 입도의 표준 (mm) 체의 호칭 골재 최대치수 각체를 통과하는 것의 중량 백분율 50 40 30 25 20 15 10 5 2.5 40 100 95 ∼ 100 35 ∼ 70 10 ∼ 30 0 ∼ 5 30 100 95 ∼ 100 40 ∼ 75 10 ∼ 35 0 ∼ 10 0 ∼ 5 25 100 95 ∼ 100 25 ∼ 60 0 ∼ 10 0 ∼ 5 19 100 90 ∼ 100 20 ∼ 55 0 ∼ 10 0 ∼ 5 13 100 90 ∼ 100 40 ∼ 70 0 ∼ 15 0 ∼ 5 10 100 85 ∼ 100 0 ∼ 30 0 ∼10 (4) 고강도 콘크리트에 사용되는 골재의 최대크기는 40 mm 이하로서 가능한 25 mm이하를 사용하도록 하며, 철근 최소 수평간격의 3/4, 그리고 부재 최소치수의 1/5 이내의 것을 사용하도록 한다. (5) 고강도에 사용하는 굵은골재는 단단하고 견고하여야 하며, 열팽창계수가 시멘트페이스트과 현저하게 다른 것은 피하여야 한다. (6) 콘크리트에 포함된 염화물량은 염소이온량으로서 0.3 kg/m3 이하가 되어야 한다. 여기서, 점토량 시험은 KS F 2512, 골재씻기 시험은(0.08 mm체 통과량)은 KS F 2511, 유기불순물 시험은 KS F 2510, 염화물함유량 시험은 KS F 2515, 골재의 안정성 시험은 KS F 2507에 따른다. 2.2 배합 (1) 고강도 콘크리트의 배합강도는 설계기준강도 및 현장에서의 콘크리트 품질변화를 고려해서 정한다. (2) 고강도 콘크리트의 배합강도는 일반적인 경우 현장에서 콘크리트의 압축강도 시험값이 설계기준강도 이하로 되는 경우가 1/20 이상의 확률로 일어나서는 안 된다. (3) 물시멘트 비 ① 고강도 콘크리트의 물시멘트 비는 KCS 14 20 33 (2.2.1(2))을 따르되 아래의 사항을 추가하여 적용한다. ② 물시멘트비는 50% 이하로 한다. (4) 단위 시멘트량 ① 고강도 콘크리트의 단위 시멘트량은 KCS 14 20 33 (2.2.1(3))을 따른다. (5) 단위수량 ① 단위수량은 185 kg/m3 이하로 하고 소요의 워커빌리티를 얻을 수 있는 범위 안에서 가능한 작게 한다. (6) 잔골재율 ① 고강도 콘크리트의 잔골재율은 KCS 14 20 33 (2.2.1(5))을 따른다. (7) 고성능감수제 ① 고강도 콘크리트의 고성능감수제는 KCS 14 20 33 (2.2.1(6))을 따른다. (8) 소요 공기량 ① 기상의 변화가 심하거나 동결융해에 대한 대책이 필요한 경우를 제외하고는 공기연행제를 사용하지 않는 것을 원칙으로 한다. 3. 시공 3.1 운반 (1) 운반은 KCS 14 20 33 (3.2)을 따른다. 3.2 부어넣기 및 양생 3.2.1 부어넣기 (1) 고강도 콘크리트의 부어넣기는 KCS 14 20 33 (3.3)을 따른다. 3.2.2 양생 (1) 고강도 콘크리트의 양생은 KCS 14 20 33 (3.4)을 따른다. 3.3 거푸집 및 동바리 (1) 콘크리트용 거푸집 및 동바리는 소정의 강도와 강성을 가지는 동시에 완성된 구조물의 위치, 형상 및 치수가 정확하게 확보될 수 있도록 설계 및 시공을 하여야 한다. (2) 동바리는 작용하중을 안정하게 기초에 전달할 수 있는 형식의 것을 사용해야 한다. (3) 거푸집 및 받침기둥은 콘크리트를 부어넣기 전과 부어넣기 중에 공사감독자의 검사를 받아야 한다. (4) 거푸집 제거시기 및 순서는 콘크리트가 자중 및 시공에 가해지는 하중에 충분히 견딜만한 강도를 가질 때까지 떼어 내어서는 안 된다. (5) 거푸집판이 건조할 염려가 있을 때는 살수를 하여야 한다. (6) 특수거푸집과 받침기둥을 사용할 경우는 공사기준에 따른다. 3.4 현장품질관리 (1) 품질관리 및 검사는 EXCS 14 20 00에 따른다. 다만, 시험횟수는 부어넣기 공구마다, 부어넣는 날마다 150 m3당 1회 이상을 실시한다. 집필위원 성 명 소 속 성 명 소 속 박경탁 한국도로공사 자문위원 성 명 소 속 성 명 소 속 국가건설기준센터 및 건설기준위원회 성 명 소 속 성 명 소 속 이영호 한국건설기술연구원 이여경 한국건설기술연구원 이용수 한국건설기술연구원 원훈일 한국건설기술연구원 구재동 한국건설기술연구원 김한수 건국대학교 김태송 한국건설기술연구원 남정수 충남대학교 최봉혁 한국건설기술연구원 박순규 서울특별시 김기현 한국건설기술연구원 서명석 경동대학교 김희석 한국건설기술연구원 송제영 BK방수기술연구소 류상훈 한국건설기술연구원 신성수 한국기술사회 허원호 한국건설기술연구원 오상근 서울과학기술대학교 김나은 한국건설기술연구원 장덕배 동양미래대학교 주영경 한국건설기술연구원 최수경 한서대학교 이승환 한국건설기술연구원 중앙건설기술심의위원회 성 명 소 속 성 명 소 속 강선영 ㈜선엔지니어링종합건축사사무소 빈혜진 다옴스페이스 김동관 청주대학교 유정한 서울과학기술대학교 김성민 LH 최윤기 숭실대학교 김천학 한국시설안전공단 국토교통부 성 명 소 속 성 명 소 속 장순재 국토교통부 도로정책과 김호 국토교통부 도로정책과 EXCS 14 20 36 : 2021 고강도 콘크리트(부대시설편) 2021년 8월 5일 발행 소관부서 국토교통부 관련단체 한국도로공사 (39660) 경상북도 김천시 혁신8로 77 한국도로공사 ☎ 1588-2504(대표) http://www.ex.co.kr 국가건설기준센터 10223 경기도 고양시 일산서구 고양대로 283(대화동) Tel : 031-910-0444 http://www.kcsc.re.kr",
    "sections": {
      "scope": "(1) 고강도 콘크리트의 적용범위는 보통콘크리트에서 설계기준 강도가 40 MPa 이상의 고강도 콘크리트 시공에 필요한 일반적인 사항에 대하여 적용하며 콘크리트의 생산 및 태설, 양생과 관련하여 본 절에 명시되지 아니한 사항은 EXCS 14 20 00을 적용한다.",
      "materials": "2. 자재 1 2.1 자재 1 2.1.1 시멘트 1 2.1.2 고성능감수제 1 2.1.3 혼화재 2 2.1.4 잔골재 2 2.1.5 굵은골재 2 2.2 배합 3 3. 시공 4 3.1 운반 4 3.2 부어넣기 및 양생 4 3.2.1 부어넣기 4 3.2.2 양생 4 3.3 거푸집 및 동바리 4 3.4 현장품질관리 4 1. 일반사항 1.1 적용 범위 (1) 고강도 콘크리트의 적용범위는 보통콘크리트에서 설계기준 강도가 40 MPa 이상의 고강도 콘크리트 시공에 필요한 일반적인 사항에 대하여 적용하며 콘크리트의 생산 및 태설, 양생과 관련하여 본 절에 명시되지 아니한 사항은 EXCS 14 20 00을 적용한다. 1.2 참고 기준 (1) 고강도 콘크리트의 잔골재는 KCS 14 20 33 (1.4)을 따르되 아래의 사항을 추가하여 적용한다. (2) EXCS 14 20 00 콘크리트공사 (3) KS F 2405 콘크리트의 압축 강도 시험 방법 1.3 용어의 정의 내용 없음 1.4 제출물 (1) 다음 사항은 EXCS 10 10 10에 따라 제출한다. 1.4.1 제품자료 (1) 다음 품목에 대한 제조업자 제품자료 ① 혼화제 ② 시멘트 1.5 운반, 보관 및 취급 (1) 혼화제 : 혼화제의 운반, 보관 및 취급은 승인된 제조업자의 제품자료에 따른다. (2) 시멘트 : 시멘트의 운반, 보관 및 취급은 EXCS 14 20 00에 따른다. 2. 자재 2.1 자재 2.1.1 시멘트 (1) 고강도 콘크리트의 시멘트는 KCS 14 20 33 (2.1.1)을 따른다. 2.1.2 고성능감수제 (1) 고강도 콘크리트의 고성능감수제는 KCS 14 20 33 (2.1.2 (1))을 따른다. 2.1.3 혼화재 (1) 고강도 콘크리트의 혼화재는 KCS 14 20 33 (2.1.2 (2))을 따른다. 2.1.4 잔골재 (1) 고강도 콘크리트의 잔골재는 KCS 14 20 33 (2.1.3)을 따르되 아래의 사항을 추가하여 적용한다. 표 2.1-1 골재의 품질 항목 종류 절건 비중 흡수율 (%) 실적률 (%) 점토량 (%) 씻기시험에의한 손실량 (%) 유기 불순물 염분 (NaCl) (%) 안정성 (%) 굵은골재 2.5 이상 2.0 이하 59 이상 0.25 이하 1.0 이하 - - 12 이하 잔골재 2.5 이상 3.0 이하 - 1.0 이하 2.0 이하 표준색 이하 0.04 이하 10 이하 표 2.1-2 잔골재의 입도의 표준 체의 호칭 체를 통과한 것의 중량 백분율(%) 10 mm 100 5 mm 95 ~ 100 2.5 mm 80 ~ 100 1.2 mm 50 ~ 85 0.6 mm 25 ~ 60 0.3 mm* 10 ~ 30 0.15 mm* 2 ~ 10 * 이 경우 물시멘트비를 낮추기 위하여 0.3 mm, 0.15 mm체를 통과하는 양은 가능한한 적게 하는 것이 좋다. 2.1.5 굵은골재 (1) 고강도 콘크리트의 굵은골재는 KCS 14 20 33 (2.1.4 (2))을 따르되 아래의 사항을 추가하여 적용한다. (2) 굵은골재는 깨끗하고, 강하고, 내구적이며, 알맞는 입도를 갖고 얇은 석편, 유기불순물, 염분 등의 유해량을 함유해서는 안되며, 표 2.1-1의 기준을 만족하여야 한다. (3) 고강도 콘크리트에 사용되는 굵은골재의 입도분포는 굵고, 가는 골재들이 골고루 섞이어 공극률을 줄임으로써 시멘트페이스트이 최소가 되도록 하는 것이 좋으며, 그 입도는 아래표의 범위를 표준으로 한다. 체가름 시험은 KS F 2502에 따른다. 표 2.1-3 굵은골재 입도의 표준 (mm) 체의 호칭 골재 최대치수 각체를 통과하는 것의 중량 백분율 50 40 30 25 20 15 10 5 2.5 40 100 95 ∼ 100 35 ∼ 70 10 ∼ 30 0 ∼ 5 30 100 95 ∼ 100 40 ∼ 75 10 ∼ 35 0 ∼ 10 0 ∼ 5 25 100 95 ∼ 100 25 ∼ 60 0 ∼ 10 0 ∼ 5 19 100 90 ∼ 100 20 ∼ 55 0 ∼ 10 0 ∼ 5 13 100 90 ∼ 100 40 ∼ 70 0 ∼ 15 0 ∼ 5 10 100 85 ∼ 100 0 ∼ 30 0 ∼10 (4) 고강도 콘크리트에 사용되는 골재의 최대크기는 40 mm 이하로서 가능한 25 mm이하를 사용하도록 하며, 철근 최소 수평간격의 3/4, 그리고 부재 최소치수의 1/5 이내의 것을 사용하도록 한다. (5) 고강도에 사용하는 굵은골재는 단단하고 견고하여야 하며, 열팽창계수가 시멘트페이스트과 현저하게 다른 것은 피하여야 한다. (6) 콘크리트에 포함된 염화물량은 염소이온량으로서 0.3 kg/m3 이하가 되어야 한다. 여기서, 점토량 시험은 KS F 2512, 골재씻기 시험은(0.08 mm체 통과량)은 KS F 2511, 유기불순물 시험은 KS F 2510, 염화물함유량 시험은 KS F 2515, 골재의 안정성 시험은 KS F 2507에 따른다. 2.2 배합 (1) 고강도 콘크리트의 배합강도는 설계기준강도 및 현장에서의 콘크리트 품질변화를 고려해서 정한다. (2) 고강도 콘크리트의 배합강도는 일반적인 경우 현장에서 콘크리트의 압축강도 시험값이 설계기준강도 이하로 되는 경우가 1/20 이상의 확률로 일어나서는 안 된다. (3) 물시멘트 비 ① 고강도 콘크리트의 물시멘트 비는 KCS 14 20 33 (2.2.1(2))을 따르되 아래의 사항을 추가하여 적용한다. ② 물시멘트비는 50% 이하로 한다. (4) 단위 시멘트량 ① 고강도 콘크리트의 단위 시멘트량은 KCS 14 20 33 (2.2.1(3))을 따른다. (5) 단위수량 ① 단위수량은 185 kg/m3 이하로 하고 소요의 워커빌리티를 얻을 수 있는 범위 안에서 가능한 작게 한다. (6) 잔골재율 ① 고강도 콘크리트의 잔골재율은 KCS 14 20 33 (2.2.1(5))을 따른다. (7) 고성능감수제 ① 고강도 콘크리트의 고성능감수제는 KCS 14 20 33 (2.2.1(6))을 따른다. (8) 소요 공기량 ① 기상의 변화가 심하거나 동결융해에 대한 대책이 필요한 경우를 제외하고는 공기연행제를 사용하지 않는 것을 원칙으로 한다. 3. 시공 3.1 운반 (1) 운반은 KCS 14 20 33 (3.2)을 따른다. 3.2 부어넣기 및 양생 3.2.1 부어넣기 (1) 고강도 콘크리트의 부어넣기는 KCS 14 20 33 (3.3)을 따른다. 3.2.2 양생 (1) 고강도 콘크리트의 양생은 KCS 14 20 33 (3.4)을 따른다. 3.3 거푸집 및 동바리 (1) 콘크리트용 거푸집 및 동바리는 소정의 강도와 강성을 가지는 동시에 완성된 구조물의 위치, 형상 및 치수가 정확하게 확보될 수 있도록 설계 및 시공을 하여야 한다. (2) 동바리는 작용하중을 안정하게 기초에 전달할 수 있는 형식의 것을 사용해야 한다. (3) 거푸집 및 받침기둥은 콘크리트를 부어넣기 전과 부어넣기 중에 공사감독자의 검사를 받아야 한다. (4) 거푸집 제거시기 및 순서는 콘크리트가 자중 및 시공에 가해지는 하중에 충분히 견딜만한 강도를 가질 때까지 떼어 내어서는 안 된다. (5) 거푸집판이 건조할 염려가 있을 때는 살수를 하여야 한다. (6) 특수거푸집과 받침기둥을 사용할 경우는 공사기준에 따른다. 3.4 현장품질관리 (1) 품질관리 및 검사는 EXCS 14 20 00에 따른다. 다만, 시험횟수는 부어넣기 공구마다, 부어넣는 날마다 150 m3당 1회 이상을 실시한다. 집필위원 성 명 소 속 성 명 소 속 박경탁 한국도로공사 자문위원 성 명 소 속 성 명 소 속 국가건설기준센터 및 건설기준위원회 성 명 소 속 성 명 소 속 이영호 한국건설기술연구원 이여경 한국건설기술연구원 이용수 한국건설기술연구원 원훈일 한국건설기술연구원 구재동 한국건설기술연구원 김한수 건국대학교 김태송 한국건설기술연구원 남정수 충남대학교 최봉혁 한국건설기술연구원 박순규 서울특별시 김기현 한국건설기술연구원 서명석 경동대학교 김희석 한국건설기술연구원 송제영 BK방수기술연구소 류상훈 한국건설기술연구원 신성수 한국기술사회 허원호 한국건설기술연구원 오상근 서울과학기술대학교 김나은 한국건설기술연구원 장덕배 동양미래대학교 주영경 한국건설기술연구원 최수경 한서대학교 이승환 한국건설기술연구원 중앙건설기술심의위원회 성 명 소 속 성 명 소 속 강선영 ㈜선엔지니어링종합건축사사무소 빈혜진 다옴스페이스 김동관 청주대학교 유정한 서울과학기술대학교 김성민 LH 최윤기 숭실대학교 김천학 한국시설안전공단 국토교통부 성 명 소 속 성 명 소 속 장순재 국토교통부 도로정책과 김호 국토교통부 도로정책과 EXCS 14 20 36 : 2021 고강도 콘크리트(부대시설편) 2021년 8월 5일 발행 소관부서 국토교통부 관련단체 한국도로공사 (39660) 경상북도 김천시 혁신8로 77 한국도로공사 ☎ 1588-2504(대표) http://www.ex.co.kr 국가건설기준센터 10223 경기도 고양시 일산서구 고양대로 283(대화동) Tel : 031-910-0444 http://www.kcsc.re.kr",
      "construction": "3. 시공 4 3.1 운반 4 3.2 부어넣기 및 양생 4 3.2.1 부어넣기 4 3.2.2 양생 4 3.3 거푸집 및 동바리 4 3.4 현장품질관리 4 1. 일반사항 1.1 적용 범위 (1) 고강도 콘크리트의 적용범위는 보통콘크리트에서 설계기준 강도가 40 MPa 이상의 고강도 콘크리트 시공에 필요한 일반적인 사항에 대하여 적용하며 콘크리트의 생산 및 태설, 양생과 관련하여 본 절에 명시되지 아니한 사항은 EXCS 14 20 00을 적용한다. 1.2 참고 기준 (1) 고강도 콘크리트의 잔골재는 KCS 14 20 33 (1.4)을 따르되 아래의 사항을 추가하여 적용한다. (2) EXCS 14 20 00 콘크리트공사 (3) KS F 2405 콘크리트의 압축 강도 시험 방법 1.3 용어의 정의 내용 없음 1.4 제출물 (1) 다음 사항은 EXCS 10 10 10에 따라 제출한다. 1.4.1 제품자료 (1) 다음 품목에 대한 제조업자 제품자료 ① 혼화제 ② 시멘트 1.5 운반, 보관 및 취급 (1) 혼화제 : 혼화제의 운반, 보관 및 취급은 승인된 제조업자의 제품자료에 따른다. (2) 시멘트 : 시멘트의 운반, 보관 및 취급은 EXCS 14 20 00에 따른다. 2. 자재 2.1 자재 2.1.1 시멘트 (1) 고강도 콘크리트의 시멘트는 KCS 14 20 33 (2.1.1)을 따른다. 2.1.2 고성능감수제 (1) 고강도 콘크리트의 고성능감수제는 KCS 14 20 33 (2.1.2 (1))을 따른다. 2.1.3 혼화재 (1) 고강도 콘크리트의 혼화재는 KCS 14 20 33 (2.1.2 (2))을 따른다. 2.1.4 잔골재 (1) 고강도 콘크리트의 잔골재는 KCS 14 20 33 (2.1.3)을 따르되 아래의 사항을 추가하여 적용한다. 표 2.1-1 골재의 품질 항목 종류 절건 비중 흡수율 (%) 실적률 (%) 점토량 (%) 씻기시험에의한 손실량 (%) 유기 불순물 염분 (NaCl) (%) 안정성 (%) 굵은골재 2.5 이상 2.0 이하 59 이상 0.25 이하 1.0 이하 - - 12 이하 잔골재 2.5 이상 3.0 이하 - 1.0 이하 2.0 이하 표준색 이하 0.04 이하 10 이하 표 2.1-2 잔골재의 입도의 표준 체의 호칭 체를 통과한 것의 중량 백분율(%) 10 mm 100 5 mm 95 ~ 100 2.5 mm 80 ~ 100 1.2 mm 50 ~ 85 0.6 mm 25 ~ 60 0.3 mm* 10 ~ 30 0.15 mm* 2 ~ 10 * 이 경우 물시멘트비를 낮추기 위하여 0.3 mm, 0.15 mm체를 통과하는 양은 가능한한 적게 하는 것이 좋다. 2.1.5 굵은골재 (1) 고강도 콘크리트의 굵은골재는 KCS 14 20 33 (2.1.4 (2))을 따르되 아래의 사항을 추가하여 적용한다. (2) 굵은골재는 깨끗하고, 강하고, 내구적이며, 알맞는 입도를 갖고 얇은 석편, 유기불순물, 염분 등의 유해량을 함유해서는 안되며, 표 2.1-1의 기준을 만족하여야 한다. (3) 고강도 콘크리트에 사용되는 굵은골재의 입도분포는 굵고, 가는 골재들이 골고루 섞이어 공극률을 줄임으로써 시멘트페이스트이 최소가 되도록 하는 것이 좋으며, 그 입도는 아래표의 범위를 표준으로 한다. 체가름 시험은 KS F 2502에 따른다. 표 2.1-3 굵은골재 입도의 표준 (mm) 체의 호칭 골재 최대치수 각체를 통과하는 것의 중량 백분율 50 40 30 25 20 15 10 5 2.5 40 100 95 ∼ 100 35 ∼ 70 10 ∼ 30 0 ∼ 5 30 100 95 ∼ 100 40 ∼ 75 10 ∼ 35 0 ∼ 10 0 ∼ 5 25 100 95 ∼ 100 25 ∼ 60 0 ∼ 10 0 ∼ 5 19 100 90 ∼ 100 20 ∼ 55 0 ∼ 10 0 ∼ 5 13 100 90 ∼ 100 40 ∼ 70 0 ∼ 15 0 ∼ 5 10 100 85 ∼ 100 0 ∼ 30 0 ∼10 (4) 고강도 콘크리트에 사용되는 골재의 최대크기는 40 mm 이하로서 가능한 25 mm이하를 사용하도록 하며, 철근 최소 수평간격의 3/4, 그리고 부재 최소치수의 1/5 이내의 것을 사용하도록 한다. (5) 고강도에 사용하는 굵은골재는 단단하고 견고하여야 하며, 열팽창계수가 시멘트페이스트과 현저하게 다른 것은 피하여야 한다. (6) 콘크리트에 포함된 염화물량은 염소이온량으로서 0.3 kg/m3 이하가 되어야 한다. 여기서, 점토량 시험은 KS F 2512, 골재씻기 시험은(0.08 mm체 통과량)은 KS F 2511, 유기불순물 시험은 KS F 2510, 염화물함유량 시험은 KS F 2515, 골재의 안정성 시험은 KS F 2507에 따른다. 2.2 배합 (1) 고강도 콘크리트의 배합강도는 설계기준강도 및 현장에서의 콘크리트 품질변화를 고려해서 정한다. (2) 고강도 콘크리트의 배합강도는 일반적인 경우 현장에서 콘크리트의 압축강도 시험값이 설계기준강도 이하로 되는 경우가 1/20 이상의 확률로 일어나서는 안 된다. (3) 물시멘트 비 ① 고강도 콘크리트의 물시멘트 비는 KCS 14 20 33 (2.2.1(2))을 따르되 아래의 사항을 추가하여 적용한다. ② 물시멘트비는 50% 이하로 한다. (4) 단위 시멘트량 ① 고강도 콘크리트의 단위 시멘트량은 KCS 14 20 33 (2.2.1(3))을 따른다. (5) 단위수량 ① 단위수량은 185 kg/m3 이하로 하고 소요의 워커빌리티를 얻을 수 있는 범위 안에서 가능한 작게 한다. (6) 잔골재율 ① 고강도 콘크리트의 잔골재율은 KCS 14 20 33 (2.2.1(5))을 따른다. (7) 고성능감수제 ① 고강도 콘크리트의 고성능감수제는 KCS 14 20 33 (2.2.1(6))을 따른다. (8) 소요 공기량 ① 기상의 변화가 심하거나 동결융해에 대한 대책이 필요한 경우를 제외하고는 공기연행제를 사용하지 않는 것을 원칙으로 한다. 3. 시공 3.1 운반 (1) 운반은 KCS 14 20 33 (3.2)을 따른다. 3.2 부어넣기 및 양생 3.2.1 부어넣기 (1) 고강도 콘크리트의 부어넣기는 KCS 14 20 33 (3.3)을 따른다. 3.2.2 양생 (1) 고강도 콘크리트의 양생은 KCS 14 20 33 (3.4)을 따른다. 3.3 거푸집 및 동바리 (1) 콘크리트용 거푸집 및 동바리는 소정의 강도와 강성을 가지는 동시에 완성된 구조물의 위치, 형상 및 치수가 정확하게 확보될 수 있도록 설계 및 시공을 하여야 한다. (2) 동바리는 작용하중을 안정하게 기초에 전달할 수 있는 형식의 것을 사용해야 한다. (3) 거푸집 및 받침기둥은 콘크리트를 부어넣기 전과 부어넣기 중에 공사감독자의 검사를 받아야 한다. (4) 거푸집 제거시기 및 순서는 콘크리트가 자중 및 시공에 가해지는 하중에 충분히 견딜만한 강도를 가질 때까지 떼어 내어서는 안 된다. (5) 거푸집판이 건조할 염려가 있을 때는 살수를 하여야 한다. (6) 특수거푸집과 받침기둥을 사용할 경우는 공사기준에 따른다. 3.4 현장품질관리 (1) 품질관리 및 검사는 EXCS 14 20 00에 따른다. 다만, 시험횟수는 부어넣기 공구마다, 부어넣는 날마다 150 m3당 1회 이상을 실시한다. 집필위원 성 명 소 속 성 명 소 속 박경탁 한국도로공사 자문위원 성 명 소 속 성 명 소 속 국가건설기준센터 및 건설기준위원회 성 명 소 속 성 명 소 속 이영호 한국건설기술연구원 이여경 한국건설기술연구원 이용수 한국건설기술연구원 원훈일 한국건설기술연구원 구재동 한국건설기술연구원 김한수 건국대학교 김태송 한국건설기술연구원 남정수 충남대학교 최봉혁 한국건설기술연구원 박순규 서울특별시 김기현 한국건설기술연구원 서명석 경동대학교 김희석 한국건설기술연구원 송제영 BK방수기술연구소 류상훈 한국건설기술연구원 신성수 한국기술사회 허원호 한국건설기술연구원 오상근 서울과학기술대학교 김나은 한국건설기술연구원 장덕배 동양미래대학교 주영경 한국건설기술연구원 최수경 한서대학교 이승환 한국건설기술연구원 중앙건설기술심의위원회 성 명 소 속 성 명 소 속 강선영 ㈜선엔지니어링종합건축사사무소 빈혜진 다옴스페이스 김동관 청주대학교 유정한 서울과학기술대학교 김성민 LH 최윤기 숭실대학교 김천학 한국시설안전공단 국토교통부 성 명 소 속 성 명 소 속 장순재 국토교통부 도로정책과 김호 국토교통부 도로정책과 EXCS 14 20 36 : 2021 고강도 콘크리트(부대시설편) 2021년 8월 5일 발행 소관부서 국토교통부 관련단체 한국도로공사 (39660) 경상북도 김천시 혁신8로 77 한국도로공사 ☎ 1588-2504(대표) http://www.ex.co.kr 국가건설기준센터 10223 경기도 고양시 일산서구 고양대로 283(대화동) Tel : 031-910-0444 http://www.kcsc.re.kr",
      "quality": "(1) 품질관리 및 검사는 EXCS 14 20 00에 따른다. 다만, 시험횟수는 부어넣기 공구마다, 부어넣는 날마다 150 m3당 1회 이상을 실시한다. \n집필위원\n성 명\n소 속\n성 명\n소 속\n박경탁\n한국도로공사\n자문위원\n성 명\n소 속\n성 명\n소 속\n국가건설기준센터 및 건설기준위원회\n성 명\n소 속\n성 명\n소 속\n이영호\n한국건설기술연구원\n이여경\n한국건설기술연구원\n이용수\n한국건설기술연구원\n원훈일\n한국건설기술연구원\n구재동\n한국건설기술연구원\n김한수\n건국대학교\n김태송\n한국건설기술연구원\n남정수\n충남대학교\n최봉혁\n한국건설기술연구원\n박순규\n서울특별시\n김기현\n한국건설기술연구원\n서명석\n경동대학교\n김희석\n한국건설기술연구원\n송제영\nBK방수기술연구소\n류상훈\n한국건설기술연구원\n신성수\n한국기술사회\n허원호\n한국건설기술연구원\n오상근\n서울과학기술대학교\n김나은\n한국건설기술연구원\n장덕배\n동양미래대학교\n주영경\n한국건설기술연구원\n최수경\n한서대학교\n이승환\n한국건설기술연구원\n중앙건설기술심의위원회\n성 명\n소 속\n성 명\n소 속\n강선영\n㈜선엔지니어링종합건축사사무소\n빈혜진\n다옴스페이스\n김동관\n청주대학교\n유정한\n서울과학기술대학교\n김성민\nLH\n최윤기\n숭실대학교\n김천학\n한국시설안전공단\n국토교통부\n성 명\n소 속\n성 명\n소 속\n장순재\n국토교통부 도로정책과\n김호\n국토교통부 도로정책과\nEXCS 14 20 36 : 2021\n고강도 콘크리트(부대시설편)\n2021년 8월 5일 발행\n소관부서   국토교통부\n관련단체   한국도로공사\n(39660) 경상북도 김천시 혁신8로 77 한국도로공사\n☎ 1588-2504(대표)\nhttp://www.ex.co.kr\n국가건설기준센터\n10223 경기도 고양시 일산서구 고양대로 283(대화동)\nTel : 031-910-0444\nhttp://www.kcsc.re.kr\n## 테이블\n### 테이블 1\n### 테이블 2\n### 테이블 3\n### 테이블 4\n### 테이블 5\n### 테이블 6\n### 테이블 7\n### 테이블 8\n### 테이블 9\n### 테이블 10\n### 테이블 11\n### 테이블 12\n### 테이블 13\n### 테이블 14\n### 테이블 15\n### 테이블 16\n### 테이블 17\n### 테이블 18\n### 테이블 19",
      "safety": ""
    }
  },
  "metadata": {
    "quality_score": 75,
    "keywords": [
      "압축강도",
      "공기량",
      "철근",
      "콘크리트",
      "시멘트",
      "골재",
      "배합",
      "양생",
      "거푸집",
      "동바리",
      "방수"
    ],
    "references": [
      "KCS",
      "EXCS"
    ],
    "equations": 0,
    "tables": 4
  },
  "standard_code": "EXCS 14 20 36"
}