{
  "id": "EXCS 14 20 25",
  "title": "경량골재 콘크리트(부대시설편)",
  "category": "콘크리트",
  "content": {
    "full": "**표준코드**: EXCS 14 20 25 **문서 제목**: 목적 **변환일시**: 2025-07-09 16:44:44 **첨부 이미지**: 1개 Expressway Construction Specification EXCS 14 20 20 고속도로공사 전문시방서 Expressway Construction Specification EXCS 14 20 25 : 2021 경량골재 콘크리트 (부대시설편) 2021년 8월 5일 제정 http://www.kcsc.re.kr 고속도로공사 전문시방서 제·개정에 따른 경과 조치 「고속도로공사 전문시방서(EXCS ; Expressway Construction Specification)」는 국가건설기준(KCS ; Korea Construction Specification)를 기본으로 하여 고속도로 시공에 관련된 공종을 대상으로 작성한 종합적인 시방기준으로서, 단위공사 설계시 해당 공사의 특성과 여건 등에 맞게 「공사시방서」를 작성하는데 활용하기 위한 「전문시방서」(Guide Specification)이므로 관계법상 구속력과 계약도서로서의 효력이 없습니다. 이 시방기준 발간 시점에 이미 시행 중인 설계용역이나 건설공사는 발주기관의 장이 필요하다고 인정하는 경우 종전에 적용하고 있는 기준을 그대로 사용할 수 있으며, 이 시방기준으로 공사시방서 작성 시 도로교통연구원 홈페이지 및 국가건설기준센터 홈페이지에 등재된 최신 시방기준을 반드시 확인 후 작성하시기 바랍니다. ※ 도로교통연구원 홈페이지 : http://www.ex.co.kr/research/ 국가건설기준센터 홈페이지 : http://www.kcsc.re.kr/ 건설기준 연혁 ∙ 이 시방기준은 건설기준 코드체계 전환에 따라 기존 고속도로공사 전문시방서와 건설기준(표준시방서) 간 중복·상충을 비교 검토하여 코드로 통합 정비하였다. ∙ 이 기준은 기존의 고속도로공사 전문시방서를 중심으로 KCS 14 20 20 등의 해당하는 부분을 통합 정비하여 기준으로 제정한 것으로 제⋅개정 연혁은 다음과 같다. 건설기준 주요내용 제정 또는 개정 (년.월) 고속도로공사 전문시방서(부대시설편) ∙ 고속도로공사 전문시방서 부대시설편을 제정 제정 (2002.2) 고속도로공사 전문시방서(부대시설편) ∙ 시대적 흐름을 반영하고 건설기술 발전에 이바지함으로써 ‘신뢰받는 국민기업 실현’을 달성하기 위하여 개정함 개정 (2005.12) EXCS 14 20 25 :2021 ∙ 건설기준 코드체계 전환에 따라 코드화로 통합 정비함 제정 (2021.8) 제 정 : 2021년 8월 5일 심 의 : 중앙건설기술심의위원회 소관부서 : 국토교통부 도로정책과 관련단체 : 한국도로공사 개 정 : 년 월 일 자문검토 : 국가건설기준센터 건설기준위원회 작성기관 : 한국도로공사 목 차 1. 일반사항 1 1.1 적용 범위 1 1.2 참고 기준 1 1.3 용어의 정의 1 1.4 제출물 1 1.4.1 제품자료 1 1.4.2 견본 1 1.5 운반, 보관 및 취급 1 1.5.1 경량골재 1 1.5.2 시멘트 2 2. 자재 2 2.1 자재 2 2.1.1 시멘트 2 2.1.2 인공경량골재 2 2.1.3 물 2 2.2 경량 콘크리트 2 2.2.1 기준 2 2.2.2 종류 및 품질 2 2.3 배합 3 3. 시공 3 3.1 작업준비 3 3.2 시공기준 3 3.2.1 경량 콘크리트 레디믹스트 콘크리트 3 3.2.2 경량 콘크리트 운반 및 부어넣기 4 3.2.3 경량 콘크리트의 피복두께 4 3.2.4 양생 4 3.3 현장품질관리 4 1. 일반사항 1.1 적용 범위 (1) 경량골재 콘크리트의 적용 범위는 경량 콘크리트의 시공에서 필요한 일반적인 사항에 대하여 적용하며 콘크리트의 생산 및 타설, 양생과 관련하여 본 이기준에 명시되지 아니한 사항은 EXCS 14 20 00을 적용한다. 1.2 참고 기준 (1) 경량골재 콘크리트의 참고 기준은 KCS 14 20 20 (1.4)를 따르되 아래의 사항을 추가하여 적용한다. (2) EXCS 14 20 00 콘크리트공사 (3) KS F 2505 골재의 단위용적질량 및 실적률 시험방법 (4) KS F 2515 골재중의 염화물 함유량 시험 방법 (5) KS F 2527 콘크리트용 골재 (6) KS L 5105 수경성 시멘트 모르타르의 압축 강도 시험 방법 (7) KS L 5201 포틀랜드 시멘트 1.3 용어의 정의 (1) 경량골재 콘크리트 용어의 정의는 KCS 14 20 20 (1.5)에 따른다. 1.4 제출물 (1) 다음 사항은 EXCS 10 10 10에 따라 제출한다. 1.4.1 제품자료 (1) 다음 품목에 대한 제조업자 제품자료 ① 인공경량골재 ② 시멘트 1.4.2 견본 (1) 다음 품목에 대한 제조업자의 제품견본 ① 경량 콘크리트 제작견본 가. 본 공사시의 경량 콘크리트 제조방법과 동일한 방법으로 제작한 300×300×100 mm 크기의 견본 1.5 운반, 보관 및 취급 1.5.1 경량골재 (1) 골재를 쌓아둘 곳은 될 수 있는 대로 물 빠짐이 좋고, 햇볕을 덜 받는 장소를 택한다. (2) 골재의 짐부리기, 쌓아올리기 및 물 뿌리기를 할 때에는 입자가 분리되지 않도록 한다. (3) 골재에 때때로 물을 뿌리고 표면에 포장 등을 하여 항상 같은 습윤상태를 유지한다. (4) 경량골재는 배합 전에 충분히 흡수시키고, 표면건조내부포수 상태에 가까운 상태로 사용하는 것을 원칙으로 한다. 1.5.2 시멘트 (1) 시멘트의 운반, 보관 및 취급 방법은 코드화에 따른다. 2. 자재 2.1 자재 2.1.1 시멘트 (1) KS L 5201의 1종 보통 포틀랜드 시멘트에 적합한 제품을 사용한다. 2.1.2 인공경량골재 (1) 인공경량골재는 KCS 14 20 20 (2.1.1(1))을 따르되 아래의 사항을 추가하여 적용한다. (2) 인공경량골재는 KS F 2527에 적합한 것으로 한다. (3) 인공경량 굵은골재의 최대치수는 15 mm 또는 20 mm 로 한다. (4) 경량골재는 아래 적합한 소요의 단위중량을 가져야 하고, 변동폭이 작은 것이어야 한다. 단위중량시험은 KS F 2505에 규정되어 있는 방법에 따라 실시하며, 그 시험치는 재료를 절대 건조 상태로하여 표시한다. 표 2.1-1 경량골재의 단위중량 치 수 건조된 상태의 최대단위중량(t/m3) 잔 골 재 굵은골재 잔골재와 굵은골재의 혼합물 1.12 0.88 1.04 2.1.3 물 (1) 물은 품질에 영향을 주는 기름, 산, 유기불순물이 함유되지 않은 정수를 사용한다. 2.2 경량 콘크리트 2.2.1 기준 (1) 경량 콘크리트는 골재의 전부 또는 일부에 인공경량골재를 사용하여 설계기준강도가 24 MPa 이하, 기건 단위용적중량이 1.4 ~ 2.0 t/m3의 범위에 들어가는 것으로 한다. 2.2.2 종류 및 품질 (1) 경량 콘크리트의 종류는 경량 콘크리트 1종 및 경량 콘크리트 2종으로 한다. (2) 설계기준강도 및 기건 단위용적중량의 범위는 아래와 같다. 표 2.2-1 경량콘크리트의 설계기준강도 및 기건 단위용적중량 사용한 골재에 의한 콘크리트의 종류 사용골재 설계기준강도 (MPa) 기건단위 용적중량 (t/m3) 굵은골재 잔 골재 경량 콘크리트 1종 인공경량골재 모래, 부순모래, 고로슬래그잔골재 18 21 24 1.7 ～ 2.0 경량 콘크리트 2종 인공경량골재 인공경량골재나 혹은 인공경량 골재의 일부를 모래, 부순 모래, 고로슬래그 잔골재로 대치한 것 15 18 21 1.4 ～ 1.7 (3) 설계기준강도 및 기건 단위용적중량은 공사시방에 따른다. (4) 슬럼프 값은 180 mm 이하로 한다. (5) 단위시멘트량의 최소 값은 300 kg/m3, 물시멘트비의 최대 값은 60 %로 한다. 2.3 배합 (1) 배합은 KCS 14 20 20 (2.2.1(1))을 따르되 아래의 사항을 추가하여 적용한다. (2) 경량 콘크리트에는 AE제 또는 AE감수제를 사용한다. (3) 공기량은 보통콘크리트를 사용한 콘크리트보다 1 % 크게 해야 한다. 3. 시공 3.1 작업준비 (1) 바탕을 깨끗이 청소하고 주변 벽체에 경량 콘크리트 타설높이를 먹매김하여 표시한다. (2) 하절기에는 경량 기포콘크리트 타설 직전에 바탕모체에 물축임을 한다. 3.2 시공기준 3.2.1 경량 콘크리트 레디믹스트 콘크리트 (1) 레디믹스트 콘크리트 공장은 경량 콘크리트에 관한 레디믹스트 콘크리트의 KS표시 허가를 받은 공장이어야 한다. (2) 위의 KS표시허가를 받지 아니한 공장을 이용할 경우는, 그 공장의 품질관리상태를 충분히 조사하고, 또한 시험비빔에 의하여 소요품질의 콘크리트가 제조가능한가를 확인하고 공사감독자의 승인을 받는다. 3.2.2 경량 콘크리트 운반 및 부어넣기 (1) 현장대리인은 공사를 시작하기 전에 실제로 시공하는 콘크리트에 대하여 워커빌리티, 강도 및 비중을 시험하여 공사감독자에게 그 결과를 보고한다. (2) 경량 콘크리트의 운반에 있어서는 콘크리트의 배합, 부어넣기 개소, 단위시간당 부어넣기량 및 시공시의 조건 등을 고려하고, 분리, 누수 및 품질의 변화를 되도록 생기지 않게 할 수 있는 방법으로 운반한다. (3) 부어넣기, 다짐을 할 때에는 골재분리가 생기지 않게 하며, 그 방법 및 다짐용구를 적절하게 선정하여 행하여야 한다. (4) 부어넣기는 안정될 때까지 침하량이 비교적 크므로 보와 바닥의 콘크리트는 기둥 및 벽체의 콘크리트가 충분히 안정된 다음에 부어 넣는다. (5) 콘크리트 표면에 떠오르는 경량 굵은골재는 탬핑, 흙손 등에 의해 내부에 눌러 넣어 콘크리트 표면이 평탄하게 되도록 한다. 3.2.3 경량 콘크리트의 피복두께 (1) 경량 콘크리트의 철근 피복두께는 보통 콘크리트 피복두께에 대하여 10 mm를 더한 것으로 한다. 3.2.4 양생 (1) 경량 콘크리트 타설 후 기온이 저하 될 경우 동해를 입지 않도록 보양한다. (2) 경량 콘크리트 타설 후 3일간은 충격이나 하중을 가하지 않도록 하고, 상부마감재 시공은 경량 기포콘크리트가 완전히 양생된 이후에 한다. 3.3 현장품질관리 (1) 콘크리트의 품질관리는 EXCS 14 20 00에 따른다. 집필위원 성 명 소 속 성 명 소 속 박경탁 한국도로공사 자문위원 성 명 소 속 성 명 소 속 국가건설기준센터 및 건설기준위원회 성 명 소 속 성 명 소 속 이영호 한국건설기술연구원 이여경 한국건설기술연구원 이용수 한국건설기술연구원 원훈일 한국건설기술연구원 구재동 한국건설기술연구원 김한수 건국대학교 김태송 한국건설기술연구원 남정수 충남대학교 최봉혁 한국건설기술연구원 박순규 서울특별시 김기현 한국건설기술연구원 서명석 경동대학교 김희석 한국건설기술연구원 송제영 BK방수기술연구소 류상훈 한국건설기술연구원 신성수 한국기술사회 허원호 한국건설기술연구원 오상근 서울과학기술대학교 김나은 한국건설기술연구원 장덕배 동양미래대학교 주영경 한국건설기술연구원 최수경 한서대학교 이승환 한국건설기술연구원 중앙건설기술심의위원회 성 명 소 속 성 명 소 속 강선영 ㈜선엔지니어링종합건축사사무소 빈혜진 다옴스페이스 김동관 청주대학교 유정한 서울과학기술대학교 김성민 LH 최윤기 숭실대학교 김천학 한국시설안전공단 국토교통부 성 명 소 속 성 명 소 속 장순재 국토교통부 도로정책과 김호 국토교통부 도로정책과 EXCS 14 20 25 : 2021 경량골재 콘크리트(부대시설편) 2021년 8월 5일 발행 소관부서 국토교통부 관련단체 한국도로공사 (39660) 경상북도 김천시 혁신8로 77 한국도로공사 ☎ 1588-2504(대표) http://www.ex.co.kr 국가건설기준센터 10223 경기도 고양시 일산서구 고양대로 283(대화동) Tel : 031-910-0444 http://www.kcsc.re.kr",
    "sections": {
      "scope": "(1) 경량골재 콘크리트의 적용 범위는 경량 콘크리트의 시공에서 필요한 일반적인 사항에 대하여 적용하며 콘크리트의 생산 및 타설, 양생과 관련하여 본 이기준에 명시되지 아니한 사항은 EXCS 14 20 00을 적용한다.",
      "materials": "2. 자재 2 2.1 자재 2 2.1.1 시멘트 2 2.1.2 인공경량골재 2 2.1.3 물 2 2.2 경량 콘크리트 2 2.2.1 기준 2 2.2.2 종류 및 품질 2 2.3 배합 3 3. 시공 3 3.1 작업준비 3 3.2 시공기준 3 3.2.1 경량 콘크리트 레디믹스트 콘크리트 3 3.2.2 경량 콘크리트 운반 및 부어넣기 4 3.2.3 경량 콘크리트의 피복두께 4 3.2.4 양생 4 3.3 현장품질관리 4 1. 일반사항 1.1 적용 범위 (1) 경량골재 콘크리트의 적용 범위는 경량 콘크리트의 시공에서 필요한 일반적인 사항에 대하여 적용하며 콘크리트의 생산 및 타설, 양생과 관련하여 본 이기준에 명시되지 아니한 사항은 EXCS 14 20 00을 적용한다. 1.2 참고 기준 (1) 경량골재 콘크리트의 참고 기준은 KCS 14 20 20 (1.4)를 따르되 아래의 사항을 추가하여 적용한다. (2) EXCS 14 20 00 콘크리트공사 (3) KS F 2505 골재의 단위용적질량 및 실적률 시험방법 (4) KS F 2515 골재중의 염화물 함유량 시험 방법 (5) KS F 2527 콘크리트용 골재 (6) KS L 5105 수경성 시멘트 모르타르의 압축 강도 시험 방법 (7) KS L 5201 포틀랜드 시멘트 1.3 용어의 정의 (1) 경량골재 콘크리트 용어의 정의는 KCS 14 20 20 (1.5)에 따른다. 1.4 제출물 (1) 다음 사항은 EXCS 10 10 10에 따라 제출한다. 1.4.1 제품자료 (1) 다음 품목에 대한 제조업자 제품자료 ① 인공경량골재 ② 시멘트 1.4.2 견본 (1) 다음 품목에 대한 제조업자의 제품견본 ① 경량 콘크리트 제작견본 가. 본 공사시의 경량 콘크리트 제조방법과 동일한 방법으로 제작한 300×300×100 mm 크기의 견본 1.5 운반, 보관 및 취급 1.5.1 경량골재 (1) 골재를 쌓아둘 곳은 될 수 있는 대로 물 빠짐이 좋고, 햇볕을 덜 받는 장소를 택한다. (2) 골재의 짐부리기, 쌓아올리기 및 물 뿌리기를 할 때에는 입자가 분리되지 않도록 한다. (3) 골재에 때때로 물을 뿌리고 표면에 포장 등을 하여 항상 같은 습윤상태를 유지한다. (4) 경량골재는 배합 전에 충분히 흡수시키고, 표면건조내부포수 상태에 가까운 상태로 사용하는 것을 원칙으로 한다. 1.5.2 시멘트 (1) 시멘트의 운반, 보관 및 취급 방법은 코드화에 따른다. 2. 자재 2.1 자재 2.1.1 시멘트 (1) KS L 5201의 1종 보통 포틀랜드 시멘트에 적합한 제품을 사용한다. 2.1.2 인공경량골재 (1) 인공경량골재는 KCS 14 20 20 (2.1.1(1))을 따르되 아래의 사항을 추가하여 적용한다. (2) 인공경량골재는 KS F 2527에 적합한 것으로 한다. (3) 인공경량 굵은골재의 최대치수는 15 mm 또는 20 mm 로 한다. (4) 경량골재는 아래 적합한 소요의 단위중량을 가져야 하고, 변동폭이 작은 것이어야 한다. 단위중량시험은 KS F 2505에 규정되어 있는 방법에 따라 실시하며, 그 시험치는 재료를 절대 건조 상태로하여 표시한다. 표 2.1-1 경량골재의 단위중량 치 수 건조된 상태의 최대단위중량(t/m3) 잔 골 재 굵은골재 잔골재와 굵은골재의 혼합물 1.12 0.88 1.04 2.1.3 물 (1) 물은 품질에 영향을 주는 기름, 산, 유기불순물이 함유되지 않은 정수를 사용한다. 2.2 경량 콘크리트 2.2.1 기준 (1) 경량 콘크리트는 골재의 전부 또는 일부에 인공경량골재를 사용하여 설계기준강도가 24 MPa 이하, 기건 단위용적중량이 1.4 ~ 2.0 t/m3의 범위에 들어가는 것으로 한다. 2.2.2 종류 및 품질 (1) 경량 콘크리트의 종류는 경량 콘크리트 1종 및 경량 콘크리트 2종으로 한다. (2) 설계기준강도 및 기건 단위용적중량의 범위는 아래와 같다. 표 2.2-1 경량콘크리트의 설계기준강도 및 기건 단위용적중량 사용한 골재에 의한 콘크리트의 종류 사용골재 설계기준강도 (MPa) 기건단위 용적중량 (t/m3) 굵은골재 잔 골재 경량 콘크리트 1종 인공경량골재 모래, 부순모래, 고로슬래그잔골재 18 21 24 1.7 ～ 2.0 경량 콘크리트 2종 인공경량골재 인공경량골재나 혹은 인공경량 골재의 일부를 모래, 부순 모래, 고로슬래그 잔골재로 대치한 것 15 18 21 1.4 ～ 1.7 (3) 설계기준강도 및 기건 단위용적중량은 공사시방에 따른다. (4) 슬럼프 값은 180 mm 이하로 한다. (5) 단위시멘트량의 최소 값은 300 kg/m3, 물시멘트비의 최대 값은 60 %로 한다. 2.3 배합 (1) 배합은 KCS 14 20 20 (2.2.1(1))을 따르되 아래의 사항을 추가하여 적용한다. (2) 경량 콘크리트에는 AE제 또는 AE감수제를 사용한다. (3) 공기량은 보통콘크리트를 사용한 콘크리트보다 1 % 크게 해야 한다. 3. 시공 3.1 작업준비 (1) 바탕을 깨끗이 청소하고 주변 벽체에 경량 콘크리트 타설높이를 먹매김하여 표시한다. (2) 하절기에는 경량 기포콘크리트 타설 직전에 바탕모체에 물축임을 한다. 3.2 시공기준 3.2.1 경량 콘크리트 레디믹스트 콘크리트 (1) 레디믹스트 콘크리트 공장은 경량 콘크리트에 관한 레디믹스트 콘크리트의 KS표시 허가를 받은 공장이어야 한다. (2) 위의 KS표시허가를 받지 아니한 공장을 이용할 경우는, 그 공장의 품질관리상태를 충분히 조사하고, 또한 시험비빔에 의하여 소요품질의 콘크리트가 제조가능한가를 확인하고 공사감독자의 승인을 받는다. 3.2.2 경량 콘크리트 운반 및 부어넣기 (1) 현장대리인은 공사를 시작하기 전에 실제로 시공하는 콘크리트에 대하여 워커빌리티, 강도 및 비중을 시험하여 공사감독자에게 그 결과를 보고한다. (2) 경량 콘크리트의 운반에 있어서는 콘크리트의 배합, 부어넣기 개소, 단위시간당 부어넣기량 및 시공시의 조건 등을 고려하고, 분리, 누수 및 품질의 변화를 되도록 생기지 않게 할 수 있는 방법으로 운반한다. (3) 부어넣기, 다짐을 할 때에는 골재분리가 생기지 않게 하며, 그 방법 및 다짐용구를 적절하게 선정하여 행하여야 한다. (4) 부어넣기는 안정될 때까지 침하량이 비교적 크므로 보와 바닥의 콘크리트는 기둥 및 벽체의 콘크리트가 충분히 안정된 다음에 부어 넣는다. (5) 콘크리트 표면에 떠오르는 경량 굵은골재는 탬핑, 흙손 등에 의해 내부에 눌러 넣어 콘크리트 표면이 평탄하게 되도록 한다. 3.2.3 경량 콘크리트의 피복두께 (1) 경량 콘크리트의 철근 피복두께는 보통 콘크리트 피복두께에 대하여 10 mm를 더한 것으로 한다. 3.2.4 양생 (1) 경량 콘크리트 타설 후 기온이 저하 될 경우 동해를 입지 않도록 보양한다. (2) 경량 콘크리트 타설 후 3일간은 충격이나 하중을 가하지 않도록 하고, 상부마감재 시공은 경량 기포콘크리트가 완전히 양생된 이후에 한다. 3.3 현장품질관리 (1) 콘크리트의 품질관리는 EXCS 14 20 00에 따른다. 집필위원 성 명 소 속 성 명 소 속 박경탁 한국도로공사 자문위원 성 명 소 속 성 명 소 속 국가건설기준센터 및 건설기준위원회 성 명 소 속 성 명 소 속 이영호 한국건설기술연구원 이여경 한국건설기술연구원 이용수 한국건설기술연구원 원훈일 한국건설기술연구원 구재동 한국건설기술연구원 김한수 건국대학교 김태송 한국건설기술연구원 남정수 충남대학교 최봉혁 한국건설기술연구원 박순규 서울특별시 김기현 한국건설기술연구원 서명석 경동대학교 김희석 한국건설기술연구원 송제영 BK방수기술연구소 류상훈 한국건설기술연구원 신성수 한국기술사회 허원호 한국건설기술연구원 오상근 서울과학기술대학교 김나은 한국건설기술연구원 장덕배 동양미래대학교 주영경 한국건설기술연구원 최수경 한서대학교 이승환 한국건설기술연구원 중앙건설기술심의위원회 성 명 소 속 성 명 소 속 강선영 ㈜선엔지니어링종합건축사사무소 빈혜진 다옴스페이스 김동관 청주대학교 유정한 서울과학기술대학교 김성민 LH 최윤기 숭실대학교 김천학 한국시설안전공단 국토교통부 성 명 소 속 성 명 소 속 장순재 국토교통부 도로정책과 김호 국토교통부 도로정책과 EXCS 14 20 25 : 2021 경량골재 콘크리트(부대시설편) 2021년 8월 5일 발행 소관부서 국토교통부 관련단체 한국도로공사 (39660) 경상북도 김천시 혁신8로 77 한국도로공사 ☎ 1588-2504(대표) http://www.ex.co.kr 국가건설기준센터 10223 경기도 고양시 일산서구 고양대로 283(대화동) Tel : 031-910-0444 http://www.kcsc.re.kr",
      "construction": "3. 시공 3 3.1 작업준비 3 3.2 시공기준 3 3.2.1 경량 콘크리트 레디믹스트 콘크리트 3 3.2.2 경량 콘크리트 운반 및 부어넣기 4 3.2.3 경량 콘크리트의 피복두께 4 3.2.4 양생 4 3.3 현장품질관리 4 1. 일반사항 1.1 적용 범위 (1) 경량골재 콘크리트의 적용 범위는 경량 콘크리트의 시공에서 필요한 일반적인 사항에 대하여 적용하며 콘크리트의 생산 및 타설, 양생과 관련하여 본 이기준에 명시되지 아니한 사항은 EXCS 14 20 00을 적용한다. 1.2 참고 기준 (1) 경량골재 콘크리트의 참고 기준은 KCS 14 20 20 (1.4)를 따르되 아래의 사항을 추가하여 적용한다. (2) EXCS 14 20 00 콘크리트공사 (3) KS F 2505 골재의 단위용적질량 및 실적률 시험방법 (4) KS F 2515 골재중의 염화물 함유량 시험 방법 (5) KS F 2527 콘크리트용 골재 (6) KS L 5105 수경성 시멘트 모르타르의 압축 강도 시험 방법 (7) KS L 5201 포틀랜드 시멘트 1.3 용어의 정의 (1) 경량골재 콘크리트 용어의 정의는 KCS 14 20 20 (1.5)에 따른다. 1.4 제출물 (1) 다음 사항은 EXCS 10 10 10에 따라 제출한다. 1.4.1 제품자료 (1) 다음 품목에 대한 제조업자 제품자료 ① 인공경량골재 ② 시멘트 1.4.2 견본 (1) 다음 품목에 대한 제조업자의 제품견본 ① 경량 콘크리트 제작견본 가. 본 공사시의 경량 콘크리트 제조방법과 동일한 방법으로 제작한 300×300×100 mm 크기의 견본 1.5 운반, 보관 및 취급 1.5.1 경량골재 (1) 골재를 쌓아둘 곳은 될 수 있는 대로 물 빠짐이 좋고, 햇볕을 덜 받는 장소를 택한다. (2) 골재의 짐부리기, 쌓아올리기 및 물 뿌리기를 할 때에는 입자가 분리되지 않도록 한다. (3) 골재에 때때로 물을 뿌리고 표면에 포장 등을 하여 항상 같은 습윤상태를 유지한다. (4) 경량골재는 배합 전에 충분히 흡수시키고, 표면건조내부포수 상태에 가까운 상태로 사용하는 것을 원칙으로 한다. 1.5.2 시멘트 (1) 시멘트의 운반, 보관 및 취급 방법은 코드화에 따른다. 2. 자재 2.1 자재 2.1.1 시멘트 (1) KS L 5201의 1종 보통 포틀랜드 시멘트에 적합한 제품을 사용한다. 2.1.2 인공경량골재 (1) 인공경량골재는 KCS 14 20 20 (2.1.1(1))을 따르되 아래의 사항을 추가하여 적용한다. (2) 인공경량골재는 KS F 2527에 적합한 것으로 한다. (3) 인공경량 굵은골재의 최대치수는 15 mm 또는 20 mm 로 한다. (4) 경량골재는 아래 적합한 소요의 단위중량을 가져야 하고, 변동폭이 작은 것이어야 한다. 단위중량시험은 KS F 2505에 규정되어 있는 방법에 따라 실시하며, 그 시험치는 재료를 절대 건조 상태로하여 표시한다. 표 2.1-1 경량골재의 단위중량 치 수 건조된 상태의 최대단위중량(t/m3) 잔 골 재 굵은골재 잔골재와 굵은골재의 혼합물 1.12 0.88 1.04 2.1.3 물 (1) 물은 품질에 영향을 주는 기름, 산, 유기불순물이 함유되지 않은 정수를 사용한다. 2.2 경량 콘크리트 2.2.1 기준 (1) 경량 콘크리트는 골재의 전부 또는 일부에 인공경량골재를 사용하여 설계기준강도가 24 MPa 이하, 기건 단위용적중량이 1.4 ~ 2.0 t/m3의 범위에 들어가는 것으로 한다. 2.2.2 종류 및 품질 (1) 경량 콘크리트의 종류는 경량 콘크리트 1종 및 경량 콘크리트 2종으로 한다. (2) 설계기준강도 및 기건 단위용적중량의 범위는 아래와 같다. 표 2.2-1 경량콘크리트의 설계기준강도 및 기건 단위용적중량 사용한 골재에 의한 콘크리트의 종류 사용골재 설계기준강도 (MPa) 기건단위 용적중량 (t/m3) 굵은골재 잔 골재 경량 콘크리트 1종 인공경량골재 모래, 부순모래, 고로슬래그잔골재 18 21 24 1.7 ～ 2.0 경량 콘크리트 2종 인공경량골재 인공경량골재나 혹은 인공경량 골재의 일부를 모래, 부순 모래, 고로슬래그 잔골재로 대치한 것 15 18 21 1.4 ～ 1.7 (3) 설계기준강도 및 기건 단위용적중량은 공사시방에 따른다. (4) 슬럼프 값은 180 mm 이하로 한다. (5) 단위시멘트량의 최소 값은 300 kg/m3, 물시멘트비의 최대 값은 60 %로 한다. 2.3 배합 (1) 배합은 KCS 14 20 20 (2.2.1(1))을 따르되 아래의 사항을 추가하여 적용한다. (2) 경량 콘크리트에는 AE제 또는 AE감수제를 사용한다. (3) 공기량은 보통콘크리트를 사용한 콘크리트보다 1 % 크게 해야 한다. 3. 시공 3.1 작업준비 (1) 바탕을 깨끗이 청소하고 주변 벽체에 경량 콘크리트 타설높이를 먹매김하여 표시한다. (2) 하절기에는 경량 기포콘크리트 타설 직전에 바탕모체에 물축임을 한다. 3.2 시공기준 3.2.1 경량 콘크리트 레디믹스트 콘크리트 (1) 레디믹스트 콘크리트 공장은 경량 콘크리트에 관한 레디믹스트 콘크리트의 KS표시 허가를 받은 공장이어야 한다. (2) 위의 KS표시허가를 받지 아니한 공장을 이용할 경우는, 그 공장의 품질관리상태를 충분히 조사하고, 또한 시험비빔에 의하여 소요품질의 콘크리트가 제조가능한가를 확인하고 공사감독자의 승인을 받는다. 3.2.2 경량 콘크리트 운반 및 부어넣기 (1) 현장대리인은 공사를 시작하기 전에 실제로 시공하는 콘크리트에 대하여 워커빌리티, 강도 및 비중을 시험하여 공사감독자에게 그 결과를 보고한다. (2) 경량 콘크리트의 운반에 있어서는 콘크리트의 배합, 부어넣기 개소, 단위시간당 부어넣기량 및 시공시의 조건 등을 고려하고, 분리, 누수 및 품질의 변화를 되도록 생기지 않게 할 수 있는 방법으로 운반한다. (3) 부어넣기, 다짐을 할 때에는 골재분리가 생기지 않게 하며, 그 방법 및 다짐용구를 적절하게 선정하여 행하여야 한다. (4) 부어넣기는 안정될 때까지 침하량이 비교적 크므로 보와 바닥의 콘크리트는 기둥 및 벽체의 콘크리트가 충분히 안정된 다음에 부어 넣는다. (5) 콘크리트 표면에 떠오르는 경량 굵은골재는 탬핑, 흙손 등에 의해 내부에 눌러 넣어 콘크리트 표면이 평탄하게 되도록 한다. 3.2.3 경량 콘크리트의 피복두께 (1) 경량 콘크리트의 철근 피복두께는 보통 콘크리트 피복두께에 대하여 10 mm를 더한 것으로 한다. 3.2.4 양생 (1) 경량 콘크리트 타설 후 기온이 저하 될 경우 동해를 입지 않도록 보양한다. (2) 경량 콘크리트 타설 후 3일간은 충격이나 하중을 가하지 않도록 하고, 상부마감재 시공은 경량 기포콘크리트가 완전히 양생된 이후에 한다. 3.3 현장품질관리 (1) 콘크리트의 품질관리는 EXCS 14 20 00에 따른다. 집필위원 성 명 소 속 성 명 소 속 박경탁 한국도로공사 자문위원 성 명 소 속 성 명 소 속 국가건설기준센터 및 건설기준위원회 성 명 소 속 성 명 소 속 이영호 한국건설기술연구원 이여경 한국건설기술연구원 이용수 한국건설기술연구원 원훈일 한국건설기술연구원 구재동 한국건설기술연구원 김한수 건국대학교 김태송 한국건설기술연구원 남정수 충남대학교 최봉혁 한국건설기술연구원 박순규 서울특별시 김기현 한국건설기술연구원 서명석 경동대학교 김희석 한국건설기술연구원 송제영 BK방수기술연구소 류상훈 한국건설기술연구원 신성수 한국기술사회 허원호 한국건설기술연구원 오상근 서울과학기술대학교 김나은 한국건설기술연구원 장덕배 동양미래대학교 주영경 한국건설기술연구원 최수경 한서대학교 이승환 한국건설기술연구원 중앙건설기술심의위원회 성 명 소 속 성 명 소 속 강선영 ㈜선엔지니어링종합건축사사무소 빈혜진 다옴스페이스 김동관 청주대학교 유정한 서울과학기술대학교 김성민 LH 최윤기 숭실대학교 김천학 한국시설안전공단 국토교통부 성 명 소 속 성 명 소 속 장순재 국토교통부 도로정책과 김호 국토교통부 도로정책과 EXCS 14 20 25 : 2021 경량골재 콘크리트(부대시설편) 2021년 8월 5일 발행 소관부서 국토교통부 관련단체 한국도로공사 (39660) 경상북도 김천시 혁신8로 77 한국도로공사 ☎ 1588-2504(대표) http://www.ex.co.kr 국가건설기준센터 10223 경기도 고양시 일산서구 고양대로 283(대화동) Tel : 031-910-0444 http://www.kcsc.re.kr",
      "quality": "(1) 콘크리트의 품질관리는 EXCS 14 20 00에 따른다. \n집필위원\n성 명\n소 속\n성 명\n소 속\n박경탁\n한국도로공사\n자문위원\n성 명\n소 속\n성 명\n소 속\n국가건설기준센터 및 건설기준위원회\n성 명\n소 속\n성 명\n소 속\n이영호\n한국건설기술연구원\n이여경\n한국건설기술연구원\n이용수\n한국건설기술연구원\n원훈일\n한국건설기술연구원\n구재동\n한국건설기술연구원\n김한수\n건국대학교\n김태송\n한국건설기술연구원\n남정수\n충남대학교\n최봉혁\n한국건설기술연구원\n박순규\n서울특별시\n김기현\n한국건설기술연구원\n서명석\n경동대학교\n김희석\n한국건설기술연구원\n송제영\nBK방수기술연구소\n류상훈\n한국건설기술연구원\n신성수\n한국기술사회\n허원호\n한국건설기술연구원\n오상근\n서울과학기술대학교\n김나은\n한국건설기술연구원\n장덕배\n동양미래대학교\n주영경\n한국건설기술연구원\n최수경\n한서대학교\n이승환\n한국건설기술연구원\n중앙건설기술심의위원회\n성 명\n소 속\n성 명\n소 속\n강선영\n㈜선엔지니어링종합건축사사무소\n빈혜진\n다옴스페이스\n김동관\n청주대학교\n유정한\n서울과학기술대학교\n김성민\nLH\n최윤기\n숭실대학교\n김천학\n한국시설안전공단\n국토교통부\n성 명\n소 속\n성 명\n소 속\n장순재\n국토교통부 도로정책과\n김호\n국토교통부 도로정책과\nEXCS 14 20 25 : 2021\n경량골재 콘크리트(부대시설편)\n2021년 8월 5일 발행\n소관부서   국토교통부\n관련단체   한국도로공사\n(39660) 경상북도 김천시 혁신8로 77 한국도로공사\n☎ 1588-2504(대표)\nhttp://www.ex.co.kr\n국가건설기준센터\n10223 경기도 고양시 일산서구 고양대로 283(대화동)\nTel : 031-910-0444\nhttp://www.kcsc.re.kr\n## 테이블\n### 테이블 1\n### 테이블 2\n### 테이블 3\n### 테이블 4\n### 테이블 5\n### 테이블 6\n### 테이블 7\n### 테이블 8\n### 테이블 9\n### 테이블 10\n### 테이블 11\n### 테이블 12\n### 테이블 13\n### 테이블 14\n### 테이블 15\n### 테이블 16\n### 테이블 17\n### 테이블 18",
      "safety": ""
    }
  },
  "metadata": {
    "quality_score": 65,
    "keywords": [
      "슬럼프",
      "공기량",
      "철근",
      "콘크리트",
      "시멘트",
      "골재",
      "배합",
      "양생",
      "방수"
    ],
    "references": [
      "KCS",
      "EXCS"
    ],
    "equations": 0,
    "tables": 2
  }
}